title,company,location,site,description,job_url
Data Analyst,Ardonagh Analytics Lab,"Mullingar, County Westmeath, Ireland",linkedin,"The Ardonagh Analytics Lab, based in Mullingar, Ireland, delivers unrivalled risk insight and innovative data\-driven solutions for The Ardonagh Group’s collective of leading businesses, their customers and insurance partners. With more than 50 diverse brands worldwide, we have access to unique perspectives into emerging market trends and the solutions needed to meet customer needs on a global scale. At the core of our business lies a commitment to innovation. Working in areas such as Big Data, Machine Learning and Artificial Intelligence our team of talented experts work at the very forefront of data analytics development, harnessing the latest technologies and tools to build our suite of ground\-breaking solutions. At the Ardonagh Analytics Lab we believe that data and technology should be used to enhance our people driven relationships – not replace them. We are a family of like\-minded, entrepreneurial individuals and we welcome people from all walks of life. Our shared values shape a unique culture where everyone can thrive. The Ardonagh Analytics Lab is part of The Ardonagh Group, the UK’s largest independent insurance distribution platform and a top 20 broker globally. Ardonagh is home to a set of best\-in\-class and specialist brands with a network of more 150 locations worldwide and a combined workforce of nearly 12,000 people. **Responsibilities** * Help turn data into information and information into insight. * Using a variety of tools and query techniques, work with and interpret a variety of data sets to develop the insight that solves problems and identifies business opportunities. * Act as the key link between the Data Engineering and Data Visualisation Teams to understand the data sources available, identify opportunities for its value \& use and ensure the insights that can be derived are available for presentation and access by colleagues and clients across The Group. * Communicate data\-driven results and recommendations clearly to technical and non\-technical audiences. * Supplement and enrich automated reporting solutions with the analytical insight that leads to action and improvements in business performance. * Help drive a culture change around the use and purpose of data to ensure actions are driven by fact based insight. * Help define, implement and lead on robust data management and reporting processes across The Group. * Identify and help standardise the use and governance of data. * Design and implement methods to ensure consistent application and use of analytics for the organisation. **Person Specification** * Min. 5 years data analysis \& reporting experience * Strong knowledge of SQL and experience in data querying, data mining, data segmentation. * Strong quantitative analysis skills and experience in developing calculations to interpret and assess data sets to produce insight. Excellent problem solving skills. * 2\+ years experience using statistical analysis languages (R, Python, etc.). * Good understanding of database concepts and understanding of structures required. * Strong understanding of Business Intelligence strategies/design as it relates to Data analysis. * Financial services and ideally General Insurance experience strongly desired. * Experienced and independent subject matter expert, capable of working on own initiative whilst delivering best practice solutions that deliver the strategic objectives. **The Company** In an industry that never stands still, neither do we. The Ardonagh Group was founded in 2017 and has grown to become the UK’s largest independent insurance distribution platform and a top 20 broker globally. Our best\-in\-class entrepreneurial and specialist brands span a network of 150\+ locations worldwide and have a combined workforce of more than c.10,000 people. Across our portfolio, we offer a highly diversified range of insurance\-related products and services across the full insurance value chain in the UK, Ireland and broader international markets. From complex multinational corporations to individuals purchasing personal insurance policies, our understanding of the communities we serve, together with our scale and breadth, allows us to deliver a broad range of product and risk solutions to meet the needs of a rapidly evolving market. If you approach life with a sense of adventure you might just find what you need at Ardonagh to bring your ambition to life. Find out more about Ardonagh’s world of opportunity on LinkedIn or visit **www.ardonagh.com** . \#AAL",https://www.linkedin.com/jobs/view/4382712067
Data Analyst,Darwin Hawkins,"Dublin, County Dublin, Ireland",linkedin,"**Job Title:** Data Analyst – Technology Consulting (Assistant Manager / Manager) **Sector:** Professional Services – Consulting **Location:** Dublin (Hybrid) **Salary:** €60,000 – €80,000 \+ bonus \& benefits **Our Client** Our client is a highly regarded, market\-leading professional services firm with a rapidly expanding Technology Consulting practice. Operating on a global scale, they partner with a diverse range of clients to deliver data\-driven solutions and transformation initiatives. The firm is known for its collaborative culture, strong leadership and clear progression pathways, making it an excellent platform for career growth. **Why should you apply?** This is an excellent opportunity to join a high\-growth consulting team working on impactful, data\-led projects across multiple industries. You will gain exposure to senior stakeholders, work on complex transformation initiatives and play a key role in shaping how organisations use data to drive decision\-making. The team offers a strong blend of technical and commercial exposure, along with clear progression opportunities into leadership roles. You will be working in a collaborative, forward\-thinking environment with access to cutting\-edge tools and technologies. **Who should apply?** This role will suit candidates currently working in data analytics, consulting or industry roles who are looking to take the next step in a client\-facing, project\-driven environment. * 3–8 years’ experience in data analytics or related roles * Strong experience with data visualisation tools such as Power BI, Tableau or Excel * Proficiency in SQL, Python or similar programming languages * Experience working with large datasets, data transformation and data quality processes * Strong stakeholder engagement and communication skills * Experience in consulting or client\-facing environments is advantageous **Role and Reporting Lines** Reporting into senior leadership within the Technology Consulting team, this role will involve: * Analytics Delivery – Supporting end\-to\-end data analytics engagements across multiple clients * Data Transformation – Cleaning, validating and transforming data to ensure accuracy and usability * Visualisation – Developing dashboards and reports to communicate key insights * Stakeholder Engagement – Working with clients to gather requirements and deliver actionable insights * Automation – Supporting process improvement initiatives using tools such as Power Query and Power Automate * Documentation – Producing technical documentation and process workflows * Project Delivery – Managing multiple workstreams and ensuring timely delivery of outputs * Innovation – Staying up to date with emerging trends in analytics and applying new tools and techniques **Interested in this position?** To apply please submit your CV to Frank Bailey who is managing this assignment via the link below or to inquire further please contact us directly on 01 529 4200",https://www.linkedin.com/jobs/view/4395321517
Data Architect,Deloitte,"Dublin, D, IE",indeed,"**Deloitte is the biggest professional services Firm in the world and making an impact is more than just what we do: it’s why we’re here. We’re driven to create positive progress for our clients, community, people, and the planet. This sense of purpose inspires us to work to the highest standards, to tackle the challenges that matter.***Joining us means becoming part of a Consulting team that’s at the top of its game and growing. Working with the best people and technology in the market, you’ll tackle meaningful projects that transform the future for high\-profile local and international clients. And you’ll do it as part of a people\-first culture that’s supportive, collaborative and, above all, welcoming.* . At Deloitte, our Artificial Intelligence \& Data Team drives innovation by transforming data into actionable insights that empower our clients. As a Data Architect, you will play a pivotal role in designing and delivering cutting\-edge data solutions across diverse industries, leveraging the latest technologies and our global network. This role offers a unique opportunity to lead impactful projects, collaborate cross\-functionally, and develop your leadership skills in a dynamic, supportive environment focused on continuous learning and personal growth.**Key skills and prior experience*** A minimum of a third\-level degree in Maths, Physics, Engineering, Computer Science, or a related discipline * Proven experience leading and delivering complex data\-related projects, with the ability to motivate and guide teams to achieve outstanding results * Strong stakeholder management skills, including influencing senior leaders and providing expert advice based on industry best practices * Commercial experience in information and data management, with familiarity in enterprise\-grade data architecture technologies such as Cloudera CDP, Azure Databricks, and cloud\-native environments **What type of work will I be doing?*** Scoping, designing, and leading the implementation of scalable data solutions and models using open source and proprietary technologies * Developing technical specifications and architecture designs for data storage and management aligned with enterprise standards * Ensuring data security and integrity are embedded within all architectural designs * Leading and mentoring data analysts and engineers to deliver solutions aligned with target architectures * Collaborating across Deloitte’s Technology and Transformation business areas to integrate data capabilities with broader organisational goals * Managing client engagements across various industries, building trusted relationships and identifying growth opportunities * Coaching junior team members, aligning their responsibilities with their professional development objectives **Who is the Hiring Manager?** The hiring manager is an experienced leader within Deloitte’s Artificial Intelligence \& Data Team, known for a collaborative and inclusive leadership style. They value open communication, professional development, and fostering a positive team culture. Their approach balances high performance expectations with empathy, encouraging innovation and continuous learning while maintaining a strong focus on delivering exceptional client outcomes.**Where is this role based?** This role is based in Dublin or Cork, with a flexible working model that includes hybrid arrangements between office and client sites. For more information, please visit our Deloitte Works webpage.*If you believe that you meet most of the criteria above, we encourage you to apply. Deloitte is an equal opportunities employer and will ensure any reasonable accommodations are implemented as part of the recruitment and selection process.* **What we offer** *Your reward at Deloitte is competitive, supports our purpose and enables our people to never stop growing. Your reward at Deloitte is not just your salary, we believe in investing in our people's personal and professional development and empowering their work\-life balance. Our ambition is to achieve gender equality and enable continuous growth. We offer supports and benefits that suit you, wherever you are in life, including health and well\-being, pension, savings, training, coaching and* enhanced leave options *among others.**Keep on being you. Bring your full, absolute self to work, every day. Explore, question and collaborate. Stretch your thinking, while building a career that inspires and energises you. And, whatever motivates you, keep growing both professionally and personally – because when you make an impact that matters, we do too.*",https://ie.indeed.com/viewjob?jk=0b8f38d71bad9bb7
Data Architect,Deloitte,"Dublin, County Dublin, Ireland",linkedin,"**Deloitte is the biggest professional services Firm in the world and making an impact is more than just what we do: it’s why we’re here. We’re driven to create positive progress for our clients, community, people, and the planet. This sense of purpose inspires us to work to the highest standards, to tackle the challenges that matter.** *Joining us means becoming part of a Consulting team that’s at the top of its game and growing. Working with the best people and technology in the market, you’ll tackle meaningful projects that transform the future for high\-profile local and international clients. And you’ll do it as part of a people\-first culture that’s supportive, collaborative and, above all, welcoming.* At Deloitte, our Artificial Intelligence \& Data Team drives innovation by transforming data into actionable insights that empower our clients. As a Data Architect, you will play a pivotal role in designing and delivering cutting\-edge data solutions across diverse industries, leveraging the latest technologies and our global network. This role offers a unique opportunity to lead impactful projects, collaborate cross\-functionally, and develop your leadership skills in a dynamic, supportive environment focused on continuous learning and personal growth. **Key Skills And Prior Experience** * A minimum of a third\-level degree in Maths, Physics, Engineering, Computer Science, or a related discipline * Proven experience leading and delivering complex data\-related projects, with the ability to motivate and guide teams to achieve outstanding results * Strong stakeholder management skills, including influencing senior leaders and providing expert advice based on industry best practices * Commercial experience in information and data management, with familiarity in enterprise\-grade data architecture technologies such as Cloudera CDP, Azure Databricks, and cloud\-native environments **What type of work will I be doing?** * Scoping, designing, and leading the implementation of scalable data solutions and models using open source and proprietary technologies * Developing technical specifications and architecture designs for data storage and management aligned with enterprise standards * Ensuring data security and integrity are embedded within all architectural designs * Leading and mentoring data analysts and engineers to deliver solutions aligned with target architectures * Collaborating across Deloitte’s Technology and Transformation business areas to integrate data capabilities with broader organisational goals * Managing client engagements across various industries, building trusted relationships and identifying growth opportunities * Coaching junior team members, aligning their responsibilities with their professional development objectives **Who is the Hiring Manager?** The hiring manager is an experienced leader within Deloitte’s Artificial Intelligence \& Data Team, known for a collaborative and inclusive leadership style. They value open communication, professional development, and fostering a positive team culture. Their approach balances high performance expectations with empathy, encouraging innovation and continuous learning while maintaining a strong focus on delivering exceptional client outcomes. **Where is this role based?** This role is based in Dublin or Cork, with a flexible working model that includes hybrid arrangements between office and client sites. For more information, please visit our Deloitte Works webpage. *If you believe that you meet most of the criteria above, we encourage you to apply. Deloitte is an equal opportunities employer and will ensure any reasonable accommodations are implemented as part of the recruitment and selection process.* **What We Offer** *Your reward at Deloitte is competitive, supports our purpose and enables our people to never stop growing. Your reward at Deloitte is not just your salary, we believe in investing in our people's personal and professional development and empowering their work\-life balance. Our ambition is to achieve gender equality and enable continuous growth. We offer supports and benefits that suit you, wherever you are in life, including health and well\-being, pension, savings, training, coaching and* enhanced leave options *among others.* *Keep on being you. Bring your full, absolute self to work, every day. Explore, question and collaborate. Stretch your thinking, while building a career that inspires and energises you. And, whatever motivates you, keep growing both professionally and personally – because when you make an impact that matters, we do too.*",https://www.linkedin.com/jobs/view/4395721770
Data Engineer,Central Bank of Ireland,"Dublin, County Dublin, Ireland",linkedin,"**The Central Bank of Ireland serves the public interest by safeguarding monetary and financial stability and by working to ensure that the financial system operates in the best interests of consumers and the wider economy.** We currently have a vacancy for an **Associate Data Analyst, People Analytics** on a **specified purpose contract of 12 months** in the **HR Division** . This role is aligned with the **Bank Executive grade** and the BEX salary scale of *€39,090* applies. Please click here for further information on our salary scales. The purpose of the role is to assist the People Analytics team with specialist data analytics expertise to support the delivery of effective outcomes, including the production of relevant periodic management information. The role requires a comprehensive understanding of statistical analysis, business analytics, and practical experience in leveraging diverse data analytics tool to drive informed decision\-making within People Analytics. **Responsibilities** * Assist in delivering comprehensive data analysis findings, supporting divisional actions via descriptive, diagnostic, predictive, and decision analytics. * Prepare and analyse information ensuring timely, accurate delivery to stakeholders, effectively communicating completed work outcomes. * Continuously design, implement, and enhance reporting capabilities and tools to produce valuable management insights for informed business decisions. * Ensure stringent data integrity controls and compliance with relevant procedures, policies, and legislative requirements. * Collaborate with colleagues to facilitate effective project and work program delivery within the People Analytics domain. **Requirements** * Hold a third level honours degree or professional qualification in statistics, business analytics, computer science, mathematics, finance, economics, risk, or related fields. * 3\-5 years of relevant experience in data analytics within industry, academia, or financial services, spanning data science, statistical consulting, business intelligence, or data\-focused risk analysis. * Possess understanding/experience in applying data science/analytics in a business context along with practical knowledge of analytics software/tools and infrastructure. * Exhibit proficiency in database management (SQL, SQL Server/Services), statistical analysis tools (R, SAS, Matlab), programming languages (Python, Java, Julia), and business intelligence reporting/visualisation tools. Ability to acquire proficiency in new tools/languages as required. * Willingness to understand the broader regulatory environment, coupled with strong communication, organisational, workload management, judgment, and professional conduct skills. We know it's our people who make the Central Bank special and we are focused on creating a diverse, inclusive, fulfilling and progressive work environment. We encourage applications from candidates with different backgrounds, experiences and perspectives as it strengthens us, as individuals and as an organisation. We are committed to positively supporting candidates with disabilities. If we can make any reasonable accommodations for you in the recruitment process in order to give you the opportunity to perform to your best, please email our Disability Inclusion Partner, Aobh Kavanagh at aobh.kavanagh@centralbank.ie. Any information that you provide will be used only for the purposes of providing relevant support and will have no bearing on how your application will be viewed. *We have recently implemented a hybrid working model to balance the flexibility working from home provides with the value our office environments bring to support collaboration and connection with colleagues.* **Our approach to hybrid working enables colleagues to work from home up to 50% of working days, building on an existing broad range of flexible working policies and practices already in place to support our people achieve the right balance.** Our policies also provide insight into our organisational culture, work environment and working arrangements. Here are some of the key policies (subject to ongoing review and amendment) which may be of interest as you consider a career with us. The Central Bank pension scheme mirrors the rules of the civil service pension scheme. Therefore if you are in receipt of civil/public service pension, abatement may apply to your current pension. Details of the appropriate pension scheme will be provided upon determination of the appointee’s status. Application Details: Closing Date: **09/04/2026** To apply, please complete the application form attached (via the “apply” link). Before starting your application you will be asked to create a profile with us, this will allow you to track and review your application throughout the process. Click ""register"" to create a profile and complete the application process. Once your application has been successfully submitted you will receive an automatic email from us acknowledging receipt. If you do not receive this auto\-acknowledgement, please contact recruitment@centralbank.ie Our policies also provide insight into our organisational culture, work environment and working arrangements. Here are some of the key policies (subject to ongoing review and amendment) which may be of interest as you consider a career with us. **The Central Bank pension scheme mirrors the rules of the civil service pension scheme. Therefore if you are in receipt of civil/public service pension, abatement may apply to your current pension. Details of the appropriate pension scheme will be provided upon determination of the appointee’s status.** *Cuirfear fáilte roimh iarratais i nGaeilge* *The Central Bank of Ireland is an equal opportunities employer.*",https://www.linkedin.com/jobs/view/4395343077
