title,company,location,site,description,job_url
Practice Accountant,Kildare Audit & Accountancy Services,"Newbridge, KE, IE",indeed,"**Full job description** Due to the continued growth of the practice, an opportunity has arisen for a recently qualified accountant to join the firm, reporting directly to the practice owner, and heading up their own portfolio of clients. This role offers excellent potential for the successful candidate, to develop their own niche within the firm, liaise with clients and opportunities to progress within the practice as you develop and demonstrate your expertise. **Key Responsibilities** This role will oversee the preparation and review of financial accounts and tax computations for sole traders, companies, and partnerships, for review by Senior / Partner. In addition, preparation of audit working papers for individual companies and groups will be part of the ongoing role. Responsibilities: * Review and prepare financial accounts and tax computations. * Manage own portfolio of clients across multiple industries * Build relationships with clients and drive business growth * Support clients in preparation of regular management accounts * Help develop and train junior members of the team Experience \& Skills: * ACCA/ACA qualification with a minimum of 2\-3 years' experience in Practice. * Good technical knowledge in accounting, with a focus on efficient production of accounts to a high standard of detail and accuracy. * Rounded level of experience as career developed, with a full understanding of the process of accounts preparation from ground level, i.e. Debtors / Creditors / Bank process and reconciliation, up to formatted accounts review and audit review work * Outstanding communication and interpersonal skills, with a focus on delivering high\-quality client service. * Familiar with different accounting software packages and excellent verbal and written communication internally \& externally * Ability to self manage and direct with good organizational abilities, capable of managing multiple tasks and meeting strict deadlines. * Commercial awareness with the ability to offer practical, client\-focused solutions. * Willingness to learn, adapt, learn and grow with technology, and interest in implementing same internally and supporting client systems development. Competitive salary offered to the right candidate. Job Type: Full\-time Pay: €50,000\.00\-€60,000\.00 per year Benefits: * 25 days holidays * Hybrid 1\-2 days per week * EAP * Excellent work/life balance * Development and training support Ability to commute/relocate: * Newbridge, Co. Kildare Experience: * Accounting (Irish Practice Firm) : 2 years (required) Language: * English (required) Qualification * CPA, ACCA, ACA (required) Work authorisation: * Ireland (required) Work Location: In person Job Type: Full\-time Pay: €50,000\.00\-€60,000\.00 per year Benefits: * Company events * Company pension * Employee assistance program * Sick pay Ability to commute/relocate: * Newbridge, County Kildare: reliably commute or plan to relocate before starting work (required) Application question(s): * Do you have a Full Drivers Licence and own transport Experience: * General practice: 4 years (required) Work Location: In person",https://ie.indeed.com/viewjob?jk=99a240c9d5db3a6b
Procurement Assistant,Greatech Integration (Ireland) Ltd.,"Blanchardstown, D, IE",indeed,"**Principal Accountabilities:** * Review all data in entire BOM \& responsible to source materials / components per MPN, Manufacturer, Description \& Drawings. * Prepare quote package \& monitor RFQ through process \& documenting all concerns, discrepancies \& issues for new / bidding project related. * Manage all supplier in a manner consistent with the highest professional, ethical, moral \& legal standards * To plan, source \& develop new potential suppliers at the competitive price, quality \& lead time. * Managing\& coordinate supplier selection and qualification \& conducting Supplier Audit Program (SAP) together Supplier Quality Engineer (SQE). * Manage supplier performance, consolidate \& maintain all suppliers performance \& indicators. Prepare Supplier Quarterly Performance Assessment (SQPA) report. * Manage system data entry, ASL setup; Issue PO; Update promised date into system and ensure update accurate and timely. * Maintain product price list, approved suppliers master list \& Contract Agreements * Embark on cost reduction activities \& participate in regular cost\-saving program * Coordinate interaction between the section in the Material department \& all other department. * Supporting the organization by driving early supplier involvement, meeting bill of material cost targets via should cost analysis and sourcing timelines * Liaising with existing supplier / vendor on material pull in / push out; negotiating prices, payment term and delivery (lead time); send out Open Order Report (OOR) by weekly basis and ensure promised date update timely in system. * Coordinate and monitor shipment activities, including delivery schedules, logistics arrangements, and tracking of inbound materials to ensure timely arrival in line with project timelines. * Perform risk management to minimize project risk. * Team player, adaptive to organizational change and flexible in embracing changes * To comply to all requirements of ISO (inclusive of all standard approved by Management) and to adhere to general safety practices, standard operating procedures, work instructions, policies and guidelines provided by the company. * Other duties and assignments as instructed by superiors from time to time. **Requirements:** * Diploma or Degree in Business, Supply Chain, Engineering, or a related field (or currently pursuing). * 0–2 years’ experience in procurement, purchasing, or administrative support (manufacturing/engineering environment is an advantage). * Ability to multi\-task and work independently with minimal supervision, work under pressure and propensity to meet timelines. * Proficiency in MS Office applications (Excel, Word, and PowerPoint) is essential. * Advantageous to have experience in using ERP software. * Strong communication skills, both written and oral, are essential. **Benefits:** * On\-site parking * Refer a friend scheme * Bike to work scheme * Loyalty holidays scheme * Relevant training for development Job Types: Full\-time, Permanent Application question(s): * When are you able to start? * How many years of supply chain management / procurement related experience do you have? Experience: * Manufacturing / Automation Line: 1 year (preferred) Work authorisation: * Ireland (required) Work Location: In person",https://ie.indeed.com/viewjob?jk=fa4c86abdf1ce507
Project Finance Associate,Elevate Partners,"Dublin, County Dublin, Ireland",linkedin,"**We have partnered with a growing renewables platform to hire a Project Finance Associate to support a large\-scale financing programme, with \~€1bn of capital to be raised over the coming years.** **The role offers direct exposure to the structuring and execution of complex debt financings across renewable energy and infrastructure assets, working closely with senior treasury leadership and external lenders.** **Responsibilities** * Support the execution of project finance and corporate funding transactions * Develop and maintain financial models to assess funding capacity, bankability and covenant compliance * Prepare lender materials, credit analysis and transaction documentation * Coordinate with banks, institutional lenders, advisers and legal counsel * Support ongoing treasury activities including refinancing analysis, drawdowns and reporting **Profile** * 2–5 years’ experience in project finance, infrastructure finance, leveraged finance or corporate finance * Strong financial modelling and analytical skills * Experience working with lenders, advisers or institutional capital providers * Commercial, detail\-oriented and comfortable operating in a transaction\-driven environment **To discuss this opportunity in confidence, contact Diarmuid Clancy via dclancy@elevatepartners.ie or apply directly via the link provided.**",https://www.linkedin.com/jobs/view/4395291516
Project Planner,TGS International Group,"Dublin, County Dublin, Ireland",linkedin,"**Project Planner** **Location: Dublin** **Salary: Up to €60,000** **Employment type: Permanent** **Job Description** The Planning Manager is responsible for the strategic and operational planning of complex construction projects, with a particular emphasis on Mechanical \& Electrical (M\&E) installations. This individual will lead programme development, resource planning, progress tracking, and reporting across the full project lifecycle—from pre\-construction to commissioning and close\-out. **Main Duties \& Responsibilities** * Develop, manage, and maintain detailed master construction programmes using Primavera P6, ASTA Powerproject, Microsoft Project, and other scheduling tools. * Produce Level 1–4 programmes as required, in line with contract and client expectations. * Accurately resource\-load programmes and link to cost and procurement schedules. * Incorporate subcontractor and supplier input into the overall programme. * Track and update programmes regularly, measuring actual progress against baseline. * Generate and interpret a full suite of planning outputs. * Proactively identify schedule\-related risks and develop time\-based mitigation strategies. * Maintain a live risk register for planning\-related risks and provide inputs into broader project risk management efforts. * Lead “what\-if” and recovery scenario modelling. * Support acceleration efforts by developing programme crash strategies without compromising safety or quality. * Align programmes with commercial strategy and contractual requirements (e.g., NEC, FIDIC, JCT). * Present planning information confidently and clearly to clients, senior leadership, and project stakeholders. * Support pre\-construction teams in the development of tender and bid\-stage programmes. * Lead and mentor junior planners and scheduling engineers across multiple projects. * Help develop and standardise planning best practices and templates across the organisation. **Qualifications** * Extensive experience in construction planning, with a successful track record in a senior planning role. * Proficiency in Primavera P6, ASTA Powerproject, and Microsoft Project. * Demonstrated experience of delivering fully resourced and logically linked programmes. * Proven ability to produce and interpret outputs such as critical path analysis, float calculations, histograms, and earned value metrics. * Experience across large\-scale, multi\-disciplinary construction projects, ideally with M\&E focus. **Additional Information** Having an inclusive and flexible culture helps the business continue to grow as a strong, dynamic, and innovative organisation. The company also offers: * Competitive salary * Professional development support * Employee Assistance Program * Health and Wellness programs",https://www.linkedin.com/jobs/view/4396984144
QC Analyst (Bioassay),Morgan McKinley,"Dún Laoghaire, Dún Laoghaire-Rathdown, Ireland",linkedin,"An exciting opportunity for an experienced QC Bioanalytical Analyst with pharmaceutical industry experience within a wide variety of analytical techniques including but not limited to cell based\- Bioassays, Immunoassays, Cell Culture (use of cells to execute bioassays) and Aseptic Technique. Experience with liquid\-handling robots is also preferable. **Key Responsibilities** * Performing a wide variety of analytical techniques including but not limited to cell based\- Bioassays, Immunoassays, Cell Culture (use of cells to execute bioassays) and Aseptic Technique. Experience with liquid\-handling robots is also preferable. * Plan and perform multiple, complex routine/ non\-routine methods and procedures and a large variety of assays. * Participate in the peer review of analytical data * Responsible for providing technical guidance and applying expertise and critical thinking to help to resolve technical issues. * Lead training of staff on technical aspects of job as required. * Develop, revise and implement procedures that comply with appropriate regulatory requirements. * Qualification of analytical equipment and related testing functions * Participate in Analytical Method Transfers * Compliance with Standard Operating Procedures and Registered specifications. * Maintain quality systems within the QC laboratories to ensure ongoing compliance to cGLP and cGMP. * Ensure timely completion of Laboratory Investigation Reports and deviations through the Non\-Conformance procedures. * Participate in the generation and update of SOP’s, trend data, investigations, non\-conformances, validation protocols, reports, method validation/verifications and equipment qualifications. * Participate in regulatory agency inspections as required. * Plan and implement procedures and systems to maximise operating efficiency. * Manage and contribute to the achievements of department productivity and quality goals. **Qualifications \& Experience:** * Hold a Degree in Science/Biochemistry or related discipline * Must be confident working with cells to execute bioassays within a GMP environment. * Minimum 2 years' pharmaceutical industry experience",https://www.linkedin.com/jobs/view/4393407905
Refurb Maintenance Technician (Dublin & surrounding area),JR Support Services LTD,"Dublin, D, IE",indeed,"**Refurb Maintenance Technician (**Dublin **\& surrounding area)** Role Overview We are seeking an experienced Refurbishment Maintenance Technician to deliver high\-quality turnaround works on void properties, ensuring units are fully prepared for new tenant occupancy. The role involves multi\-trade maintenance with a strong focus on quality, efficiency, and attention to detail Key Responsibilities * Complete full void property refurbishments and turnaround works * Prepare properties to a move\-in ready standard within tight timeframes * Carry out general maintenance, repairs, and reinstatement works * Identify and resolve defects to ensure a high\-quality finish * Work independently or as part of a team across multiple sites * Maintain clean, safe, and organised working environments * Skillset needed \- * Strong all\-round maintenance experience (multi\-trade essential) * Painting \& decorating (walls, ceilings, woodwork) * Minor carpentry \& woodwork repairs * Basic electrical works (e.g. light fittings, sockets – non\-certified) * Basic plumbing (e.g. taps, sanitaryware, small repairs) * Tiling repairs and small installations * General property maintenance across multiple trades Job Type: Full\-time Benefits: * Additional leave * Company car * Company events * Company pension * Sick pay Language: * English (required) Licence/Certification: * Driving Licence (required) Work Location: On the road",https://ie.indeed.com/viewjob?jk=eb9611cd777fceeb
Registrar,Bon Secours,"Dublin, D, IE",indeed,"**Job Title:** Medical Registrar in General Internal Medicine (GIM)**Reporting to:** Administratively accountable to the Medical Manpower Manager Clinically and professionally responsible to the attending Consultant**Job Summary:** Act under the supervision of the Consultant in the provision of a medical service to patients and support the Consultants in their duties. The fundamental philosophy guiding this position is to promote and preserve the Bon Secours Mission, Values and Ethos.**Responsibilities:*** The primary responsibility is to provide direct care for patients including taking history and physical examinations, ordering image investigations, coordinating care with the inpatient teams and organising follow up for patients * Completing the inpatient drug Kardex and hospital admission note is expected so as to avoid duplication * On rare occasions the registrar may be asked to assist in the admission of patients from direct ward referral and / or day case patients and / or patients transferred from other hospitals when inpatient admitting teams are overwhelmed. This will be at the discretion of the attending Consultant in GIM and dependent on workload * The hours of work will be negotiated individually with the Registrar, but will ideally encompass hours where the service is maximally busy such as the afternoons and early evenings * Assess, review, verify and document findings for patients as requested by the attending Consultant and / or Nursing Staff. Document review findings in clinical notes in a timely and legible manner * Provide Clinical Cover for procedures undertaken in departments * Prescribe medications for patients as required e.g., as directed by Consultant and/or, following a Consultant review or Nursing staff * Give ongoing assistance and support to all Consultants in the care of patients and give instant feedback on any issues or problems requiring attention * Assist in the education of colleagues and Nursing staff Participate in the NCHD On Call Rota * Participate and contribute to the M\&M meeting * Respond to emergency situations in accordance with protocol Maintain effective liaison with all Hospital staff and NCHD colleagues to ensure effective teamwork and safe outcomes * Respond to any Adverse Occurrences e.g., injuries, falls, sudden illnesses etc, suffered by patients, visitors or staff * Actively engage with medical education of all medical students and Physician Associate students attending the hospital * Undertake associated administrative duties e.g., issue of sickness certificates etc * Contribute to quality improvement and risk management initiatives wherever possible * Act and behave professionally and perform one’s duties in a manner that optimises patient care and protects and enhances the reputation and mission of Bon Secours Hospital * Adhere to hospital policies and procedures e.g., blood guidelines, infection control, JCI policies, work hours and overtime. * Implement quality standards ensuring that a quality service is provided at all times. * Comply with Health and Safety Regulations, ensuring safe working practices and a safe working environment. * Undertake any other duties that may reasonably be required. **ESSENTIAL QUALIFICATIONS*** Possess a Medical Degree * Minimum of 4 years post qualification experience * Possess current full Medical Council Registration **ESSENTIAL EXPERIENCE*** Have sufficient medical, diagnostic and management experience and capability to fulfil functions of the post **ESSENTIAL KNOWLEDGE AND SKILLS*** Have excellent supervisory, interpersonal and communication skills and a high capacity for responsibility and individual initiative * Be able to demonstrate adoptability to the rapid changes taking place in the Hospital * Possess excellent communication and interpersonal skills – working knowledge of the English language **ESSENTIAL PERSONAL ATTRIBUTES*** Be a good team worker * Be motivated, methodical with superior attention to detail **CLOSING DATE FOR RECEIPT OF APPLICATIONS 10TH APRIL 2026***Bon Secours Health System is an equal opportunities employer. Our values of Human Dignity, Compassion, Stewardship, Service and Integrity guide everything we do. We are committed to fostering an inclusive and supportive workplace where all employees have the opportunity to thrive. We welcome applications from individuals of all backgrounds, abilities and perspectives, and provide reasonable accommodations throughout the recruitment process. If you require any assistance, please contact* *recruitmentdublin@bonsecours.ie*",https://ie.indeed.com/viewjob?jk=e874d4949bff7518
