title,company,location,site,description,job_url
Administrative Assistant,AWN Consulting Ltd.,"Dublin, County Dublin, Ireland",linkedin,"Are you a motivated Administrative Assistant seeking a more flexible and supportive work environment? Look no further than AWN Consulting! Our company values work\-life balance and offers a hybrid work policy that allows for remote work and collaborative office settings. Training and development are at the forefront of our priorities, as we invest in your growth through chartership opportunities, training programs, and mentorship. At AWN, we celebrate diversity and prioritise inclusivity, respect, and well\-being for all our employees. Our partnership with Health Assured provides a range of services aimed at improving mental and physical health, and our employee resource groups promote a supportive environment where you can thrive and reach your full potential. Join our team and embark on a fulfilling career in the environmental sector where you can truly make a difference. In addition to our supportive work environment, we offer a comprehensive employee benefits package designed to enhance every aspect of your life. From income protection to paid maternity and paternity leave, service awards, and performance\-related bonuses, we also provide access to a bike\-to\-work scheme and organise various social events throughout the year for all staff members. As a subsidiary of Trinity Consultants, AWN stands out as a premier environmental consultancy offering expert services to a wide range of clients throughout Ireland and Europe. Our team of highly experienced environmental experts deliver top\-quality services in areas including Environmental Impact Assessments, acoustic assessments, air quality assessments, and process safety management. As Ireland’s premier specialist environmental consultancy our team work on a range of large, complex and interesting projects. Examples of our recent projects include – MetroLink, BusConnects, DART\+, Semi\-conductor manufacturing facilities, biologics manufacturing facilities and many more. **Position Overview** AWN is expanding its Administration Team and is currently seeking a Junior Administrative Assistant. The successful candidate will join our dynamic admin and finance team, providing support across project administration, HR and Operations. **Main Duties and Responsibilities** * Acting as point of contact for project set up on our accounts software * Assisting with the upkeep of employee documentation, training, recruitment paperwork and induction packs * Assisting with the upkeep of our Internal Management System in line with our audit requirements * Updating spreadsheets and client records * Providing administrative support to the admin team and across the organisation * Answering and directing phone calls * Writing and distributing emails, correspondence memos and letters * Working within a busy company, multi\-tasking and contributing to all aspects of office administration **Essential Requirements:** * 1\-2 years’ experience working in a similar role * Excellent organisational and interpersonal skills, self\-motivation, and the ability to work independently and as part of a team. * High attention to detail, excellent report writing, and communication skills. * Excellent proficiency in Microsoft Office. **Benefits** * Competitive salary. * Contributory pension. * Discretionary company bonus. * Up to 25 days holiday. * Hybrid working/ flexible working arrangements available. * Paid Maternity/Paternity leave. * Career development and support, including training and assistance towards professional chartership or membership.",https://www.linkedin.com/jobs/view/4395345653
"Analyst I, CDD",GoFundMe,"Dublin, County Dublin, Ireland",linkedin,"**Want to help us help others? We’re hiring!** GoFundMe is the world’s most powerful community for good, dedicated to helping people help each other. By uniting individuals and nonprofits in one place, GoFundMe makes it easy and safe for people to ask for help and support causes—for themselves and each other. Together, our community has raised more than $40 billion since 2010\. Join us! The GoFundMe team is searching for a skilled and passionate Analyst I to join our global Trust \& Safety team. In this dynamic role, you will be required to operate at an impeccable level of consistency while mastering new techniques and technologies to ensure GoFundMe remains a safe place to give and receive donations online. Trust \& Safety is an integral part of GoFundMe's business. It drives growth, builds and nurtures our brand, and ensures that we always do the right thing by our customers. We are at the front line of GoFundMe’s efforts to protect donors, fundraiser organizers, beneficiaries, and our company from financial crimes and abuse. As a member of the Customer Due Diligence (CDD) team, you will be responsible for providing high\-quality email support to ensure the authenticity of fundraisers, campaign organizers, and beneficiaries, as well as analyzing fundraisers for fraud and money laundering schemes, verifying identities and Know Your Customer/Business (KYC/B) information, and enforcing compliance with relevant laws and regulations. **The Job** * Provide high\-quality email and occasional phone support to customers and other stakeholders to ensure fundraiser authenticity and safe delivery of funds for beneficiaries. * Evaluate fundraiser and account attributes for unusual activity and escalate identified risks for final determination and/or next steps. * Conduct KYC and CDD reviews on individuals to support escalation pathways to the EDD team for enhanced due diligence; focusing on identity verification, sanctions and watchlist screening, Politically Exposed Person(s), Counter\-Terrorism Financing, and financial crimes. * Conduct onboarding due diligence and KYB reviews on organizations, including but not limited to, identity verification and watchlist management, to ensure entities comply with our Terms of Service and applicable laws and regulations. * Collect and analyze information on an organization’s governance, operations, and financial performance. * Work cross\-functionally with Payments Risk, Content Risk, Legal, Customer Care, the Compliance program, Product, and others to ensure fundraisers on GoFundMe are legitimate and donations are delivered to the correct parties. * Field questions connected to customer due diligence from internal partners. * Develop a deep understanding of risk\-related issues experienced on the platform. **You** * Bachelor’s degree or equivalent experience preferred. * 1\-3 years experience working in the payments or compliance industry, with knowledge of merchant processing behaviors. * In\-depth knowledge of global customer due diligence, AML, CTF, sanctions, beneficial ownership requirements, Know Your Customer standards, and how these apply for a merchant and the wider financial ecosystem. * Passionate about staying current on regulatory changes, industry guidance, and card scheme compliance. * Excel in individual performance metrics to adhere to Service Level Agreements and maintain strong quality standards, while contributing to improving the team’s operational performance. * Ability to work with ambiguity, thrive in a dynamic environment with shifting priorities and quickly adapt to process and policy changes. * Empathetic with a strong customer\-centric mindset. * Work well with a distributed global workforce and confidently maintain communication while working autonomously in a remote or hybrid environment. * Ambitious self\-starter with excellent attention to detail. * Fast learner, with initiative and follow through without sacrificing quality. * Strong performer, able to meet deadlines while balancing different priorities. * Communicate clearly and concisely both orally and in writing, with C1 English proficiency. * Inquisitive with a solution\-oriented mindset. * Exemplify company core values and embody team culture. * Adaptable to structured schedules and resilience in covering holiday shifts as part of regular operations. **Why you’ll love it here** * Make an Impact: Be part of a mission\-driven organization making a positive difference in millions of lives every year. * Innovative Environment: Work with a diverse, passionate, and talented team in a fast\-paced, forward\-thinking atmosphere. * Collaborative Team: Join a fun and collaborative team that works hard and celebrates success together. * Competitive Benefits: Enjoy competitive pay and comprehensive healthcare benefits. * Holistic Support: Enjoy financial assistance for things like hybrid work, family planning, along with generous parental leave, flexible time\-off policies, and mental health and wellness resources to support your overall well\-being. * Growth Opportunities: Participate in learning, development, and recognition programs to help you thrive and grow. * Commitment to DEI: Contribute to diversity, equity, and inclusion through ongoing initiatives and employee resource groups. * Community Engagement: Make a difference through our volunteering program. **We live by our core values:** *impatient to be great* , *find a way* , *earn trust every day* , *fueled by purpose* . Be a part of something bigger with us! GoFundMe is proud to be an equal opportunity employer that actively pursues candidates of diverse backgrounds and experiences. We do not discriminate on the basis of race, color, religion, ethnicity, nationality or national origin, sex, sexual orientation, gender, gender identity or expression, pregnancy status, marital status, age, medical condition, mental or physical disability, or military or veteran status. If you require a reasonable accommodation to complete a job application or a job interview or to otherwise participate in the hiring process, please contact us at accommodationrequests@gofundme.com. **Global Data Privacy Notice For Job Candidates And Applicants** Depending on your location, the General Data Protection Regulation (GDPR) or certain US privacy laws may regulate the way we manage the data of job applicants. Our full notice outlining how data will be processed as part of the application procedure for applicable locations is available here. By submitting your application, you are agreeing to our use and processing of your data as required. **Learn More About GoFundMe** We’re proud to partner with GoFundMe.org, an independent public charity, to extend the reach and impact of our generous community, while helping drive critical social change. You can learn more about GoFundMe.org’s activities and impact in their FY ‘24 annual report. Our annual “Year in Help” report reflects our community’s impact in advancing our mission of helping people help each other. For recent company news and announcements, visit our Newsroom.",https://www.linkedin.com/jobs/view/4395345704
Analyst – Development Land,Savills,"Dublin, D, IE",indeed,"**The Company** Savills is a company that leads rather than follows and now has over 30,000 employees in 700 offices and associates throughout the Americas, Europe, Asia Pacific, Africa and the Middle East. Our reputation has been established by securing the best professional talent in the market and by providing top class professional advice to our clients through dedicated customer care. The Savills Ireland Development Agency \& Consultancy team are clear market leaders, with an impressive track record of consistently handling some of the largest development consultancy instructions in Ireland.**The Role / Location** We are now seeking an experienced and ambitious Analyst to join our Development Agency and Consultancy team in Dublin. This is an exciting opportunity to play a key role in delivering strategic advice to clients across both consultancy and agency disciplines, providing expertise in development land strategy, valuation, planning and financial analysis. The successful candidate will demonstrate strong technical capability, commercial acumen, and a deep understanding of the Irish development land and planning market. The role will be predominately consultancy based; however, the successful candidate should demonstrate their ability to work flexibly in both consultancy and agency roles. **Role Competencies:*** Provide strategic consultancy advice on development land, planning, and financial viability to a range of clients including developers, investors, institutions, and lenders. * Undertake detailed site analysis, market research, and financial modelling to establish optimum development strategies. * Deliver high\-quality written reports, appraisals, presentations and recommendations, demonstrating commercial insight and accuracy. * Prepare and analyse development cashflows and appraisals using Excel and Argus Developer to a high standard. * Advise on project feasibility, design, phasing, and delivery to maximise site potential and value. * Provide advice on planning policy, zoning, and development potential in the Irish market. * Monitor activity and trends in the Irish development land market. * Support and lead on land and investment sales and acquisitions, managing the process from inspection and appraisal through to due diligence, negotiation, and completion. * Prepare and deliver compelling pitches and presentations to clients and stakeholders. * Manage client instructions efficiently, ensuring Savills’ brand and service standards are consistently upheld. * Build and maintain strong relationships with existing and prospective clients to generate new business opportunities. * Contribute to the department’s growth through market intelligence and networking within the Irish property market. * Demonstrate strong negotiation and sales skills across commercial and development transactions. * Manage and strengthen client relationships, ensuring high standards of service and responsiveness. * Collaborate with other Savills teams to deliver integrated solutions and cross\-departmental efficiencies. * Mentor and guide junior team members, supporting their development and contributing to a positive, high\-performance culture. **Person Specification:*** Excellent verbal and written communication skills. * BA degree in Finance, Real Estate or a related field * Minimum 4–5 years’ experience in property consultancy, development, or agency roles. * Strong financial and analytical skills, with advanced Excel cashflow modelling and Argus Developer proficiency. * Excellent report writing and presentation skills, with the ability to communicate complex information clearly. * In\-depth understanding of the Irish development land and planning market and relevant policy environment. * Strong commercial acumen and negotiation skills. * Ability to manage multiple complex projects and meet tight deadlines. * Confident communicator with proven ability to build trust and credibility at all levels. * Proactive, adaptable, and motivated by delivering quality outcomes in a fast\-paced environment. **Savills Ireland is an equal opportunity employer.***Savills aims to attract, recruit and retain the best people from the widest possible pool of talent. As such, we are committed to creating an inclusive and diverse working environment for all employees by striving at all times to be an organisation which does not discriminate, values everyone’s talents and abilities and where diversity is positively promoted.*",https://ie.indeed.com/viewjob?jk=cfbf6f0345e297ae
"Analyst, Finance, GFS",West Pharmaceutical Services,"Dublin, County Dublin, Ireland",linkedin,"**Description** **This is a 12 month fixed term contract.** **This is a hybrid position requiring the team member to be onsite a minimum of 3 days per week.** **Who We Are** At West, we’re a dedicated team that is connected by a purpose to improve patient lives that has been at the center of our Company for more than a century. Our story began when Herman O. West solved the problem of supplying penicillin in mass quantities to the US Government during World War 2\. Through our work to deliver thousands of life\-saving and life\-enhancing injectable medicines to millions of patients daily, West’s indelible mark on the healthcare industry has just begun. A name started our story. How will yours help write our future? There’s no better place to join an inclusive community of professionals with opportunities for lifelong learning, growth and development. Supported by benefit programs, we empower the physical, mental, emotional and financial health of our team members and their families. We believe in giving back to help those in need in the communities where we live and work. And are equally committed to creating a healthier environment and planet through our sustainability efforts. **Job Summary** * To position itself to meet the requirements of continuing rapid business growth and future market development, West Pharmaceutical Services have developed a transformation strategy of standardization, simplification and centralization of global accounting operations. * In accordance with that strategy, we are establishing a Global Financial Centre of Excellence in Dublin, Ireland. Reporting to, and working closely with, the Regional Finance Manager, in this role, you will be responsible for the preparation of Monthly Financial Reports, Annual Financial Statements and any other internal or external reports as required, ensuring that they are completed in a timely, accurate and efficient manner. **Essential Duties And Responsibilities** * Support the migration of the record to report accounting function from other company locations * Preparation of monthly financial reports, ensuring they are completed in a timely, accurate and efficient manner and in accordance with US GAAP * Preparation, analysis and posting of journals at month end * Preparation and analysis of balance sheet reconciliations at month end * Calculation, posting and analysis of monthly accruals and prepayments, ensuring that all items are accurately captured * Review and reconciliation of inter\-company accounts * Preparation of multi\-currency bank reconciliations * Preparation of variance analysis * Support of statutory reporting process * Preparation of transactional taxes e.g. VAT * Support annual corporation tax compliance * Liaise with internal and external auditors * Process, technology and service: + Support deployment of SAP S/4 HANA and other systems e.g. Blackline to garner greater efficiency within the Record to Report function + Support implementation of Artificial Intelligence and/or RPA to drive further efficiency and effectiveness in our delivery of accounting services * Other duties as assigned ****Education**** * Bachelor's Degree in Accounting or Business with concentration in Accounting/Finance preferred or equivalent experience * Qualified accountant i.e. ACA, ACCA, CIMA or CPA ****Work Experience**** * Minimum 3 years of relevant accounting/finance experience required **Preferred Knowledge, Skills And Abilities** * Big 4 an advantage * Previous Shared Service Centre with multinational publicly quoted company experience * Working knowledge of US GAAP * Proficient in SAP or similar ERP * Proficient in MS Office applications * Experience of Bl tools an advantage * Excellent communication and leadership skills * Able to multi task * Able to be aware of all relevant SOPs as per Company policy as they are related to the position covered by this Job Description * Able to comply with the company's safety policy at all times * Able to comply with the company's quality policy at all times ****Travel Requirements**** 10%: Up to 26 business days per year ****Physical Requirements**** Sedentary\-Exerting up to 10lbs/4kgs of force occasionally, and/or negligible amount of force frequently or constantly to lift, carry, push, pull, or otherwise move objects, including the human body. Sedentary work involves sitting most of the time. West is an equal opportunity employer and we value diversity at our company. We do not discriminate on the basis of race, religion, color, national origin, gender, sex, gender identity, sexual orientation, age, marital status, veteran status, or disability status. If you have a special need that requires accommodation in order to apply to West, please send an email to Apply.Accommodation@westpharma.com . Where permitted by law, an offer of employment with West Pharmaceutical Services, or any of its subsidiary or affiliate companies, is contingent upon the satisfactory completion of background screening.",https://www.linkedin.com/jobs/view/4395335437
Analytical Associate Scientist,PSC Biotech® Corporation,"Dunboyne, County Meath, Ireland",linkedin,"**About PSC Biotech** **Who are we?** PSC Biotech is a leading Biotech Consultancy firm founded in 1996, headquartered in Pomona, California, USA, with Global operations in Ireland, India, Singapore, Australia and the US, serving 350 clients in more than 23 countries worldwide. We provide cloud\-based software solutions for Quality Management and Regulatory Inspections, pharmaceuticals contract manufacturing professionals, and metrology services to our clients. **‘Take your Career to a new Level’** PSC Biotech disrupts the conventional consultancy model by aligning our EVP as one of the unique selling point which includes the opportunity to work with the most talented cohort of like\-minded professionals operating in the Pharma/ Biotech Industry. We offer a permanent contract of employment giving exposure of working in Top Pharmaceutical client sites in a diverse\-cultural work setting. **Employee Value Proposition** Employees are the “heartbeat” of PSC Biotech, we provide unparalleled empowering career development though Learning \& Development in\-house training mentorship through constant guidance to facilitate career progression. We believe in creating high performing teams that can exceed our client’s expectations with regards to quality of all scalable and business unit deliverables, staying under budget and ensuring timelines for our deliverables are being met. **Overview:** A fantastic opportunity has arisen for an Analytical Associate Scientist R\&D this individual will work closely with the Enabling Technology and Engineering group to leverage Process Automation knowledge as well as the Analytical group to enable the adoption of Process Analytical Technology (PAT).The Microbiology Lab Operations group with work closely with Operations to understand facility fit and will be able to flex resources as needed. This is an onsite \& day based role **Requirements** **Responsibilities:** * Support laboratory operations within the laboratory facility which will include support of equipment qualification (PQ), documentation generation of SOP’s, Work instructions as well as contributing to lab and process establishment. * Perform supporting activities for general lab operations, Run the business tasks such as EM, Facility testing, method verifications, troubleshooting and execution of laboratory studies were required. * Review, trending and reporting of laboratory data, to support generation of batch data, to collate and analyse end of quarter and year reports for all raw data generated. Maintaining and release of laboratory stock, ordering laboratory consumables where required. * Manage and ensure routine cleans of laboratory equipment are completed as per site procedures, ensure laboratory housekeeping standards are maintained, identifying continuous improvement opportunities in laboratory processes. * Responds to standard requests from partners, customers and clients (internal and/or external) and escalate to manager when appropriate * Active participation in functional meetings, facilitation of cross\-functional meetings where required, audits ( internal and external) * Support site safety culture and ways of working. * Support introduction of novel, innovative solutions, supporting the testing of biologics within the facility. * Build team effectiveness skills, learn to promote team success through own actions and by demonstrating respect and appreciation for diverse populations. * Support timely training completion and coaching of team members. * Be flexible to support changing business needs, (e.g. Infrequent out of hours testing support for exceptional circumstances). **Skills Required:** * A degree qualification in a relevant field (Biological Sciences/ Engineering), preferable for background in microbiology. * A minimum of 1\+ years experience working in a relevant academic or industry field, (Internships and student placements will be considered in lieu of experience). * Ability to work as part of a team and on own initiative in a constructive manner. * Some knowledge with Biologics manufacturing and familiarity with microbiological testing techniques. * Knowledge of laboratory systems (e.g. LIMS, E\-logs, MODA, and electronic notebooks). * Ability to think logically and be proactive under pressure. * A good knowledge of GMP, familiarity with USP, EP, JP requirements.",https://www.linkedin.com/jobs/view/4393060494
