title,company,location,site,description,job_url
Customer Service Intermediate Analyst (French or German will be an asset),Citi,"Dublin, County Dublin, Ireland",linkedin,"Shape your career with Citi in Dublin. By joining Citi, you will become part of a global organization whose mission is to serve as a trusted partner to our clients by responsibly providing financial services that enable growth and economic progress. Citi has had a presence in Ireland since 1965, it was one of the first foreign banks to open an office in the country and is the Citibank Europe Plc Headquarters. **Team/Role Overview** The Customer Service Analyst is an intermediate\-level position responsible for providing clients with resolutions and support in coordination with the Customer Service team. The overall objective of this role is to address external customer issues and provide ongoing customer service support. **Responsibilities:** * Manage a portfolio of high\-profile clients, ensuring queries are acknowledged, investigated and resolved timely and professionally and in line with departmental standards * Provide coaching and support to team and serve a point of contact for escalations * Develop and maintain client portfolio through regular calls and face to face interaction, as needed * Inform clients about problems (system failures, market issues) and provide regular resolution updates * Advise on and advocate the implementation of process improvement and reengineering to improve client experience * Maintain knowledge of new market and regulatory requirements affecting client portfolio/base * Escalate customer feedback, processing delays and errors appropriately * Conduct necessary analyses to resolve problems, liaising with internal teams on escalation, as necessary * Complete tasks such as reviews, audit preparation, capacity planning, reporting and maintain control environment **Qualifications:** * Relevant experience (customer service/business/financial environment) preferred * Additional European language (French/German) will be an asset * Demonstrated project management and organizational skills to prioritize multiple tasks * Proven self\-reliance and accountability and ability to manage risk * Consistently demonstrate clear and concise written and verbal communication with ability to influence stakeholders * Proven investigative and analytical skills **What We Can Offer You** By joining Citi Dublin, you will not only be part of a business casual workplace with a hybrid working model (up to 2 days working at home per week), but also receive a competitive base salary (which is annually reviewed) and enjoy a whole host of additional benefits that support you (and your family) to be well, live well and save well. Discover more here. Alongside these benefits Citi is committed to ensuring our workplace is where everyone feels comfortable coming to work as their whole self every day. We want the best talent around the world to be energized to join us, motivated to stay, and empowered to thrive. **Sounds like Citi has everything you need? Then apply to discover the true extent of your capabilities.** Ł1 \-\-\-\-\-\-\-\-\-\-\-\-\-\-\-\-\-\-\-\-\-\-\-\-\-\-\-\-\-\-\-\-\-\-\-\-\-\-\-\-\-\-\-\-\-\-\-\-\-\-\-\-\-\- **Job Family Group:** Customer Service \-\-\-\-\-\-\-\-\-\-\-\-\-\-\-\-\-\-\-\-\-\-\-\-\-\-\-\-\-\-\-\-\-\-\-\-\-\-\-\-\-\-\-\-\-\-\-\-\-\-\-\-\-\- **Job Family:** Institutional Customer Service \-\-\-\-\-\-\-\-\-\-\-\-\-\-\-\-\-\-\-\-\-\-\-\-\-\-\-\-\-\-\-\-\-\-\-\-\-\-\-\-\-\-\-\-\-\-\-\-\-\-\-\-\-\- **Time Type:** Full time \-\-\-\-\-\-\-\-\-\-\-\-\-\-\-\-\-\-\-\-\-\-\-\-\-\-\-\-\-\-\-\-\-\-\-\-\-\-\-\-\-\-\-\-\-\-\-\-\-\-\-\-\-\- **Primary Location Full Time Salary Range:** 52 580,00 € \- 73 620,00 € \-\-\-\-\-\-\-\-\-\-\-\-\-\-\-\-\-\-\-\-\-\-\-\-\-\-\-\-\-\-\-\-\-\-\-\-\-\-\-\-\-\-\-\-\-\-\-\-\-\-\-\-\-\- **Most Relevant Skills** Please see the requirements listed above. \-\-\-\-\-\-\-\-\-\-\-\-\-\-\-\-\-\-\-\-\-\-\-\-\-\-\-\-\-\-\-\-\-\-\-\-\-\-\-\-\-\-\-\-\-\-\-\-\-\-\-\-\-\- **Other Relevant Skills** For complementary skills, please see above and/or contact the recruiter. \-\-\-\-\-\-\-\-\-\-\-\-\-\-\-\-\-\-\-\-\-\-\-\-\-\-\-\-\-\-\-\-\-\-\-\-\-\-\-\-\-\-\-\-\-\-\-\-\-\-\-\-\-\- **Automated Processing and AI** We use automated processing, including artificial intelligence, for our legitimate business interests (or our reasonable and appropriate business purposes) to identify and align the candidate's skills and abilities with a specific job opening. Additionally, if you so choose, or consent, we can match your skills and abilities to other suitable roles at Citi. Importantly, all our hiring processes and decisions, including determining your suitability for a role, are conducted, checked, and decided by individuals. Our automated processing and AI do not involve relying on automatic or autonomous decision\-making. Please refer to any Jurisdictional Considerations, with specific provisions for your country (where relevant) for further details. \-\-\-\-\-\-\-\-\-\-\-\-\-\-\-\-\-\-\-\-\-\-\-\-\-\-\-\-\-\-\-\-\-\-\-\-\-\-\-\-\-\-\-\-\-\-\-\-\-\-\-\-\-\- *This job opening is for an existing job vacancy.* \-\-\-\-\-\-\-\-\-\-\-\-\-\-\-\-\-\-\-\-\-\-\-\-\-\-\-\-\-\-\-\-\-\-\-\-\-\-\-\-\-\-\-\-\-\-\-\-\-\-\-\-\-\- *Citi is an equal opportunity employer, and qualified candidates will receive consideration without regard to their race, color, religion, sex, sexual orientation, gender identity, national origin, disability, status as a protected veteran, or any other characteristic protected by law.* *If you are a person with a disability and need a reasonable accommodation to use our search tools and/or apply for a career opportunity review* *Accessibility at Citi.* *View Citi’s EEO Policy Statement and the Know Your Rights poster.*",https://www.linkedin.com/jobs/view/4369154983
Data Architect,Version 1,"Dublin, County Dublin, Ireland",linkedin,"**Company Description** Version 1 has celebrated over 28 years in Technology Services and continues to be trusted by global brands to deliver solutions that drive customer success. Our expertise enables our customers to navigate the rapidly changing Digital\-First world we live in. We foster strong partnerships with leading technology giants including Microsoft, AWS, Oracle, Red Hat, OutSystems, Snowflake, ensuring that our customers are provided with the highest quality solutions and services. We’re An Award\-winning Employer Reflecting How Our Employees Are At The Very Heart Of Version 1 And What We Do * UK \& Ireland's premier AWS, Microsoft \& Oracle partner * 3300\+ strong, €350/£300m revenue business * 10\+ years as a Great Place to Work in Ireland \& UK * Best Workplace for Women in the UK \& Ireland by GPTW * Best Workplace for Wellbeing in the UK by GPTW We’re a core values driven company, we hire people who share our values, and we reward those who display and foster them, it’s deeply embedded within our DNA. Invest in us and we’ll invest in you! **Job Description** As a Data Solution Architect you will be expected to take an architecture lead role on our client’s solution delivery engagements, with high levels of customer engagement. This will involve ongoing analysis of business requirements throughout the lifetime of the service. Candidates will have a strong understanding of data architecture and analytics design and project delivery life\-cycles with an emphasis of working in client facing environments. **Typically The Role Will Involve The Following** * Translating Business requirements to technical solutions and the production of specifications, * Designing and implementing business intelligence \& modern data analytics platform technical solutions, * Data architecture design and implementation, * Data modelling, * ETL, data integration and data migration design and implementation, * Master data management system and process design and implementation, * Data quality system and process design and implementation, * Major focus on data science, data visualisation, AI, ML, * Documentation of solution (e.g. data modelling, configuration, and setup etc.) including HLD and LLD, * Working within a project management/agile delivery methodology, * Managing Team Members on a day to day basis, * Managing technical delivery of solution. **Qualifications** Hands on experience with data solution architecture, design, rollout and technical leadership, * Hands on experience with business intelligence and analytics tools, data modelling, data staging, and data extraction processes, including data warehouse and cloud infrastructure, * Strong team leadership and/or customer management experience; experience of leading a team of technical resources and developing junior and senior people on the team. * Cloud experience in AWS or Azure with Databricks experience is desirable. * Experience and demonstrated competencies with multi\-dimensional design, star schemas, facts and dimensions. * Expertise in logical and physical data warehouse database design, DWH development * Experience and demonstrated competencies in ETL development techniques * Experience in data warehouse performance optimization, * Good knowledge and concepts around data science, data visualisation etc. side. * Experience on projects across a variety of industry sectors an advantage, * Comprehensive understanding of data management best practices including demonstrated experience with data profiling, sourcing, and cleansing routines utilizing typical data quality functions involving standardization, transformation, rationalization, linking and matching, * Good knowledge of Databricks, Azure / AWS / Snowflake, Oracle cloud, R, Python. **Additional Information** **Why Version 1?** At Version 1, we believe in providing our employees with a comprehensive benefits package that prioritises their wellbeing, professional growth, and financial stability. * Share in our success with our Quarterly Performance\-Related Profit Share Scheme, where employees collectively benefit from a share of our company's profits. * Strong Career Progression \& mentorship coaching through our Strength in Balance \& Leadership schemes with a dedicated quarterly Pathways Career Development programme. * Flexible/remote working, Version 1 is tremendously understanding of life events and people’s individual circumstances and offer flexibility to help achieve a healthy work life balance. * Financial Wellbeing initiatives including; Pension, Private Healthcare Cover, Life Assurance, Financial advice and an Employee Discount scheme. * Employee Wellbeing schemes including Gym Discounts, Bike to Work, Fitness classes, Mindfulness Workshops, Employee Assistance Programme and much more. Generous holiday allowance, enhanced maternity/paternity leave, marriage/civil partnership leave and special leave policies. * Educational assistance, incentivised certifications, and accreditations, including AWS, Microsoft, Oracle, and Red Hat. * Reward schemes including Version 1’s Annual Excellence Awards \& ‘Call\-Out’ platform. * Environment, Social and Community First initiatives allow you to get involved in local fundraising and development opportunities as part of fostering our diversity, inclusion and belonging schemes. And many more exciting benefits… drop us a note to find out more.",https://www.linkedin.com/jobs/view/4286730105
Data Privacy Lawyer,Elevate,"Dublin, County Dublin, Ireland",linkedin,"Our customer, a leading global technology organisation is seeking Data Privacy Lawyers to join its legal team on an initial 3\-month contract. Based in Dublin, these roles will support on a range of data protection and privacy matters, working closely with senior counsel and cross\-functional teams in a fast\-paced environment. **Key Responsibilities** * Provide day\-to\-day support on data privacy and data protection matters * Review and assist with drafting data processing agreements, DPAs, and privacy\-related contractual clauses * Support responses to internal queries relating to GDPR and other applicable privacy laws * Assist with data mapping, records of processing activities (RoPA), and compliance documentation * Help maintain and update privacy policies, notices, and internal procedures * Work with cross\-functional teams (legal, compliance, product, and operations) on privacy\-related projects * Support incident response processes and general privacy risk assessments **Key Requirements** * Qualified lawyer (1–4 PQE) or paralegal with relevant data privacy experience * Working knowledge of GDPR and core European data protection principles * Experience reviewing contracts with data protection provisions * Strong attention to detail and ability to manage high\-volume work * Good communication and stakeholder management skills * Available to start at short notice **About Elevate** Elevate is a global provider of consulting, technology, and services for law departments and law firms. Headquartered in Los Angeles, our team of 1,600\+ legal professionals, lawyers, consultants, project managers, and engineers operates across the United States, Europe, the UK, Asia, Hong Kong, and Australia. Legal Talent is our flexible resourcing division, redefining careers in the legal industry. We connect exceptional legal professionals with the evolving needs of our customers through a curated, world\-class global talent community and advanced, technology\-enabled search capabilities. We are proud to have been ranked Band 1 in Chambers’ Global Flexible Legal Resourcing category. **Our Vision:** A world where legal and business teams achieve extraordinary outcomes together. At Legal Talent, **equity and inclusion** are fundamental to our success. As *The Law Company,* transforming the legal business landscape, we believe a diverse and inclusive culture is essential for attracting, retaining, and celebrating the industry’s top talent. We empower our people to bring their authentic selves to work because diversity of experience and perspective drives innovation and simply makes good business sense. As strong advocates for diversity, equity, and inclusion, Legal Talent is committed to hiring talented professionals from all backgrounds. We invite you to join the Legal Talent team and help us reshape the legal industry, making a real impact on the legal universe.",https://www.linkedin.com/jobs/view/4405695423
Document Analyst,Mercor,"Dublin, County Dublin, Ireland",linkedin,"**About The Job** **Mercor** connects elite creative and technical talent with leading AI research labs. Headquartered in San Francisco, our investors include **Benchmark** , **General Catalyst** , **Peter Thiel** , **Adam D'Angelo** , **Larry Summers** , and **Jack Dorsey** . **Position:** Job Seeker \- New Grad **Type:** **Contract** **Compensation:** **$80–$160/hour** **Location:** **Remote** **Role Responsibilities** * Review and assess domain\-specific documents for quality and accuracy. * Provide structured feedback to ensure relevance and impact. * Utilize Excel, PowerPoint, and Word for document analysis. * Work independently and asynchronously to meet project deadlines. * Contribute to high\-impact evaluation projects with strong analytical skills. **Qualifications** **Must\-Have** * Bachelor's degree (minimum) * 2\+ years of professional experience in a relevant domain * Strong proficiency in Excel, PowerPoint, and Word * Strong document analysis and review skills * Attention to detail and ability to follow structured guidelines **Compensation \& Legal** * Hourly contractor **Application Process (Takes 20–30 mins to complete)** * Upload resume * AI interview based on your resume * Submit form **Resources \& Support** * For details about the interview process and platform information, please check: https://talent.docs.mercor.com/welcome * For any help or support, reach out to: support@mercor.com *PS: Our team reviews applications daily. Please complete your AI interview and application steps to be considered for this opportunity.*",https://www.linkedin.com/jobs/view/4408633120
Engineering Graduate 2026,Exyte,"Leixlip, County Kildare, Ireland",linkedin,"**Description** **Discover your exciting role** We are seeking highly motivated **Engineering Graduates** to join our talented team at Exyte. As an Engineering Graduate, you will have the opportunity to work alongside experienced engineers and gain hands\-on experience in delivering cutting\-edge projects. You will play an integral role in various stages of project design, development, and implementation, while contributing to the creation of state\-of\-the\-art facilities. For our 2026 Graduate Programme, we are recruiting for the following **engineering** disciplines: * Mechanical * Electrical * BIM/Design * Civil/Structural * Architectural * Process * Quality * Commissioning **Explore Your Tasks And Responsibilities** * Assist in the design, planning, and execution of engineering projects within our sectors of expertise. * Support senior engineers in preparing technical documentation, drawings, and specifications. * Participate in site visits and contribute to project assessments and feasibility studies. * Collaborate with multidisciplinary teams to ensure seamless integration of engineering systems. * Develop and maintain project schedules, budgets, and risk management plans. * Learn and apply industry standards, safety regulations, and best practices to all tasks. * Continuously expand your knowledge of engineering processes and systems, with mentorship and guidance from experienced engineers. **Show Your Expertise** **Who You Are:** * A final year student or recent graduate with a relevant engineering degree. * Passionate about engineering and technology with a strong desire to build a successful career in the industry. * Excellent problem\-solving skills, with a keen eye for detail and the ability to think critically. * Strong communication skills, both written and verbal, with the ability to collaborate effectively in a team environment. * Able to prioritize tasks, work independently, and meet deadlines. * Enthusiastic, adaptable, and eager to learn in a fast\-paced, innovative environment. **What We Offer** * Competitive salary and benefits package, including healthcare \& pension. * Travel \& relocation opportunities across mainland Europe. * A dynamic and supportive work environment with opportunities for professional growth. * Exposure to innovative projects and advanced engineering technologies. * Mentorship and training programs designed to help you develop your technical and leadership skills. * A chance to work with some of the brightest minds in the industry.",https://www.linkedin.com/jobs/view/4360547984
Entry-level Game Presenter in Sofia (incl. housing & training),Savior Artigos Texteis Lda,"Dublin, County Dublin, Ireland",linkedin,"Ready to move abroad and start a new international career in **Sofia, Bulgaria** ? We are hiring **Game Presenters** on behalf of a **renowned international company in the iGaming and live entertainment industry** , operating modern live studios and working with online players across global markets. This is an exciting **on\-camera role** where you will host live card games, interact with online players, and create a professional entertainment experience from a high\-tech studio in Sofia. **No previous experience is required** . You will receive full professional training and learn everything step by step — from game procedures to on\-camera presentation. **Job Description** As a Game Presenter, you will be the **face of the game** . You will present live card games in front of the camera, guide online players through the game, follow company standards, and bring positive energy to every session. You will work in a **modern, professional studio environment** with a young international team and continue improving your **presentation, confidence and communication skills** . What we ask of you **EU citizenship** . **C1 level English** . Availability to relocate and work **on\-site in Sofia, Bulgaria** . Open to full\-time shift work or flexible part\-time options of **20 or 30 hours per week** . Comfortable being in front of the camera. Positive attitude, reliability and willingness to learn. Availability for a **video interview with a clear camera image** . Please note: **visa sponsorship is not available at the moment** . **Benefits** **Accommodation included** . **Full professional training** . Competitive salary and performance bonus scheme. Bonus after 3 months for full\-time employees. Permanent contract. Only one interview required. Additional health insurance from day one. Public transportation card. Food vouchers. Multisport card fully covered by the employer. Modern high\-tech studio in Sofia. Professional makeup and hairstyle every working day. Young international work environment. Career growth opportunities within an established global industry. Why Sofia? Sofia is one of the most dynamic capitals in the region, offering an international environment, lively social life, modern cafes, nightlife, shopping, gyms, parks and easy access to nature, including Vitosha Mountain just outside the city. Sofia offers the chance to gain **international work experience** , meet people from different countries, and start a career in a fast\-moving industry while having **housing and training included** . **Apply today and turn your confidence into a career in Sofia.** *Send your CV to Alexander Glogar: alexander.glogar@cbtalents.org* *WhatsApp: \+43 676 51 66 005*",https://www.linkedin.com/jobs/view/4408369644
"Entry-level Game Presenter in Sofia (no experience, incl. training&housing)",Savior Artigos Texteis Lda,"Dublin, County Dublin, Ireland",linkedin,"Ready to move abroad and start a new international career in **Sofia, Bulgaria** ? We are hiring **Game Presenters** on behalf of a **renowned international company in the iGaming and live entertainment industry** , operating modern live studios and working with online players across global markets. This is an exciting **on\-camera role** where you will host live card games, interact with online players, and create a professional entertainment experience from a high\-tech studio in Sofia. **No previous experience is required** . You will receive full professional training and learn everything step by step — from game procedures to on\-camera presentation. **Job Description** As a Game Presenter, you will be the **face of the game** . You will present live card games in front of the camera, guide online players through the game, follow company standards, and bring positive energy to every session. You will work in a **modern, professional studio environment** with a young international team and continue improving your **presentation, confidence and communication skills** . What we ask of you **EU citizenship** . **C1 level English** . Availability to relocate and work **on\-site in Sofia, Bulgaria** . Open to full\-time shift work or flexible part\-time options of **20 or 30 hours per week** . Comfortable being in front of the camera. Positive attitude, reliability and willingness to learn. Availability for a **video interview with a clear camera image** . Please note: **visa sponsorship is not available at the moment** . **Benefits** **Accommodation included** . **Full professional training** . Competitive salary and performance bonus scheme. Bonus after 3 months for full\-time employees. Permanent contract. Only one interview required. Additional health insurance from day one. Public transportation card. Food vouchers. Multisport card fully covered by the employer. Modern high\-tech studio in Sofia. Professional makeup and hairstyle every working day. Young international work environment. Career growth opportunities within an established global industry. Why Sofia? Sofia is one of the most dynamic capitals in the region, offering an international environment, lively social life, modern cafes, nightlife, shopping, gyms, parks and easy access to nature, including Vitosha Mountain just outside the city. Sofia offers the chance to gain **international work experience** , meet people from different countries, and start a career in a fast\-moving industry while having **housing and training included** . **Apply today and turn your confidence into a career in Sofia.** *Send your CV to Alexander Glogar: alexander.glogar@cbtalents.org* *WhatsApp: \+43 676 51 66 005*",https://www.linkedin.com/jobs/view/4408382382
