title,company,location,site,description,job_url
Graduate Sales Executive (Cypriot Market),Revolut,,linkedin,"**About Revolut** People deserve more from their money. More visibility, more control, and more freedom. Since 2015, Revolut has been on a mission to deliver just that. Our powerhouse of products — including spending, saving, investing, exchanging, travelling, and more — help our 70\+ million customers get more from their money every day. As we continue our lightning\-fast growth,‌ 2 things are essential to our success: our people and our culture. In recognition of our outstanding employee experience, we've been certified as a Great Place to Work™. So far, we have 13,000\+ people working around the world, from our offices and remotely, to help us achieve our mission. And we're looking for more brilliant people. People who love building great products, redefining success, and turning the complexity of a chaotic world into the simplicity of a beautiful solution. **About The Role** Our Sales team powers customer growth around the world. From prospecting to acquisition and activation, they own their market segments, solve complex problems, and help more customers discover the value of Revolut with a sharp, solution\-oriented approach. We're looking for a Sales Executive to join our Graduate Sales Programme, which offers an unparalleled opportunity for ambitious graduates, regardless of prior experience, to join a high\-performing, international team. You'll be at the forefront of delivering cutting\-edge financial solutions to customers while building key relationships. You’ll kick things off with a focused bootcamp, complete with workshops, lectures, and hands\-on training to sharpen your commercial and communication skills. Once you're up to speed, you'll dive straight into the on\-the\-job experience by working with real clients. Watch this video from our team members about what goes into being an Account Executive at Revolut. Up to shape what's next in finance? Let's get in touch. **What You'll Be Doing** * Outreaching prospects across multiple touch points and channels, with an emphasis on cold\-calling * Developing and executing a robust lead\-sourcing strategy by identifying key verticals, diversifying your prospects base, and maintaining consistent activity levels * Building and managing your own pipeline, from prospecting to closing and account management, maximising adoption and upsell/cross\-sell opportunities * Liaising customer relationships with internal stakeholders to ensure a smooth experience, from getting started to daily usage * Being autonomous to effectively balance your time (prospect vs. close vs. upsell), activate internal resources, and engage your team * Using solution\-based selling to understand customer needs and communicate the value proposition * Becoming a product expert on Revolut Business, its market positioning, and the solutions it offers, backed by relevant, compelling case studies **What You'll Need** * Fluency in English and Greek * To have graduated from university in 2024 or 2025 * Excellent communication skills and articulation over the phone * Impeccable literacy skills (email, LinkedIn outreach) * A drive to launch a career in a high\-performing sales culture * An interest in the financial industry **Nice to have** * Previous internship or experience in a high\-performance, fast\-paced environment, with exposure to strategic thinking, analytical tasks, or client\-facing work Building a global financial super app isn’t enough. Our Revoluters are a priority, and that’s why in 2021 we launched our inaugural D\&I Framework, designed to help us thrive and grow everyday. We're not just doing this because it's the right thing to do. We’re doing it because we know that seeking out diverse talent and creating an inclusive workplace is the way to create exceptional, innovative products and services for our customers. That’s why we encourage applications from people with diverse backgrounds and experiences to join this multicultural, hard\-working team. **Important notice for candidates:** Job scams are on the rise. Please keep these guidelines in mind when applying for any open roles. * Only apply through official Revolut channels. We don’t use any third\-party services or platforms for our recruitment. * Always double\-check the emails you receive. Make sure all communications are being done through official Revolut emails, with an @revolut.com domain. **We won't ask for payment or personal financial information during the hiring process.** If anyone does ask you for this, it’s a scam. Report it immediately. By submitting this application, I confirm that all the information given by me in this application for employment and any additional documents attached hereto are true to the best of my knowledge and that I have not wilfully suppressed any material fact. I confirm I have disclosed if applicable any previous employment with Revolut. I accept that if any of the information given by me in this application is in any way false or incorrect, my application may be rejected, any offer of employment may be withdrawn or my employment with Revolut may be terminated summarily or I may be dismissed. By submitting this application, I agree that my personal data will be processed in accordance with Revolut's Candidate Privacy Notice",https://www.linkedin.com/jobs/view/4373384051
Graduate Sales Executive (French Market),Revolut,,linkedin,"**About Revolut** People deserve more from their money. More visibility, more control, and more freedom. Since 2015, Revolut has been on a mission to deliver just that. Our powerhouse of products — including spending, saving, investing, exchanging, travelling, and more — help our 70\+ million customers get more from their money every day. As we continue our lightning\-fast growth,‌ 2 things are essential to our success: our people and our culture. In recognition of our outstanding employee experience, we've been certified as a Great Place to Work™. So far, we have 13,000\+ people working around the world, from our offices and remotely, to help us achieve our mission. And we're looking for more brilliant people. People who love building great products, redefining success, and turning the complexity of a chaotic world into the simplicity of a beautiful solution. **About The Role** Our Sales team powers customer growth around the world. From prospecting to acquisition and activation, they own their market segments, solve complex problems, and help more customers discover the value of Revolut with a sharp, solution\-oriented approach. We're looking for a Sales Executive to join our Graduate Sales Programme, which offers an unparalleled opportunity for ambitious graduates, regardless of prior experience, to join a high\-performing, international team. You'll be at the forefront of delivering cutting\-edge financial solutions to customers while building key relationships. You’ll kick things off with a focused bootcamp, complete with workshops, lectures, and hands\-on training to sharpen your commercial and communication skills. Once you're up to speed, you'll dive straight into the on\-the\-job experience by working with real clients. Watch this video from our team members about what goes into being an Account Executive at Revolut. Up to shape what's next in finance? Let's get in touch. **What You'll Be Doing** * Outreaching prospects across multiple touch points and channels, with an emphasis on cold\-calling * Developing and executing a robust lead\-sourcing strategy by identifying key verticals, diversifying your prospects base, and maintaining consistent activity levels * Building and managing your own pipeline, from prospecting to closing and account management, maximising adoption and upsell/cross\-sell opportunities * Liaising customer relationships with internal stakeholders to ensure a smooth experience, from getting started to daily usage * Being autonomous to effectively balance your time (prospect vs. close vs. upsell), activate internal resources, and engage your team * Using solution\-based selling to understand customer needs and communicate the value proposition * Becoming a product expert on Revolut Business, its market positioning, and the solutions it offers, backed by relevant, compelling case studies **What You'll Need** * Fluency in English and French * To have graduated from university in 2024 or 2025 * Excellent communication skills and articulation over the phone * Impeccable literacy skills (email, LinkedIn outreach) * A drive to launch a career in a high\-performing sales culture * An interest in the financial industry **Nice to have** * Previous internship or experience in a high\-performance, fast\-paced environment, with exposure to strategic thinking, analytical tasks, or client\-facing work Building a global financial super app isn’t enough. Our Revoluters are a priority, and that’s why in 2021 we launched our inaugural D\&I Framework, designed to help us thrive and grow everyday. We're not just doing this because it's the right thing to do. We’re doing it because we know that seeking out diverse talent and creating an inclusive workplace is the way to create exceptional, innovative products and services for our customers. That’s why we encourage applications from people with diverse backgrounds and experiences to join this multicultural, hard\-working team. **Important notice for candidates:** Job scams are on the rise. Please keep these guidelines in mind when applying for any open roles. * Only apply through official Revolut channels. We don’t use any third\-party services or platforms for our recruitment. * Always double\-check the emails you receive. Make sure all communications are being done through official Revolut emails, with an @revolut.com domain. **We won't ask for payment or personal financial information during the hiring process.** If anyone does ask you for this, it’s a scam. Report it immediately. By submitting this application, I confirm that all the information given by me in this application for employment and any additional documents attached hereto are true to the best of my knowledge and that I have not wilfully suppressed any material fact. I confirm I have disclosed if applicable any previous employment with Revolut. I accept that if any of the information given by me in this application is in any way false or incorrect, my application may be rejected, any offer of employment may be withdrawn or my employment with Revolut may be terminated summarily or I may be dismissed. By submitting this application, I agree that my personal data will be processed in accordance with Revolut's Candidate Privacy Notice",https://www.linkedin.com/jobs/view/4366549727
Graduate Tunnel Engineer - Dublin,Jacobs,"Dublin, County Dublin, Ireland",linkedin,"At Jacobs, we're challenging today to reinvent tomorrow by solving the world's most critical problems for thriving cities, resilient environments, mission\-critical outcomes, operational advancement, scientific discovery and cutting\-edge manufacturing, turning abstract ideas into realities that transform the world for good. Your impact Join the Jacobs Graduate Development Programme (GDP) and have a meaningful, positive impact on our environments, communities and societies. Bring your passion, your ingenuity and your vision. Let’s see the impact we can create, together. **What will you get?** Our Graduate Development Programme is a structured two\-year scheme designed to support your development at the start of your Jacobs career journey. Through a combination of blended learning, mentoring, progress reviews and networking, you will establish yourself as knowledgeable and competent across four key focus areas; human skills, consulting skills, champion our strategy and your passions. The Graduate Development Programme allows you to customise your learning journey to reflect your specific interests, career goals, and technical skillset – creating a graduate experience that is unique to you. The GDP is an experience programme, meaning that a large portion of what you’ll learn will be on\-the\-job. You’ll work with your manager and mentor to collect the learning experiences that will be most meaningful for you. The programme is more than just a steppingstone. It’s a launchpad for your career, offering you the tools, experiences and support you need. Join us and unlock your potential as you work on meaningful projects and collaborate with industry leaders to deliver outcomes and solutions for complex challenges. **About The Opportunity** Join us and you’ll have the chance to work on world class projects as part of our Tunnelling and Ground Engineering business. Jacobs is one of the world’s largest and most diverse providers of technical and management services, offering a full spectrum of consultancy support to commercial, government and industrial clients. As part of that support, Jacobs has developed one of the leading and longest\-standing tunnel and ground engineering consultancy capabilities in Ireland and the UK, with around 400 staff delivering practical, innovative and sustainable solutions to ground\-related problems. Reporting to one of the team leads within the Tunnels discipline this individual will be a key resource in projects for a range of internal and external clients. Our tunnels team focusses on a range of small to large scale projects from pipejack, to complex underground caverns, utilising techniques from empirical methods to 3D FE analyses. Work undertaken can be structural and/or geotechnical in nature. The candidate will work within project teams. The role is likely to include * Using technological advances to improve quality, results and efficiency * Preparing designs and drawings * Writing technical reports * Participating in internal technical and professional activities * Proactively approaching career development The successful person will join a respected and ambitious company with excellent career prospects and international opportunities. You will work as part of a diverse and highly skilled team of specialists, providing support and advice to the wider Jacobs business and clients. There will be opportunities for a broad range of responsibilities and roles within the Tunnelling and Ground Engineering team aimed at developing your career. The start date for this position is **September 2026** . Here's what you'll need * Be working towards a Degree or Masters level qualification in Tunnelling, Civil Engineering, Mining Engineering or Structural Engineering * A flexible self\-starter who is keen to drive your career forward * Adaptable to change, with a thirst for learning new things * You must have the permanent right to work in Ireland **Selection Process** Step 1 Apply Online Step 2 Solo Video Assessment Step 3 Interview **What Else We Provide** * A flexible workstyle, embracing a hybrid working pattern and supporting those who need to balance work/life commitments a bit differently than others. * Reimbursement towards relevant professional development and memberships. * A focus on safety, health, and wellbeing, prioritising our people through a culture of caring and positive mental health champion network. * Opportunities to give back to our communities through our Collectively programme, incorporating matched\-funding, paid volunteering time and charitable donations. \#EarlyCareersIreland \#GraduateIreland \#GraduateJob2026 \#GraduateCareersIreland \#GraduaterecruitmentIreland \#GraduateJobsIreland \#GraduateopportunitiesIreland Joining Jacobs not only connects you locally but globally. Our values stand on a foundation of safety, integrity, inclusion and belonging. We put people at the heart of our business, and we truly believe that by supporting one another through our culture of caring, we all succeed. We value positive mental health and a sense of belonging for all employees. With safety and flexibility always top of mind, we’ve gone beyond traditional ways of working so you have the support, means and space to maximize your potential. You’ll uncover flexible working arrangements, benefits, and opportunities, from well\-being benefits to our global giving and volunteering program, to exploring new and inventive ways to help our clients make the world a better place. No matter what drives you, you’ll discover how you can cultivate, nurture, and achieve your goals – all at a single global company. Find out more about life at Jacobs. We aim to embed inclusion and belonging in everything we do. We know that if we are inclusive, we’re more connected and creative. We accept people for who they are, and we champion the richness of different perspectives, lived experiences and backgrounds in the workplace, as a source of learning and innovation. We are committed to building vibrant communities within Jacobs, including through our Jacobs Employee Networks, Communities of Practice and our Find Your Community initiatives, allowing every employee to find connection, purpose, and belonging. Find out more about our Jacobs Employee Networks here. Jacobs partners with VERCIDA to help us attract and retain talent from a wide range of backgrounds. For greater online accessibility please visit https//www.vercida.com/uk/employers/jacobs to view and access our roles. As a disability confident employer, we will interview disabled candidates who best meet the criteria. We welcome applications from candidates who are seeking flexible working and from those who may not meet all the listed requirements for a role. We value collaboration and believe that in\-person interactions are crucial for both our culture and client delivery. We empower employees with our hybrid working policy, allowing them to split their work week between Jacobs offices/projects and remote locations enabling them to deliver their best work. Your application experience is important to us, and we’re keen to adapt to make every interaction even better. If you require further support or reasonable adjustments with regards to the recruitment process (for example, you require the application form in a different format), please contact the team via Careers Support.",https://www.linkedin.com/jobs/view/4366365509
Graduate Videographer (Temporary 2 Years) - Dublin City Council,Dublin City Council,"Dublin, D, IE",indeed,"**The Job** The Graduate Videographer will support the Communications Office by producing video content for digital, social and internal communications channels. As a member of the wider Communications Office, the Graduate Videographer will primarily work alongside the City Council Videographer supporting the planning, filming, editing and delivery of multimedia content that promotes the work of Dublin City Council and enhances public understanding of local government. This is a developmental graduate role designed to build professional skills, provide structured mentoring and expose the postholder to a wide range of creative and production environments across a large public sector organisation. **Salary: 39,846 \- 50,447** ============================ We are recruiting for the position of **Graduate Videographer (Temporary 2 Years) \-** **Dublin City Council.** For details of this role please see Candidate Information Booklet on the attachment below. Dublin City Council is committed to a policy of equal opportunity. We recognise the value and importance of attracting and welcoming a diverse workforce that is reflective of the communities we serve. To apply for this role please click on the link **'Apply for Job'** The Closing Date will be at Midnight on Thursday, 23rd April 2026\. **Candidates are required to complete the application form and assessment questions in full, we do not accept CVs.**",https://ie.indeed.com/viewjob?jk=5d8be6f5c911a483
Healthcare Lawyer,A&L Goodbody LLP,"Dublin, County Dublin, Ireland",linkedin,"We are seeking an ambitious Solicitor, 1\-2 years PQE, to join our Healthcare \& Life Sciences Team focusing on the areas of regulatory \& compliance, and product liability. The successful candidate will advise Irish and international clients, as well as law firms, on EU and Irish pharmaceutical and healthcare regulatory frameworks and compliance matters across the healthcare, BioPharma, MedTech, animal health, food, and cosmetics sectors. We provide our clients with comprehensive advice on a wide range of issues, including: * Product classification, authorisation/certification and regulatory requirements throughout the life cycle of each relevant product * Promotion, marketing, advertising and hospitality, regulatory requirements, prohibitions and restrictions, codes of practice of industry bodies (medicinal products and medical devices) regulatory guidance and advising on compliance and enforcement risks * Licensing, registration, certification and other requirements for manufacturing facilities and activities (MIA, controlled drugs, substances, APIs and chemicals), wholesale distribution facilities (WDA) and supply chain, brokers of medicinal products, laboratory facilities and compliance with GMP and GDP * CE marking and advice on the requirements of MDR and IVDR for all actors within the medical device supply chain * Market access, pricing and reimbursement, applications to the HSE under the Health (Pricing and Supply of Medical Goods) Act 2013 to gain reimbursement status for medicines, medical devices, special dietary foods etc and on responding to the HSE in respect of price reviews, pricing strategies of the HSE Medicines Management Programme and other pricing initiatives and requests for price reductions. Advising on the IPHA and MFI Framework Agreements for the Supply of Medicines to the HSE * Responding to regulatory authorities, conformity assessment bodies, and governmental authorities including HPRA, HIQA, Department of Health and the HSE in respect of adverse findings on inspection, audit and in respect of reviews, inquiries and investigations * Irish medical and healthcare law, telemedicine, digital health, and cross border healthcare **Transactions and Establishment** We also work closely with the firm's corporate teams advising clients on the establishment of operations in Ireland and on the regulatory aspects of structuring and due diligence in corporate transactions in the regulated sectors supported by the Healthcare and Life Sciences team **Product Recall and Product Liability** On the contentious side the successful candidate will represent manufacturers and producers in the defence of product liability claims. We also advise on notifications to competent authorities, product withdrawal and recall in the regulated sectors supported by the Healthcare and Life Sciences team. **Requirements** * Demonstrates sectoral interest and relevant experience in their career to date \- as a trainee and as a newly qualified solicitor * Possesses excellent academic achievements and technical legal ability in areas relevant to the sectors supported by the Healthcare and Life Sciences Team and role * Deals with legal concepts and technical complexity comfortably * Conducts research thoroughly, accurately and demonstrates strong and consistent attention to detail * Is a clear and concise communicator * Constructs clear advice for clients responding to client's requirements in a timely way * Is comfortable working within challenging deadlines to meet client requirements * Is comfortable working collaboratively with the Healthcare and Life Sciences Team and across the firm Note this is not a medical negligence role. **Benefits** * A competitive remuneration package * Access to the firm's marquee training and development programmes, delivered through the ALG School of Business and Law * Discretionary performance bonus * Pension and health insurance contribution, wellbeing contribution, life assurance, subsidised gym, restaurant and coffee shop * Hybrid working policy **The firm** A\&L Goodbody (ALG) is a leading Irish law firm with five international offices in Dublin, Belfast, London, New York and San Francisco. There are currently 120 partners and over 900 employees. The strong international and domestic business community in Ireland forms a valuable part of the ALG client base. ALG is incredibly proud to be recognised as the leading Irish law firm in the Chambers and Partners Europe 2024 Guide with the highest number of Band 1 practice area rankings. ALG is also ranked as a 'top tier' law firm in The Legal 500 EMEA Guide 2024 and the IFLR1000 Guide 2024\. The firm is consistently ranked number one in the Irish market and on a European level. A sample of other recent notable awards include: * Awarded the prestigious Company of the Year award at the National Diversity \& Inclusion Awards 2025 hosted by the Irish Centre for Diversity * Recognised by Mergermarket as the \#1 M\&A legal advisor in Ireland by deal volume for 2024 * Winner of the Best Client Service Award by the Lawyer European Awards * Future of Legal Services Innovation Award winners 2024 * Awarded the Investors in Diversity Silver Mark in 2024 by the Irish Centre for Diversity * Most Popular Graduate Recruiter in Law 2024 by GradIreland (for 13 consecutive years) * Law firm of the year \- Republic of Ireland 2023 at The Lawyer European Awards * Irish Law Firm of the Year 2023 at the Chambers Europe Awards * One of the top 50 most innovative law firms in Europe 2023 by the Financial Times * Best client support 2023 by the Managing Partners Forum * Business Working Responsibly Mark 2023 ALG has a reputation for leading the way in continuously developing its service to clients and internally to its business. This is delivered through the use of new processes, ways of working, innovative use of technology and marketing\-leading business service teams.",https://www.linkedin.com/jobs/view/4395295267
