title,company,location,site,description,job_url
Consulting Support Group Analyst – Graduate,Marsh McLennan,"Dublin, D, IE",indeed,"**Company:** ------------ Mercer **Description:** ---------------- **MERCER\- A MARSH BUSINESS** Mercer is a business of Marsh (NYSE: MRSH), a global leader in risk, reinsurance and capital, people and investments, and management consulting, advising clients in 130 countries. With annual revenue of over $24 billion and more than 90,000 colleagues, Marsh helps build the confidence to thrive through the power of perspective. Marsh helps clients navigate an increasingly dynamic and complex environment through four market\-leading businesses: Marsh, Guy Carpenter, Mercer and Oliver Wyman. Here in Ireland, with over 1000 dedicated colleagues, Marsh delivers risk \& insurance, and people \& investments services through Marsh and Mercer. We support organisations across public and private sectors to manage risk, protect their people, and make smarter business decisions in a complex and ever\-changing world. OUR GRADUATE PROGRAMME Our Ireland Graduate Programme provides broad exposure and hands\-on experience, helping you develop a versatile skill set and deep expertise in your chosen field. You’ll work alongside talented professionals and be empowered to identify and seize opportunities across Marsh Ireland. Graduates will be part of a structured development programme that includes: 1\. Core Area of Expertise (Mercer Wealth \- please read further below) 2\. Learning and Professional Development opportunities and 3\. Online learning from the European Early Careers Curriculum. The programme will offer continuous opportunities to engage and network within the Irish and European curriculum. This is more than a job — it’s a chance to grow, innovate, and make a real impact as part of a collective vision shaping the future of Marsh Ireland. WHAT CAN YOU EXPECT: This is a great opportunity for a recent graduate to launch an exciting career in Mercer Ireland and to be part of a company with a strong brand, committed to making a difference in people's lives. We foster a vibrant and inclusive culture where you can work with talented colleagues to create new solutions and have impact for colleagues, clients and communities. Our scale enables us to provide a range of career opportunities, as well as benefits and rewards to enhance your well\-being. We are dedicated to helping you be your best through engaging work, continuous professional development opportunities, and supportive leadership. Additionally, we offer a flexible hybrid working model, currently with three days in the office and two days’ remote, to help you maintain a healthy work\-life balance while staying connected with your colleagues. WE WILL RELY ON YOU TO: * Helping consultants to manage a portfolio of clients on a day\-to\-day basis – managing and tracking ongoing actions for client * Calculating benefits for pension plan members * Completing individual calculations as required, for example transfer values, net present values, severance calculations, standard fund threshold calculations, early retirement calculations and actuarial factors * Assessing the solvency and funding level of defined benefit pension schemes * Understanding and explaining membership movements between valuation periods * Liaising with the Lisbon team throughout the valuation process * Calculating company accounting disclosures and uploading results to Mercer Globe * Preparation of quarterly Aspire reports and other Aspire client material * Supporting investment consultants in responding to ad\-hoc client and/or member queries * Lifestyle strategy reviews i.e. assessing the suitability of the default lifestyle strategy (annuity/ARF/cash endpoints) * Supporting client managers with the preparation of meeting materials for Investment Committee and Trustee Meetings Involvement in project work across the business as required, for example risk management exercises, redundancy projects etc. * WHAT YOU WILL BE REWARDED WITH: * Competitive benefits: Including annual leave, excellent pension contributions, private medical cover, and more. * A flexible benefits programme which provides you with the opportunity to tailor your benefits to meet your needs. * Professional Qualification Support * Generous Family Leave: Comprehensive maternity, paternity, and adoption leave policies. Sports \& Social Club along with our Colleague Resource Groups * WHAT YOU WILL NEED TO HAVE: * Would suit candidates who are working towards, or planning to work towards, the Actuarial qualification. * Ability to build strong working relationships with colleagues and clients. * Excellent written and oral communication skills. Attention to detail is critical. * Interest in pensions, investment markets and asset classes * Ability to manage simultaneous projects and to meet multiple deadlines * Ability to interpret results and ask questions where relevant * Proactive and goal\-orientated * Strive to achieve efficiencies in ongoing work Possess strong IT skills. (a strong working knowledge of Microsoft Excel, Word and PowerPoint) * We embrace a culture that celebrates and promotes the many backgrounds, heritages and perspectives of our colleagues and clients regardless of their gender expression or identity, marital or civil partnership status, ethnic origin, nationality, age, background, disability, sexual orientation or beliefs. We are proud of our inclusive culture where everyone feels empowered to bring their whole selves to work and thrive. Learn more about our foundational values, mission and vision for the future by reviewing our Greater Good Policy. We are committed to providing reasonable support to any candidate with a disability/health condition to allow them to fully participate in the recruitment process. We welcome candidates to contact us at reasonableaccommodations@mmc.com to discuss any specific needs. Marsh Risk is a business of Marsh (NYSE: MRSH), a global leader in risk, reinsurance and capital, people and investments, and management consulting, advising clients in 130 countries. With annual revenue of over $27 billion and more than 95,000 colleagues, Marsh helps build the confidence to thrive through the power of perspective. For more information about Marsh Risk, visit marsh.com, or follow us on LinkedIn and X. Marsh is committed to embracing a diverse, inclusive and flexible work environment. We aim to attract and retain the best people and embrace diversity of age, background, disability, ethnic origin, family duties, gender orientation or expression, marital status, nationality, parental status, personal or social status, political affiliation, race, religion and beliefs, sex/gender, sexual orientation or expression, skin color, Traveller community, or any other characteristic protected by applicable law. We are an equal opportunities employer. We are committed to providing reasonable support to any candidate with a disability/health condition to allow them to fully participate in the recruitment process. We welcome candidates to contact us at reasonableaccommodations@mmc.com to discuss any specific needs. Marsh is committed to hybrid work, which includes the flexibility of working remotely and the collaboration, connections and professional development benefits of working together in the office. All Marsh colleagues are expected to be in their local office or working onsite with clients at least three days per week. Office\-based teams will identify at least one “anchor day” per week on which their full team will be together in person.",https://ie.indeed.com/viewjob?jk=1d17e518358f4ead
Consulting Support Group Analyst – Graduate,Marsh Risk,"Dublin, County Dublin, Ireland",linkedin,"**MERCER\- A MARSH BUSINESS** Mercer is a business of Marsh (NYSE: MRSH), a global leader in risk, reinsurance and capital, people and investments, and management consulting, advising clients in 130 countries. With annual revenue of over $24 billion and more than 90,000 colleagues, Marsh helps build the confidence to thrive through the power of perspective. Marsh helps clients navigate an increasingly dynamic and complex environment through four market\-leading businesses: Marsh, Guy Carpenter, Mercer and Oliver Wyman. Here in Ireland, with over 1000 dedicated colleagues, Marsh delivers risk \& insurance, and people \& investments services through Marsh and Mercer. We support organisations across public and private sectors to manage risk, protect their people, and make smarter business decisions in a complex and ever\-changing world. OUR GRADUATE PROGRAMME Our Ireland Graduate Programme provides broad exposure and hands\-on experience, helping you develop a versatile skill set and deep expertise in your chosen field. You’ll work alongside talented professionals and be empowered to identify and seize opportunities across Marsh Ireland. Graduates will be part of a structured development programme that includes: * Core Area of Expertise (Mercer Wealth \- please read further below) * Learning and Professional Development opportunities and * Online learning from the European Early Careers Curriculum. The programme will offer continuous opportunities to engage and network within the Irish and European curriculum. This is more than a job — it’s a chance to grow, innovate, and make a real impact as part of a collective vision shaping the future of Marsh Ireland. WHAT CAN YOU EXPECT: This is a great opportunity for a recent graduate to launch an exciting career in Mercer Ireland and to be part of a company with a strong brand, committed to making a difference in people's lives. We foster a vibrant and inclusive culture where you can work with talented colleagues to create new solutions and have impact for colleagues, clients and communities. Our scale enables us to provide a range of career opportunities, as well as benefits and rewards to enhance your well\-being. We are dedicated to helping you be your best through engaging work, continuous professional development opportunities, and supportive leadership. Additionally, we offer a flexible hybrid working model, currently with three days in the office and two days’ remote, to help you maintain a healthy work\-life balance while staying connected with your colleagues. WE WILL RELY ON YOU TO: * Helping consultants to manage a portfolio of clients on a day\-to\-day basis – managing and tracking ongoing actions for client * Calculating benefits for pension plan members * Completing individual calculations as required, for example transfer values, net present values, severance calculations, standard fund threshold calculations, early retirement calculations and actuarial factors * Assessing the solvency and funding level of defined benefit pension schemes * Understanding and explaining membership movements between valuation periods * Liaising with the Lisbon team throughout the valuation process * Calculating company accounting disclosures and uploading results to Mercer Globe * Preparation of quarterly Aspire reports and other Aspire client material * Supporting investment consultants in responding to ad\-hoc client and/or member queries * Lifestyle strategy reviews i.e. assessing the suitability of the default lifestyle strategy (annuity/ARF/cash endpoints) * Supporting client managers with the preparation of meeting materials for Investment Committee and Trustee Meetings * Involvement in project work across the business as required, for example risk management exercises, redundancy projects etc. WHAT YOU WILL BE REWARDED WITH: * Competitive benefits: Including annual leave, excellent pension contributions, private medical cover, and more. * A flexible benefits programme which provides you with the opportunity to tailor your benefits to meet your needs. * Professional Qualification Support * Generous Family Leave: Comprehensive maternity, paternity, and adoption leave policies. * Sports \& Social Club along with our Colleague Resource Groups WHAT YOU WILL NEED TO HAVE: * * Would suit candidates who are working towards, or planning to work towards, the Actuarial qualification. * Ability to build strong working relationships with colleagues and clients. * Excellent written and oral communication skills. Attention to detail is critical. * Interest in pensions, investment markets and asset classes * Ability to manage simultaneous projects and to meet multiple deadlines * Ability to interpret results and ask questions where relevant * Proactive and goal\-orientated * Strive to achieve efficiencies in ongoing work * Possess strong IT skills. (a strong working knowledge of Microsoft Excel, Word and PowerPoint) We embrace a culture that celebrates and promotes the many backgrounds, heritages and perspectives of our colleagues and clients regardless of their gender expression or identity, marital or civil partnership status, ethnic origin, nationality, age, background, disability, sexual orientation or beliefs. We are proud of our inclusive culture where everyone feels empowered to bring their whole selves to work and thrive. Learn more about our foundational values, mission and vision for the future by reviewing our Greater Good Policy. We are committed to providing reasonable support to any candidate with a disability/health condition to allow them to fully participate in the recruitment process. We welcome candidates to contact us at reasonableaccommodations@mmc.com to discuss any specific needs. Marsh Risk is a business of Marsh (NYSE: MRSH), a global leader in risk, reinsurance and capital, people and investments, and management consulting, advising clients in 130 countries. With annual revenue of over $27 billion and more than 95,000 colleagues, Marsh helps build the confidence to thrive through the power of perspective. For more information about Marsh Risk, visit marsh.com, or follow us on LinkedIn and X. Marsh is committed to embracing a diverse, inclusive and flexible work environment. We aim to attract and retain the best people and embrace diversity of age, background, disability, ethnic origin, family duties, gender orientation or expression, marital status, nationality, parental status, personal or social status, political affiliation, race, religion and beliefs, sex/gender, sexual orientation or expression, skin color, Traveller community, or any other characteristic protected by applicable law. We are an equal opportunities employer. We are committed to providing reasonable support to any candidate with a disability/health condition to allow them to fully participate in the recruitment process. We welcome candidates to contact us at reasonableaccommodations@mmc.com to discuss any specific needs. Marsh is committed to hybrid work, which includes the flexibility of working remotely and the collaboration, connections and professional development benefits of working together in the office. All Marsh colleagues are expected to be in their local office or working onsite with clients at least three days per week. Office\-based teams will identify at least one “anchor day” per week on which their full team will be together in person. **R\_346431**",https://www.linkedin.com/jobs/view/4395364260
Continuous Improvement Engineer,Mondelēz International,"Coolock, D, IE",indeed,"Job Description **Mondelēz International****Are You Ready to Make It Happen at Mondelēz International?** **Join our Mission to Lead the Future of Snacking. Make It Uniquely Yours.** You play an important role in the department, maintaining systems and performing tasks and activities that support our continuous improvement (CI) processes and culture. You help with data collection, ensure its accuracy, promote CI progress and keep track of the department KPI scorecards. **How you will contribute** You will: * Provide training on CI tools and techniques. You will also help departments follow our established daily management system (DMS) * Help teams collect data or extract it from the system to support CI activities and the DMS * Facilitate root\-cause analysis to address identified losses and departmental KPI scorecard gaps * Establish new work standards to sustain improvement * Train and qualify colleagues on CI tools and new work standards resulting from CI activities **What you will bring** A desire to drive your future and accelerate your career and the following experience and knowledge: * Experience in Continuous Improvement with practical use of IL6S, Lean, TPM or similar methodologies * Ability to lead root\-cause analysis, problem‑solving sessions and support DMS routines * Strong analytical skills with experience in loss analysis, KPI tracking, and data interpretation * Proficiency in Excel, SAP and other data tools used in manufacturing environments * Experience in FMCG, within the food manufacturing industry, with understanding of production processes, changeovers and line performance * Solid knowledge of GMP, HACCP, BRCGS, ISO 22000 and experience supporting audits, documentation and compliance * Strong communication and teamwork skills, with the ability to coach colleagues on CI tools and standards * Degree in Food Science, Nutrition, Biotechnology, Engineering or related field; food safety certifications are an advantage. * Engagement in Kaizen, sustainability or cost‑saving initiatives is an advantage **More about this role** **More about this role** **Employer:** Mondelez International **Location:** Malahide Road, Coolock, Dublin 5 (Close to M1/ M50 Junction) **Hours of work:** 39h (8 AM \- 4:30 PM from Monday to Thursday and 8 AM \- 3:30 PM on Friday) with 30 minutes break **Minimum Annual salary:** 38 600 GBP, salary to discussed further at offer stage **\*\*\*The role will close on Sunday 3rd May 2026 at 11:59 PM\*\*\*** Relocation Support Available? No Relocation support available Business Unit Summary We value our talented employees, and whenever possible strive to help one of our associates grow professionally before recruiting new talent to our open positions. If you think the open position you see is right for you, we encourage you to apply!*Our people make all the difference in our succes* Mondelēz International is an equal opportunity employer and all qualified applicants will receive consideration for employment without regard to race, color, religion, gender, sexual orientation or preference, gender identity, national origin, disability status, protected veteran status, or any other characteristic protected by law. Excited to grow your career? We value our talented employees, and whenever possible strive to help one of our associates grow professionally before recruiting new talent to our open positions. If you think the open position you see is right for you, we encourage you to apply! IF YOU REQUIRE SUPPORT TO COMPLETE YOUR APPLICATION OR DURING THE INTERVIEW PROCESS, PLEASE CONTACT THE RECRUITER Job Type Regular Process excellence Business Capability",https://ie.indeed.com/viewjob?jk=b614e4c7897d5abc
Corporate Associate,Amicus Search & Recruitment,"Dublin, County Dublin, Ireland",linkedin,"**Corporate Solicitor (1\+ PQE)** My client, a global leader in the legal sector, is making significant impact in Ireland as a disruptor within a rapidly changing legal landscape. This role offers a unique opportunity to advise on the best deals available in the local market, whilst also exploring and servicing a remarkably diverse range of commercial entities across numerous other jurisdictions, all led out of Ireland. This is a high\-performing department that would suit a mature and conscientious fee earner with strong commercial sensibilities, excellent communication skills, and a capacity to advise innovative and dynamic clients. **The Firm** My client acts as an accelerator for legal talent. You will engage with transactions of varying scale, from significant to more focused, in any corner of the world where deals are being executed. In Ireland, the firm stands as a forerunner in complex and large\-scale transactions, cultivating a culture and environment that consistently produces exceptional work. Beyond their professional drive, the team comprises great people, driven yet possessing a strong sense of camaraderie and enjoyment in their work. This is a firm truly on a journey of growth and evolution. **The Professional** The ideal candidate will possess: * 1\+ years’ PQE in a top\-tier corporate department. * A strong academic record. * Robust technical skills and acute commercial acumen. * Extensive experience across a range of corporate transactions, including Mergers \& Acquisitions (M\&A), joint ventures, and equity capital markets. * A collaborative approach and excellent communication skills. **The Reward** This role offers: * Top\-of\-market earning potential for an associate solicitor. * Exposure to the highest quality work, with a particular focus on cross\-border and multi\-jurisdictional transactions. * Unparalleled career development opportunities within a truly global firm. * A dynamic and supportive working environment.",https://www.linkedin.com/jobs/view/4373282778
Corporate M&A Lawyer - 3-7 PQE - Dublin,Hydrogen Group,"Dublin, County Dublin, Ireland",linkedin,"We’re working with a top ranked Irish law firm with a strong international presence. Consistently recognised as a market leader in Ireland and across Europe, the firm is looking for Corporate lawyers to join its team. This role will focus on **Private and Public M\&A, Private Equity, and Equity Capital Markets** . Opportunities are available for lawyers already based in Ireland or those looking to return. **Ideal Candidate:** * 3–7 PQE in Corporate/M\&A. * Strong academic background. * Strong desire to live in Dublin, Ireland. Our Ireland team has been recruiting since 2015, with consultants based in London, Hong Kong, Singapore, and Sydney. We focus on building long\-term relationships with candidates, so whether you're actively considering a move or just exploring options, we’d love to hear from you. At Hydrogen Group, we specialise in both In\-House and Private Practice roles across the UK and internationally. With 300 consultants globally, we’ve placed candidates in 67 countries. Due to the high volume of applications, we may not be able to respond individually. If you haven’t heard back within two weeks, your application may not have been successful on this occasion. *Candidates outside the stated PQE range are welcome to apply if they can demonstrate relevant experience.* For more details or a confidential chat, contact Chloe Lam\-Moores at chloelam\-moores@hydrogengroup.com",https://www.linkedin.com/jobs/view/4395265469
