title,company,location,site,description,job_url
Penetration Tester,Bank of Ireland Group plc,"Dublin, County Dublin, Ireland",linkedin,"**What is the opportunity?** As a Junior Penetration Tester, you will support the security team in identifying and validating vulnerabilities across web applications, mobile applications, APIs, and infrastructure components. Working under the guidance of senior testers, you will help strengthen the organisation's security posture through hands\-on security testing, analysis, and reporting. **In This Role, You Will** * Perform supervised penetration testing of web, mobile, and API applications * Assist with network and infrastructure scanning using standard security tools * Retest vulnerabilities to confirm successful remediation * Provide basic remediation guidance to engineering teams * Participate in ad?'hoc threat modelling and security discussions * Assist in assessing impact and likelihood of identified findings * Log, track, and follow up on vulnerabilities using internal systems * Work with product and application teams on remediation progress * Support preparation of vulnerability summaries and status reports * Help tune scanning configurations and reduce false positives * Maintain working knowledge of application and infrastructure testing tools **What will make you stand out?** The ideal candidate will have a solid understanding of core web technologies, including HTTP, APIs, authentication, and session management, along with knowledge of the OWASP Top 10 and common application vulnerabilities. They should have exposure to penetration testing tools such as Burp Suite, Nmap, and Kali Linux, as well as familiarity with SAST, DAST, and SCA tooling. Basic scripting ability in Python, PowerShell, or Bash is important, and an awareness of cloud security concepts?""across AWS, Azure, or GCP?""is beneficial. Strong analytical and problem?'solving skills are needed, supported by clear communication abilities to explain findings to technical teams. The role also requires a collaborative mindset, a willingness to learn from senior testers, and a high level of attention to detail, particularly when documenting vulnerabilities and assessment outcomes. Experience with any of the following will help you to stand out but is not vital in order to apply for this role; * CompTIA Security\+ * eLearnSecurity eJPT / eWPT **Essential Qualifications** * Related qualification in cybersecurity or computer science **More About The Team** Group Information Security and Resilience (GISR) is a diverse, collaborative team with multiple skillsets. With global cyber threats constantly evolving, the team is essential to protecting one of the Group's most important and valuable assets: Information. GISR not only protect the security of the Bank but also enable colleagues to develop secure ways of working and to help them manage information security risk. This is a hybrid role, based primarily at Baggot Plaza or Cabinteely, Dublin. We typically ask colleagues to spend a minimum of 8 days per month working in\-person to support collaboration and connection. Specific arrangements will be confirmed by your recruiter to ensure they meet the needs of the role and team. \#ij\-hybrid **Why work with us?** The Bank of Ireland company culture prioritises work\-life balance with a commitment to hybrid working, along with 25 days annual leave and excellent pension contributions. Family can mean different things to different people; we offer 6 months paid maternity leave, an innovative fertility and surrogacy policy along with working parent and carer supports. Your health and wellbeing is important to us; we offer a substantial health insurance contribution, employee assistance program, WebDoctor and financial wellbeing coaches available. We also encourage and support staff to pursue educational and professional qualifications to grow and enhance your career! **Key Competencies** * Customer Focused \- Self * Better together \- Self * Be Decisive \- Self * Take Ownership \- Self * Manage Risk \- Self We're on a continuous journey to build an inclusive and diverse workplace. We welcome applications from people of all backgrounds, lived experience, abilities and perspectives. We provide reasonable accommodations at every stage of our recruitment process for disabilities, neurodivergence or medical conditions. If you require an accommodation please complete this form and one of our recruitment team members will be in touch via email. Any information provided will be treated as confidential within the recruitment team and used only for the purpose of determining and providing appropriate accommodations for the application and recruitment process.",https://www.linkedin.com/jobs/view/4394977310
Penetration Tester,Bank of Ireland,"Dublin, D, IE",indeed,"### **What is the opportunity?** As a Junior Penetration Tester, you will support the security team in identifying and validating vulnerabilities across web applications, mobile applications, APIs, and infrastructure components. Working under the guidance of senior testers, you will help strengthen the organisation's security posture through hands\-on security testing, analysis, and reporting. ### **In this role, you will:** * Perform supervised penetration testing of web, mobile, and API applications * Assist with network and infrastructure scanning using standard security tools * Retest vulnerabilities to confirm successful remediation * Provide basic remediation guidance to engineering teams * Participate in ad?'hoc threat modelling and security discussions * Assist in assessing impact and likelihood of identified findings * Log, track, and follow up on vulnerabilities using internal systems * Work with product and application teams on remediation progress * Support preparation of vulnerability summaries and status reports * Help tune scanning configurations and reduce false positives * Maintain working knowledge of application and infrastructure testing tools ### **What will make you stand out?** The ideal candidate will have a solid understanding of core web technologies, including HTTP, APIs, authentication, and session management, along with knowledge of the OWASP Top 10 and common application vulnerabilities. They should have exposure to penetration testing tools such as Burp Suite, Nmap, and Kali Linux, as well as familiarity with SAST, DAST, and SCA tooling. Basic scripting ability in Python, PowerShell, or Bash is important, and an awareness of cloud security concepts?""across AWS, Azure, or GCP?""is beneficial. Strong analytical and problem?'solving skills are needed, supported by clear communication abilities to explain findings to technical teams. The role also requires a collaborative mindset, a willingness to learn from senior testers, and a high level of attention to detail, particularly when documenting vulnerabilities and assessment outcomes. Experience with any of the following will help you to stand out but is not vital in order to apply for this role; * CompTIA Security\+ * eLearnSecurity eJPT / eWPT ### **Essential Qualifications** * Related qualification in cybersecurity or computer science ### **More about the team** Group Information Security and Resilience (GISR) is a diverse, collaborative team with multiple skillsets. With global cyber threats constantly evolving, the team is essential to protecting one of the Group's most important and valuable assets: Information. GISR not only protect the security of the Bank but also enable colleagues to develop secure ways of working and to help them manage information security risk. This is a hybrid role, based primarily at Baggot Plaza or Cabinteely, Dublin. We typically ask colleagues to spend a minimum of 8 days per month working in\-person to support collaboration and connection. Specific arrangements will be confirmed by your recruiter to ensure they meet the needs of the role and team. \#li\-hybrid \#ij\-hybrid ### **Why work with us?** The Bank of Ireland company culture prioritises work\-life balance with a commitment to hybrid working, along with 25 days annual leave and excellent pension contributions. Family can mean different things to different people; we offer 6 months paid maternity leave, an innovative fertility and surrogacy policy along with working parent and carer supports. Your health and wellbeing is important to us; we offer a substantial health insurance contribution, employee assistance program, WebDoctor and financial wellbeing coaches available. We also encourage and support staff to pursue educational and professional qualifications to grow and enhance your career! **Key Competencies** * Customer Focused \- Self * Better together \- Self * Be Decisive \- Self * Take Ownership \- Self * Manage Risk \- Self We're on a continuous journey to build an inclusive and diverse workplace. We welcome applications from people of all backgrounds, lived experience, abilities and perspectives. We provide reasonable accommodations at every stage of our recruitment process for disabilities, neurodivergence or medical conditions. If you require an accommodation please complete this form and one of our recruitment team members will be in touch via email. Any information provided will be treated as confidential within the recruitment team and used only for the purpose of determining and providing appropriate accommodations for the application and recruitment process.",https://ie.indeed.com/viewjob?jk=bc5fb2118c9fd6d0
Planner,John Sisk & Son Ltd,"Dublin, County Dublin, Ireland",linkedin,"**Overview** At Sisk, we’re more than a construction company, we’re a family\-owned business with a global reach, committed to building excellence in every project. We deliver trust, certainty and value to our clients while embracing innovation and shaping the future of construction. The Planner supports project teams by developing, managing and monitoring programmes across design, procurement, construction, commissioning and handover stages. The role ensures projects are delivered safely, efficiently and in line with contractual, commercial and compliance requirements. Working collaboratively with project managers, engineers and commercial teams, the Planner provides accurate programme information, highlights risks and opportunities and supports decision\-making through robust reporting and analysis. **Responsibilities** **Programme Development \& Control** * Lead the development of baseline contract programmes, ensuring full logic links and a clear critical path. * Prepare construction target programmes that identify opportunities for efficiency and improvement. * Develop tender event programmes for subcontractor procurement, including design release and lead\-in activities. * Maintain and manage programme documentation within a Common Data Environment (CDE). * Create 4D models and/or 2D phasing plans to illustrate build sequences, logistics and phasing strategies. * Collaborate with project teams to develop construction methodologies that clearly demonstrate sequencing and safe delivery. * Support preparation of project preliminaries, including staff resource planning, logistics and temporary works. * Engage with the supply chain to incorporate design deliverables, lead\-in times, construction durations and resource requirements. * Identify programme risks and opportunities, incorporating mitigation strategies, float and time risk allowances. **Reporting, Progress \& As\-Built Information** * Develop and monitor tracking schedules to validate subcontractor programmes. * Produce as\-built programmes, highlighting deviations from the baseline. * Provide input into change requests, advising on programme impacts and supporting timely approvals. * Use 2D/4D phasing information to represent current programme status and progress. * Produce validated output rates to track live project progress and feed lessons learned into future tenders. * Undertake peer reviews of programmes to ensure quality, accuracy and consistency across projects. **Experience** **Essential** * Proven experience in planning within large\-scale construction projects. * Strong understanding of UK and EU legal frameworks, particularly contract management. * Proficiency in planning and programme software (e.g., Asta Powerproject). * Strong IT skills, including digital planning and reporting tools. * Ability to interpret complex project data, identify risks and propose solutions. * Excellent communication and interpersonal skills, with experience collaborating across teams and with external stakeholders. * Experience working in multidisciplinary teams and contributing to project delivery. **Desirable** * Experience using Synchro and 4D planning tools to full potential. * Knowledge of BIM processes and collaborative data environments (CDEs). * Experience producing or reviewing 2D/4D phasing models. * Evidence of continuous professional development (e.g., CPD events, professional body engagement). * Experience mentoring or supporting junior colleagues. **Qualifications** **Essential** * Degree or diploma in Construction Management, Civil Engineering, Project Management or a related discipline. Equivalent professional experience will also be considered. * Certification or advanced training in planning software (e.g., Asta Powerproject). **Desirable** * Membership (or eligibility for membership) of a professional body such as CIOB, ICE or APM. * Advanced training in Asta Powerproject (progress analysis, S\-curve reporting, cost/resource management). Training in Synchro, BIM and collaborative data platforms. * Training in contract awareness (e.g., NEC, JCT). * Presentation skills training and/or leadership training. **Additional Information** * Competitive salary * 26 days annual leave * Pension and benefits * Unlimited learning and development opportunities * Much more **Our People and Recruitment Commitment** At Sisk Group our people are at the heart of our success. We offer the chance to work with purpose, build a career with no limits and be part of a great team. All vacancies are managed directly by our Internal Recruitment Team. Unsolicited contact or speculative CVs from unapproved agencies will not be accepted and no introductory fees will apply. We are an equal opportunities employer. We welcome applications from all qualified candidates regardless of gender, race, ethnicity, disability, age, sexual orientation, religion or any other protected characteristic. Reasonable adjustments are available during the recruitment process. We know the confidence gap and imposter phenomenon can stop talented candidates applying. You do not need to meet every criterion – your skills and potential matter. Don’t hold back we want to hear from you. All recruitment materials comply with legal and regulatory requirements including the EU Pay Transparency Directive and the Equality Acts UK and Ireland.",https://www.linkedin.com/jobs/view/4351703599
"Policy Executive, Engineering Industries Ireland",Ibec,"Dublin, County Dublin, Ireland",linkedin,"**JOB DETAILS** The Engineering Industries Ireland Executive will work with engineering industries Ireland member companies in relation to their policy agendas, in particular on technical policy and regulatory developments with a commercial impact on the engineering sector in Ireland. The Executive will carry out the necessary tasks, in consultation with the Director of Engineering Industries Ireland to ensure the objectives of the engineering manufacturing and services sectors are met across a range of policy issues. The Executive will also work as an effective member of the Engineering Industries Ireland Association team. **Closing date for applications is 16th April 2026\.** **About The Role** **Primary Responsibilities:** * Secretariat to the sectoral working groups. Ensure meetings are held regularly, appropriate minutes and papers prepared, and action plans implemented. * Provide analysis and appropriate updates on key issues on policy and regulation to the groups, producing major reports and other outputs where appropriate. These issues may include (non\-exhaustive) innovation, sustainability, people, and regulation. * Support the Director of Engineering with lobbying and representation activities on behalf of member companies on environment and sustainability issues at national and European level. * Develop contacts and network with relevant policy and technical contacts in all relevant Government departments and state agencies. * Liaise with relevant European Sectoral Associations, if relevant to existing sector initiatives * Communication with member companies on a range of relevant policy issues * Drafting of letters, submissions, and position papers prior to circulation to members for approval * Preparation of newsletters and content for digital communications * Be an active member of the overall Engineering Industries Ireland Team ensuring the objectives of the sector are met. * Carry out other duties as identified and agreed with the Director of Engineering Industries Ireland that are in keeping with the overall strategy of the association, which can be expanded beyond environmental sustainability. **NOTE: This list is not exhaustive but serves to reflect the nature of the duties included in the role. Given the nature of the organisation and the need to respond to members’ needs on an ongoing basis, the role is subject to change over time. Sector assignment may be subject to change.** **About You** **Qualifications, skills and experience** **Qualifications** * Primary degree in a relevant discipline – for example business, sustainability, politics * Relevant post graduate qualifications an advantage **Knowledge (Desirable)** * Business, social and environmental issues facing the engineering sector and its supply chain in Ireland, EU and globally * The Irish, EU and international policy and regulatory context and its implications for the engineering sector * Role of national and EU government and agencies in policy making and regulation and an understanding of the issues that shape legislative and regulatory policy Experience * Ideally 2\+ years relevant post graduate experience (relevant – industry, sustainability, or public affairs/policy) * Experience of working with committees/working groups * Working in a busy and dynamic team environment; comfortable taking on varying team roles **Skills** * Ability to work effectively with a range of stakeholders and manage the complexities involved * Exceptional communication skills, written and oral including public speaking ability * Ability to review and interpret complex information and present it in summary form **Why us?** **Ibec Core Competencies** ***Bias towards action*** * Collaborative – work together as ‘one Ibec’. * Dynamic – approach initiatives with careful planning, energy, drive, and resilience. * Decisive – make clear, well\-informed decisions. ***Member and Customer Focus*** * Agile and Adaptive – embrace change and be adaptive to members’ needs and in ambitious situations. * Creative and Innovative – not afraid of dynamic thinking in finding solutions. * Curious and Critical Thinking – open minded and proactive in gathering data in developing opinions. ***Drive and Personal Leadership*** * Ambitious – driven and can take responsible risks. * Accountable – committed to highest standards and takes ownership of actions. * Continuous Improvement – proactive on personal and professional development **Ibec is an equal opportunity, and inclusive employer is committed to providing reasonable accommodations for potential and existing employees with a disability. Should you wish to request a reasonable accommodation please email Kenny at Kenneth.Kelly@ibec.ie** **About Us** **Working in Ibec** Join Ibec and further your career. Working in Ibec means you are part of an overall effort to deliver on a vision for Ireland to be a balanced, growing and prosperous society. We look to the workplace of the future with the changing needs of our members as well as our workforce to create a dynamic and exciting working environment. We hire people from many backgrounds who are highly knowledgeable, engaging, professional and, most importantly, passionate about business.",https://www.linkedin.com/jobs/view/4397060590
Primary Design Engineer (P&R) | Dublin or Limerick,Kirby Group Engineering,"Dublin, County Dublin, Ireland",linkedin,"**Primary Design Electrical Engineer \| Ireland** * Permanent position available with a considerable portfolio of works for the next 5\+ years * To build your career by assisting in the delivery of ‘leading edge’ engineering projects. * To work with a vibrant, agile and multi\-functional team in delivering projects on time, safely, to budget and to the required quality standards. * To benefit from Kirby’s Career Development Programmes that will enhance your leadership capability. * To work with the best. * Excellent package on offer with room for negotiations **About Kirby Group Engineering** Kirby Group Engineering is an international multi\-disciplinary engineering services contractor and leading provider of high\-value engineering services to a number of ‘blue chip’ companies. Operating across Ireland, the UK and Europe, Kirby has become the engineering service provider of choice in growth segments such as pharmaceuticals, data centres and power transmission and distribution. Our culture is innovative, collaborative and performance focused. The successful candidate will have the opportunity to grow and develop in a company committed to developing talent and rewarding performance. **Role Purpose** As Primary Design Electrical Engineer you will be responsible for the lead technical support on projects, from initial enquiry and tendering right through to construction, commissioning and energisation across all Kirby business units. The role will require an adaptable and agile individual who will work with various sections across the entire business, with a particular emphasis on the HV electrical elements of M\&E projects. While the role will be primarily focusing on M\&E installations and projects, the successful applicant will be part of the Power \& Renewables engineering team affording them the opportunity to expand their knowledge and experience on electrical installations up to 400kV. **Primary Design Electrical Engineer Responsibilities** In conjunction with your project team, you will be responsible for the execution of various stages of a project as follows: * Produce Primary Plant designs for the development and delivery of HV substation projects. * Produce engineering reporting documentation such as CT burden assessments, control building lighting and heating calculations * Produce Substation compound and building layout drawings, incorporating the TSO/DSO Specifications and Employer’s Requirements in the design documentation. * Co\-operate with internal teams such as Secondary design, civil and operations engineers, consultants, contractors, and clients to ensure technical compliance. * Produce and review all primary plant technical drawings, specifications, and documentation. * Ensure designs are produced in compliance with applicable standards (IEC, IEEE, EN etc.) and regulatory requirements such as fire and evacuation regulations. * Provide technical support during installation, testing, and commissioning phases. * Identify and mitigate safety and design risks and resolve technical issues proactively. **Necessary requirement of the Electrical Project Engineer** * 3rd level Qualification in Electrical Engineering * Minimum of 3 years in Primary Engineering Design design/project management experience on industrial installation projects * Professional and commercial acumen and be capable of representing Kirby at a senior level in meetings * Detailed understanding of HV and MV network requirements in industrial settings, with particular emphasis on resilience and studies requirements * Experience with energy management systems and integration of automated control systems to electrical networks * A proven track record of delivering projects on time and to budget * Experience of managing multiple projects at the one time * Strong IT skills * A flexible and delivery focused mind\-set * Excellent communicator/strong interpersonal skills/communicates with impact * Excellent record keeper and administration skills * Leads and influences others. * Innovates and leads in mechanical/technical activity and challenges. * Plans and effectively manages projects. * Solves problems analytically and acts decisively * Is process driven and focuses on EHS and Quality Work Management Systems and Processes * Mentor and Coach to junior engineers and graduates ***For more information on this Electrical Project Engineer/ Project Engineer position or other Electrical Project Engineer / Mechanical Engineer opportunities based in Ireland the UK or Europe contact Kirby Group Talent Acquisitions Team confidentially on \+353 (0\)1 454 0411 or apply in confidence.***",https://www.linkedin.com/jobs/view/4390820511
