title,company,location,site,description,job_url
Electrical Design Engineer - LV Switchgear,,"Carlow, CW, IE",indeed,"Switchgear Electrical Design Engineer \- Junior, Intermediate or Senior Modutech Switchgear are seeking Switchgear Electrical Design Engineers for designing, developing, and validating electrical LV switchgear systems used in power distribution. The role involves creating schematics, ensuring compliance with standards, and supporting manufacturing and testing processes. **Key Responsibilities** * Design LV electrical switchgear panels including: * Single Line Diagrams (SLDs) * Wiring diagrams and schematics * Layout drawings and panel arrangements * Select appropriate components such as: * Circuit breakers * Busbars * Protection relays * Contactors and control devices * Ensure designs comply with standards like: * IEC (e.g., IEC 60439, IEC 61439\) * NSAI IS10101:2025 * Perform electrical calculations: * Load calculations * Short\-circuit analysis * Thermal and busbar sizing * Coordinate with: * Mechanical design teams * Manufacturing/production teams * Clients and project managers * Prepare technical documentation: * Bill of Materials (BOM) * Test procedures * Operation \& maintenance manuals * Support factory acceptance tests (FAT) and site commissioning * Troubleshoot and optimize designs for cost, safety, and performance **Required Skills \& Competencies** * Strong knowledge of: * Power distribution systems * Switchgear design principles * Protection and control systems * Proficiency in design tools such as: * AutoCAD Electrical * EPLAN / (or similar) * Understanding of electrical standards and regulations * Ability to read and create technical drawings * Problem\-solving and analytical skills * Good communication and teamwork abilities **Qualifications** * Bachelor’s degree in Electrical Engineering or related field * 2–5\+ years of experience in switchgear or panel design (varies by role level) * Knowledge of LV systems is essential **Preferred Experience** * Experience with large industrial and commercial projects * Familiarity with protection equipment, relays etc (e.g., Siemens, ABB, Schneider) * Experience in panel manufacturing or testing environments **Typical Work Environment** * Engineering office with CAD/design work * Occasional factory visits or site work * Collaboration with cross\-functional engineering teams **Career Progression** **Junior or intermediate candidates may also be considered with relevant experience and requirements.** * Junior Design Engineer → Senior Design Engineer → Lead Engineer → Engineering Manager Job Type: Permanent Pay: €40,000\.00\-€65,000\.00 per year Work Location: In person",https://ie.indeed.com/viewjob?jk=b9f6fa21fadde3d3
Endpoint & Automation Engineer,BoyleSports,"Dundalk, LH, IE",indeed,"**Job Title:**Endpoint \& Automation Engineer **Location:** Dundalk HQ Hybrid \| Ireland Remote **Department:** Technology **Reports To:** Head of Retail \& Corporate IT **Job Type:** Full\-Time / Permanent **Role Overview** We are seeking a highly capable and detail\-oriented Endpoint \& Automation Engineer to join our growing Corporate IT team. This role blends traditional endpoint management with responsibility for designing and implementing IT automation to support operational efficiency, compliance, and scalability. The successful candidate will manage the full lifecycle of end\-user devices while automating key IT infrastructure tasks such as provisioning, compliance enforcement, patching, and reporting — helping reduce manual workloads and improve service delivery. **Key Responsibilities** **Endpoint Lifecycle Management** * Design, implement, and maintain secure Windows/macOS base images (Golden Images). * Automate device provisioning using Microsoft Intune Autopilot, Apple DEP, or similar tools. * Manage patching policies, device encryption, and standardised configurations across all corporate and retail endpoints. * Track asset lifecycle from procurement through decommissioning using inventory tools. **Security \& Compliance** * Implement and maintain endpoint GPOs and compliance policies through Intune or MDM. * Support DLP controls, device encryption, anti\-virus enforcement, USB restrictions, and user access reviews. * Help maintain compliance with regulatory standards including PCI\-DSS and ISO 27001\. **Infrastructure Automation (Automation Engineer Scope)** * Identify repetitive or manual infrastructure tasks and automate using PowerShell, Python, or other scripting languages. * Design and maintain automation pipelines for user onboarding/offboarding, device enrolment, group membership management, patch scheduling, and reporting. * Work with Azure DevOps, GitHub Actions or similar platforms to implement CI/CD pipelines for internal IT scripts and configuration policies. * Build dashboards to visualise key metrics (compliance, patch status, device health). **Monitoring, Reporting \& Support** * Develop health check scripts for endpoints to identify issues proactively. * Provide reporting on patch compliance, update success, endpoint security status, and configuration drift. * Act as final escalation point for endpoint or scripting issues not resolved by the Service Desk. * Support incident management and root cause analysis for endpoint outages or anomalies. **Collaboration \& Strategic Projects** * Collaborate closely with Systems, CyberSecurity, Service Desk, and Network teams to standardise and modernise endpoint and automation strategy. * Assist with IT transformation projects such as JML process improvements, automation of approvals, and integration of service workflows. * Drive innovation by introducing new tools and processes aligned with the business needs. **Essential Skills \& Experience** * 3\+ years in endpoint management or IT automation (Ansible). * Hands\-on experience with Microsoft Intune, Autopilot, and Azure AD. * Proficiency in scripting (PowerShell essential, Python a plus). * Excellent understanding with preferably Windows/macOS or GPOs, Azure AD, O365, device security. * Experience with GitHub, Azure DevOps or similar version\-controlled automation frameworks. * Strong understanding of IT infrastructure components including networking and identity. **Desirable Skills** * Experience with JAMF or mobile device management. * Background in SCCM/MDT or modern endpoint deployment strategies. * Experience integrating APIs (e.g. for Service Desk, HR systems, inventory tools). * Understanding of security frameworks (e.g. NIST, ISO 27001\). **Personal Attributes** * Automation\-first mindset with a strong attention to detail. * A continuous improvement advocate — always seeking to make processes faster and more reliable. * Excellent written and verbal communication, with a strong documentation ethic. * Comfortable working both independently and in collaboration with multi\-functional teams. * Pro\-active approach to cost management, consistently seeking opportunities to reduce the total cost of ownership for endpoint devices through strategic procurement, lifecycle optimisation, and the implementation of efficient device management practices. * Positive, solutions\-oriented attitude with strong troubleshooting skills. **Why Join Us** * Influence the next\-generation endpoint and automation strategy. * Drive efficiencies through tooling, scripting, and systems standardisation. * Be part of a transformation journey to secure and scale a modern IT corporate \& retail estate. * Training, support, and career path development within a high\-impact team.",https://ie.indeed.com/viewjob?jk=0db5a31e44673fb5
"Engineer QA, PC Apps",Dolby Laboratories,"Dublin, County Dublin, Ireland",linkedin,"Join the leader in entertainment innovation and help us design the future. At Dolby, science meets art, and high tech means more than computer code. As a member of the Dolby team, you’ll see and hear the results of your work everywhere, from movie theaters to smartphones. We continue to revolutionize how people create, deliver, and enjoy entertainment worldwide. To do that, we need the absolute best talent. We’re big enough to give you all the resources you need, and small enough so you can make a real difference and earn recognition for your work. We offer a collegial culture, challenging projects, and excellent compensation and benefits, not to mention a Flex Work approach that is truly flexible to support where, when, and how you do your best work. **The role** For Dolby’s PC Applications, you will support the quality, stability, and reliability of consumer\-facing client applications used by end users at scale. As an Engineer QA, you will primarily focus on manual and exploratory testing, supporting feature development and release validation while gradually building ownership of assigned test areas. This role reflects the traditional QA Engineer role used on Dolby Access and is intentionally suitable for manual QA engineers, with optional paths toward automation over time. **What We Offer** * Work on consumer\-facing PC applications with visible impact on real users. * A collaborative QA and engineering environment focused on quality, learning, and shared ownership. * Stable products, clear expectations, and realistic scope for manual quality assurance. * Opportunities to grow toward automation or senior SQA roles over time. **What You Will Do** * Execute manual and exploratory tests for assigned features or application areas. * Design, execute, and maintain test cases based on requirements and specifications. * Participate in release validation, regression testing, and smoke testing activities. * Clearly report defects and work with software engineers to support investigation and resolution. * Maintain basic test documentation and contribute to improving test coverage over time. **Required** **What you bring** * Experience in manual software testing or quality assurance for consumer or client\-side applications. * Good understanding of software testing fundamentals, including test case design, execution, and defect reporting. * Ability to follow test plans, document results, and work in a structured manner. * Attention to detail and a quality\-focused mindset. * Good communication skills and ability to collaborate effectively within a team. **Nice to have** * Experience testing Windows\-based desktop applications. * Experience with test automation or scripting (e.g. Python. * Familiarity with bug tracking tools and basic CI or release validation workflows. * Interest in growing toward automation or advanced SQA roles in the future. Dolby Hiring Entity: 77 Sir John Rogerson's Quay, Block C Grand Canal Docklands Dublin D02 VK60Ireland",https://www.linkedin.com/jobs/view/4397333562
Graduate AI software engineer,Bending Spoons,"Dublin, County Dublin, Ireland",linkedin,"At Bending Spoons, we’re striving to build one of the all\-time great companies. A company that serves a huge number of customers. A company where team members grow to their full potential. A company that functions at unparalleled levels of effectiveness and efficiency. A company that creates value for shareowners at an extraordinary rate. And a company that does so while adhering to high ethical standards. In pursuit of this objective, we acquire and improve digital businesses, not to sell on, but to own and operate for the long term. The transformations we make are often deep—designed to speed up innovation, benefit customers, and strengthen business performance. Here, hierarchy is minimal and teams are small and talent\-dense. We operate established products with the ambition, agility, and urgency of a startup. Across the company, we integrate AI deeply into how we work so that human judgment and machine intelligence reinforce each other. For a talented, driven, and collaborative individual, working at Bending Spoons is an opportunity to learn, make an impact, and progress their career at an exceptionally high rate. That’s our promise to such a candidate. **A few examples of your responsibilities** * **Build AI\-powered product experiences.** Work with product teams to identify high\-impact opportunities where AI can transform the user experience for millions—and then build these transformative solutions. Drive the process from possibility to production, delivering code that’s robust, reproducible, and built for scale. * **Amplify your impact with AI.** Integrate the most powerful AI tools directly into your development workflow—design, implementation, testing, and documentation—to move faster while maintaining high standards for correctness, reliability, and maintainability. * **Master your toolkit.** Work across diverse stacks with end\-to\-end ownership, choosing the right technologies for each challenge. From monoliths to microservices, gRPC to REST, Kubernetes to Docker, Python to Rust—you’ll apply technologies thoughtfully, focusing on depth and purpose rather than trends. * **Build software that matters.** Take real ownership from idea to production, creating systems used by millions and evolving them into products at scale. * **Simplify relentlessly.** Question every layer of complexity. Improve architectures, pipelines, and codebases to build systems that are simpler, more scalable, and easier to maintain. **What we look for** * **Reasoning ability.** Given the necessary knowledge, you can solve complex problems. You think from first principles, and structure your ideas sharply. You resist the influence of biases. You identify and take care of the details that matter. * **Drive.** You’re extremely ambitious in everything you do—and your initiative, effort, and tenacity match the intensity of your ambition. You feel deeply responsible for your work. You hold yourself to a high—and rising—bar. * **Team spirit.** You give generously and without the expectation of receiving in return. You support the best idea, not your idea. You're always happy to get your hands dirty to help your team. You’re reliable, honest, and transparent. * **Proficiency in English.** You read, write, and speak proficiently in English. **What we offer** * **Incredibly talented, entrepreneurial teams.** You’ll work in small, result\-oriented, autonomous teams alongside some of the brightest people in your field. * **An exceptional opportunity for growth.** We go to great lengths to hire individuals of outstanding potential—then, our priority is to put them in the ideal position to thrive. Spooners in their 20s lead products worth hundreds of millions of dollars. And if you’ve got what it takes, you’ll soon be playing an essential role in major projects, too. * **Competitive pay and access to equity in the company.** Typically, we offer individuals at the start of their career an annual salary of £85,797 in London and €66,065 elsewhere in Europe. For a candidate that we assess as possessing considerable relevant experience, the salary on offer tends to be between £112,189 and £250,512 in London, and €107,837 and €188,848 elsewhere in Europe. Compensation varies by location and expected impact, and grows rapidly as you gain experience and translate it into greater contributions. For individuals who demonstrate exceptional capability, we may offer compensation that extends beyond the usual ranges to reflect their higher expected impact. If you're offered a permanent contract, you'll also be able receive some of your pay in company equity at a discounted price, thus participating in the value creation we achieve together. If relocating to Italy, you may enjoy a 50% tax cut. * **All. These. Benefits.** Flexible hours, remote working, unlimited backing for learning and training, top\-of\-the\-market health insurance, a rich relocation package, generous parental support, and a yearly retreat to a stunning location. We help each Spooner set up the conditions to do their best work. * **A flexible start date and part\-time options.** You don't need to wait until graduation to apply. We offer flexible start dates and the possibility to begin part\-time, transitioning to full\-time as you complete your degree. Many Spooners joined before graduating and progressively took on greater responsibility, with arrangements that allowed them to do so without compromising their education. **Commitment \& contract** Permanent or fixed\-term. Full\-time. **Location** Milan (Italy), London (UK), Madrid (Spain), Warsaw (Poland) or remote in selected countries. **The selection process** In our screening process, we prioritize verifiable signals of excellence, regardless of seniority. Some people hold back because they feel they lack experience or have an “imperfect” CV. If you like the role and believe you could excel over time, don’t self\-reject. If you pass our screening, you’ll be asked to complete one or more tests. They are challenging, may involve unfamiliar problems, and can take several hours. We set the bar high and won’t extend an offer until we’re confident we’ve found the right candidate. This is why a job may remain open for months or be reposted several times. We consider all applicants for employment and provide reasonable accommodations for individuals with disabilities—please let us know through this form. **Before you apply** If you’ve applied before but didn't receive an offer, we recommend waiting at least one year before applying again. Bending Spoons is a demanding environment. We’re extremely ambitious and we hold ourselves—and one another—to a high standard. While this tends to lead to extraordinary learning, achievement, and career growth, it also requires significant commitment. To help you ramp up quickly and set yourself up for success, we recommend spending your first few months working from our Milan office, regardless of your long\-term work location. It’s the best way to rapidly absorb our company culture and build trust with your new teammates. We’ll support you with generous travel and accommodation assistance. After that, you’re welcome to work from our offices in Milan or London, or remotely from approved countries—depending on what we agree at the offer stage. If the role speaks to you and you’re excited to give your best, we’d love to hear from you. Apply now—we can’t wait to meet you.",https://www.linkedin.com/jobs/view/4405720986
Graduate Geologist,SLR Consulting,"Dublin, County Dublin, Ireland",linkedin,"SLR have an exceptional career opportunity for an aspiring Geologist to join our distinguished Mining Advisory team, spanning Ireland and the UK. This position holds significant importance in our commitment to expanding our service offerings to a broad spectrum of mining clients, both domestically and internationally. As part of our closely\-knit team, we will help you develop your skills to provide day\-to\-day guidance, oversight, and assistance, as well as undertaking more complex analysis, on a variety of interesting projects. This position will be based from our Dublin office. **The Role** With support from senior colleagues, initial duties and responsibilities will include: * Supervision of mineral resource drilling programmes and geological core logging * Planning procurement and management of ground investigations and preparation of factual and interpretative reports * Undertaking routine quarry inspections, aggregate sampling and sample management * Generating and manging geological / geotechnical databases; * Petrographic analyses, thin section microscopy, and preparation of technical reports * Sample management and logistics logistics * Reviewing, interpreting and reporting the results of routine aggregate analysis; and * Preparing geological Conceptual Site Models. **About Us** SLR are global leaders in Sustainability Solutions, helping our clients achieve their sustainability goals. We are a consultancy with 4000\+ employees across 6 regions in over 125 countries. Our ‘one team’ culture is at the heart of our business, providing a collaborative and supportive environment for professional development. Along with competitive salaries, our staff enjoy a comprehensive benefits package with a company pension plus excellent **healthcare offering** , **travel and life insurance** and a **structured career framework** with regular reviews offering outstanding opportunities for progression. Alongside 25 day’s annual leave, with additional **flexible bank holidays,** we offer **flexible,** **agile and hybrid working** which enables staff to tailor hours worked around core hours, with family friendly policies help balance the needs of professional and home life. **About You** We are looking for a hard\-working team player with a degree in geological science and a desire to build a career in the mining and resource extraction sector. **You Will Also Have** * Excellent communication skills, verbal and written * Strong project co\-ordination skills * Computer literate with experience using Microsoft Office products * Ability to work in a collaborative team environment but also to demonstrate independence in completing work tasks * Willingness to learn how to use modelling packages Due to site\-based travel requirements, a **full driving licence** is essential for this position. **Culture \& Inclusion at SLR** We are committed to being an equal opportunities employer, and our expectations go beyond purely complying with legislation. Through our Regional C\&I Committees, Global Council and Employee Networks, we foster an inclusive environment where all people regardless of their background can thrive. We welcome applications from all individuals, regardless of their background, including those from groups that are currently under\-represented at SLR, such as people identifying as 2SLGBTQI\+, Indigenous peoples, ethnic minority groups, women, and people with visible or invisible disabilities, including those who are neurodivergent. Should you require any special adjustments throughout the recruitment process with us, please let us know. As a Disability Confident Committed employer, we seek to ensure all applicants have equitable support when applying to SLR.",https://www.linkedin.com/jobs/view/4384266628
