title,company,location,site,description,job_url
Junior Accounts Payable Administrator,GMC Utilities Group,"Dublin, D, IE",indeed,"**Are you looking to become part of a collaborative team whilst maximising your potential to grow and develop within your career? Apply today.** **The Role.** GMC Utilities Group Ltd are seeking an experienced and detail\-oriented **Junior** **Accounts Payable Administrator** to join our growing Finance Team, based in Ballycoolin, Dublin 11\. This is a key role within the organisation, supporting the Finance Department in managing subcontractor accounts payable processes, ensuring accuracy, efficiency, and compliance in all financial transactions. **Key Duties and Responsibilities will include but are not limited to:** **Key Responsibilities:** Upload weekly subcontractor costs into Sage, creating purchase order cost accruals. Process large volumes of subcontractor invoices against accrued costs, deducting any necessary retentions. Maintain accurate subcontractor creditor balances at all times. Ensure all agreed credit terms are correctly recorded and utilised on the accounting system. Complete creditor statement reconciliations on a regular basis. Prepare weekly and monthly payment lists using aged creditor listings and notes on Sage 200 for review and approval. Notify payments through ROS and process any required RCT deductions within Sage. Review and adjust accrued costs to ensure accuracy. Handle supplier and subcontractor queries promptly and professionally. **The Candidate: Required Experience and Competencies:** Proven experience in an Accounts Payable or Finance Administration role. Strong organisational skills and attention to detail. Excellent communication and interpersonal skills with the ability to collaborate across departments. Flexible approach and ability to manage variable workloads. Strong IT skills, particularly Microsoft Excel (advanced level) and Sage 200 experience (desirable). Fluent English, both written and verbal. **Become a part of something bigger.** At the heart of GMC is our people, from engineers through to customer service and we aim to work collaboratively towards our common goals. GMC is an equal opportunity employer, and we aim to recruit and retain like\-minded people from diverse backgrounds with a wide range of expertise. In GMC we foster a work culture that promotes collaboration and learning, building an environment where our people have the capacity to maximise their potential whilst gaining the opportunity to continuously develop. **Our Future.** Since the founding of GMC in 1981 by Gerry McCloskey, GMC has grown to be Ireland's leading Civils and Utilities company and the future for GMC is bright. We have engaged with our staff and other stakeholders to agree and publish our core values. One of our core values is to *""Focus on the Future""*. Our growth to date reflects the confidence that our customers have in our service delivery, in the innovative approach that we bring to how we do our work, and to our culture of safety and quality. We have ambitious plans to develop our footprint in Ireland and overseas but understand that every decision we make contributes to people's quality of life throughout generations, and we don't take that responsibility lightly as we build Ireland's infrastructure of tomorrow, today.",https://ie.indeed.com/viewjob?jk=85291e5937ad1f69
Junior Business Analyst,Berkley Group,"Dublin, County Dublin, Ireland",linkedin,"**Junior Business Analyst (AI)** **Initial 3\-6 month contract** **Dublin, Hybrid** **My client a leading professional services company is on the lookout for a Junior Business Analyst to join their team.** The Job: * Support the development lifecycle of software projects by acting as a bridge between technical teams and business stakeholders. * Gather and document requirements, ensuring they are translated into clear, actionable user stories and functional specifications. * Assist in the integration of AI features, helping to define use cases, data requirements, and success metrics for machine learning models or automated workflows. * Conduct gap analysis and process mapping to identify opportunities for software optimization and AI\-driven efficiency. * Facilitate UAT (User Acceptance Testing) by creating test scripts and ensuring the final product aligns with the original business intent. * Maintain project documentation and backlogs within Agile environments. Have You: * Proven 1\-2 years experience as a Junior Business Analyst, specifically within a software development or IT environment. * Hands\-on exposure to AI or Data Science projects, with an understanding of how AI can be applied to solve business problems. * Strong requirement elicitation skills, including the ability to run workshops and interview stakeholders effectively. * Experience working in Agile/Scrum frameworks. * Analytical mindset with the ability to interpret complex data and present findings to non\-technical audiences. * Immediate availability to commit to an initial 3\-6 month contract period. Candidates must have a stamp 4 visa, UK/EU Passport\* **Berkley Business \& Technology is a specialist consultancy, recruiting professionals for organizations throughout Ireland, UK \& Europe; for more information go to www.berkley\-group.com.** **If you would like to discuss this vacancy further or to discuss your career options in confidence, please send your profile to brendanoconnell@berkley\-group.com**",https://www.linkedin.com/jobs/view/4408292899
Junior Field IT Support,Ticketmaster,"Dublin, County Dublin, Ireland",linkedin,"**Job Summary** **JOB DESCRIPTION – Junior Field IT Support** Location:Dublin (Onsite) Division: Ticketmaster UK/IRE – Enterprise Support Contract Terms: Permanent, 40 hours per week **THE TEAM** The Technology Support team which is part of the Global Support \& Operations organisation, is a customer focused service delivery team providing technical support and installations services across the various business units and client base. We are a key department responsible for the successful delivery of major events and festivals as well as ensuring the ongoing support and maintenance of our fixed client base and owned and operated venues. Focused on providing high levels of customer and client satisfaction we are driven to provide safe, secure and reliable solutions and services that enables fans to enjoy the experience of live events. **THE JOB** The Technology Support team will focus their day to day by providing support to our clients and the wider Ticketmaster and Livenation business either remotely or in person. Supporting a wide range of products, peripherals and Ticketmaster proprietary software you will need to be technically focused and customer centric. The Technical Support team will often work in the pressurised but enjoyable environment of festivals and outdoor events installing a wide range of hardware and software solutions that provides fans with a seamless and enjoyable experience attending Live events. **What You Will Be Trained To Support** * Installation and support of Ticketmaster proprietary software and hardware e.g. Ticket printers, Handheld Devices and Point of Sale * Installation of software, firmware to ensure devices are up to date * Installing and supporting network devices including Wireless Access Points, Switches, Bridges etc * Upgrading and replacing hardware and software as and when required * Configuring and testing of the above said hardware and software * Diagnosing and remediation of issues and problems both remotely and on\-site * Raising incidents and updating incident management software * Tracking Assets and updating asset management software * Minimise incidents and service distribution by providing proactive support and maintenance * Coordinating and liaising with clients prior to attendance and installations * Working with third party providers and contractors often in a lead capacity * Provide on\-site end user training and demonstration of Ticketmaster products * Updating and maintaining technical and operational documentation * Communicating and collaborating with multiple teams and clients * Following best practices and procedures ensuring standards are maintained * Maintain an understanding of all TM and LN products usage and functionality **What You Need To Know** * A willingness or keen interest or knowledge of Microsoft, and mobile device applications. * An interest in learning wired and wireless networking technologies and products * Eager to expand knowledge within the entertainment business and its requirements to meet our client’s needs, be committed to your development within the Junior support role. **YOU** * An aptitude for understanding concepts and methodologies, both technical and non\-technical * Good interpersonal and communication skills – Fluent English essential * Candidate must be detail oriented and organised * Ability to travel required * May be required to work nights, weekends, or holidays * Must have valid clean driving licence * Candidate must be dynamic to meet the needs of an ever\-changing live entertainment environment **TICKETMASTER VALUES** * Reliability – We understand that fans and clients rely on us to power their live event experiences, and we rely on each other to make it happen. * Teamwork \- – We believe individual achievement pales in comparison to the level of success that can be achieved by a team * Integrity – We are committed to the highest moral and ethical standards on behalf of the countless partners and stakeholders we represent * Belonging \- We are committed to building a culture in which all people can be their authentic selves, have an equal voice and opportunities to thrive **EQUAL OPPORTUNITIES** We are passionate and committed to our people and go beyond the rhetoric of diversity and inclusion. You will be working in an inclusive environment and be encouraged to bring your whole self to work. We will do all that we can to help you successfully balance your work and home life. As a growing business we will encourage you to develop your professional and personal aspirations, enjoy new experiences, and learn from the talented people you will be working with. It’s talent that matters to us and we encourage applications from people irrespective of their gender, race, sexual orientation, religion, age, disability status or caring responsibilities. **CULTURE** We’re fans who help fans everywhere get in to the live events they love. A proud division of Live Nation Entertainment, Ticketmaster has changed the way the world connects with their favourite artists, teams, and shows, and we continue to shape innovation every day. We’re not just selling tickets (though we do that better than anyone else), we’re enriching lives one amazing experience at a time. And we think that’s pretty amazing. If you’re passionate about the magic of live entertainment like we are, and you want to work at a company dedicated to helping millions of fans experience it, we want to hear from you. We have a ‘Fan First’ mindset, placing customers at the heart of everything we do. Whether working behind the scenes or engaging directly with the ‘Fan’ you will be part of a culture that supports and enriches the fan experience. Your work, our passion… delivering world class experiences – Fan First. Live Nation Entertainment will never request payment or equipment purchases as part of the hiring process. Recruiters will only contact candidates from official Live Nation or affiliated brand email domains.",https://www.linkedin.com/jobs/view/4406433794
Junior Field IT Support,Live Nation Entertainment,"Dublin, County Dublin, Ireland",linkedin,"**Job Summary** **JOB DESCRIPTION – Junior Field IT Support** Location:Dublin (Onsite) Division: Ticketmaster UK/IRE – Enterprise Support Contract Terms: Permanent, 40 hours per week **THE TEAM** The Technology Support team which is part of the Global Support \& Operations organisation, is a customer focused service delivery team providing technical support and installations services across the various business units and client base. We are a key department responsible for the successful delivery of major events and festivals as well as ensuring the ongoing support and maintenance of our fixed client base and owned and operated venues. Focused on providing high levels of customer and client satisfaction we are driven to provide safe, secure and reliable solutions and services that enables fans to enjoy the experience of live events. **THE JOB** The Technology Support team will focus their day to day by providing support to our clients and the wider Ticketmaster and Livenation business either remotely or in person. Supporting a wide range of products, peripherals and Ticketmaster proprietary software you will need to be technically focused and customer centric. The Technical Support team will often work in the pressurised but enjoyable environment of festivals and outdoor events installing a wide range of hardware and software solutions that provides fans with a seamless and enjoyable experience attending Live events. **What You Will Be Trained To Support** * Installation and support of Ticketmaster proprietary software and hardware e.g. Ticket printers, Handheld Devices and Point of Sale * Installation of software, firmware to ensure devices are up to date * Installing and supporting network devices including Wireless Access Points, Switches, Bridges etc * Upgrading and replacing hardware and software as and when required * Configuring and testing of the above said hardware and software * Diagnosing and remediation of issues and problems both remotely and on\-site * Raising incidents and updating incident management software * Tracking Assets and updating asset management software * Minimise incidents and service distribution by providing proactive support and maintenance * Coordinating and liaising with clients prior to attendance and installations * Working with third party providers and contractors often in a lead capacity * Provide on\-site end user training and demonstration of Ticketmaster products * Updating and maintaining technical and operational documentation * Communicating and collaborating with multiple teams and clients * Following best practices and procedures ensuring standards are maintained * Maintain an understanding of all TM and LN products usage and functionality **What You Need To Know** * A willingness or keen interest or knowledge of Microsoft, and mobile device applications. * An interest in learning wired and wireless networking technologies and products * Eager to expand knowledge within the entertainment business and its requirements to meet our client’s needs, be committed to your development within the Junior support role. **YOU** * An aptitude for understanding concepts and methodologies, both technical and non\-technical * Good interpersonal and communication skills – Fluent English essential * Candidate must be detail oriented and organised * Ability to travel required * May be required to work nights, weekends, or holidays * Must have valid clean driving licence * Candidate must be dynamic to meet the needs of an ever\-changing live entertainment environment **TICKETMASTER VALUES** * Reliability – We understand that fans and clients rely on us to power their live event experiences, and we rely on each other to make it happen. * Teamwork \- – We believe individual achievement pales in comparison to the level of success that can be achieved by a team * Integrity – We are committed to the highest moral and ethical standards on behalf of the countless partners and stakeholders we represent * Belonging \- We are committed to building a culture in which all people can be their authentic selves, have an equal voice and opportunities to thrive **EQUAL OPPORTUNITIES** We are passionate and committed to our people and go beyond the rhetoric of diversity and inclusion. You will be working in an inclusive environment and be encouraged to bring your whole self to work. We will do all that we can to help you successfully balance your work and home life. As a growing business we will encourage you to develop your professional and personal aspirations, enjoy new experiences, and learn from the talented people you will be working with. It’s talent that matters to us and we encourage applications from people irrespective of their gender, race, sexual orientation, religion, age, disability status or caring responsibilities. **CULTURE** We’re fans who help fans everywhere get in to the live events they love. A proud division of Live Nation Entertainment, Ticketmaster has changed the way the world connects with their favourite artists, teams, and shows, and we continue to shape innovation every day. We’re not just selling tickets (though we do that better than anyone else), we’re enriching lives one amazing experience at a time. And we think that’s pretty amazing. If you’re passionate about the magic of live entertainment like we are, and you want to work at a company dedicated to helping millions of fans experience it, we want to hear from you. We have a ‘Fan First’ mindset, placing customers at the heart of everything we do. Whether working behind the scenes or engaging directly with the ‘Fan’ you will be part of a culture that supports and enriches the fan experience. Your work, our passion… delivering world class experiences – Fan First. Live Nation Entertainment will never request payment or equipment purchases as part of the hiring process. Recruiters will only contact candidates from official Live Nation or affiliated brand email domains.",https://www.linkedin.com/jobs/view/4408581996
Junior Pensions Consultant,Sigmar Recruitment,"South Dublin, Ireland",linkedin,"**Junior Pensions Consultant** **About Your New Employer** Join a leading provider of pensions solutions and be part of an innovative and dynamic organisation focused on employee engagement and investment offerings. As Junior Pensions Consultant you will have the opportunity to work within a team dedicated to supporting thousands across the construction industry with pension, life assurance, and illness benefits. **About Your New Job** * As Junior Pensions Consultant you will deliver engaging presentations (in\-person and virtual) to pension scheme members across multiple schemes. * You will explain pension benefits, options, and retirement processes in a clear, accessible way and help increase member understanding. * You will support member engagement campaigns, respond to follow\-up queries, and promote Additional Voluntary Contributions (AVCs). * As Junior Pensions Consultant you will tailor your communications for different audiences (e.g., site staff, pre\-retirees), maintaining high levels of accuracy and clarity, and collaborate with internal teams to ensure consistency and support the development of communication materials. **What Skills You Need** * QFA qualified * Strong presentation and public speaking skills, with the ability to explain complex topics simply. * Excellent communication and interpersonal abilities, confident with both large and small groups. * Organised and goal\-oriented, able to manage your own diary and work to deadlines. * Relevant experience in pensions, financial services, or employee benefits (preferred). **What's on Offer** The chance to make a real impact by enhancing financial literacy and future readiness for members in a critical sector. Excellent professional development opportunities in a supportive and collaborative environment. Activity target driven role with a focus on engagement and education, not sales or regulated advice. **What's Next** Apply now by submitting your application or contact Aoife Lowe, 01 474 4643, alowe@sigmar.ie. to take your next career step. We welcome candidates seeking a rewarding and meaningful role in a unique, supportive environment.",https://www.linkedin.com/jobs/view/4408750889
Junior Recruitment Consultant - No Experience Required,Archer Recruitment,,linkedin,"* **Transparent promotion pathway — you control how fast you progress** * **Uncapped commission — your results determine your income** * **Industry\-leading training — equips you with elite\-level expertise** At Archer, advancement is earned. We run a performance\-led environment with clearly defined goals, open expectations, and progression driven by results, not tenure or office politics. Strong performance doesn’t go unnoticed here; it’s recognised quickly and rewarded with accelerated career growth. High performers earn 3 promotions in their first year! We specialise in developing ambitious professionals into Recruitment and Business Development experts. You’ll benefit from practical, one\-on\-one coaching, a clear and structured progression framework, and a commission structure with no ceiling, expanding as you progress. Our consultants build genuine market expertise, unlock significant earning potential, and move forward in their careers far faster than in most fields. **Why Join the Team?** * **Drive Growth:** Meet clients across the IT market and help power our expansion with outstanding service and results. * **Make an Impact:** Play a key role in shaping our success while fast\-tracking your own career. * **Level Up Fast:** Get expert training and mentorship to grow into a top performer and future leader. * **Earn Without Limits:** Benefit from a strong base salary plus uncapped commission that truly rewards high achievers. **Your day\-to\-day as a Recruitment Consultant:** * **Client Management:** Build and maintain strong relationships with clients from a varied range of industries. * **Candidate Sourcing:** Proactively source, screen, and qualify candidates for various roles within the IT sector. Utilise a variety of sourcing methods, including LinkedIn, networking, and database management. * **Market Insight:** Stay informed about the IT industry, including trends, challenges, and opportunities. Use this knowledge to inform recruitment strategies and provide insights to clients and candidates. **What You Will Have:** * 3\+ years of professional experience (any industry can be considered) \- No recruitment experience required * A proactive, ambitious mindset and the confidence to take ownership of your growth * Strong communication skills and a natural drive to succeed **Benefits \& Perks** * Basic Salary \+ Uncapped Commission \+Additional Bonus Structure (Average OTE: Year 1 €48k\+, Year 2 €69k\+, Year 3 €100k\+) * Internal Learning and development, helping support and train alongside the support of your manager * Clear path for progression: 13 promotions available all the way to Equity Partner \+ Leadership Academy programme for managers in the making * Sabbatical: Paid sabbatical every 3 years * Industry\-leading training programme with 150\+ training modules * Fantastic team culture, very collaborative and regular team socials **Turn ambition into reward** At Archer, performance drives growth and uncapped earnings. Apply today and start building the career you deserve. Contact Ciara O’Flynn at **ciara.oflynn@archer.ie** or **\+353 1 902 6804\.**",https://www.linkedin.com/jobs/view/4408505444
