title,company,location,site,description,job_url
2026 Software Dev Engineer Intern - Ireland,myGwork - LGBTQ+ Business Community,"Dublin, County Dublin, Ireland",linkedin,"**This job is with Amazon, an inclusive employer and a member of myGwork – the largest global platform for the LGBTQ\+ business community. Please do not contact the recruiter directly.** **Description** Do you want to solve real customer problems through innovative technology? Do you enjoy working on scalable services in a collaborative team environment? Do you want to see your code directly impact millions of customers worldwide? At Amazon, we hire the best minds in technology to innovate and build on behalf of our customers. Customer obsession is part of our company DNA, which has made us one of the world's most beloved brands. Our Software Development Engineer (SDE) interns use modern technology to solve complex problems while seeing their work's impact first\-hand. The challenges SDE interns solve at Amazon are meaningful and influence millions of customers, sellers, and products globally. We seek individuals passionate about creating new products, features, and services while managing ambiguity in an environment where development cycles are measured in weeks, not years. At Amazon, we believe in ownership at every level. As an SDE intern, you'll own the entire lifecycle of your code \- from design through deployment and ongoing operations. This ownership mindset, combined with our commitment to operational excellence, ensures we deliver the highest quality solutions for our customers. We're looking for curious minds who think big and want to define tomorrow's technology. At Amazon, you'll grow into the high impact engineer you know you can be, supported by a culture of learning and mentorship. Every day brings exciting new challenges and opportunities for personal growth. Amazon internships across all seasons are full\-time positions, and interns should expect to work in office, Monday\-Friday, up to 40 hours per week typically between 8am\-5pm. Specific team norms around working hours will be communicated by your manager. Interns should not have conflicts such as classes or other employment during the Amazon workday. Key job responsibilities * Collaborate and communicate effectively with experienced cross\-disciplinary Amazonians to design, build, and operate innovative products and services that delight our customers, while participating in technical discussions to drive solutions forward. * Design and develop scalable solutions using cloud\-native architectures and microservices in a large distributed computing environment. * Participate in code reviews and contribute to technical documentation. * Build and maintain resilient distributed systems that are scalable, fault\-tolerant, and cost\-effective. * Leverage and contribute to the development of GenAI and AI\-powered tools to enhance development productivity while staying current with emerging technologies. * Write clean, maintainable code following best practices and design patterns. * Demonstrate operational excellence through monitoring, troubleshooting, and resolving production issues. A day in the life As an intern, you will be matched to a manager and a mentor and will have the opportunity to influence the evolution of Amazon technology and lead critical projects early in your career. In addition to working on an impactful project, you will have the opportunity to engage with Amazonians for both personal and professional development, expand your network, and participate in activities with other interns throughout your internship. No matter the location of your internship, we give you the tools to own your project and learn in a real\-world setting. **About The Team** Intern Community: As an Amazon Intern, you'll be part of a vibrant, supportive community that empowers your growth and development. You'll collaborate with interns from around the world, networking and participating in social events to broaden your perspectives. You can also join specialized groups focused on areas like sustainability to explore your diverse interests. **Support** The internship program provides a robust support system, including weekly intern office hours, dedicated IT and HR support, and a program team committed to your success. This ensures you have the guidance and assistance needed to thrive. **Learning Sessions** Exclusive learning sessions will further enhance your skills, granting you access to Amazon's cutting\-edge learning platforms and the expertise of industry leaders. These structured development opportunities will prepare you for the next step in your career. **Opportunities** Upon successful completion of the internship, you may be considered for a graduate role or a second internship, allowing you to continue your journey with Amazon. Additionally, you'll enjoy a competitive monthly salary, relocation support, and access to a range of employee benefits. **Basic Qualifications** * Are enrolled in a Bachelor's degree or above in Computer Science, Computer Engineering, or related fields at time of application * Knowledge of programming languages such as C/C\+\+, Python, Java or Perl * Knowledge of computer science fundamentals such as object\-oriented design, operating systems, algorithms, data structures, and complexity analysis **Preferred Qualifications** * Experience from a technical internship * Experience with distributed, multi\-tiered systems, algorithms, and relational databases * Experience in optimization mathematics such as linear programming and nonlinear optimization * Ability to effectively articulate technical challenges and solutions * Adept at handling ambiguous or undefined problems as well as ability to think abstractly Amazon is an equal opportunities employer. We believe passionately that employing a diverse workforce is central to our success. We make recruiting decisions based on your experience and skills. We value your passion to discover, invent, simplify and build. Protecting your privacy and the security of your data is a longstanding top priority for Amazon. Please consult our Privacy Notice (https://www.amazon.jobs/en/privacy\_page) to know more about how we collect, use and transfer the personal data of our candidates. Amazon is an equal opportunity employer and does not discriminate on the basis of protected veteran status, disability, or other legally protected status. Our inclusive culture empowers Amazonians to deliver the best results for our customers. If you have a disability and need a workplace accommodation or adjustment during the application and hiring process, including support for the interview or onboarding process, please visit https://amazon.jobs/content/en/how\-we\-hire/accommodations for more information. If the country/region you're applying in isn't listed, please contact your Recruiting Partner.]]\>",https://www.linkedin.com/jobs/view/4396270015
ASPIRE Global Service Centre – Onsite Support Analyst,Version 1,"Dublin, County Dublin, Ireland",linkedin,"**Company Description** Version 1 is a true global leader in business transformation. For nearly three decades, we have been strategically partnering with customers to go beyond expectations through the power of cutting\-edge technology and expert teams. Our deep expertise in cloud, data and AI, application modernisation, and service delivery management has redefined businesses globally, helping shape the future for large public sector organisations and major global and private brands. We put users and user\-centric design at the heart of everything we do, enabling our customers to exceed expectations for their customers. Our approach is underpinned by the Version 1 Strength in Balance model – a balanced focus across our customers, our people and a strong organisation. This model is guided by core values that are embedded in every aspect of what we do. Our customers’ need for transformation is our driving force. We enable them to accelerate their journey to their digital future with our deep expertise and innovative approach. Our global technology partners – Oracle, Microsoft, AWS, Red Hat, and Snowflake – help us tackle any challenge by leveraging a technology\-driven approach. Our people unlock our potential. They immerse themselves into the world of our customers to truly understand the unique challenges they face. Our teams, made up of highly skilled, passionate individuals, act with agility and integrity. We continually invest in their development and foster a culture that encourages collaboration and innovation. This is a reflection of our Strength in Balance model, which emphasises a balanced focus on our customers, our people, and a strong organisation. Through our comprehensive range of Managed Service offerings, we take ownership of the tasks that distract Customers from what really matters; driving their business objectives and strategic initiatives. We enable them to save time, and reduce costs and risk, by continually improving your technology estates, ensuring they drive value for their business. Go beyond simply ‘keeping the lights on’ and embrace the potential of our ASPIRE Managed Services that place AI, continuous improvement and business innovation at the heart of everything we do. From operational maintenance through to optimisation, we are trusted managed service experts with a sustainable, value\-led approach and a wealth of industry sector expertise and experience. **Job Description** * Onsite rotational role, Dublin, ROI * Full time position – 08:00hrs to 18:00hrs working days except ROI Bank Holidays. Covering early and late support hours on local rota. Working from Home or Version 1 office when not on Customer site. * Department: ASPIRE Managed Services * Practice: Services Reliability Group **Role Summary** Our ASPIRE Global Service Centre is the central hub of our Service Management operations. Beyond a traditional Service Desk, it stands as the central authority and shared service delivery hub, orchestrating all operational workflows, processes, procedures, and tooling. It’s a core delivery component of the Version 1 ASPIRE Managed Services offering that places AI, continuous improvement and business innovation at the heart of everything Version 1 does. With a focus on supporting self\-service and automation, we utilise the best digital capabilities of the ServiceNow ITSM tooling product to provide the very best experience to our customers. We are looking for a skilled and results\-oriented Onsite Support Analyst based in Dublin, Republic of Ireland. In this role, you will serve as the primary point of contact for local technical support at our organisation's customer sites. Your responsibilities will include delivering prompt and professional assistance to resolve IT\-related challenges, enabling your colleagues and customers to remain productive and achieve their goals. With a strong focus on delivering exceptional customer service, you will apply your technical expertise to ensure a dependable IT infrastructure. Whether addressing first\-level issues, escalating complex problems, or performing maintenance tasks, you will be dedicated to maintaining an efficient and seamless IT environment. The ideal candidate will play a pivotal role in resolving advanced technical issues, including Microsoft 365 and Windows operating systems environments whilst being proficient in security practices (i.e. MFA) MacOS, mobile device management and remote support tools. This position requires outstanding problem\-solving abilities, onsite presence and customer empathy whilst being able to handle escalations and calmly and professionally. **Key Responsibilities** * Serve as the first point of contact for technical support via phone, email, or chat. * Log and manage incidents, service requests, and queries in the ServiceNow ITSM or Customer systems. * Perform initial triage, diagnosis and troubleshooting for IT issues, including hardware, software, Audio Visual, and network problems. * Ensure timely resolution of incidents in line with Service Level Agreements (SLAs). * Maintain accurate documentation of incidents, resolutions, and troubleshooting steps. * Contribute to the development and maintenance of the IT knowledge base. * Deliver excellent customer service and build strong relationships with end\-users. * Handling escalations calmly \& professionally * Onsite presence \& demonstrating end user empathy * Provision of VIP / Executive support * Monitor system performance and identify potential issues proactively. * Conduct routine health checks of systems, applications, and networks to ensure optimal performance. * Monitor and manage system alerts to address potential issues before they escalate. * Set up and configure new laptops, mobile devices, and peripherals. * Liaise with 3rd party suppliers (i.e. Couriers, Vendors) * Manage user accounts, permissions, and access rights. * Install, update, and patch software applications according to company policy. * Maintain inventory of IT equipment and manage equipment lifecycle. * Perform scheduled maintenance, such as software updates, patch installations, and backups. * Support audio/visual equipment for meeting rooms and company events. * Collaborate with other IT teams to address complex or recurring problems / Escalation to L2/L3 support teams * Test business continuity measures, including disaster recovery plans, to ensure readiness. * Collaborate with other IT team members to ensure timely resolution of issues and continuous improvement of service delivery. * Participate in ongoing training and development to stay current with IT trends and technologies. * Package and deploy routine security updates. **Qualifications** **Skills, Education \& Qualifications:** * Minimum of 2\-5 years of experience in deskside support. * Strong customer service orientation with excellent communication skills. * Ability to explain technical concepts to non\-technical users. * Strong understanding of IT infrastructure, systems, and troubleshooting methodologies. * Experience with service desk management tools (e.g., ServiceNow). * Knowledge of ITIL frameworks and best practices; ITIL v4 certification preferred. * Strong communication, interpersonal, and problem\-solving abilities. * Customer\-focused mindset with a commitment to delivering high\-quality support. * Strategic thinking and decision\-making. * Ability to manage multiple priorities and meet deadlines. * Adaptability to evolving technologies and processes. * Proficiency in Microsoft Office 365 Support (M365 \& O365\) * Proficiency in Windows 10/11 Operating Systems and associated troubleshooting * Proficiency in MacOS troubleshooting and support * Security awareness and support (MFA, phishing) * Proficiency in server interaction (password resets, AD tasks) / Hardware troubleshooting skills. * Mobile Device management tools * Experience with remote support tools * Understanding and working knowledge of asset management tools * Understanding of basic networking concepts and associated troubleshooting (TCP/IP, DNS, DHCP) * Printer \& scanner troubleshooting * Knowledge of AWS and Azure fundamentals. * Proficiency in Azure Active Directory and Group Policy Support. * Ability to lift and transport equipment (logistics, i.e. installs, desk moves, hardware deployment) * Mobility to access various office areas, including under desks and in server/Comms rooms. * May require occasional after\-hours support for critical issues or scheduled maintenance. **Additional Information** At Version 1, we believe in providing our employees with a comprehensive benefits package that prioritises their well\-being, professional growth, and financial stability. One of our standout advantages is the ability to work with a hybrid schedule along with business travel, allowing our employees to strike a balance between work and life. We prioritise the health and safety of our employees, providing private medical and life insurance coverage, as well as free eye tests and contributions towards glasses. Our team members can also stay ahead of the curve with incentivized certifications and accreditations, including AWS, Microsoft, Oracle, and Red Hat. Our employee\-designed Profit Share scheme divides a portion of our company's profits each quarter amongst employees. We are dedicated to helping our employees reach their full potential, offering Pathways Career Development Quarterly, a programme designed to support professional growth.",https://www.linkedin.com/jobs/view/4381721706
Associate - Civil Engineering,CS CONSULTING,"Dublin, D, IE",indeed,"**Associate \- Civil Engineering** *Dublin City Centre \| Senior Leadership Role \| Strategic Impact* CS Consulting is seeking an experienced Associate \- Civil Engineering to join our Dublin\-based leadership team. This is a senior technical and managerial role, offering the opportunity to lead civil infrastructure delivery on high\-profile projects while contributing directly to the strategic growth of the business. **The Opportunity** As an Associate, you will take ownership of civil infrastructure design and delivery across a broad portfolio of projects. You’ll combine technical authority with commercial insight, managing projects from concept through construction and handover, while mentoring and developing engineers within the practice. You will be entrusted with decision\-making across design, programme delivery, cost control, and client management, representing CS Consulting at a senior professional level. This role is ideal for a technically strong, commercially aware engineer ready to step into a visible leadership position. **Upcoming Projects** You will work on a diverse range of technically challenging projects, including: * Large\-scale residential developments for the Land Development Agency (LDA) and Development Partners * High\-rise and low\-rise private residential projects nationwide * Refurbishment of historic structures for the OPW and other public/private clients * New\-build commercial offices and hotels * Fit\-out and refurbishment of commercial offices and hotels * Industrial and data centre projects **Key Responsibilities** * Lead the design and delivery of all civil infrastructure on significant projects * Provide technical and commercial leadership across project lifecycles, from early concept through construction * Collaborate closely with Directors, clients, and multidisciplinary design teams * Mentor, coach, and develop engineers within the practice * Ensure compliance with Irish standards, including Uisce Éireann publications, the Greater Dublin Regional Code of Practice for Drainage Works, and Local Authority guidelines * Manage interactions with Local Authorities, Statutory Bodies, and Utility Providers on behalf of clients * Oversee site delivery including BCAR inspections, submittals, RFI responses, snagging, and project closeout * Exercise independent professional judgement on complex technical and commercial matters * Manage project budgets, schedules, and client relationships **Candidate Profile** * Masters or Honours degree in Civil Engineering (or equivalent) * Chartered Engineer (Engineers Ireland and/or ICE) * Minimum 10 years’ post\-qualification experience in a consulting engineering environment * Proven leadership in delivering civil infrastructure across a broad range of project types * Strong conceptual, detailed design, and construction stage expertise * Excellent knowledge of the Irish planning system, typical planning reports, and statutory engagement * Proficiency in civil design software (InfoDrainage, Civil 3D, AutoCAD) and experience in coordinated BIM environments * High competence with Microsoft Office and project planning tools * Strong commercial awareness and experience managing project finances and client relationships * Excellent leadership, people management, and stakeholder engagement skills * Solutions\-focused, proactive, and adaptable mindset * Full Drivers Licence (desirable) **What We Offer** * Competitive base salary and defined bonus scheme * Generous annual leave allowance \+ company bonus day * Employer pension contribution * Opportunity to influence business strategy and direction * Exposure to high\-profile, technically diverse projects * Collaborative, forward\-thinking environment that invests in people, technology, and innovation * Genuine career progression opportunities and leadership development At CS Consulting, we value technical excellence, integrity, and collaboration. This is a chance to play a key role in shaping projects, teams, and the future of our business.",https://ie.indeed.com/viewjob?jk=3662a686bc9c96dc
Associate - Investment Funds,Robert Walters,"Dublin, County Dublin, Ireland",linkedin,"Associates \- Investment Management Group (Funds) A prestigious, top\-tier law firm is seeking talented and ambitious Associates to join their growing Investment Management Group (IMG). This firm is renowned for its world\-class legal expertise, collaborative culture, and commitment to delivering exceptional outcomes for clients in the investment management sector. The IMG team has experienced significant growth in recent years, advising some of the largest domestic and international investment managers. This is an exciting opportunity to work with industry leaders on high\-profile matters while advancing your career in a supportive and dynamic environment. **Key Responsibilities** As part of this leading funds team, you will: * Assist in the establishment of Irish fund structures across diverse investment strategies, including ETFs, UCITS, and Private Funds (e.g., PE, VC, real estate, infrastructure, credit/loan origination). * Advise on UCITS Management Company and Alternative Investment Fund Manager authorisations. * Provide regulatory support to clients engaged in asset management activities. **Experience, Knowledge \& Skills** The ideal candidate will: * Be qualified as a solicitor in Ireland, England and Wales, or another common law jurisdiction. * Have an excellent academic background. * Possess 1\-3 years of post\-qualification experience in establishing Irish fund structures. * Demonstrate strong written and verbal communication skills. * Exhibit exceptional attention to detail. * Be a proactive team player with a collaborative mindset. **What’s On Offer** This is an opportunity to join one of the most respected firms in the market, offering: * A competitive salary package. * Performance\-related bonus structure. * Comprehensive health insurance coverage. * Pension plan and life assurance/income protection cover. * Relocation assistance for candidates joining from overseas. * A vibrant workplace culture with an active sports and social club. If you are looking to take the next step in your career with a top\-tier law firm that values teamwork, innovation, and excellence, we’d love to hear from you! Robert Walters Operations Limited is an employment business and employment agency and welcomes applications from all candidates",https://www.linkedin.com/jobs/view/4395871044
