title,company,location,date_posted,description
Graduate Mechanical &#038; Electrical Engineer,Avonmore Electrical Co. Ltd,"Roskeen, County Cork, Ireland",2026-03-20,
"Hiring for 2026! Teach English Overseas with Full Training, Visa Sponsorship & Career Support",English 1,"County Limerick, Ireland",2026-03-20,
Hydrologist / Hydraulic Modeller,SLR Consulting,"Cork, County Cork, Ireland",2026-03-20,
Intermediate Quantity Surveyor - Cork,Cairn,"Cork, County Cork, Ireland",2026-03-20,
Intern SSG,Cadence,"Cork, County Cork, Ireland",2026-03-20,
MERCHANDISER - ROI,UK Greetings,"Dungarvan, WD, IE",2026-03-20,"LEARN MORE ABOUT US AND THE ROLE:**Location:** Dungarvan (X35 W935 and X35 N611\) **Hours:** 3 hours per week **Days:** Thursday or Friday **Benefits:** Holiday Entitlement, Merchandiser Recognition Programme, Employee Benefits Scheme, Expenses/Mileage/Travel Time where applicable As an inclusive employer Carlton Greetings are passionate about creating a workforce that represents the diversity of our communities and the customers we supply. We encourage candidates from all backgrounds to apply f..."
Project Engineering Summer Student,Sanofi,"County Waterford, Ireland",2026-03-20,
Project Manager,Coffey,"Cork, County Cork, Ireland",2026-03-20,
QC Micro Analyst - Shift,CareerWise Recruitment,"Cork, County Cork, Ireland",2026-03-20,
Reporting and Accounting Analyst,Uisce Éireann Irish Water,"Cork, County Cork, Ireland",2026-03-20,
Sales & Customer Service Graduate,Tricel,"Killarney, KY, IE",2026-03-20,"**Sales and Customer Service Graduate** Are you looking to kick\-start your career and gain valuable experience in a growing organisation? If so, we are looking for an ambitious graduate to join our Sales and Customer Service Team. We want to be part of your career journey and help you develop your career. As a Graduate in Tricel, we will welcome you onboard with immediate effect. At the end of your 2\-year Graduate Programme, you will have gained: International work experience, a qualification..."
Sales Associate,NEXT,"Cork, C, IE",2026-03-20,"**SHIFTS YOU ARE APPLYING FOR:** **37\.50hrs p/w; Mon 08:00 \- 16:30; Tue 08:00 \- 16:30; Wed 08:00 \- 16:30; Thu 08:00 \- 16:30; Fri 08:00 \- 16:30** **About the role** As a Sales Associate at Victoria’s Secret you’ll work in an exciting, engaging, fast\-paced environment, surrounded by a friendly and supportive team who are all connected through their passion for delivering the very best customer experience. No two days are ever the same, which is part of the fun, however we can give you an id..."
Sanctions analyst,TELUS Digital,"Cork, County Cork, Ireland",2026-03-20,
Senior Accountant,GPC Finance,"Cork, County Cork, Ireland",2026-03-20,
Senior Backend Cloud Engineer,Acuity Inc.,"Cork, C, IE",2026-03-20,"Acuity Inc. (NYSE: AYI) is a market\-leading industrial technology company. We use technology to solve problems in spaces, light and more things to come. Through our two business segments, Acuity Brands Lighting (ABL) and Acuity Intelligent Spaces (AIS), we design, manufacture, and bring to market products and services that make a valuable difference in people’s lives. We achieve growth through the development of innovative new products and services, including lighting, lighting controls, buildi..."
Senior Cybersecurity Engineer,Arctic Wolf,"Cork, County Cork, Ireland",2026-03-20,
Site Agent,Coffey,"Cork, County Cork, Ireland",2026-03-20,
Social and Activity Assistant - Dublin and Cork,Centre of English Studies (CES),"Cork, County Cork, Ireland",2026-03-20,
Software Quality Assurance Engineer Senior,Acuity Inc.,"Cork, C, IE",2026-03-20,"Acuity Inc. (NYSE: AYI) is a market\-leading industrial technology company. We use technology to solve problems in spaces, light and more things to come. Through our two business segments, Acuity Brands Lighting (ABL) and Acuity Intelligent Spaces (AIS), we design, manufacture, and bring to market products and services that make a valuable difference in people’s lives. We achieve growth through the development of innovative new products and services, including lighting, lighting controls, buildi..."
Specialist 2,PwC Ireland,"Bandon, County Cork, Ireland",2026-03-20,
Structural Engineer,MWP,"Cork, County Cork, Ireland",2026-03-20,
Team Leader,Rehab Group,"Bantry, C, IE",2026-03-20,"**The Rehab Group** We are an independent voluntary organisation providing services and support for people with disabilities and their families for more than 70 years. Our work positively impacts the lives of over 12,000 people with disabilities, equipping them with the confidence, skills, and self\-belief to achieve their expressed goals **We Welcome All Backgrounds and Abilities!** We are an inclusive employer and encourage applicants from diverse backgrounds, including those with different ab..."
Trainee Accountant,Xeinadin,"Cork, County Cork, Ireland",2026-03-20,
"Workplace Solutions - Sales Engineer, Associate",JPMorganChase,"Cork, C, IE",2026-03-20,"**JOB DESCRIPTION** **Sales Engineer** The Sales Engineer will play a key role in the Sales team, ensuring seamless coordination, effective support, high performance, and excellence in execution across the following key areas: **Requests for Proposal (RFP)** * Serve as the primary liaison between the RFP team and Sales team. * Review proposals to ensure accuracy and alignment with client needs. * Draft responses where specialized sales team knowledge is required. **Field Sales Support** * Delive..."
Senior Architectural Technologist,DPS Group Global,"Little Island, C, IE",2026-02-09,"Location: Cork, Little Island Employment Type: Full\-Time Reference Code: 314833 Date Posted: 09/Feb/2026 **Senior Architectural Technologist** **About Us** Arcadis is the world’s leading company in sustainable design, engineering, and consultancy for natural and built assets. With over 36,000 professionals in 70\+ countries, we are united in improving quality of life and solving the world’s most complex challenges. **Location/s**: Based in our Little Island, Cork offices. **Role description** S..."
HGV Apprentice Driver,Inver,"Cork, C, IE",2025-08-06,"### **Description** **Business Overview** Inver Energy (‘Inver’) has been supplying fuels across Ireland for almost 40 years. From our jointly owned terminal in Foynes, we offer a range of fuel products to industrial, commercial, agricultural, domestic, wholesale and retail customers. We also operate 115 service stations under the Inver and Amber brands along with 18 convenience stores. Superior customer service, competitive prices, quality fuels and supporting our local community is what drives..."
Sous Chef - The Bishop's Buttery - Cashel Palace Hotel,Relais & Châteaux,"Cashel, TA, IE",2024-06-07,"#### **Détail de l'offre** The Bishop’s Buttery is Cashel Palace’s Michelin\-starred fine dining restaurant, where creativity, precision, and passion come together. Our kitchen team pushes boundaries while celebrating the best of Irish produce — offering chefs the opportunity to grow, innovate, and be part of an award\-winning legacy. The Bishop's Buttery, located in the 5 Star Cashel Palace Hotel, is seeking a talented and ambitious Sous Chef to join our esteemed culinary team. This is an excep..."
