title,company,location,site,description,job_url
Quantity Surveyor,PJ Hegarty & Sons,"Dublin, County Dublin, Ireland",linkedin,"At PJ Hegarty \& Sons, we pride ourselves in a holistic approach to Quantity Surveying. Our responsibility is to manage the company’s financial interests in a manner as wide as is possible and simultaneously assist in project delivery to meet the Client’s vision for the project. These responsibilities include the management of costs and value and also the management of our contractual relationships with the Client and the supply chain. We are currently seeking experienced Quantity Surveyors in the Greater Dublin area. You will be responsible for the cost and value management of projects from mobilisation to the settlement of final accounts. **Overview** As a Quantity Surveyor in our team, you will have progressed from graduate level and will be focused upon becoming a Senior Surveyor. We have a progressive training programme focused upon your development and tailored to meet the requirements of the SCSI/RICS Assessment of Professional Competence. You will be given the tools to assist you manage a trainee or graduate quantity surveyor. You will also participate in departmental training and will be involved in receiving training from seniors and also giving training to juniors. Key Duties * Participate in procurement of specialist trades for the project and make appointment recommendations to the project director. * Assist in the drafting of subcontract Agreements. * Receive, assess, and settle subcontract interim valuations and final accounts. * Review developing design information and advise the wider project team of the cost implications in good time. * Identify and advise the wider project team of value engineering opportunities. * Complete monthly valuations for submission to the Employer’s Representative and agree said valuations. * Participate in the monthly internal cost reporting systems engaging in cost V value reconciliations, turnover reports, prelim cost reports and project outcome projections. * Be a key player in the preparation of the project final account submission to the Client. * Assist in the provision of proactive advice to the project director on matters of contract. * And most importantly Develop and maintain strong working relationships with the wider project team. **Skills/Experience Required** You will have * A level 8 degree in Quantity Surveying or above * 3\+ Years’ experience in a similar role * Good written and oral communication skills with emphasis on ability to provide and explain reports accurately. * A proven track record in dealing with Subcontractors and Clients. * Good problem\-solving skills. * A reasonable knowledge of current forms of Agreement for the industry * You will be\-Computer literate in Microsoft Office, and have some knowledge of Bluebeam, CostX, and Cubit (although training can be given in these) * Able to work well under pressure, on your own and also as part of a team. * Career driven, ambitious and enthusiastic with your eye on promotion to the role of a Senior Surveyor. Further Information At PJ Hegarty and Sons, we acknowledge that your career is a journey and dependent upon that career to date you may be stronger or indeed weaker in some areas. As indicated, we will tailor a training programme to meet any needs and actively encourage Continuous Professional Development. Diversity and Inclusion The Company is an Equal Opportunities employer and recognises its responsibility to provide equality of opportunity to employees and prospective employees. Our Aim is to ensure that no job applicant or employee receives less favourable treatment on the grounds of religious belief, political opinion, gender, marital status, civil status, sexual orientation, disability, race, age and membership of the Traveller community. The Company will not accept or tolerate any form of discrimination, direct or indirect, by any member of the Company. The Company is committed to the fair treatment of employees at all times.",https://www.linkedin.com/jobs/view/4337445971
Recently Qualified Accountant,GPC Finance,"Dublin, County Dublin, Ireland",linkedin,"An opportunity has opened for a Recently Qualified Accountant to join a medium sized accountancy practice based in Dublin. This role offers an excellent opportunity for career progression within a dynamic and growing practice. The successful Qualified Accountant will be expected to work within a diverse team and will help to mentor Junior Accountants. **Responsibilities** * Responsible for range of clients in SME sector with turnover ranging from 1m to 25m turnover. * Oversee and direct junior staff in accounts preparation. * Preparation of Cash Flow Projections and business plans as required by clients. * Dealing with Clients on diverse range of issues in relation to the day to day running of their businesses. **Requirements** * The accountant will be **Fully Qualified ACA/ACCA/CTA** * Excellent communication skills and confident conversing with Clients and stakeholders, through all mediums. * Minimum 2 years’ experience in an Irish practice environment. * Previous tax and accounts preparation experience **Benefits** * **€50,000 \- €65,000 DOE** * Friendly culture. * Clear progression pathway. * Hybrid work model. * Flexible hours. * Paid CPD obligations. * Target based performance bonus. * Free parking * Social events * Wellness initiatives * Early Friday finish during Summer If you are a Recently Qualified Accountant looking for a new opportunity, please contact Andrew Hendrickx for more information. We do not send out your cv without your permission.",https://www.linkedin.com/jobs/view/4404684258
Receptionist,St John of God University Hospital,"Dublin, County Dublin, Ireland",linkedin,"**Receptionist – Permanent, Part\-time** Part\-time – evenings, weekends, bank holidays with flexibility to cover day shifts as and when required **Responsibilities:** * Operation of the hospital’s switchboard with efficiency and courtesy at all times. * Be responsible for all aspects of the work involved in the reception area. * Manage patient, staff, family and visitor interactions with empathy and excellent communication skills * Mange and sort internal/ external post daily. * Communicate relevant information to the wider hospital when appropriate, eg. on call rotas. * Manage the ordering and logging of taxis. * Send SMS reminders to patients for upcoming appointments. * Coordinate visitor sign ins with the security team. * Coordinate walk\-in assessments and admissions with the appropriate staff, ensuring accurate record keeping and electronic records and kept up to date. * Complete complaints / adverse incident reports where necessary on the appropriate IT system. * Update, manage and distribute the hospital’s telephone listings. * Observe the reception area and report entry of any unauthorised persons to the security team and Head of Operations when necessary. * Assist with the issuing and collection of bleeps * Support other staff with the operation of ICT equipment ad software available at reception, eg. fax machine, binding machine, photocopier. * Participate in all staff development and in\-service training relevant to the post as may be organised by the hospital * Provide administrative support for any other team within the administrative department as directed by the Administrative Coordinator or a person designated by him/her. * Be actively involved in future service developments within the hospital. * To be fully familiar with the terms of the Safety, Health and Welfare at Work Act and all relevant policy documents of the organisation; i.e. Employee Handbook, Safety Statement, Guidelines for Investigation of Allegations of Non\-Accidental Injury and Safeguarding of Vulnerable Adults and Vulnerable Adolescents. * To be fully familiar with the policies, procedures, protocols and guidelines relevant to the reception area and to be fully compliant with same. * To respect and operate within the framework of the tradition, character and Ethos which govern the work of the Hospital. * To ensure that all departmental reports and Centre records are confidential to the service at Saint John of God Hospital and to maintain confidentiality in respect of matters which come to your knowledge in the course of your official duties. * Demonstrate flexibility in performing your duties and if necessary to work outside the standard working hours should the business need arise. * Assist with data entry projects or administrative work as assigned by the Administrative Coordinator or a person designated by him/her. * Perform any other duties as may be reasonably required. **Qualifications:** * Leaving Certificate or FETAC Level 5 or equivalent required as a minimum * Minimum 2 years’ experience in a similar role * Excellent IT skills \- Microsoft 365 and Microsoft Office Suite * Display excellent customer care skills and empathy",https://www.linkedin.com/jobs/view/4405977939
Receptionist – Front of House - Dun Laoghaire,Truly,"Dublin, County Dublin, Ireland",linkedin,"**Who We Are** Truly Dental is a growing network of modern, state\-of\-the\-art dental practices across Ireland. With a strong focus on patient care, innovation, and community, we create a welcoming environment where both patients and staff feel supported. Our Dunlaoghaire clinic is part of this vision, bringing high\-quality dental services to the local community. **Fast Facts** * 14\+ clinics operating across Ireland * Serving thousands of patients each year with comprehensive dental care * Strong emphasis on career progression for our staff, from entry\-level roles to management positions **Purpose of the Vacancy** We are seeking a **Front of House Receptionist** to join our Dunlaoghaire team. This role is essential to ensuring a smooth patient experience by welcoming visitors, managing appointments, and supporting the clinic's busy operations. **Key Responsibilities** * Greet and welcome patients in a professional and friendly manner * Manage multiline phone system and respond to inquiries * Schedule and confirm appointments efficiently * Prepare patient charts and update records in a timely manner * Handle billing statements and process payments * Support clinic staff with administrative needs * Maintain a welcoming and organized reception area **Requirements: Skills \& Competencies** **Education** * High school diploma or equivalent required * Administrative or medical administration training is a plus **Experience** * Previous front desk or receptionist experience (preferably in a medical or dental environment) * Experience in customerfacing roles with high service standards **Knowledge \& Skills** * Strong command of Microsoft Office (Word, Excel, Outlook) * Excellent written and verbal communication in English * Ability to multitask in a fastpaced environment * Confident, assertive, and able to handle challenging situations with patients **Core Competencies** * Multitasking and organizational skills * Strong interpersonal communication * Resilience and ability to stand firm with demanding clients * Teamoriented with a proactive attitude **What We Offer** * Competitive hourly rate * Training provided on all internal systems and processes * Clear career progression pathways (Front of House Supervisor, Assistant Practice Manager, Practice Manager) * Supportive, friendly work environment with opportunities to grow within Truly Dental **Key Details before Applying** * Full time role * Schedule includes weekends and evening shifts * Fluent, confident English communication is a must (native or nearnative level)",https://www.linkedin.com/jobs/view/4406258479
Receptionist – Front of House - Dun Laoghaire,Truly Dental,"Dublin, D, IE",indeed,"### **Who we are** Truly Dental is a growing network of modern, state\-of\-the\-art dental practices across Ireland. With a strong focus on patient care, innovation, and community, we create a welcoming environment where both patients and staff feel supported. Our Dunlaoghaire clinic is part of this vision, bringing high\-quality dental services to the local community. ### **Fast Facts** * 14\+ clinics operating across Ireland * Serving thousands of patients each year with comprehensive dental care * Strong emphasis on career progression for our staff, from entry\-level roles to management positions ### **Purpose of the Vacancy** We are seeking a **Front of House Receptionist** to join our Dunlaoghaire team. This role is essential to ensuring a smooth patient experience by welcoming visitors, managing appointments, and supporting the clinic's busy operations. ### **Key Responsibilities** * Greet and welcome patients in a professional and friendly manner * Manage multiline phone system and respond to inquiries * Schedule and confirm appointments efficiently * Prepare patient charts and update records in a timely manner * Handle billing statements and process payments * Support clinic staff with administrative needs * Maintain a welcoming and organized reception area ### **Requirements: Skills \& Competencies** **Education** * High school diploma or equivalent required * Administrative or medical administration training is a plus **Experience** * Previous front desk or receptionist experience (preferably in a medical or dental environment) * Experience in customerfacing roles with high service standards **Knowledge \& Skills** * Strong command of Microsoft Office (Word, Excel, Outlook) * Excellent written and verbal communication in *English* * Ability to multitask in a fastpaced environment * Confident, assertive, and able to handle challenging situations with patients **Core Competencies** * Multitasking and organizational skills * Strong interpersonal communication * Resilience and ability to stand firm with demanding clients * Teamoriented with a proactive attitude ### **What we offer** * Competitive hourly rate * Training provided on all internal systems and processes * Clear career progression pathways (Front of House Supervisor, Assistant Practice Manager, Practice Manager) * Supportive, friendly work environment with opportunities to grow within Truly Dental ### **Key Details before Applying** * Full time role * Schedule includes weekends and evening shifts * Fluent, confident English communication is a must *(native or nearnative level)*",https://ie.indeed.com/viewjob?jk=9b0de153191fa648
Regulatory Reporting Analyst,Monzo Bank,"Dublin, County Dublin, Ireland",linkedin,"***🚀 We’re on a mission to make money work for everyone.*** We’re waving goodbye to the complicated and confusing ways of traditional banking. After starting as a prepaid card, our product offering has grown a lot in the last 10 years in the UK. As well as personal and business bank accounts, we offer joint accounts, accounts for 16\-17 year olds, a free kids account and credit cards in the UK, with more exciting things to come beyond. Our UK customers can also save, invest and combine their pensions with us. With our hot coral cards and get\-paid\-early feature, combined with financial education on social media and our award winning customer service, we have a long history of creating magical moments for our customers! We’re not about selling products \- we want to solve problems and change lives through Monzo ❤️ 📍Dublin \| 💰€45,000 \- €55,000 \+ incentive awards tied to your performance➕ benefits \| Hear from the team ✨ **⭐Our Finance team** Our Finance team is growing and we’re looking for a curious, adaptive and data\-focused Regulatory Reporting Analyst with a strong attention to detail to join our regulatory reporting team at Monzo EU (Ireland). The team is responsible for understanding our prudential regulatory reporting requirements, working on projects to set up and submit these and collaborating with teams across the Group. **🔑You’ll play a key role by...** * Setting up and operating processes to produce timely, accurate and complete regulatory reporting and Pillar 3 disclosures for Monzo’s regulators (and the associated management information required for sign\-off) e.g. Central Bank of Ireland * Understanding, reviewing and documenting the applicable regulatory interpretations, such as the Capital Requirements Regulations (CRR) and Basel 3\.1 * Designing and implementing controls to ensure regulatory reporting is timely, accurate and complete and that regulatory compliance is maintained * Facilitating appropriate governance over regulatory reporting and ensuring compliance with the applicable control framework * Implementation and testing (UAT) of new releases of the Bank’s automated regulatory reporting tool * Partnering with teams internally to help them make informed business decisions and providing regulatory reporting input into new product launches * Ensuring any regulatory reporting you’re responsible for runs like clockwork, including leveraging data visualisation tools to build dashboards and facilitate useful insights * Designing brilliant ways to automate your work and leverage technology to ensure we scale with the business **🤩We’d love to hear from you if…** * You’re a qualified or part qualified accountant with experience working within financial services. * You have previous knowledge of regulatory reporting, such as capital reporting (COREP), liquidity reporting (e.g. LCR) or financial reporting (FINREP) * You’re excited by data and have a sharp eye for detail, with amazing Excel or GSheets skills * You have experience with some coding languages like SQL would be a bonus, although a willingness to learn is just fine * You have a proven record of implementing processes to deliver to non\-negotiable, regulatory deadlines * You have experience in the large\-scale implementation and testing (UAT) of automated reporting solutions * You want to automate or enhance recurring processes, particularly by leveraging technology, but know how to balance this with getting the actual reports out! * You have an open mind, enjoy transparency and think outside the box * What we’re doing at Monzo excites you! Not ticking every box? That’s totally okay! Studies show that women and people of colour might hesitate to apply unless they meet every single requirement. At Monzo, we’re dedicated to creating a diverse and welcoming team. If you’re passionate about this role and keen to learn and grow with us, we encourage you to apply— even if you don’t have everything thats listed just yet. Drop us your application, we’d love to hear from you! **🙌What’s In It For You** 💰€45,000 \- €55,000 ➕ incentive awards tied to your performance. ⏰We offer flexible working hours and trust you to work enough hours to do your job well, and at times that suit you and your team. 🏝 Annual Leave \- 34 days including public holidays (24 holiday days \+ 10 public holidays) 📚€1,200 learning budget each year to use on books, training courses and conferences. 🏥Private healthcare scheme 💰Pension scheme: the minimum contribution is 4% and Monzo matches any additional contributions that you make up to a maximum of 6% 💛Wellbeing benefits: financial education, women’s and men’s health support, mental health benefits, including coaching and counselling **🌈 The application journey has 4 key steps** * An introductory call with a Monzo Recruiter * An initial call with the hiring manager * A series of technical and behavioural interviews This process should take around 2\-3 weeks \- your schedule is really important to us, so we promise to be as flexible as possible! We have some guidelines on using Artificial Intelligence (AI) to ace an application and interview at Monzo. You can read them here. We’ll only close this role once we have enough applications for the next stage. Please submit your application as soon as possible to make sure you don’t miss out. If you're successful in applying for this role, we'll work with you to find a start date. In some cases, there might be a delay in when you can be released from your current role so that we can make sure things continue to run smoothly. We’ll be sure to communicate this with you and keep you updated. S1 **Equal opportunities for everyone** Diversity and inclusion are a priority for us and we’re making sure we have lots of support for all of our people to grow at Monzo. At Monzo, we’re embracing diversity by fostering an inclusive environment for all people to do the best work of their lives with us. This is integral to our mission of making money work for everyone. You can read more in our blog, 2024 Diversity and Inclusion Report and 2024 Gender Pay Gap Report. We’re an equal opportunity employer. All applicants will be considered for employment without attention to age, ethnicity, religion, sex, sexual orientation, gender identity, family or parental status, national origin, or veteran, neurodiversity or disability status. If you have a preferred name, please use it to apply. We don't need full or birth names at application stage 😊",https://www.linkedin.com/jobs/view/4406215620
Release Engineer,Air Apps,"Dublin, County Dublin, Ireland",linkedin,"**About Air Apps** At Air Apps, we believe in thinking bigger—and moving faster. We’re a family\-founded company on a mission to create the world’s first AI\-powered Personal \& Entrepreneurial Resource Planner (PRP), and we need your passion and ambition to help us change how people plan, work, and live. Born in Lisbon, Portugal in 2018—and now with offices in both Lisbon and San Francisco—we’ve remained self\-funded while reaching over 100 million downloads worldwide. Our long\-term focus drives us to challenge the status quo every day, pushing the boundaries of AI\-driven solutions that truly make a difference. Here, you’ll be a creative force, shaping products that empower people across the globe. Join us on this journey to redefine resource management—and change lives along the way. ****The Role**** As a **Release Engineer** at Air Apps, you will be responsible for ensuring the **smooth, reliable, and efficient release process** of our applications. You will oversee **versioning, build management, and deployment workflows** , ensuring that new features and updates are delivered seamlessly to users. Your role will involve **collaborating with development, QA, DevOps, and product teams** to streamline and automate release cycles, reduce risks, and maintain high standards for software delivery. * This is a fully onsite position, based at our office in Lisbon, where you will collaborate closely with cross\-functional teams in person and contribute to a dynamic and fast\-paced environment. We are open to support with relocation efforts. **Responsibilities** * Manage and optimize release pipelines to ensure smooth deployment of software updates. * Define and maintain versioning strategies, ensuring consistency across multiple environments. * Coordinate with engineering, QA, and DevOps teams to ensure timely and stable releases. * Automate and improve build, release, and deployment processes for efficiency and reliability. * Monitor and troubleshoot release\-related issues, ensuring minimal downtime. * Maintain documentation for release workflows, rollback plans, and deployment strategies. * Ensure compliance with security, performance, and quality standards in all releases. * Work with CI/CD tools (e.g., Jenkins, GitHub Actions, GitLab CI, CircleCI) to manage automated releases. * Implement and maintain feature flagging strategies to enable controlled rollouts. * Analyze release performance and drive continuous improvements in deployment processes. **Requirements** * Around 3\+ years of experience in release engineering, DevOps, or build/release management. * Experience with CI/CD tools (Jenkins, GitHub Actions, GitLab CI, CircleCI, ArgoCD). * Strong understanding of version control systems (Git) and branching strategies (GitFlow, trunk\-based development). * Experience with containerization (Docker, Kubernetes) and cloud environments (AWS, Azure, GCP). * Knowledge of scripting languages (Bash, Python, or PowerShell) for automation. * Familiarity with build systems for mobile and web applications (Xcode, Gradle, Webpack). * Strong troubleshooting skills and ability to quickly resolve build or deployment issues. * Understanding of release risk assessment and rollback strategies. * Experience working in an agile development environment with fast\-paced release cycles. * Excellent collaboration and communication skills to coordinate across teams. ****What benefits are we offering?**** * Apple hardware ecosystem for work. * Annual Bonus * Top\-tier Health and Life Insurance for peace of mind. * Transportation Budget to support your commute needs. * Coverflex benefits package for meal allowances, well\-being, and more. * Childcare support. * Air Conference \- an opportunity to meet the team, collaborate, and grow together. * Pension Fund to support your long\-term financial planning. * Urban Sports Club membership to keep you active. * Meals 100% free at the hub. ****Diversity \& Inclusion**** At Air Apps, we are committed to fostering a diverse, inclusive, and equitable workplace. We enthusiastically welcome applicants from all backgrounds, experiences, and perspectives. We celebrate diversity in all its forms and believe that varied voices and experiences make us stronger. ****Application Disclaimer**** At Air Apps, we value transparency and integrity in our hiring process. Applicants must submit their own work without any AI\-generated assistance. Any use of AI in application materials, assessments, or interviews will result in disqualification. Compensation Range: €54K \- €67K",https://www.linkedin.com/jobs/view/4405168869
