title,company,location,site,description,job_url
Project Engineer,RoviSys,"Dublin, County Dublin, Ireland",linkedin,"**Overview** **About RoviSys:** RoviSys is an independent system integrator with year\-over\-year growth in Ireland, Europe, and world\-wide. RoviSys provides a variety of information and automation services in many industries globally. RoviSys Ireland formed in 2022, with the Dublin Office open in May 2024\. Dublin is part of RoviSys Europe group and currently operates closely with our European HQ located in Utrecht in The Nederland’s. Manufactures and systems we are currently working on in Ireland are including but not limited to Emerson DeltaV, Rockwell, Siemens PCS7 and S7, Schneider, Honeywell IQSET and Trend PLCs. SCADA include, Ignition, Aveva, AVEVA PI, IQ Vision, Cimplicity, and iFIX. **About The Opportunity** Project Engineers are responsible for leading engineering teams that design and implement customer automation projects. Project engineers take a comprehensive approach to solving problems, learning the details of each project’s mechanical, electrical, and software systems. **Responsibilities** **Software Design \& Development:** * Leading design and develop control system software for PLCs, DCS, SCADA, MES and historian platforms. * Create and maintain detailed design documentation to support system architecture and functionality. * Assists Project Manager in identifying changes in project scope and developing change orders * Serves as a technical contact for customers **Hardware Design \& Testing** * Design electrical control panels and oversee their testing to ensure compliance with specifications and safety standards. **Project Execution \& Validation** * Lead and conduct Factory Acceptance Testing to validate system performance prior to deployment. * Lead site commissioning activities for both hardware and software components. * Perform Site Acceptance Testing to confirm system functionality in the live environment. * On site commissioning A Project Engineer will typically work in a project team of 2 – 20 and will be expected to work closely with the project manager. Site location can vary, currently are in Ireland, Netherlands, Germany, UK, Spain, Nordic’s and more across the EU. As RoviSys operates a platform\-independent model, we engage with a wide variety of industrial systems. This creates a unique opportunity to work in a diverse and fast\-paced environment where continuous development and growth are part of everyday work. **Qualifications** * Bachelor of Science (Level 8\) in Engineering, Engineering Technology, Computer Science or and equivalent qualification. * 5\+ years of experience in automation * Eligible to work and travel in Ireland and Europe without sponsorship. * Full Irish Drivers License * Attend the Dublin Office on a daily basis * Strong background in industrial automation and control systems. * Hands\-on experience with PLC/DCS programming and SCADA configuration. * Familiarity with validation protocols and quality standards in regulated industries. * Experience in leading a team of engineers in a project environment * Excellent problem\-solving ability * Strong communication skills. * As a minimum, you must be proficient on one or more of the following platforms: + Rockwell ControlLogix/CompactLogix, PlantPAx, or FactoryTalk + Emerson DeltaV + Schneider Electric Modicon PLCs, EcoStruxure, PowerSCADA, Power Monitoring Expert (PME) + Siemens S7, PCS7, or WinCC + Ignition + Or similar IT, automation, or MES platform Open to travel is a must.",https://www.linkedin.com/jobs/view/4380504270
Project Engineer (MES),Horizon Controls Group,"Swords, County Dublin, Ireland",linkedin,"We are seeking a highly capable **Project Engineer with a strong MES focus** , specializing in **Werum PAS\-X** , to support the delivery of digital manufacturing and operational excellence initiatives for a pharmaceutical client. This role will play a key part in the implementation, enhancement, and lifecycle management of **Manufacturing Execution Systems (MES)** across GMP\-regulated production environments. The successful candidate will bring proven experience in **PAS\-X design, recipe modeling, electronic batch record (EBR) deployment, system integration, and project execution** , working closely with manufacturing, automation, validation, IT, and quality teams. Key Responsibilities * Lead or support the delivery of MES projects with a primary focus on Werum PAS\-X. * Translate process and manufacturing requirements into: + MES functional specifications + Master batch records + Electronic workflows + Materials and equipment models + Exception handling logic * Configure and support PAS\-X modules including: + Electronic Batch Recording (EBR) + MBR design + Weigh \& Dispense + Materials Management + Review by Exception * Collaborate with process SMEs, operations, QA, and IT to optimize digital batch execution. * Manage project activities including: + Scope definition + Schedule tracking + Vendor coordination + Risk management + Change control + Stakeholder reporting * Support system integration with: + DeltaV / DCS + PLCs + LIMS + ERP / SAP + Historians + Serialization systems * Coordinate FAT, SAT, UAT, and go\-live readiness activities. * Support CSV, IQ/OQ, and validation documentation in line with GAMP 5\. * Troubleshoot MES issues during deployment, hypercare, and steady\-state operations. * Drive continuous improvement initiatives to improve batch release time, right\-first\-time performance, and data integrity. **Required Qualifications** * Bachelor’s degree in Engineering, Computer Science, Biotechnology, Pharmaceutical Technology, or related discipline. * 5\+ years of project engineering or MES delivery experience within pharmaceutical, biotech, or life sciences manufacturing. * Strong hands\-on experience with Werum PAS\-X / Körber PAS\-X. * Proven expertise in: + Electronic Batch Records + Recipe / workflow design + GMP manufacturing processes + Master data modeling + Exception management * Experience managing project timelines, deliverables, and cross\-functional stakeholders. * Strong knowledge of: + GAMP 5 + 21 CFR Part 11 + Annex 11 + Data integrity principles * Excellent documentation, communication, and problem\-solving skills. **Preferred Experience** * Experience in biologics, sterile fill\-finish, vaccine, or API manufacturing. * Exposure to PAS\-X rollouts, site expansions, or global template deployments. * Familiarity with DeltaV, Syncade, SAP, PI Historian, LIMS, and SCADA integrations. * Experience with recipe standardization and multi\-site MES harmonization. * Knowledge of ISA\-88 / ISA\-95 concepts. * Previous capital project or digital transformation program experience. Key Competencies * MES project delivery * Werum PAS\-X expertise * EBR optimization * Stakeholder management * GMP compliance mindset * Cross\-functional collaboration * Risk and issue management * Continuous improvement",https://www.linkedin.com/jobs/view/4402119324
Project Engineer - Capital Maintenance,Celtic Anglian Water Ltd.,"Ringsend, D, IE",indeed,"The main duties and responsibilities will be to provide project engineering management, tendering and technical input to the design and operational costing of water and wastewater schemes. This will include working with multi\-disciplinary teams of civil, mechanical, process and electrical/ICA engineers/ contractors. Majority of works will be delivered in brown fields and will require significant coordination and communication with operations, detail planning and in time execution within budget. **Responsibilities** * production of documentation, including reports, drawings, calculations, specifications, tender documentation including particular specifications. * production of project budgets and resource loaded detailed work programmes. * co\-ordinating with PSCS, PSDP, Client, Operations and other stakeholders. * providing technical advice and guidance. * providing input to bids and project manage appropriate projects. * supervision \& management of contractors. * responding to Client requests for information. * Preparation and/or review RAMS * Identify interfaces with operations, impacts, consequence, work\-arpunds and plan, execute operations dependent tasks within the suitable window * Support maintenance by managing SLAs and contractors * Identify and prioritise capital maintenance projects based on equipment/process condition and criticality **Skills** * Effective leadership, interpersonal and communication skills. * The ability to command respect and to create a sense of community amongst the members of the project teams. * Good knowledge of techniques for planning, monitoring and controlling projects. * Sufficient seniority and credibility to advise project teams on their projects. * The ability to find ways of solving or pre\-empting problems. * Ability risk assess equipment and criticality * have experience of design at all levels from feasibility to a ""for construction"" level. * have considerable technical knowledge of all aspects of design as it impacts technical, budgetary and programme issues. * have good communication skills, be computer literate and hold a valid driving licence. * be able to interact positively with senior and junior staff alike. * be progressive and imaginative in their work and strive to add value where possible for the benefit of the company and our clients. * PRINCE2 or PMP qualification or experience in a PRINCE2/PMP structured projects is preferred ‍ ‍ Join the team Employee benefits include: * Competitive annual leave entitlement * Generous pension scheme * Health and Wellbeing initiatives * Professional development support",https://ie.indeed.com/viewjob?jk=ae46c2fc6b060bbc
Project Quantity Surveyor,GEDON™ | Commercial & Executive Search for the Built Environment,"Dublin, County Dublin, Ireland",linkedin,"**ABOUT THE BUSINESS** Our client is a well\-established specialist subcontractor operating across the glazing and façade sector, with a strong presence in the Irish construction market. With a portfolio that spans bespoke residential developments, large\-scale mixed\-use commercial schemes and complex healthcare facilities, this is a business that consistently delivers technically challenging work to the highest standard. Having built a strong reputation for quality and reliability over many years, the company has developed long\-standing relationships with leading main contractors, developers and end clients across Ireland. Their ability to manage technically intricate packages — from design coordination through to installation — has made them a trusted name across multiple sectors. The business is in a strong period of growth, supported by an active pipeline of projects and a robust order book. As a result, there is a deliberate focus on strengthening the commercial team to support continued delivery and position the business well for future opportunities. This is an excellent time to join a company with clear ambition and the infrastructure to support professional development. **WORKING ENVIRONMENT \& PROJECT EXPOSURE** You will be based in the company's Dublin office, working alongside an experienced commercial and project delivery team. The business operates with a dedicated site team who manage all on\-site activities, meaning your focus will be on the commercial and contractual management of projects from the office environment — providing a structured and professional working setting. The projects you will work across are varied and technically interesting, ranging from bespoke high\-end residential schemes through to large\-scale mixed\-use commercial developments and healthcare facilities. Contract values typically run up to €5 million per package, offering the opportunity to manage meaningful projects with real commercial substance at each stage of delivery. The team culture is collaborative and professional, with experienced senior staff available to provide guidance and mentorship. You will gain strong exposure to the full commercial lifecycle of specialist subcontract packages, working closely with estimating, project management and procurement functions throughout the process. **KEY RESPONSIBILITIES** * Manage the full commercial lifecycle of specialist façade and glazing packages from award through to final account * Prepare and submit interim valuations, variations and claims in line with contract requirements * Identify, value and negotiate contract variations and ensure accurate change management records are maintained * Liaise with main contractors and clients on all commercial and contractual matters throughout the project * Monitor project costs and budgets, providing regular commercial reporting to the senior team * Support procurement activities including package letting and subcontractor management * Assist in the preparation of final accounts and ensure timely resolution of outstanding commercial matters **WHAT YOU NEED** * A degree in Quantity Surveying or a closely related construction discipline is essential * 2–4 years of post\-graduate commercial experience within the construction or specialist subcontract sector * Previous experience working for a subcontractor or specialist trade contractor is desirable * A solid understanding of contract administration, variations and valuation processes * Strong communication and negotiation skills with the ability to manage client and contractor relationships professionally * Well\-organised, commercially aware and able to manage multiple projects simultaneously * Proficiency in standard QS software and Microsoft Office suite **WHAT YOU'LL GET IN RETURN** This role offers a salary of up to €80,000 depending on experience, alongside a performance\-related bonus, company pension and a flexible work\-from\-home arrangement available following a 12\-month review period. You will be joining a business that is actively growing its Dublin operation, with a clear opportunity to progress your career within a strong and well\-resourced commercial team. The variety of project types on offer — across residential, commercial and healthcare — ensures a genuinely well\-rounded experience and a platform to develop your expertise at pace. **HOW TO APPLY** To apply for this role, please send an up\-to\-date CV via the Apply Now button. For a confidential discussion, you can also contact **Finn Davey** on **\+353 1 270 9457** or email **finn@gedonexecutive.com** .",https://www.linkedin.com/jobs/view/4402947861
Python Developer,Randstad Digital,"Dublin, County Dublin, Ireland",linkedin,"Python \& Generative AI Developer **Location:** Dublin and Belfast (Hybrid \- 3 days on\-site) **Role Type:** Permanent / Full\-Time **Experience:** 6–10 years **Role Overview** We are seeking a highly skilled **Python \& AI Developer** to join our team in Dublin. This role focuses on the end\-to\-end development, deployment, and scaling of advanced Generative AI and Machine Learning solutions within an enterprise environment. **Key Responsibilities** * **AI/ML Development:** Build, tune, and deploy LLM\-based applications using platforms like **Vertex AI** and **Hugging Face** . * **Advanced RAG:** Design and implement sophisticated **Retrieval\-Augmented Generation (RAG)** pipelines and agentic frameworks. * **Prompt Engineering:** Develop robust prompt strategies, tuning methods, and reusable templates. * **Data Engineering:** Handle large\-scale unstructured data and integrate AI with enterprise applications via APIs and **Vector Databases** (Pinecone, PG Vector, Neo4j). * **Production \& MLOps:** Establish CI/CD pipelines and manage model deployment using **Kubernetes/OpenShift** and **MLOps** principles. **Technical Requirements** * **Core Programming:** Expert\-level **Python** (Pandas, NumPy, scikit\-learn, PyTorch/TensorFlow, FastAPI, LangChain, LlamaIndex). * **Generative AI:** Deep experience with **LLMs** (Gemini, OpenAI, Claude, Llama) and evaluating model safety/performance via Guardrails. * **Data Science:** Strong foundations in NLP, Neural Networks, Statistics, and ML modeling. * **DevOps/Cloud:** Proficiency in **CI/CD** (Jenkins, GitLab, or Azure DevOps) and container orchestration. **Qualifications** * 6–10 years of experience in Apps Development or Systems Analysis. * Proven track record of deploying GenAI models to production. * Strong problem\-solving skills and the ability to navigate complex, ambiguous projects independently. *Must be eligible to work in Ireland. This role requires 3 days per week in the Dublin/Belfast office.*",https://www.linkedin.com/jobs/view/4399985261
Quantitative Financial Risk Officer - based in Luxembourg,European Investment Bank (EIB),"Dublin, County Dublin, Ireland",linkedin,"**This position is based at our Luxembourg headquarters and requires regular office presence.** The EIB offers you the opportunity to live and work in a truly international and multi\-cultural environment. We also offer relocation support. The **EIB** , the European Union's bank, is seeking to recruit for its Group Risk \& Compliance Directorate (GR\&C), Group Financial Risk Department (GFIN), ALM \& Market Risk Division (ALM), Quantitative Model Implementation Unit (QMI), at its headquarters in Luxembourg, a ****Quantitative Financial Risk Officer** **\***** . **This is a full\-time position at grade 5 for which the EIB offers a permanent contract.** * Internal benchmark Officer Financial Risk Management ***Panel interviews are anticipated for June 2026\.*** Purpose You will design, implement, test, document and adjust when needed quantitative models in domains relevant to the ALM and Market Risk Division, in line with the Bank’s financial risk policies and relevant best banking practices, regulations and EIBG’s evolving business requirements. You will provide financial engineering expertise and support to model users from inside and outside the division. Operating Network You will report to the Head of the Quantitative Model Implementation Unit and work closely with colleagues from across the Bank (Risk Management, Finance, Financial Control, Corporate Services, and, as the case may be, Internal Audit). You will also interact externally with consultancy and software development firms for risk management and data matters. Accountabilities Take The Lead In Designing, Prototyping, Implementing, Testing, Documenting And Adjusting Or Enhancing When Needed Quantitative Models In Domains Relevant For The Division Or For Other Stakeholders Such As FI, CFC And PMM. Such Models May, For Example, Cover Areas Such As * Interest Rate Risk in the Banking Book (including all market risk models), * Interest Rate Risk Strategy and Interest Rate Risk Appetite, * Net Funding Result, * Pension Risk Modelling, * Funds Transfer Pricing and its sub\-components, * Loan Pricing, * Stress Testing, * ICAAP related calculations, * Long\-Term Funding Strategy and * Operational Planning **The Tasks Will Concretely Relate To** * Designing the quantitative models in collaboration with colleagues from the division and steering the implementation of all required technical functionalities * Creating smart specifications for the software vendors, by building prototype models for future integration by the vendors or by performing in\-house developments directly * Testing and documenting the model implementations * Contribute to the ongoing consolidation of risk management models and tools into a single financial risk platform. * Respond to ad\-hoc/non\-recurrent demands, as selected by the Heads of Unit and Division, including new initiatives/policies related to the content of the post when needed. * Provide financial engineering expertise and support to colleagues inside and outside the Division. **Qualifications** * University degree (minimum an equivalent to a Bachelor) preferably in a quantitative field. Post\-graduate studies in these subjects would be an advantage. * Minimum 5 years of relevant professional experience in ALM or Financial/Market Risk Management, including experience in a quantitative and financial modelling role (for example yield curve modelling, risk / sensitivity calculations, net interest income simulations, transfer\-pricing systems or capital allocation models). * Hands\-on experience in designing and implementing financial or risk models, e.g. design and implementation of pricing libraries, risk applications or ALM calculation and projection tools. * Hands\-on experience with at least one object\-oriented programming language, e.g. C\#, C\+\+ or Python. * Excellent knowledge of English and/or French (\*\*\*), with a good command of the other. (Knowledge of other EU languages would be an advantage). Competencies **Find Out More About EIB Core Behavioural Skills Here** To find out more about our eligibility criteria click here *(\*\*\*) Unless stated explicitly as a required qualification, a good command of French is not a pre\-requisite for hire. As both English and French are however official working languages of the EIB, proficiency in both languages is a pre\-requisite for your future career development. Any language clause in your contract must be fulfilled in order for you to be eligible for a promotion (either via the annual appraisal cycle or via an internal selection process). Proficiency is understood to mean the attainment of* *level 5 of the Inter Institutional language courses, corresponding to B1\.2 of the Common European Framework of Reference for Languages (CEFRL). The Bank offers appropriate training support.* We hire and value talent with unique characteristics, creating a work environment where they can be themselves. We believe that Diversity, Equity and Inclusion makes us a performing and innovative organisation. We encourage all suitably qualified and eligible candidates to apply regardless of their gender identity/expression, age, racial, ethnic and cultural background, religion and beliefs, sexual orientation, disability or neurodiversity. If you require reasonable accommodation during the recruitment process due to a disability, neurodivergence, or a chronic health condition, please contact the EIB Recruitment team Jobs@eib.org who will manage your request appropriately. By applying for this position, you acknowledge the importance of maintaining the security and integrity of the Information of the EIB Group. In case of selection for the position, you agree to comply with all measures (policies, controls, document classification and management) implemented by the EIB Group to prevent unauthorised disclosure of any information or any damage to the EIB Group reputation. Deadline for applications: **11th May 2026**",https://www.linkedin.com/jobs/view/4402505301
"Real Estate Lawyer - Associate - 3PQE+, Dublin",Addleshaw Goddard,"Dublin, County Dublin, Ireland",linkedin,"Capitalising on the continued success of AG Ireland, our highly regarded Dublin Real Estate practice is looking to hire a motivated Associate to provide exceptional legal advice and support to our expanding client base. The Real Estate Division is one of Addleshaw Goddard's largest, comprising of over 200 fee earners. In our Dublin office, the Real Estate team currently comprises 5 partners and circa 18 other fee earners. **What You'll Do:** * Supporting the management of matters involving the roll\-out of leases for our retail clients, utilising the latest legal technology and working closely with our Paralegal division and junior team members in large scale M\&A transactions and loan sales. * Supporting our international investment division on inward property investments relating to offices, logistics parks and shopping centres. * Supporting our Finance team within their lending transactions. * Working collaboratively as a cohesive team, to execute high\-value client matters to the highest standard. * Working closely with existing clients to maintain and develop relationships, acting as a trusted advisor capable of providing timely and quality advice whilst managing expectations. **Who We're Looking For:** * Have at least 3 years \+ experience within commercial property and Real Estate matters, seeking a challenging and interesting role. * Proven ability to independently manage transactional real estate matters with minimal supervision. * Have enthusiasm, resilience, and ambition to find solutions to clients' legal challenges and requirements. * Be a confident stakeholder manager, with evidenced experience of engaging with internal and external stakeholders of all levels. * Adopt a consultative and thorough approach to tasks. * Maintain efficient diary and task management across a range matters, ensuring the accuracy and levels of client service expected within a high performing team. * Be confident in drafting clear and legally effective documents, which reflect the client's instructions. **Why Choose Us?** Addleshaw Goddard is a place where you are not just valued but encouraged to reach your full potential. Our culture promotes improvement, growth, and collaboration, making us the natural choice for top\-tier clients. We celebrate diversity and are committed to creating an inclusive environment for all our employees. Interested? If this role sounds like your next career step, we'd love to hear from you. Click the Apply button to view the full role profile on our website and start your application!",https://www.linkedin.com/jobs/view/4402501830
