title,company,location,site,description,job_url
Corporate and M&A Lawyer,A&L Goodbody LLP,"Dublin, County Dublin, Ireland",linkedin,"The Corporate and M\&A practice group is recruiting for qualified lawyers with experience ranging from **2 to 6 years PQE.** **Our firm:** We advise domestic and global corporations, individual shareholders and entrepreneurs, sponsors and lenders, investment banks, private equity providers, state and semi state entities. Our corporate and M\&A group works closely with our specialist departments and together we are the market leaders on both domestic and international transactions. Working together with our multidisciplinary Client Technology team, we offer our clients immediate and centralised access to market\-leading technology solutions. The ability to layer innovation and expertise differentiates us from other firms by ensuring that our clients can leverage new technology and best practices on an ever\-evolving basis. If you are a qualified lawyer looking to join a dynamic and market\-leading Corporate and M\&A practice group or currently practicing abroad looking for an opportunity to return to Ireland, we want to hear from you. **The role:** The practice group advise clients through every stage of the company life\-cycle: * Private M\&A * Public M\&A * Capital Markets \- Equity * Private Equity * Venture Capital \& Growth Equity * PLC Advisory and Governance * Corporate Reorganisations * Corporate Advisory and Company Law * Goodbody Secretarial Limited – Company Secretarial and Governance Services **Requirements:** * Qualified candidates from 2 to 6yrs PQE * Ideally from a large or medium corporate law firm, in Ireland or the United Kingdom * An excellent academic record * Strong interpersonal and communications skills * Strong team and collaborative skills * Excellent organisational and prioritisation skills **Benefits:** At A\&L we pride ourselves on the high calibre of our employees. We place strong emphasis on career development and enabling our people to excel in their careers. Our work environment is friendly, professional and collaborative. As well as working for a market leading team we offer: * A competitive remuneration package * Access to the firm's marquee training and development programmes, delivered through the ALG School of Business and Law * Discretionary performance bonus * Pension and health insurance contribution, wellbeing contribution, life assurance, subsidised gym, restaurant and coffee shop * Hybrid working policy **The Firm:** A\&L Goodbody (ALG) is a leading Irish law firm with five international offices in Dublin, Belfast, London, New York and San Francisco. There are currently 120 partners and over 900 employees. The strong international and domestic business community in Ireland forms a valuable part of the ALG client base. ALG is incredibly proud to be recognised as the leading Irish law firm in the Chambers and Partners Europe 2024 Guide with the highest number of Band 1 practice area rankings. ALG is also ranked as a 'top tier' law firm in The Legal 500 EMEA Guide 2024 and the IFLR1000 Guide 2024\. The firm is consistently ranked number one in the Irish market and on a European level. A sample of other recent notable awards include: * Awarded the prestigious Company of the Year award at the National Diversity \& Inclusion Awards 2025 hosted by the Irish Centre for Diversity * Recognised by Mergermarket as the \#1 M\&A legal advisor in Ireland by deal volume for 2024 * Winner of the Best Client Service Award by the Lawyer European Awards * Future of Legal Services Innovation Award winners 2024 * Awarded the Investors in Diversity Silver Mark in 2024 by the Irish Centre for Diversity * Most Popular Graduate Recruiter in Law 2024 by GradIreland (for 13 consecutive years) * Law firm of the year \- Republic of Ireland 2023 at The Lawyer European Awards * Irish Law Firm of the Year 2023 at the Chambers Europe Awards * One of the top 50 most innovative law firms in Europe 2023 by the Financial Times * Best client support 2023 by the Managing Partners Forum * Business Working Responsibly Mark 2023 ALG has a reputation for leading the way in continuously developing its service to clients and internally to its business. This is delivered through the use of new processes, ways of working, innovative use of technology and marketing\-leading business service teams. **Accessibility** If you require any accommodation during the recruitment process, please contact us and we will work with you to ensure the best possible candidate experience. We value a diverse and inclusive workforce and are an equal opportunities employer.",https://www.linkedin.com/jobs/view/4368108515
Customer Contact Agent,Cornmarket,"Dublin, D, IE",indeed,"**Who We Are** **At Cornmarket**, we look after the financial wellbeing of public servants and their families. We’ve been focused on public sector employees for over 50 years, learning how to bring our clients the best financial services – from car, home, health and life insurance, to income protection, retirement planning and beyond. **Role Purpose** We are looking for a Customer Contact Agent to join our Life Sales team. Customer Contact Agents are responsible for making appointments with existing clients, on behalf of our team of Financial Consultants, on a primarily outbound call basis. The role holder will be effectively managing the diaries of our Consultants to ensure that all appointments can go ahead as scheduled in line with our clients’ expectations. This is an entry\-level position within the Life Department, one which provides an ideal opportunity to individuals looking to carve out a future in financial services. The role holder will receive on\-the\-job training and coaching to enable them to excel in terms of their own contribution, with strong encouragement and reward to undertake QFA exams. **Accountabilities of the Role** * Making outbound calls and taking calls from members of the public sector unions to arrange appointments with the company’s Consultants * Meeting monthly targets which are built around call volume and appointment scheduling (alongside these targets comes an excellent monthly bonus structure) * Dealing with clients in a professional and timely manner with a customer first approach * Cross\-selling other Cornmarket products and services * Performing tasks in a compliant manner to set procedures and prescribed scripts * Completing various administration duties, such as data entry, logging and scanning * Participating in weekly team meetings * Continuously looking for and suggesting ways to improve existing processes **What We Can Offer You** * Flexible working from home options as part of our Cornmarket Flex ways of working * Significant investments in your professional development (e.g. insurance qualifications, professional qualifications relevant to your role) * Annual leave (increases based on service) * Flexi leave (option to take additional annual leave) * Attractive flexible pension contribution rates * Health insurance or wellness subsidy * Fully paid family leave types (maternity/paternity/surrogacy) * Performance based bonus/commission * Income protection * Life cover * Discounts on financial products * Comprehensive health wellbeing programme * Employee Assistance Programme * Active Sports Social Club **Skills Knowledge Required** * Previous experience in dealing with customers over the phone or in a customer service role desired * Excellent verbal communication skills * Proven track record in meeting and exceeding targets * Strong IT Skills with good working knowledge of the MS office suite * Ability to adapt to and learn new tasks * Highly motivated to work to defined targets **Behavioural Competencies Required** * Drive for results and target driven * Approachable and a can\-do attitude * Excellent communication skills * Quality\-focused, Customer First approach * Strong attention to detail * Excellent PC Microsoft Word Skills * Ability to learn and carry out tasks in line with procedure * Team player ﻿ **Equal Opportunities Data Privacy Notice** Cornmarket is committed to building an inclusive workplace environment, We’re proud to be an equal opportunity employer, striving to create a welcoming environment. All qualified applicants will be considered for employment without regard to age, disability, ethnic background, family status, gender identify or expression, marital status, membership of the Traveller Community, national origin, race, religion, sexual orientation. We are also committed to providing reasonable accommodations to qualified individuals with disabilities in the employment application process. To request an accommodation, please contact our Talent Acquisition Team. To review our data use practices, visit our Recruitment Data Privacy Notice.",https://ie.indeed.com/viewjob?jk=79e4862f57129228
Customer Contact Agent,Cornmarket Group Financial Services Ltd.,"Dublin, County Dublin, Ireland",linkedin,"**Who We Are** **At Cornmarket** , we look after the financial wellbeing of public servants and their families. We’ve been focused on public sector employees for over 50 years, learning how to bring our clients the best financial services – from car, home, health and life insurance, to income protection, retirement planning and beyond. **Role Purpose** We are looking for a Customer Contact Agent to join our Life Sales team. Customer Contact Agents are responsible for making appointments with existing clients, on behalf of our team of Financial Consultants, on a primarily outbound call basis. The role holder will be effectively managing the diaries of our Consultants to ensure that all appointments can go ahead as scheduled in line with our clients’ expectations. This is an entry\-level position within the Life Department, one which provides an ideal opportunity to individuals looking to carve out a future in financial services. The role holder will receive on\-the\-job training and coaching to enable them to excel in terms of their own contribution, with strong encouragement and reward to undertake QFA exams. **Accountabilities Of The Role** * Making outbound calls and taking calls from members of the public sector unions to arrange appointments with the company’s Consultants * Meeting monthly targets which are built around call volume and appointment scheduling (alongside these targets comes an excellent monthly bonus structure) * Dealing with clients in a professional and timely manner with a customer first approach * Cross\-selling other Cornmarket products and services * Performing tasks in a compliant manner to set procedures and prescribed scripts * Completing various administration duties, such as data entry, logging and scanning * Participating in weekly team meetings * Continuously looking for and suggesting ways to improve existing processes **What We Can Offer You** * Flexible working from home options as part of our Cornmarket Flex ways of working * Significant investments in your professional development (e.g. insurance qualifications, professional qualifications relevant to your role) * Annual leave (increases based on service) * Flexi leave (option to take additional annual leave) * Attractive flexible pension contribution rates * Health insurance or wellness subsidy * Fully paid family leave types (maternity/paternity/surrogacy) * Performance based bonus/commission * Income protection * Life cover * Discounts on financial products * Comprehensive health wellbeing programme * Employee Assistance Programme * Active Sports Social Club **Skills Knowledge Required** * Previous experience in dealing with customers over the phone or in a customer service role desired * Excellent verbal communication skills * Proven track record in meeting and exceeding targets * Strong IT Skills with good working knowledge of the MS office suite * Ability to adapt to and learn new tasks * Highly motivated to work to defined targets **Behavioural Competencies Required** * Drive for results and target driven * Approachable and a can\-do attitude * Excellent communication skills * Quality\-focused, Customer First approach * Strong attention to detail * Excellent PC Microsoft Word Skills * Ability to learn and carry out tasks in line with procedure * Team player ﻿ **Equal Opportunities Data Privacy Notice** Cornmarket is committed to building an inclusive workplace environment, We’re proud to be an equal opportunity employer, striving to create a welcoming environment. All qualified applicants will be considered for employment without regard to age, disability, ethnic background, family status, gender identify or expression, marital status, membership of the Traveller Community, national origin, race, religion, sexual orientation. We are also committed to providing reasonable accommodations to qualified individuals with disabilities in the employment application process. To request an accommodation, please contact our Talent Acquisition Team. To review our data use practices, visit our Recruitment Data Privacy Notice.",https://www.linkedin.com/jobs/view/4396117355
Customer Success Associate - Dublin,Datadog,"Dublin, County Dublin, Ireland",linkedin,"As a Customer Success Associate, you will focus on the long term strategic relationship with our customers, drive adoption, and identify growth opportunities across a high volume of Datadog customers to ensure successful product use and retention. You’ll be an advocate for the customer internally and focus on providing a positive experience for a high volume of accounts. Associates follow a well\-defined methodology to identify the customer’s unique needs and clearly convey the value of the Datadog product. As we scale our Customer Success team, furthering personal development and team success is a top priority. *At Datadog, we place value in our office culture \- the relationships and collaboration it builds and the creativity it brings to the table. We operate as a hybrid workplace to ensure our Datadogs can create a work\-life harmony that best fits them* **What You’ll Do:** * Identify target opportunities, manage the full sales cycle and proactively build strategic relationships with customers and focus on retention. * Manage requests from your book of business such as but not limited to technical support escalations, billing questions, documentation/enablement requests to ensure a positive customer experience * Pivot account management strategy based on different customer requirements and needs seamlessly and efficiently * Act as an advisor to customers to ensure they’re leveraging the solution effectively * Monitor and identify usage trends to uncover renewal risks and support greater adoption rates * Collaborate cross\-functionally with internal Datadog teams (support, product, finance, and legal) **Who You Are:** * Customer\-minded, always trying to provide the most value possible * Driven and motivated by a career in sales with a strong desire to grow a career in Customer Success. * A strong communicator (written and verbal) with excellent attention to detail * Experienced in independently negotiating contract terms and overcoming pricing objections for up\-sell/cross sell activities * 0\-2 years of experience in a customer account facing role and desire to grow a career in Customer Success * Passionate about building long term and lasting relationships *Datadog values people from all walks of life. We understand not everyone will meet all the above qualifications on day one. That's okay. If you’re passionate about technology and want to grow your skills, we encourage you to apply.* **Benefits and Growth:** * Best\-in\-breed onboarding * Sales training in MEDDIC and Command of the Message * An inclusive company culture, opportunity to join our Community Guilds * Intra\-departmental mentor and buddy program for in\-house networking * Continuous professional development, product training, and career pathing * New hire stock equity (RSU) and employee stock purchase plan (ESPP) * Generous global benefits *Benefits and Growth listed above may vary based on the country of your employment and the nature of your employment with Datadog.* **About Datadog:** Datadog (NASDAQ: DDOG) is a global SaaS business, delivering a rare combination of growth and profitability. We are on a mission to break down silos and solve complexity in the cloud age by enabling digital transformation, cloud migration, and infrastructure monitoring of our customers’ entire technology stacks. Built by engineers, for engineers, Datadog is used by organizations of all sizes across a wide range of industries. Together, we champion professional development, diversity of thought, innovation, and work excellence to empower continuous growth. Join the pack and become part of a collaborative, pragmatic, and thoughtful people\-first community where we solve tough problems, take smart risks, and celebrate one another. Learn more about \#DatadogLife on Instagram, LinkedIn, and Datadog Learning Center. **Equal Opportunity at Datadog:** Datadog is proud to offer equal employment opportunity to everyone regardless of race, color, ancestry, religion, sex, national origin, sexual orientation, age, citizenship, marital status, disability, gender identity, veteran status, and other characteristics protected by law. We also consider qualified applicants regardless of criminal histories, consistent with legal requirements. Here are our Candidate Legal Notices for your reference. Datadog endeavors to make our Careers Page accessible to all users. If you would like to contact us regarding the accessibility of our website or need assistance completing the application process, please complete this form. This form is for accommodation requests only and cannot be used to inquire about the status of applications. **Privacy and AI Guidelines:** Any information you submit to Datadog as part of your application will be processed in accordance with Datadog’s Applicant and Candidate Privacy Notice. For information on our AI policy, please visit Interviewing at Datadog AI Guidelines.",https://www.linkedin.com/jobs/view/4393974378
Customer Success Associate - Dublin,Datadog,"Dublin, D, IE",indeed,"As a Customer Success Associate, you will focus on the long term strategic relationship with our customers, drive adoption, and identify growth opportunities across a high volume of Datadog customers to ensure successful product use and retention. You'll be an advocate for the customer internally and focus on providing a positive experience for a high volume of accounts. Associates follow a well\-defined methodology to identify the customer's unique needs and clearly convey the value of the Datadog product. As we scale our Customer Success team, furthering personal development and team success is a top priority. *At Datadog, we place value in our office culture \- the relationships and collaboration it builds and the creativity it brings to the table. We operate as a hybrid workplace to ensure our Datadogs can create a work\-life harmony that best fits them* **What You'll Do:** * Identify target opportunities, manage the full sales cycle and proactively build strategic relationships with customers and focus on retention. * Manage requests from your book of business such as but not limited to technical support escalations, billing questions, documentation/enablement requests to ensure a positive customer experience * Pivot account management strategy based on different customer requirements and needs seamlessly and efficiently * Act as an advisor to customers to ensure they're leveraging the solution effectively * Monitor and identify usage trends to uncover renewal risks and support greater adoption rates * Collaborate cross\-functionally with internal Datadog teams (support, product, finance, and legal) **Who You Are:** * Customer\-minded, always trying to provide the most value possible * Driven and motivated by a career in sales with a strong desire to grow a career in Customer Success. * A strong communicator (written and verbal) with excellent attention to detail * Experienced in independently negotiating contract terms and overcoming pricing objections for up\-sell/cross sell activities * 0\-2 years of experience in a customer account facing role and desire to grow a career in Customer Success * Passionate about building long term and lasting relationships *Datadog values people from all walks of life. We understand not everyone will meet all the above qualifications on day one. That's okay. If you're passionate about technology and want to grow your skills, we encourage you to apply.* **Benefits and Growth:** * Best\-in\-breed onboarding * Sales training in MEDDIC and Command of the Message * An inclusive company culture, opportunity to join our Community Guilds * Intra\-departmental mentor and buddy program for in\-house networking * Continuous professional development, product training, and career pathing * New hire stock equity (RSU) and employee stock purchase plan (ESPP) * Generous global benefits *Benefits and Growth listed above may vary based on the country of your employment and the nature of your employment with Datadog.* **About Datadog:** Datadog (NASDAQ: DDOG) is a global SaaS business, delivering a rare combination of growth and profitability. We are on a mission to break down silos and solve complexity in the cloud age by enabling digital transformation, cloud migration, and infrastructure monitoring of our customers' entire technology stacks. Built by engineers, for engineers, Datadog is used by organizations of all sizes across a wide range of industries. Together, we champion professional development, diversity of thought, innovation, and work excellence to empower continuous growth. Join the pack and become part of a collaborative, pragmatic, and thoughtful people\-first community where we solve tough problems, take smart risks, and celebrate one another. Learn more about \#DatadogLife on Instagram, LinkedIn, and Datadog Learning Center. **Equal Opportunity at Datadog:** Datadog is proud to offer equal employment opportunity to everyone regardless of race, color, ancestry, religion, sex, national origin, sexual orientation, age, citizenship, marital status, disability, gender identity, veteran status, and other characteristics protected by law. We also consider qualified applicants regardless of criminal histories, consistent with legal requirements. Here are our Candidate Legal Notices for your reference. Datadog endeavors to make our Careers Page accessible to all users. If you would like to contact us regarding the accessibility of our website or need assistance completing the application process, please complete this form. This form is for accommodation requests only and cannot be used to inquire about the status of applications. **Privacy and AI Guidelines:** Any information you submit to Datadog as part of your application will be processed in accordance with Datadog's Applicant and Candidate Privacy Notice. For information on our AI policy, please visit Interviewing at Datadog AI Guidelines.",https://ie.indeed.com/viewjob?jk=b0658f7daff32a3b
Cyber Security Analyst,Archer Recruitment,"Dublin, County Dublin, Ireland",linkedin,"**Cybersecurity Analyst \- GRC Focus, Elevate Your Global Career!** **• Lead the Dublin GRC hub** **• Collaborate with teams across the US \& UK** **• High\-visibility, high\-impact role** We’re looking for a **Cybersecurity Analyst** with a strong focus on **Governance, Risk, and Compliance (GRC)** to join a globally respected reinsurance organisation. Based in Dublin, a key hub for security and technology operations, this role offers **high visibility and the chance to influence security practices across multiple regions** . This position goes beyond standard cybersecurity tasks. While contributing to broader security initiatives, your **focus will be leading GRC activities with an audit\-driven, controls\-focused approach** . You will **collaborate with global teams** to uncover control gaps, strengthen governance frameworks, and ensure regulatory compliance. You’ll be instrumental in **audits, risk assessments, and client due diligence** , helping the organisation continuously **enhance its security posture** . **Why This Role Will Accelerate Your Career** • Take full ownership as Dublin’s GRC lead • Engage directly with international stakeholders across Ireland, the US, and the UK • Gain hands\-on experience in audits, regulatory assessments, and control gap analysis • Make a tangible impact shaping policies, controls, and governance frameworks • Clear pathway to senior GRC, audit, or global security leadership roles **What You’ll Bring** • 2\-5 years’ experience in cybersecurity, GRC, or audit\-focused roles • Bachelor’s degree in Cybersecurity, IT, or a related field • Relevant certifications such as Security\+, CySA\+, CISA, or CISM (preferred) **Package \& Benefits** €50,000\-63,000 \+ 10% Bonus \+ Pension \+ Health Insurance \+ Onsite Canteen \+ Life Assurance Ready to own a globally visible GRC function, sharpen your audit expertise, and grow your international career? Contact Serena Akbib on \+353 1 960 9972 or email your CV to serena.akbib@archer.ie",https://www.linkedin.com/jobs/view/4393907256
