title,company,location,site,description,job_url
"ASIC Digital Design, Architect",Synopsys Inc,"Dublin, County Dublin, Ireland",linkedin,"We Are: At Synopsys, we drive the innovations that shape the way we live and connect. Our technology is central to the Era of Pervasive Intelligence, from self\-driving cars to learning machines. We lead in chip design, verification, and IP integration, empowering the creation of high\-performance silicon chips and software content. Join us to transform the future through continuous technological innovation. You Are: An experienced and visionary ASIC Digital Architect, who is passionate about driving the future of semiconductor technology. You possess deep functional knowledge and expertise in design methodologies, and you thrive in an environment where you can influence and implement strategic goals. Your background includes a comprehensive understanding of protocols such as HBM, DDR, PCIe/CXL, AMBA and its applications. You can define and executing a new architecture for protocols such as UAL (Universal Accelerator Link). You are a proactive problem solver, capable of working with minimal oversight, and you excel in communicating complex technical concepts to a diverse audience. Your leadership skills enable you to guide and mentor teams, fostering innovation and excellence in all your projects. What You’ll Be Doing: * Defining and developing ASIC RTL design and verification at both chip and block levels. * Creating and executing design plans for complex digital designs, particularly focusing on HBM, PCIe/CXL and AMBA protocols. * Collaborating with cross\-functional teams to ensure seamless integration and functionality of designs. * Utilizing advanced design and verification methodologies and tools to achieve high\-quality results. * Mentoring and guiding junior engineers, promoting best practices, and fostering a culture of continuous improvement. * Communicating with internal and external stakeholders to align on project goals and deliverables. The Impact You Will Have: * Enhancing the reliability and performance of Synopsys’ digital design processes. * Driving innovations in HBM, PCIe/CXL and AMBA technology, contributing to the development of cutting\-edge semiconductor solutions. * Improving time\-to\-market for high\-performance silicon chips through efficient methodologies. * Building and nurturing a highly skilleddevelopmentteam, elevating overall project quality. * Influencing strategic decisions that shape the future of Synopsys’ capabilities. * Ensuring that Synopsysremainsa leader in the semiconductor industry through continuous technological advancements. What You’ll Need: * Extensive experience in ASIC RTL design. * In\-depth knowledge of HBM, PCIe, CXL,AMBA and similar IO protocols and their applications. * Proficiencyin advanceddigital designtools and methodologies. * Strong problem\-solving skills and the ability to work independently. * Excellent communication skills for effective collaboration with diverse teams. Who You Are: * A visionary leader with a strategic mindset. * A mentor who fosters talent and encourages innovation. * A proactive problem solver who thrives in complex environments. * An effective communicator with the ability to convey technical concepts to a broad audience. * A team player who values collaboration and diversity. The Team You’ll Be A Part Of: You will join a dynamic and innovative team focused on advancing Synopsys' design technologies. Our team is dedicated to excellence, collaboration, and continuous improvement. We work closely with various departments to ensure the successful integration and performance of our solutions. Together, we drive the future of semiconductor technology and make a significant impact on the industry. Specifically, according to a match profile, you will be a key technical contributor to the architecture and execution of one of HBM/PCIe/CXL digital core protocols. Rewards and Benefits: We offer a comprehensive range of health, wellness, and financial benefits to cater to your needs. Our total rewards include both monetary and non\-monetary offerings. Your recruiter will provide more details about the salary range and benefits during the hiring process.",https://www.linkedin.com/jobs/view/4374774216
Administrative Assistant,AWN Consulting Ltd.,"DUBLIN 17, D, IE",indeed,"Are you a skilled **Administrative Assistant**? Are you seeking a more flexible and supportive work environment? Look no further than AWN Consulting! **Company Background** Our company values work\-life balance and offers a hybrid work policy that allows for remote work and collaborative office settings. Training and development are at the forefront of our priorities, as we invest in your growth through chartership opportunities, training programs, and mentorship. At AWN, we celebrate diversity and prioritise inclusivity, respect, and well\-being for all our employees. Our partnership with Health Assured provides a range of services aimed at improving mental and physical health, and our employee resource groups promote a supportive environment where you can thrive and reach your full potential. Join our team and embark on a fulfilling career in the environmental sector where you can truly make a difference. In addition to our supportive work environment, we offer a comprehensive employee benefits package designed to enhance every aspect of your life. From income protection to paid maternity and paternity leave, service awards, and performance\-related bonuses, we also provide access to a bike\-to\-work scheme and organise various social events throughout the year for all staff members. As a subsidiary of Trinity Consultants, AWN stands out as a premier environmental consultancy offering expert services to a wide range of clients throughout Ireland and Europe. Our team of highly experienced environmental experts deliver top\-quality services in areas including Environmental Impact Assessments, acoustic assessments, air quality assessments, and process safety management. As Ireland’s premier specialist environmental consultancy our team work on a range of large, complex and interesting projects. Examples of our recent projects include – MetroLink, BusConnects, DART\+, Semi\-conductor manufacturing facilities, biologics manufacturing facilities and many more. **Position Overview** AWN is expanding its Administration Team and is currently seeking a Junior Administrative Assistant. The successful candidate will join our dynamic admin and finance team, providing support across project administration, HR and Operations. **Main Duties and Responsibilities** * Acting as point of contact for project set up on our accounts software * Assisting with the upkeep of employee documentation, training, recruitment paperwork and induction packs * Assisting with the upkeep of our Internal Management System in line with our audit requirements * Updating spreadsheets and client records * Providing administrative support to the admin team and across the organisation * Answering and directing phone calls * Writing and distributing emails, correspondence memos and letters * Working within a busy company, multi\-tasking and contributing to all aspects of office administration **Essential Requirements:** * 1\-2 years’ experience working in a similar role * Excellent organisational and interpersonal skills, self\-motivation, and the ability to work independently and as part of a team. * High attention to detail, excellent report writing, and communication skills. * Excellent proficiency in Microsoft Office. **Benefits** * Competitive salary. * Contributory pension. * Discretionary company bonus. * Up to 25 days holiday. * Hybrid working/ flexible working arrangements available. * Paid Maternity/Paternity leave. * Career development and support, including training and assistance towards professional chartership or membership. Please send CVs to \[email protected]",https://ie.indeed.com/viewjob?jk=f486587e75c3ccf8
Air Freight Operations Graduate,DHL Global Forwarding,"Dublin, County Dublin, Ireland",linkedin,"**DHL Global Forwarding Graduate Programme 2026** **As a Graduate** , you’ll use your talents to create innovative solutions and shape the future across our business. Join a global network of passionate experts – backed by the latest technology, to develop your career to management level. The DGF Graduate Scheme places you in a variety of roles across our international Freight Forwarding business. Throughout the scheme you will be empowered to learn on the job and deliver real results. We offer a supportive culture in a highly engaged workforce and provide investment in your training to ensure that you get the most out of your graduate scheme. **What the scheme looks like:** 24‑month structured scheme A comprehensive operational development programme including exposure to: * Airfreight export documentation and compliance * Customer communication and relationship management * Booking management, transport scheduling and shipment coordination * End‑to‑end job file ownership support * Global network communication with DHL overseas offices * Air Cargo Security processes and Known Shipper checks * Performance and KPI management * Billing accuracy, invoicing support and cost checking * Exception management and incident reporting * Cross‑functional collaboration across Warehouse, Customer Service, Finance and Global Network teams You will develop gradually, starting with supported tasks and progressing toward independently handling export shipments. **Skills, Experience \& Educational Qualifications required:** * 2:1 or above degree (predicted or obtained) in Logistics, Supply Chain, Business, Transport Management, Aviation Management, or related discipline * Interest in airfreight operations, logistics and international trade * Motivation to develop a career within Freight Forwarding * Passion for excellent customer service and operational accuracy * Enthusiastic, open‑minded, with a strong ‘Can‑Do’ attitude * Confident communicator able to work with customers, carriers and global teams * Eligibility to work in Ireland * Fluent in English **Additional Personal Qualities:** * Strong attention to detail and accuracy in documentation and data handling * Organised, reliable and capable of managing time‑sensitive tasks * Calm under pressure when handling urgent shipments * Proactive problem‑solver who is eager to learn * Team‑oriented, respectful and collaborative * Willingness to learn operational systems, regulatory processes and SOPs **What do we offer?** The scheme will initially be a 24‑month Fixed Term Contract (FTC), with the aim that our Graduates move into a permanent position within the business – subject to a suitable vacancy being available and in line with the selection process for the role. **What will you get in return?** * Access to a variety of our excellent benefits, including 21 days’ holiday, bank holidays, service days, pension scheme, gym membership, discounted private healthcare, education assistance programme and family leave supports. * Early responsibility and fast progression. * Experience working within a fast‑paced environment. * Regular performance feedback and personal development planning. * Management Team Mentor and DGF Buddy. * Competitive salary. * You will be working for an accredited Top Employer and a certified Great Place to Work. **Location:** Dublin Based – Cedar Drive, Dublin Airport Logistics Park, St. Margaret’s, Co. Dublin **Hours:** 37\.5 hours per week **Closing:** TBC",https://www.linkedin.com/jobs/view/4405376856
Android Software Engineer,myGwork - LGBTQ+ Business Community,"Dublin, County Dublin, Ireland",linkedin,"**This job is with eBay, an inclusive employer and a member of myGwork – the largest global platform for the LGBTQ\+ business community. Please do not contact the recruiter directly.** At eBay, we're more than a global ecommerce leader \- we're changing the way the world shops and sells. Our platform empowers millions of buyers and sellers in more than 190 markets around the world. We're committed to pushing boundaries and leaving our mark as we reinvent the future of ecommerce for enthusiasts. Our customers are our compass, authenticity thrives, bold ideas are welcome, and everyone can bring their unique selves to work \- every day. We're in this together, sustaining the future of our customers, our company, and our planet. Join a team of passionate thinkers, innovators, and dreamers \- and help us connect people and build communities to create economic opportunity for all. At eBay, we're more than a global ecommerce leader \- we're changing the way the world shops and sells. Our platform empowers millions of buyers and sellers in more than 190 markets around the world. We're committed to pushing boundaries and leaving our mark as we reinvent the future of ecommerce for enthusiasts. Our customers are our compass, authenticity thrives, bold ideas are welcome, and everyone can bring their unique selves to work \- every day. We're in this together, sustaining the future of our customers, our company, and our planet. Join a team of passionate thinkers, innovators, and dreamers \- and help us connect people and build communities to create economic opportunity for all. We're looking for a motivated mobile app developer to help us build the next generation architecture at eBay. Together, we will delight millions of customers a year. eBay is a global commerce leader where you can influence how the world buys, sells, and gives. You'll be part of a work culture that's been genuinely committed to diversity and inclusion since its founding twenty five years ago. Here, you can be yourself, do your best work, and have a meaningful impact on people across the globe. We seek people with drive, ideas, and a passion for helping small businesses succeed to help shape the future of eBay\-does this sound like you? If so, we'd love to talk to you! **Job Functions** You will be a member of our native mobile architecture team, building the next generation of our native application architecture. * Support Core Product developers with debugging Android and new OS feature issues * Work closely with every Core Product domain on feature and architecture implementation * We follow agile practices and focus on continual improvement in our practices, driven from the ground up. We expect you to advocate for improvements in code and culture, and to support your colleagues in the same. * Work well with team members and other teams, dividing up workload appropriately. * Partner and collaborate with other organizations throughout eBay. **Job Requirements** * 2\+ years of experience in designing, building, refactoring and releasing native apps. * Able to own a feature of an Android application and develop it fully. * Proven experience with Kotlin/Java. * Experience with pairing, code reviews, and other techniques to maintain high\-quality code and resiliency. * Working knowledge of modern Android APIs, concurrency/coroutines, compose, transitions, animations, client side persistence, and architectural patterns for mobile apps. * Preferred experience with Android Architecture Components, MVVM, and Dagger/other modern DI frameworks. * Experience in Agile/Kanban methodologies and working in Agile teams is desirable. * Experience with AI tooling is a plus. **Benefits** Benefits are an essential part of your total compensation for the work you do every day. Whether you're single, in a growing family, or nearing retirement, eBay offers a variety of comprehensive and competitive benefit programs to meet your needs. Including maternal \& paternal leave, paid sabbatical, and plans to help ensure your financial security today and in the years ahead because we know feeling financially secure during your working years and through retirement is important. Here at eBay, we love creating opportunities for others by connecting people from widely diverse backgrounds, perspectives, and geographies. So, being diverse and inclusive isn't just something we strive for, it is who we are, and part of what we do each and every single day. We want to ensure that as an employee, you feel eBay is a place where, no matter who you are, you feel safe, included, and that you have the opportunity to bring your unique self to work. To learn about eBay's Diversity \& Inclusion click here: https://www.ebayinc.com/company/diversity\-inclusion/ **Additional Details** eBay is an equal opportunity employer. All qualified applicants will receive consideration for employment without regard to race, color, religion, national origin, sex, sexual orientation, gender identity, veteran status, and disability, or other legally protected status. If you have a need that requires accommodation, please contact us at talent@ebay.com. We will make every effort to respond to your request for accommodation as soon as possible. View our accessibility statement to learn more about eBay's commitment to ensuring digital accessibility for people with disabilities. We use cookies to enhance your experience and may use AI tools for administrative tasks in the hiring process. To learn how we handle your personal data and use AI responsibly, please visit our Talent Privacy Notice, Privacy Center, and AI Hiring Guidelines. ]]\>",https://www.linkedin.com/jobs/view/4404160894
Basic Grade Psychologist,Enable Ireland,"Dublin, County Dublin, Ireland",linkedin,"Would you like to work for a great employer? Enable Ireland is an organisation that makes a real difference to the lives of children and adults with disabilities in Ireland, and is named as one of Ireland's Irish Independent 150 **Best Employers 2025\.** Enable Ireland, as an equal opportunities employer, proudly maintains a Silver Award in Diversity from the Irish Centre for Diversity. We vigorously advocate for fairness, respect, equality, diversity, inclusion, and engagement, and are dedicated to ongoing enhancement in these areas. We are currently seeking a highly\-motivated **Basic Grade Psychologist** to join our team currently based in **Sandymount and Leopardstown.** **Leopardstown** Our Leopardstown office is ideally situated within a HSE building at Leopardstown Shopping Centre, offering excellent connectivity, convenience, and a vibrant working environment. Located directly on the Luas Green Line and just minutes from the M50, it ensures easy access for commuters from across the city and beyond. The shopping centre offers a range of amenities including Dunnes Stores, coffee shops like Vanilla Pod and Costa, ample parking, a pharmacy, and dry cleaning services among other retailers, making it a practical and attractive location for staff. **Sandymount** Our Sandymount office is located in a vibrant seaside village with a welcoming community feel. Just a short walk from Sandymount Strand, the village offers a great mix of cafes, restaurants, and local shops, including a Tesco for convenience. The office is served by the DART commuter train and central bus routes, making it easily commutable from the city and surrounding areas. **Contract Type:** Permanent Post **Contract Hou** rs: Full Time Post, 35 hours per week Salary Scale: €60,342 \- €105,535 pro rata per annum. Salary scales are subject to LSI’s (Long Service Increments) **This pay scale is subject to increases in 2026 in accordance with the recent WRC agreement towards enhanced pay adjustments in Section 39 organisations.** **Annual Leave Entitlement** : 34 days pro rata per annum and proportionately less for less than 12 months service **Overview of the Post:** To work as a member of the interdisciplinary team providing services to children and families within the region. The post holder will be responsible for the provision of psychology services including assessment and intervention to children accessing the Early Intervention service as appropriate. **Overview of Duties \& Responsibilities:** **Please See Job Description For Full List Of Duties.** **The successful candidate will have:** ***Essential Criteria:*** * Candidates for appointment must: * Have a recognised university degree or diploma (QQ1 level 8 equivalent) obtained with 1st or 2nd class honours in which Psychology was taken as a major subject and honours obtained in that subject. AND * Have an Irish post\-graduate professional psychology qualification accredited by the Psychological Society of Ireland in Clinical, Counselling or Educational Psychology. OR * An equivalent qualification from another jurisdiction validated by the Department of Health. AND * Demonstrate competence in the Care Group/s applied for. AND * Must be a member of the Psychological Society of Ireland (PSI) or a member of the British Psychological Society (BPS). AND * Applicants with a clinical or counselling psychology qualification must demonstrate that they have acquired in appropriate health settings, for the area / areas for which they wish to apply \- Disability (Child and Adult), Child Psychology, Adult Psychology \- either at least 60 days or equivalent supervised clinical placements as part of the professional qualification; or at least 60 days or equivalent post\-qualification supervised work experience as a psychologist. Note 2\. OR * Applicants with an educational psychology qualification must demonstrate that they have acquired in appropriate health settings for the area / areas for which they wish to apply \- Child Disability, Child Psychology \- either at least 60 days or equivalent supervised clinical placements as part of the professional qualification; or at least 60 days or equivalent post qualification supervised work experience as a psychologist. Note 2\. Note 2: Combinations of supervised clinical placement experience as part of the qualification and post qualification supervised work experience within a single care group area to give a total of 60 days are not acceptable. AND * Eligible to work in the State. ***Desirable Criteria:*** * Experience working in the disability sector. * Experience of inter/trans disciplinary team working. * Knowledge and experience of Assessment of Need process. * Experience of working with children aged from birth to 18 years, with a range of disabilities, (including physical disability, autism, learning disability) and their families. * Experience in Autism diagnosis. * Applicants must have at least one\-year satisfactory post\-graduate experience working as a Clinical or Educational Psychologist. **If you believe you would fit the role then please submit your application today.** **Benefits** As a staff member of Enable Ireland, you will have access to a wide range of benefits, including: * Excellent internal and external training opportunities * Generous annual leave entitlements * Flexible Working * Long service reward scheme * Pay adjusted Maternity Leave * Pay adjusted Adoptive Leave * Pay adjusted Paternity Leave * Wellbeing benefits * Pension For a full list of our benefits \& conditions, please click here: **What now?** **To apply, please download the Job Description and Person Specification for your information and complete the online application form. CVs will not be accepted.** **Closing date for applications: 08/05/2026** **Interview date for successful candidates: TBC** ***A panel may be formed from this vacancy for any similar vacancies, which may arise during the next 12 months.*** * The post will be subject to reference checks and may be subject to Garda vetting/police clearance, as relevant. * Due to the large volume of applications, we are not in the position to provide individual feedback to applicants who are not shortlisted for interview. * Applications are invited from suitably qualified applicants from all sections of the community. * The above information serves only as a guide to the advertised position. Enable Ireland, at its discretion, reserves the right to change this prior to appointment. * Please review Enable Ireland’s Rezoomo Privacy Policy here: https://enableireland.ie/resources/publications/rezoomo\-privacy\-policy * Please review the Enable Ireland’s External Data Protection Notice available at https://www.enableireland.ie/privacy\-policy for details on how Enable Ireland processes applicant’s personal information. Please note if you are invited for interview, we will share your personal data with: * Any virtual service provider we use to host the interview; and * the interview panel (if applicable). Your information will be stored for this purpose in line with our retention policy",https://www.linkedin.com/jobs/view/4405726092
