title,company,location,site,description,job_url
Hiring Now! Entry-Level English Teacher (ESL) | No Experience Needed,English 1,"Dublin 4, County Dublin, Ireland",linkedin,"**Launch Your International Career with Purpose and Adventure** Are you searching for a **rewarding, entry\-level job** that lets you **travel the world** , **work abroad** , and gain **real\-world experience** all while making a difference? Whether you're a **recent graduate** , exploring a **career change** , or an **ESL/TEFL\-certified teacher** ready to take your skills overseas, this is the opportunity you’ve been looking for. **English 1** is now hiring **motivated, globally minded individuals** for **full\-time English teaching jobs in China** . No teaching experience? No problem. We provide **full training** , **ready\-made teaching materials** , and **visa sponsorship,** making this the perfect **graduate job** , **first job** , or **international career move** for anyone ready to start something new. **What you'll do** * Teach English to young learners aged 3–16 in a fun, interactive, and immersive classroom setting. * Deliver high\-energy lessons using English 1’s award\-winning curriculum and digital tools. * Provide constructive feedback and help students build confidence in their English skills. * Take part in school events, cultural activities, and student engagement programs. **What you’ll get** * Competitive salary \+ performance bonus after 6 months * 21 days paid leave (10 days paid leave \+ 11 days statutory holidays) * Flight allowance * International health insurance (co\-paid) * Airport pick\-up support * \*\*Sponsored legal Z work visa \+ up to 2 weeks sponsored hotel stay * Comprehensive induction training, ongoing support, and fully prepared teaching materials * TEFL certificate \+ skill development \& career advancement * Distance learning courses (Level 6 Trinity College CertPT, DELTM) * English 1\-organized social and cultural activities \+ free Mandarin Chinese lessons *The hotel accommodation for the first two weeks will be deemed as a sponsorship upon successful completion of the first\-year contract. \*\*Sponsored legal Z work visa expenses will be reimbursed.* **Who we’re looking for** * A bachelor’s degree (in any subject) * A valid passport * A genuine interest in education, travel, and cultural exchange. * ESL certification (TEFL, TESOL, CELTA) is a plus\- we can sponsor * Clean background check. **Why work at English 1?** * Teachers are at the core of everything we do at English 1 * Over **30 years** of success in China with **200\+ schools** in **50\+ cities** . * Strong presence in **China** and **Indonesia** . * **Professional development** and career **advancement opportunities** . Whether you're graduating soon, pivoting into a new career, or seeking international experience, this opportunity offers a chance to teach, travel, and grow \#EntryLevel \#Graduates \#EnglishTeacher \#ESL \#TEFL \#TeachingJobs \#GraduateJobs \#hiring \#jobs \#entrylevel \#teachercns \#graduates \#esl \#tefl \#teach \#JobAlert \#NowHiring \#JobOpening \#CareerOpportunities \#JobSearch \#WorkWithUs \#LinkedInJobs \#JobSeeker \#OpenToWork \#CareerGoals \#JobHunt \#NewJob \#CollegeGraduates \#BachelorsDegree \#RecentGrad \#ClassOf2025 \#JobSearch \#CareerSuccess \#EntryLevelJobs \#HiringNow \#YoungProfessionals \#CareerGrowth \#Networking \#LinkedInNetworking \#FutureLeaders \#UniversityAlumni \#HigherEd \#AlumniNetwork \#CollegeSuccess",https://www.linkedin.com/jobs/view/4393509229
"Hiring Now! Teach English Overseas with Full Training, Visa Sponsorship & Career Support",English 1,,linkedin,"**Teach English Overseas with Full Training, Visa Sponsorship \& Career Support** Looking for a **stable, full\-time job abroad** where you can **teach English, gain international experience, and receive professional training\-** even if you’ve never taught before? English 1 is recruiting **entry\-level English teachers** to teach English in China. This role is designed specifically for **first\-time teachers, graduates, and professionals transitioning into education** , with **structured training, ready\-made lessons, and continuous support** . **What you'll do** * Teach English to young learners aged 3–16 in a fun, interactive, and immersive classroom setting. * Deliver high\-energy lessons using English 1’s award\-winning curriculum and digital tools. * Provide constructive feedback and help students build confidence in their English skills. * Take part in school events, cultural activities, and student engagement programs. **What you’ll get** * Competitive salary \+ performance bonus after 6 months * 21 days paid leave (10 days paid leave \+ 11 days statutory holidays) * Flight allowance * International health insurance (co\-paid) * Airport pick\-up support * \*\*Sponsored legal Z work visa \+ up to 2 weeks sponsored hotel stay * In\-class coaching and mentoring * Visa sponsorship \& legal work permit * Comprehensive induction training, ongoing support, and fully prepared teaching materials * TEFL certificate \+ skill development \& career advancement * Distance learning courses (Level 6 Trinity College CertPT, DELTM) * English 1\-organized social and cultural activities \+ free Mandarin Chinese lessons *The hotel accommodation for the first two weeks will be deemed as a sponsorship upon successful completion of the first\-year contract. \*\*Sponsored legal Z work visa expenses will be reimbursed.* **Who we’re looking for** * A bachelor’s degree (in any subject) * A valid passport * A genuine interest in education, travel, and cultural exchange. * ESL certification (TEFL, TESOL, CELTA) is a plus\- we can sponsor * Clean background check. **Why work at English 1?** * Teachers are at the core of everything we do at English 1 * Over **30 years** of success in China with **200\+ schools** in **50\+ cities** . * Strong presence in **China** and **Indonesia** . * **Professional development** and career **advancement opportunities** . Whether you're graduating soon, pivoting into a new career, or seeking international experience, this opportunity offers a chance to teach, travel, and grow \#EntryLevel \#Graduates \#EnglishTeacher \#ESL \#TEFL \#TeachingJobs \#GraduateJobs \#hiring \#jobs \#entrylevel \#teachercns \#graduates \#esl \#tefl \#teach \#JobAlert \#NowHiring \#JobOpening \#CareerOpportunities \#JobSearch \#WorkWithUs \#LinkedInJobs \#JobSeeker \#OpenToWork \#CareerGoals \#JobHunt \#NewJob \#CollegeGraduates \#BachelorsDegree \#RecentGrad",https://www.linkedin.com/jobs/view/4393503588
"Hiring Now! Teach English Overseas with Full Training, Visa Sponsorship & Career Support",English 1,"Dublin, County Dublin, Ireland",linkedin,"**Teach English Overseas with Full Training, Visa Sponsorship \& Career Support** Looking for a **stable, full\-time job abroad** where you can **teach English, gain international experience, and receive professional training\-** even if you’ve never taught before? English 1 is recruiting **entry\-level English teachers** to teach English in China. This role is designed specifically for **first\-time teachers, graduates, and professionals transitioning into education** , with **structured training, ready\-made lessons, and continuous support** . **What you'll do** * Teach English to young learners aged 3–16 in a fun, interactive, and immersive classroom setting. * Deliver high\-energy lessons using English 1’s award\-winning curriculum and digital tools. * Provide constructive feedback and help students build confidence in their English skills. * Take part in school events, cultural activities, and student engagement programs. **What you’ll get** * Competitive salary \+ performance bonus after 6 months * 21 days paid leave (10 days paid leave \+ 11 days statutory holidays) * Flight allowance * International health insurance (co\-paid) * Airport pick\-up support * \*\*Sponsored legal Z work visa \+ up to 2 weeks sponsored hotel stay * In\-class coaching and mentoring * Visa sponsorship \& legal work permit * Comprehensive induction training, ongoing support, and fully prepared teaching materials * TEFL certificate \+ skill development \& career advancement * Distance learning courses (Level 6 Trinity College CertPT, DELTM) * English 1\-organized social and cultural activities \+ free Mandarin Chinese lessons *The hotel accommodation for the first two weeks will be deemed as a sponsorship upon successful completion of the first\-year contract. \*\*Sponsored legal Z work visa expenses will be reimbursed.* **Who we’re looking for** * A bachelor’s degree (in any subject) * A valid passport * A genuine interest in education, travel, and cultural exchange. * ESL certification (TEFL, TESOL, CELTA) is a plus\- we can sponsor * Clean background check. **Why work at English 1?** * Teachers are at the core of everything we do at English 1 * Over **30 years** of success in China with **200\+ schools** in **50\+ cities** . * Strong presence in **China** and **Indonesia** . * **Professional development** and career **advancement opportunities** . Whether you're graduating soon, pivoting into a new career, or seeking international experience, this opportunity offers a chance to teach, travel, and grow \#EntryLevel \#Graduates \#EnglishTeacher \#ESL \#TEFL \#TeachingJobs \#GraduateJobs \#hiring \#jobs \#entrylevel \#teachers \#graduates \#esl \#tefl \#teach \#JobAlert \#NowHiring \#JobOpening \#CareerOpportunities \#JobSearch \#WorkWithUs \#LinkedInJobs \#JobSeeker \#OpenToWork \#CareerGoals \#JobHunt \#NewJob \#CollegeGraduates \#BachelorsDegree \#RecentGrad \#ClassOf2025 \#JobSearch \#CareerSuccess \#EntryLevelJobs \#HiringNow \#YoungProfessionals \#CareerGrowth \#Networking \#LinkedInNetworking \#FutureLeaders \#UniversityAlumni \#HigherEd \#AlumniNetwork \#CollegeSuccess",https://www.linkedin.com/jobs/view/4387244274
"Hiring Now! Teach English Overseas with Full Training, Visa Sponsorship & Career Support",English 1,"South Dublin, Ireland",linkedin,"**Teach English Overseas with Full Training, Visa Sponsorship \& Career Support** Looking for a **stable, full\-time job abroad** where you can **teach English, gain international experience, and receive professional training\-** even if you’ve never taught before? English 1 is recruiting **entry\-level English teachers** to teach English in China. This role is designed specifically for **first\-time teachers, graduates, and professionals transitioning into education** , with **structured training, ready\-made lessons, and continuous support** . **What you'll do** * Teach English to young learners aged 3–16 in a fun, interactive, and immersive classroom setting. * Deliver high\-energy lessons using English 1’s award\-winning curriculum and digital tools. * Provide constructive feedback and help students build confidence in their English skills. * Take part in school events, cultural activities, and student engagement programs. **What you’ll get** * Competitive salary \+ performance bonus after 6 months * 21 days paid leave (10 days paid leave \+ 11 days statutory holidays) * Flight allowance * International health insurance (co\-paid) * Airport pick\-up support * \*\*Sponsored legal Z work visa \+ up to 2 weeks sponsored hotel stay * In\-class coaching and mentoring * Visa sponsorship \& legal work permit * Comprehensive induction training, ongoing support, and fully prepared teaching materials * TEFL certificate \+ skill development \& career advancement * Distance learning courses (Level 6 Trinity College CertPT, DELTM) * English 1\-organized social and cultural activities \+ free Mandarin Chinese lessons *The hotel accommodation for the first two weeks will be deemed as a sponsorship upon successful completion of the first\-year contract. \*\*Sponsored legal Z work visa expenses will be reimbursed.* **Who we’re looking for** * A bachelor’s degree (in any subject) * A valid passport * A genuine interest in education, travel, and cultural exchange. * ESL certification (TEFL, TESOL, CELTA) is a plus\- we can sponsor * Clean background check. **Why work at English 1?** * Teachers are at the core of everything we do at English 1 * Over **30 years** of success in China with **200\+ schools** in **50\+ cities** . * Strong presence in **China** and **Indonesia** . * **Professional development** and career **advancement opportunities** . Whether you're graduating soon, pivoting into a new career, or seeking international experience, this opportunity offers a chance to teach, travel, and grow \#EntryLevel \#Graduates \#EnglishTeacher \#ESL \#TEFL \#TeachingJobs \#GraduateJobs \#hiring \#jobs \#entrylevel \#teachercns \#graduates \#esl \#tefl \#teach \#JobAlert \#NowHiring \#JobOpening \#CareerOpportunities \#JobSearch \#WorkWithUs \#LinkedInJobs \#JobSeeker \#OpenToWork \#CareerGoals \#JobHunt \#NewJob \#CollegeGraduates \#BachelorsDegree \#RecentGrad",https://www.linkedin.com/jobs/view/4393535338
"Hiring for 2026! Teach English Abroad | Full Training, Visa Sponsorship & Career Growth",English 1,"Dublin 4, County Dublin, Ireland",linkedin,"Looking for a **stable, full\-time job abroad** where you can **teach English, gain international experience, and receive professional training\-** even if you’ve never taught before? English 1 is recruiting **entry\-level English teachers** to teach English in China. This role is designed specifically for **first\-time teachers, graduates, and professionals transitioning into education** , with **structured training, ready\-made lessons, and continuous support** . **What you'll do** * Teach English to young learners aged 3–16 in a fun, interactive, and immersive classroom setting. * Deliver high\-energy lessons using English 1’s award\-winning curriculum and digital tools. * Provide constructive feedback and help students build confidence in their English skills. * Take part in school events, cultural activities, and student engagement programs. **What you’ll get** * Competitive salary \+ performance bonus after 6 months * 21 days paid leave (10 days paid leave \+ 11 days statutory holidays) * Flight allowance * International health insurance (co\-paid) * Airport pick\-up support * \*\*Sponsored legal Z work visa \+ up to 2 weeks sponsored hotel stay * In\-class coaching and mentoring * Visa sponsorship \& legal work permit * Comprehensive induction training, ongoing support, and fully prepared teaching materials * TEFL certificate \+ skill development \& career advancement * Distance learning courses (Level 6 Trinity College CertPT, DELTM) * English 1\-organized social and cultural activities \+ free Mandarin Chinese lessons *The hotel accommodation for the first two weeks will be deemed as a sponsorship upon successful completion of the first\-year contract. \*\*Sponsored legal Z work visa expenses will be reimbursed.* **Who we’re looking for** * A bachelor’s degree (in any subject) * A valid passport * A genuine interest in education, travel, and cultural exchange. * ESL certification (TEFL, TESOL, CELTA) is a plus\- we can sponsor * Clean background check. **Why work at English 1?** * Teachers are at the core of everything we do at English 1 * Over **30 years** of success in China with **200\+ schools** in **50\+ cities** . * Strong presence in **China** and **Indonesia** . * **Professional development** and career **advancement opportunities** . Whether you're graduating soon, pivoting into a new career, or seeking international experience, this opportunity offers a chance to teach, travel, and grow \#EntryLevel \#Graduates \#EnglishTeacher \#ESL \#TEFL \#TeachingJobs \#GraduateJobs \#hiring \#jobs \#entrylevel \#teachercns \#graduates \#esl \#tefl \#teach \#JobAlert \#NowHiring \#JobOpening \#CareerOpportunities \#JobSearch \#WorkWithUs \#LinkedInJobs \#JobSeeker \#OpenToWork \#CareerGoals \#JobHunt \#NewJob \#CollegeGraduates \#BachelorsDegree \#RecentGrad",https://www.linkedin.com/jobs/view/4393516045
Hotel Management Accountant,Fairmont Carton House,"Maynooth, KE, IE",indeed,"A five\-star career awaits at Carton House! We invite you to begin your next career chapter at Carton House \- a storied and dynamic five\-star resort destination and the first and only member of the Fairmont Hotel collection in Ireland. Nurturing a working environment built on fairness, inclusivity, and growth for all team members, we deliver the highest standard of service, turning moments into memories for all of our guests. We are currently recruiting a **Hotel Management Accountant** to join our Finance Team team at Carton House. **Key Responsibilities:** * Support the Director of Finance in managing the day to day financial operations of the hotel. * Assisting with the preparation of monthly management accounts and P\&L reporting * Completing balance sheet reconciliations and maintaining strong financial controls. * Assisting with revenue reporting and financial analysis across the hotel. * Supporting budgeting and forecasting processes. * Post monthly journals to Sun accounting system. * Reconcile a number of bank accounts. * Preparing financial reports and assisting with audits and compliance requirements. * Working closely with operational managers to ensure financial procedures are followed. * Identifying opportunities to improve reporting, controls and financial processes. * Mentor and train finance team members and graduates. Contribute to the financial performance and smooth running of the finance department. * **Key Requirements:** * The role will suit and experienced hotel financial controller, hotel accountant, finance supervisor or accounts manager within a hotel or hospitality business. * A recognized accounting qualification or being part qualified is desirable. * Previous experience within hotel or hospitality finance preferred. * Strong Analytical ability and excellent attention to detail. * Strong communication and organisational skills. * Confidence working with department heads and operational managers. * A proactive approach and a genuine interest in the hotel finance. * Exceptional analytical abilities. * Knowledge of IT systems(Procure wizard, Opera cloud, Alkimii) * Proven people management and leadership skills. **Why work for Carton House, A Fairmont Managed Hotel?** * To be part of Accor's large global hospitality network. * Employee benefit card offering discounted rates in Accor Hotels worldwide. * Refer a Friend bonus of €250\. * Learning and development opportunities. * Employee Assistance Programme. * Strong team focus and team atmosphere. * Meals and uniform are provided. * Free parking. * Team\-building and social events organised throughout the year in line with our successful Awards and Recognition Scheme. * Training is provided both on\-the\-job and through organised training seminars with both internal and external trainers.",https://ie.indeed.com/viewjob?jk=1758086c03f78a7e
Hotel Management Graduate Programme,MHL Hotel Collection,"Dublin, County Dublin, Ireland",linkedin,"**Ready to kick\-start your career in hospitality?** Our Manager in Training (MIT) Graduate Programme commences in September and is your chance to step into leadership with a structured 18\-month journey designed to build your confidence, skills and future. What you'll gain: * The opportunity to learn directly from experienced leaders across the business * A comprehensive understanding of hotel operations * Exposure to real challenges and responsibilities in a supportive setting * A clear pathway to develop your career with structured guidance and mentorship. * Click on the link below to find out more: https://online.flippingbook.com/view/541185829/ Who we are looking for: * Due to graduate or recently graduated with a relevant degree (Hospitality or Tourism \- however if you do not have a degree in these fields, but have experience in hospitality, we would still love to hear from you) * Excellent communication, teamwork and interpersonal skills * Ability to adapt to a fast paced environment * Passion for hospitality, guest satisfaction * Willingness to work flexible hours, including evenings and weekends * Open to travel within Ireland for the hotel rotations * Those seeking operational roles within the hotel industry (F\&B, Rooms, Front Office, M\&E and Reservations) If you are motivated, eager to learn and ready to take on new challenges, this programme will provide you with the tools and experience to succeed as a future manager. **Closing date 24th April** Please note we are unable to offer visa sponsorship for this role, so you must be authorised to work in Ireland **About us:** The MHL Hotel Collection is a collection of unique and individual hotels in key city and resort locations throughout Ireland. From the bustling city centres of Dublin, Galway, Limerick and Belfast , to picturesque and historic estates close to Wicklow and Galway City, each of our hotels has its own distinct personality and charm. *Due to the high volume of applications received, we regret that we are only able to contact candidates whose experience and profile closely match the requirements of the role. We sincerely thank all applicants for their interest and for taking the time to apply*",https://www.linkedin.com/jobs/view/4396451194
"Implementation Consultant (SaaS, €75k)",Ingenio Global,"Dublin, County Dublin, Ireland",linkedin,"If you thrive on delivering complex, technical solutions, enjoy building things from scratch, and are ready to take ownership of post\-sale success for enterprise clients \- this is your next challenge. You're applying for a fast\-growing, globally trusted software (Series D, $100m ARR) company helping large organisations implement critical, highly customised solutions who are looking for a **Senior Implementation Consultant** to lead end\-to\-end delivery for strategic enterprise clients You'll be working directly with senior stakeholders and cross\-functional teams. It's a **hands\-on, high\-impact post\-sale delivery** , where your technical expertise, problem\-solving, and ability to thrive in ambiguity will drive success. **What You’ll Own:** * Lead **end\-to\-end post\-sale implementations** for enterprise clients. * Manage timelines, risks, and escalations while delivering **highly customised solutions** . * Collaborate closely with Engineering, Product, Account Management, and Customer Success teams. * Translate complex customer requirements into **practical, technical implementations** . * Resolve complex technical and delivery issues, ensuring smooth, timely outcomes. * Contribute to and improve implementation methodologies and best practices. * Mentor and support junior implementation team members. **What You Bring:** * 5\+ years implementing software for **enterprise or strategic customers** . * Proven track record delivering **complex, technical, post\-sale implementations** . * Direct customer\-facing experience with **large global organisations** (e.g., Booking.com, WorldPay). * Strong experience with **APIs (RESTful)** , JSON, JavaScript, SQL, and relational databases. * Comfortable managing multiple implementations in **ambiguous, first\-time delivery scenarios** . * Strong problem\-solving skills and **technical acumen** . * Degree in Computer Science, Engineering, Software, or related field preferred; formal PM certification is a plus but not essential. * Experience in SME or scale\-up environments preferred \- **mindset matters more than brand** . **The good stuff:** * **Location:** Dublin (Hybrid – Tues/Wed/Thurs in office) * **Type:** Full\-time, permanent * **Salary:** Up to €75k \& benefits If you've read this far, it means there is clearly a level of interest and you should apply (If you are the right person of course!) If you want to **own enterprise post\-sale delivery** , work with complex systems, and make an impact from day one: APPLY NOW!",https://www.linkedin.com/jobs/view/4394370461
