title,company,location,site,description,job_url
1st Year Electrical Apprentice (Midlands Area),Walden Electrical Contracting,"Carlow, CW, IE",indeed,"1st Year Apprentice's required in the Midlands Area. Must be willing to travel to various sites. Work is based mainly in the commercial / retail sector. If you are interested in training to become and Electrician send us your C.V. Pay: From €19,000\.00 per year Work Location: In person",https://ie.indeed.com/viewjob?jk=07d4815db45d4f31
2026 Ireland Graduate Electrical Engineer: Energy Sector,Mott MacDonald,"Dublin, County Dublin, Ireland",linkedin,"**To avoid missing out on your preferred role, we recommend applying as early as possible, as positions will close once filled.** Turn your ambition into action—apply now and shape your future with us. **Job Description:** Please note that for these graduate opportunities we are happy for you to simply apply with a CV and the option to include a cover letter. At Mott MacDonald, we believe engineering is more than solving problems — it’s about shaping a better world. As a Graduate Overhead Engineer, you’ll be part of a collaborative, inclusive, and forward\-thinking team that designs and delivers sustainable solutions across sectors including energy, aviation, buildings, ports, rail \& metros, and water. **Candidate Specification:** We are looking for committed and motivated graduates with a genuine passion and a desire to make a difference in the world. If this describes you, apply today to launch your career at Mott MacDonald. To be eligible for this opportunity, you will have less than 12 months relevant experience and have a degree or are expected to achieve one of the following degree disciplines: * Electrical Engineering * Civil Engineering In your application you should be able to demonstrate your interest in the role and working at Mott MacDonald through relevant experience, such as studying relevant modules, or previous work experience. We are looking for graduates with the following characteristics: * Methodical approach to problem solving. * Ability to use your initiative to undertake tasks efficiently and independently. * Excellent verbal communication skills, which allow you to confidently liaise with clients and team members. * Excellent written communication and attention to detail and be able to demonstrate accurate technical drawings and good report writing. * As we want the best people for the role, we support flexible working. Please ask us at interview stage about any flexibility you may need. As we want the best people for the role, we support flexible working. Please ask us at interview stage about any flexibility you may need. Mott MacDonald Ltd. are not currently offering sponsorship to candidates under the Skilled Worker visa route in the UK. This decision is as a consequence of the changes made to the Skilled Worker route by the UK Government in April 2024\. Our ethos is to develop, train and retain our graduates and therefore we are looking for a long\-term relationship with our graduates. For this reason, we cannot accept applications from candidates who would be working under the Graduate visa route or other time\-limited visas, (irrespective of visa duration), due to their temporary nature and the requirement for sponsorship under the Skilled Worker route in future. We continue to welcome applications from candidates who are eligible for alternative immigration routes in the UK, that do not require sponsorship as a Skilled Worker now or in future. **About Your Development** A graduate position should be more than just a job. We know this and so do you. That’s why with our graduate roles we aim to give you the experience and technical knowledge you need to progress your career. From the moment you join us, you’ll receive the training you need. You will be assigned a mentor, who will guide you to meet the objectives of your professional training needs. You will join our three\-year early careers soft skills development programme – Accelerating your Future, which is designed to give you the skills and tools necessary for a long\-lasting successful career here at Mott MacDonald. You will have the opportunity to make a difference; learn more about Our Purpose and the difference we can make! You’re probably wondering what else is on offer. Join us, and you’ll get: * Biannual salary reviews: we believe that hard work should be rewarded and recognised. Therefore, for the first three years of your career with us, you’ll have biannual salary reviews. * A competitive salary: in addition to biannual reviews, we will ensure that you’re given a salary that matches the current industry standard. * Contributory pension up to 7% of your salary: we have the best people on our team, and we like to look out for them. With our support, you’ll have all the advice and options you need to be able to invest in your future. * A flexible benefits scheme: our company is made up of a range of different people and we understand that different people want different things. That’s why with our flexible plan, you’ll have the ability to manage the range of benefits we have on offer, to suit your specific needs. * **Our social side** Being part of Mott MacDonald means more than just work; there’s a huge range of fun and exciting things that you can get involved in. From the moment you join us, you’ll have the opportunity to expand your social and professional network, whether it’s meeting other graduates or joining forces with other members of staff from around the company at our annual sports day. Each of our offices have a sports and social committee which will give you the chance to be part of a variety of sports, social and charity events. We’re committed to promoting a strong culture of social responsibility and encourage our staff to play active roles in the local community. It's worth noting that sports and social committees tend to vary from office to office, so as well as getting involved in what’s already on offer, don’t be afraid to suggest new events or initiatives that you think could be a great addition. It doesn’t stop there. As well as events, you’ll also have access to discounts on cinema tickets, travel, fashion, utilities and much more as part of our company benefits which you can take advantage of the moment you join. **Equality, diversity and inclusion** We put equality, diversity and inclusion at the heart of our business, seeking to promote fair employment procedures and practices to ensure equal opportunities for all. We encourage individual expression in our workplace and are committed to creating an inclusive environment where everyone feels they have the opportunity to contribute. **Agile working** At Mott MacDonald, we believe it makes business sense for you and your manager to choose how you can work most effectively to meet your client, team and personal commitments. We embrace agility, flexibility and trust. **More About Mott MacDonald** We’re a global engineering, management and development consultancy. Our purpose is to improve society by considering social outcomes in everything we do, relentlessly focusing on excellence and digital innovation, transforming our clients’ businesses, our communities and employee opportunities. A fundamental part of this is respecting each person’s differences and striving to meet their needs. Our values: progress, respect, integrity, drive, excellence Location(s): Dublin, IE Contract Type: Permanent Work Pattern: Full Time Market: Energy Discipline: Electrical Job Ref: 11653 Recruiter Contact: earlycareers.recruitment@mottmac.com",https://www.linkedin.com/jobs/view/4405111022
AI Analyst - Architecture,Marsh McLennan,"Dublin, D, IE",indeed,"**Company:** ------------ Marsh **Description:** ---------------- **What can you expect?** Marsh is a global leader in insurance broking and risk management, serving clients in over 130 countries. The AI Center of Excellence is a newly formed team with a singular mission: get emerging AI capabilities into the hands of Marsh engineers and business teams as fast as the technology landscape moves. We're looking for an Associate Architect who wants to help shape how AI is adopted across a global enterprise — from day one. You'll work alongside the Head of AI CoE and senior colleagues to evaluate emerging AI technologies, design integration patterns, and build the reference architectures that guide how Marsh adopts AI at scale. This is an architecture role, not a pure engineering role — but you'll need to get hands\-on with the technologies you're evaluating. You'll be expected to test things yourself, form your own technical opinions, and contribute to architecture decisions that most people don't get near until much later in their careers. **We will count on you to:** * **Contribute to AI platform architecture** — working with the rest of the AI CoE to design how AI capabilities fit together across Marsh's technology landscape * **Identify technologies for evaluation** — research emerging AI technologies (LLMs, memory systems, agentic frameworks, guardrails) and recommend which should come up for the next proof\-of\-concept * **Collaborate on proofs\-of\-concept** — pair with a software engineer on focused PoCs, contributing the architecture perspective: how does this technology integrate with what we have, and where we're going? * **Build reference architectures** — contribute to high\-level integration diagrams, reference architectures, and technology radar documents that guide AI adoption across the business * **Document architecture for humans and AI agents** — produce architecture documentation in formats that are useful to both human engineers and AI coding agents * **Present at architecture forums** — contribute to presentations at Marsh's Architecture Council, Dev Council, and business unit forums * **Understand the enterprise landscape** — learn Marsh's existing enterprise architecture so that your recommendations account for where we are today, not just where we want to be **What you need to have:** -------------------------- * A Batchelor's degree (Master's preferred) in computer science, software engineering, data science, information systems, or a related discipline * Up to 2 years of professional experience (including internships and placements) * Genuine interest in **system design and architecture** — you think about how things fit together, not just how to make them work in isolation * Strong intellectual curiosity and high standards — you actively track emerging technology, learn quickly, and care about doing excellent work * Familiarity with **cloud platforms** (AWS, Azure, or GCP) * Hands\-on comfort with **AI coding platforms and copilots** (GitHub Copilot, Claude Code, Cursor, or similar) and the modern languages they support * Strong communication skills, in writing and in person **What makes you stand out:** ----------------------------- * Experience with **AI/ML technologies** — even academic or personal projects involving LLMs, RAG, embeddings, or agent frameworks * Familiarity with **architecture documentation** approaches that are ready for consumption by AI agents as well as humans * Exposure to **enterprise architecture** concepts — understanding how large organisations structure their technology estates * Cloud architecture certifications (AWS Solutions Architect, Azure Solutions Architect, or similar) * Experience presenting technical content to peers or at meetups/conferences **What makes this role different:** ----------------------------------- * **You'll make architecture decisions early.** Most architects spend years as engineers before they get to influence system design. Here, you'll be contributing to architecture decisions from day one. * **You'll work with preview\-stage technologies.** Beta APIs, emerging frameworks, tools that don't have documentation yet. * **You'll be one of the first members of the AI CoE.** You'll help shape ways of working, documentation standards, and team culture as the team grows. * **You'll present to senior forums.** Architecture Council, Dev Council, business unit leadership — you'll be in the room, contributing to conversations that shape Marsh's technical direction. * **You'll have the tools you need.** Access to AI models, tools, tokens, and broader professional development opportunities. **Why join our team:** ---------------------- * We help you be your best through professional development opportunities, interesting work and supportive leaders. * We foster a vibrant and inclusive culture where you can collaborate with talented colleagues to create new solutions and have impact for colleagues, clients and communities. * Our scale enables us to provide a range of career opportunities. \#MMCIC Marsh (NYSE: MRSH) is a global leader in risk, reinsurance and capital, people and investments, and management consulting, advising clients in 130 countries. With annual revenue of over $27 billion and more than 95,000 colleagues, Marsh helps build the confidence to thrive through the power of perspective. For more information, visit corporate.marsh.com, or follow us on LinkedIn and X. ### **Marsh is committed to embracing a diverse, inclusive and flexible work environment. We aim to attract and retain the best people and embrace diversity of age, background, disability, ethnic origin, family duties, gender orientation or expression, marital status, nationality, parental status, personal or social status, political affiliation, race, religion and beliefs, sex/gender, sexual orientation or expression, skin color, Traveller community, or any other characteristic protected by applicable law. We are an equal opportunities employer. We are committed to providing reasonable support to any candidate with a disability/health condition to allow them to fully participate in the recruitment process. We welcome candidates to contact us at reasonableaccommodations@mmc.com to discuss any specific needs.** ### **Marsh is committed to hybrid work, which includes the flexibility of working remotely and the collaboration, connections and professional development benefits of working together in the office. All Marsh colleagues are expected to be in their local office or working onsite with clients at least three days per week. Office\-based teams will identify at least one “anchor day” per week on which their full team will be together in person.**",https://ie.indeed.com/viewjob?jk=057f6ccccdb4cf3c
APM MONACO Part Time Sales Associate -Dublin,APM Monaco,"Dublin, County Dublin, Ireland",linkedin,"**Description du poste** **COMPANY DESCRIPTION:** Influenced by Monaco and the South of France, APM Monaco is a contemporary and endearing fashion jewellery brand with a touch of Monegasque elegance. Named after its founder Ariane Prette, APM Monaco was created in 1982\. In 2012, the Prette family decided to focus on silver jewellery with a cutting\-edge design, while continuing to perpetuate Ariane's legacy. With over 400 points of sale already, APM Monaco is continuing to expand and has many plans to open new stores around the world. ***We're recruiting a Sales Associate in part\-time to join our team in the shop at Dublin !*** **Job description** * To achieve and exceed monthly and yearly sales target * To acquire, build and maintain an active and strong client relationship * To strive to be a customer service oriented to ensure a positive shopping experience * Be responsible and accountable of shop stocks inventory **Profile required:** * You love APM Monaco! * Track record of outstanding sales performance * Knowledge in other language in addition to English will be a plus * Teamwork spirit and proactive attitude",https://www.linkedin.com/jobs/view/4405999041
AWS Platform Engineer,Fruition Group Ireland,"Dublin, County Dublin, Ireland",linkedin,"**AWS Platform Engineer (CloudFormation)** **Daily Rate Contract (1 day onsite, Dublin City Centre) Ireland or UK** My Dublin based client is seeking an experienced AWS Platform Engineer with strong CloudFormation expertise to join its Cloud Centre of Excellence (CCoE) on a daily rate contract. This role supports a large, highly regulated organisation undergoing significant enterprise cloud transformation. You will play a key role in shaping, building and evolving a modern AWS\-native platform supporting business\-critical workloads at scale. Key Responsibilities * Platform engineering role focused on roadmap delivery and long\-term cloud capability uplift * Work across multiple strategic AWS platform initiatives * Drive cloud\-native innovation, including AI\-native and serverless capabilities * Apply deep AWS expertise within a structured, risk\-aware enterprise environment * Design, build and manage secure, scalable AWS infrastructure using CloudFormation (Infrastructure as Code) * Engineer and enhance a modern AWS cloud platform aligned to enterprise standards * Contribute to platform roadmap initiatives and continuous improvement * Design and deploy serverless and event\-driven architectures * Build AI\-native platform components using AWS managed services * Develop and optimise CI/CD pipelines (CodeBuild, CodePipeline, Step Functions) * Implement monitoring, logging and performance optimisation solutions * Embed DevOps and automation best practices * Drive cost optimisation and operational efficiency * Ensure alignment with security, regulatory and governance requirements * Promote reusable platform patterns and shared services Experience Required * Strong hands\-on AWS experience with deep knowledge of native services * Proven track record delivering resilient, highly available enterprise\-scale cloud platforms * Strong Infrastructure as Code expertise (CloudFormation essential) * Experience writing automation and tooling scripts (Python, Bash or similar) * Solid understanding of AWS networking, IAM, security and governance * Experience building and maintaining AWS\-native CI/CD pipelines * Experience operating in regulated or risk\-aware environments * Comfortable working in Agile teams within a Cloud Centre of Excellence Desirable * AWS Certifications (Solutions Architect, DevOps Engineer, Developer) * Experience building AI/ML\-enabled AWS platforms * Exposure to platform engineering concepts (self\-service infrastructure, reusable modules, internal developer platforms)",https://www.linkedin.com/jobs/view/4404697195
Accountant,GPC Finance,"Dublin, County Dublin, Ireland",linkedin,"Our client is looking for an Accounts Senior to join their medium\-sized accounting practice in Dublin. The ideal Accounts Senior will be meticulous and analytical, with deep knowledge of accounts practices. You will work as part of a team and help to mentor junior colleagues. **Responsibilities** * Prepare and present reports for clients and partners upon request. * Prepare and finalise audit and audit\-exempt financial statements. * Address various enquiries from clients, banks, Revenue, and assist with Revenue audits. * The Accounts Senior will mentor Trainees **Requirements** * The Accounts Senior will be ACCA/ACA Qualified. * Minimum 2 years of experience in an Irish accounting practice. * Strong understanding of Accounting and Auditing Standards. * Experience in operational supervision of assignments and managing client relationships. * Basic knowledge of tax is preferred. * Integrity and reliability. **Benefits** * Salary €55,000 \- €65,000 DOE * Hybrid working model with flexible hours * 25 days of annual leave * Onsite parking * Company events \& social committee * Wellbeing initiatives * Performance based bonus If you are an Accounts Senior looking for a new opportunity, please contact Andrew Hendrickx for more information. We do not send out your cv without your permission.",https://www.linkedin.com/jobs/view/4404688161
Air Freight Operations Graduate,DHL Global Forwarding,"Dublin, County Dublin, Ireland",linkedin,"**DHL Global Forwarding Graduate Programme 2026** **As a Graduate** , you’ll use your talents to create innovative solutions and shape the future across our business. Join a global network of passionate experts – backed by the latest technology, to develop your career to management level. The DGF Graduate Scheme places you in a variety of roles across our international Freight Forwarding business. Throughout the scheme you will be empowered to learn on the job and deliver real results. We offer a supportive culture in a highly engaged workforce and provide investment in your training to ensure that you get the most out of your graduate scheme. **What the scheme looks like:** 24‑month structured scheme A comprehensive operational development programme including exposure to: * Airfreight export documentation and compliance * Customer communication and relationship management * Booking management, transport scheduling and shipment coordination * End‑to‑end job file ownership support * Global network communication with DHL overseas offices * Air Cargo Security processes and Known Shipper checks * Performance and KPI management * Billing accuracy, invoicing support and cost checking * Exception management and incident reporting * Cross‑functional collaboration across Warehouse, Customer Service, Finance and Global Network teams You will develop gradually, starting with supported tasks and progressing toward independently handling export shipments. **Skills, Experience \& Educational Qualifications required:** * 2:1 or above degree (predicted or obtained) in Logistics, Supply Chain, Business, Transport Management, Aviation Management, or related discipline * Interest in airfreight operations, logistics and international trade * Motivation to develop a career within Freight Forwarding * Passion for excellent customer service and operational accuracy * Enthusiastic, open‑minded, with a strong ‘Can‑Do’ attitude * Confident communicator able to work with customers, carriers and global teams * Eligibility to work in Ireland * Fluent in English **Additional Personal Qualities:** * Strong attention to detail and accuracy in documentation and data handling * Organised, reliable and capable of managing time‑sensitive tasks * Calm under pressure when handling urgent shipments * Proactive problem‑solver who is eager to learn * Team‑oriented, respectful and collaborative * Willingness to learn operational systems, regulatory processes and SOPs **What do we offer?** The scheme will initially be a 24‑month Fixed Term Contract (FTC), with the aim that our Graduates move into a permanent position within the business – subject to a suitable vacancy being available and in line with the selection process for the role. **What will you get in return?** * Access to a variety of our excellent benefits, including 21 days’ holiday, bank holidays, service days, pension scheme, gym membership, discounted private healthcare, education assistance programme and family leave supports. * Early responsibility and fast progression. * Experience working within a fast‑paced environment. * Regular performance feedback and personal development planning. * Management Team Mentor and DGF Buddy. * Competitive salary. * You will be working for an accredited Top Employer and a certified Great Place to Work. **Location:** Dublin Based – Cedar Drive, Dublin Airport Logistics Park, St. Margaret’s, Co. Dublin **Hours:** 37\.5 hours per week **Closing:** TBC",https://www.linkedin.com/jobs/view/4405376856
Apprentice Electricians – All Year Groups (1st to 4th Year),TDE Group,"Kilcullen, KE, IE",indeed,"**Apprentice Electricians** TDE Group Ltd are currently hiring Apprentice Electricians across all year groups due to a strong pipeline of work across Dublin and Kildare. We are an electrical contractor working across commercial and fit\-out projects. We are looking for apprentices who want to learn the trade properly, gain real site experience, and be part of a solid team. **The role will involve:** * Installation of containment (tray, trunking, conduit) * Cable installation, including larger cable runs * Lighting and general power works * Exposure to data, fire alarm and security systems * Distribution board work depending on experience **Expectations by Year** **1st Year Apprentice** * Willingness to learn and take instruction * Good timekeeping and attitude * Assisting with containment install, cable pulling and general site duties **2nd Year Apprentice** * Understanding of containment systems * Confident using tools * Assisting with installs and cable runs under supervision * Understanding of circuits **3rd Year Apprentice** * Able to work with limited supervision * Good understanding of containment and cabling * Able to install tray, trunking and conduit to a good standard * Ability to read drawings **4th Year Apprentice** * Working to a near\-qualified level * Able to carry out work independently * Comfortable reading drawings and setting out * Assisting with second fix and supporting junior apprentices **We are looking for:** * Reliable and punctual individuals * Good attitude and willingness to learn * Ability to work as part of a team **Requirements:** * Safe Pass * Manual Handling * Driving licence **What we offer:** * Ongoing work on a range of commercial projects * Opportunity to gain real experience across different types of installations * Support from experienced electricians * Long\-term opportunities within a growing company If you are interested, please apply with your CV to Info@tdegroup.ie Job Type: Apprenticeship Pay: €19,000\.00\-€46,000\.00 per year Application question(s): * You must be able to travel for this role \- Do you have your own transport and licence? Work Location: In person",https://ie.indeed.com/viewjob?jk=f5687e7ece9e12f3
