title,company,location,site,description,job_url
Integration Engineer (Client facing),Stripe,"Dublin, County Dublin, Ireland",linkedin,"Who we are About Stripe Stripe is a financial infrastructure platform for businesses. Millions of companies—from the world’s largest enterprises to the most ambitious startups—use Stripe to accept payments, grow their revenue, and accelerate new business opportunities. Our mission is to increase the GDP of the internet, and we have a staggering amount of work ahead. That means you have an unprecedented opportunity to put the global economy within everyone’s reach while doing the most important work of your career. About the team Stripe’s Professional Services team works with our most strategic users. You will work on the highest visibility projects to provide technical expertise to our customers to help accelerate their knowledge, solution design and integrations with Stripe. This role is responsible for leading strategic conversations and developing plans that will transform the payments and financial infrastructure for leading enterprises. What you’ll do Responsibilities \* Plan and execute integration engineering end\-to\-end, from high\-level architecture down to code implementation. This includes conducting discovery sessions with users to understand their goals, parsing out specific use cases, and guiding users to implement high complexity integrations. * Think on your feet and communicate technical concepts, explaining how Stripe works from both a product feature and API architecture perspective. Manage user expectations on timelines and product changes. * Be the primary, ongoing technical point of contact for our largest users' and partners' technical teams. You will be responsible for resolving user integration issues and owning escalations for operational issues and priority requests. * Collaborate with Sales, Solution Architecture and Implementation teams to drive client engagement, customer wins, and revenue on behalf of the Professional Services team * Collaborate closely with Product and Engineering to proactively identify potential enhancements and new features based on feedback you’ll gather from the field. * Provide deep technical support and debugging, inspecting and understanding the Stripe codebase and thoroughly testing functionality to best advise users, while also building and demonstrating proof\-of\-concept integrations, creating user\-specific test plans, and answering ad\-hoc technical questions. * In some cases, lead ""Hands On Keyboard"" implementations for user engagements, providing material feedback on coding practices, CI/CD, and software architecture. * Review and optimize existing user integrations and provide recommendations to improve performance, reliability, and efficiency. * Build tools and analytics; create dashboards, run queries, and generate custom data reports to support user business reviews and operational needs. * Develop and share knowledge, building reusable processes to enable the larger Professional Services team. Who you are We’re looking for someone who meets the minimum requirements to be considered for the role. If you meet these requirements, you are encouraged to apply. The preferred qualifications are a bonus, not a requirement. Minimum requirements \* 4 years \+ experience in a Software Engineering / Integration Engineering role. * Ability to write code (in programming languages like Go, Java, C/C\+\+ etc.) and quickly debug user code snippets. * Comfortable with various code\-level debugging (Stripe code and user code) and using code as a tool for problem\-solving. * Strong generalist technical experience, including proficiency in SQL and an understanding of data structures and algorithms. * Understanding of the payments domain and API security topics. * Be comfortable talking about technical concepts, and explaining how Stripe works, both from a product features and API architecture perspective. * A user first approach \& empathy with our users, capable of mapping business requirements into reliable technical solutions. * Confident and comfortable with customers, with the ability to lead strategic technical conversations. Preferred requirements \* Enjoy the puzzle of solving open\-ended problems, both individually and as a member of our team. Willingness to learn and teach others, including mentoring newer team members. * Collaborative, communicative, consultative; able to apply specific methodologies to ensure repeatability of engagements. * Intellectually curious, with great problem solving skills. * Technical writing skills to document complex integration guidance and processes. In\-office expectations Office\-assigned Stripes in most of our locations are currently expected to spend at least 50% of the time in a given month in their local office or with users. This expectation may vary depending on role, team and location. For example, Stripes in Stripe Delivery Center roles in Mexico City, Mexico, Bengaluru, India, and Dublin, Ireland work 100% from the office. Also, some teams have greater in\-office attendance requirements, to appropriately support our users and workflows, which the hiring manager will discuss. This approach helps strike a balance between bringing people together for in\-person collaboration and learning from each other, while supporting flexibility when possible. Pay and benefits The annual salary range for this role in the primary location is €104,000 \- €156,000\. This range may change if you are hired in another location. For sales roles, the range provided is the role’s On Target Earnings (“OTE”) range, meaning that the range includes both the sales commissions/sales bonuses target and annual base salary for the role. This salary range may be inclusive of several career levels at Stripe and will be narrowed during the interview process based on a number of factors, including the candidate’s experience, qualifications, and specific location. Applicants interested in this role and who are not located in the primary location may request the annual salary range for their location during the interview process. Specific benefits and details about what compensation is included in the salary range listed above will vary depending on the applicant’s location and can be discussed in more detail during the interview process. Benefits/additional compensation for this role may include: equity, company bonus or sales commissions/bonuses; retirement plans; health benefits; and wellness stipends.",https://www.linkedin.com/jobs/view/4403157763
"Intern, Software Engineer",Autodesk,"Dublin, County Dublin, Ireland",linkedin,"**Job Requisition ID \#** 25WD92004 **Position Overview** At Autodesk, we’re reimagining what’s possible. As a global leader in 3D design, engineering, and entertainment software, we help people everywhere imagine, design, and create a better world. Right now, we’re transforming how our products work by moving to the cloud—opening up exciting opportunities for collaboration, innovation, and impact. What sets us apart isn’t just our technology, but our culture. At Autodesk, you’ll find an inclusive, supportive environment where early\-career talent can grow, be creative, and make real impact. It’s one of the reasons we’ve been consistently recognized by **Fortune, Forbes, and Glassdoor as a top place to work** . Over three months in our Summer 2026 Internship Program, you’ll gain hands\-on experience, mentorship, and opportunities to grow your engineering and domain expertise—while making real contributions to Autodesk’s design, manufacturing and construction technologies. Alongside technical growth, you’ll develop soft skills and build connections with other interns—locally in your office, regionally across EMEA, and globally—through programs designed just for interns. You’ll work with a team of Developer Advocates experts in a dynamic, supportive environment, collaborating on the definition and development of core technologies. Along the way, you’ll gain exposure to our exciting tech stack, which includes modelling, Design Data, AI \& DevOps tools. You will be working closely with the engineering team developing the core software building blocks on which current and future Autodesk products are being built. We are looking for someone who is enthusiastic about learning new technologies and to promote technologies to Autodesk partners. You are able to face new technologies and challenges and work in a dynamic and collaborative environment with some very passionate and awesome people. If you’re an innovative and fun team player, who strives to learn and improve, you’ll fit right in. We are a global team, and you will collaborate with a variety of people and teams from around the world. Take an active role in writing code samples, work on proof of concept using rapid prototyping principles and present technology in various events. Produce high quality readable code, covered with tests, and participate in code reviews. Continuously learn and improve your coding and design skills. **Several potential projects are available,** and we’ll assign you to the one that best aligns with your **interests and skills** , ensuring the role is tailored to you while giving you meaningful, impactful work. **Responsibilities** * Prototype, implement, and maintain production software components and cloud services. * Collaborate with experienced engineers to design, plan, develop, refactor, test, deliver, and maintain complex features across desktop, cloud and web components. * Participate actively in Agile development using LEAN methodology as a member of a scrum team. * Gain hands\-on experience with commercial development processes used at Autodesk. * Collaborate with engineering mentors to define project scope and milestones. * Present progress and final outcomes to internal stakeholders. **Minimum Qualifications** * Currently enrolled as an active student in a degree program. * Predicted First or Upper Second\-Class degree in STEM Field (e.g., Computer Science, Mathematics, Engineering, Physics) * Please include your estimated graduation year and month in your application. * Familiarity with AI/ML concepts, APIs, and agent frameworks. * Experience with databases, REST/JSON\-RPC APIs, or web development is a plus. * Passion for developer tools, open\-source, and AI innovation. **The Ideal Candidate** * Interest in design, 3D modelling or geometry, and technology. * Experience in any programming language such as .NET, and/or Typescript. * Experience in Python for AI. Learn More **About Autodesk** Welcome to Autodesk! Amazing things are created every day with our software – from the greenest buildings and cleanest cars to the smartest factories and biggest hit movies. We help innovators turn their ideas into reality, transforming not only how things are made, but what can be made. We take great pride in our culture here at Autodesk – it’s at the core of everything we do. Our culture guides the way we work and treat each other, informs how we connect with customers and partners, and defines how we show up in the world. When you’re an Autodesker, you can do meaningful work that helps build a better world designed and made for all. Ready to shape the world and your future? Join us! **Salary transparency** Salary is one part of Autodesk’s competitive compensation package. Offers are based on the candidate’s experience, educational level, and geographic location. **Diversity \& Belonging** We take pride in cultivating a culture of belonging where everyone can thrive. Learn more here: https://www.autodesk.com/company/diversity\-and\-belonging",https://www.linkedin.com/jobs/view/4371753195
Investment Analyst - Investor Development Programme,National Treasury Management Agency,"Dublin, County Dublin, Ireland",linkedin,"**Necessary arrangements can be made at interview stage to accommodate the needs of candidates with disabilities. If you are having difficulty uploading your CV online or in fully accessing any information on this site please email** **Role Profile** **Investment Analyst \- Investor Development Programme** **Job title: Investment Analyst** **Division: Ireland Strategic Investment Fund (ISIF)** **Reports to: Investment Manager** **Contract: 3 Year FTC** * Closing Date for Applications: Wednesday, 29th April 2026\*\* **Summary Of The Business** The National Treasury Management Agency (NTMA) provides asset and liability management services to the Irish Government. It has evolved from a single function agency managing the National Debt to a manager of a complex portfolio of public assets and liabilities. Businesses managed by the NTMA include borrowing for the Exchequer and the management of the National Debt, the State Claims Agency, the New Economy and Recovery Authority (“NewERA”), the Ireland Strategic Investment Fund, National Development Finance Agency and the NTMA Future Ireland Funds business unit with responsibility for the management of the Future Ireland Fund and Infrastructure, Climate and Nature Fund. The NTMA also assigns staff to the National Asset Management Agency, the Strategic Banking Corporation of Ireland (SBCI) and Home Building Finance Ireland (HBFI). Working at the NTMA offers excellent benefits, including: * Career average Defined Benefit Pension Scheme * Flexible work options, including hybrid working (3 day per week on site required) and variable work hours * An extensive wellbeing programme * Excellent learning and development opportunities that allow for full career development within the organisation * A diverse range of initiatives: LGBT\+, Gender Matters, Disability Awareness, Sports \& Social, Volunteering, and lots more * Reimbursement of annual professional membership fees ISIF is Ireland’s sovereign development fund which invests on a commercial basis in a manner designed to support economic activity and employment in Ireland. ISIF’s strategy focuses on four key investment themes: Climate \& Energy, Housing and Enabling Investments, Indigenous Businesses, and Food and Agriculture. ISIF invests across a variety of sectors, instruments (e.g. equity or debt) and asset classes (e.g. venture capital, private equity). See www.isif.ie for more detail. **Role Summary** ISIF is seeking to hire up to four Investment Analysts, which provides a unique opportunity for talented and motivated individuals to join a team tasked with the delivery of ISIF’s investment strategy and to gain exposure to the highest standards of the investment management industry. It is an ideal opportunity for high\-calibre candidates with some professional experience to either transition into an investment\-focused role or to further develop their investment skills and experience in a sovereign fund with a broad focus. The role will offer exposure to a broad range of industries and asset classes, including venture capital, growth equity, private equity and private credit. The role will have a high level of investment exposure from the outset, and successful candidates can expect to be an integral member of a team focused on one of ISIF’s four priority areas (i.e. Climate \& Energy, Housing and Enabling Investments, Indigenous Businesses, and Food and Agriculture). If you have a strong preference for any particular area, please note that when applying for the role. In addition to on\-the\-job training and experience, successful candidates will benefit from ISIF’s Investor Development Programme which is designed to provide training and development opportunities to support their professional and personal development. This is expected to include participation in internal and external training courses on relevant finance and investment matters, personal development opportunities and an ability to participate in or leverage the training opportunities made available by global asset managers or banks that ISIF has relationships with. ISIF’s Investor Development Programme will be three years in duration and successful candidates will join ISIF on a three\-year fixed\-term contract. All members of the ISIF team are required to remain flexible to respond to the dynamic nature of the ISIF mandate – this may require team members to apply their skills to other types of investment, outside of their core areas of responsibility, from time to time. **Principal Accountabilities** The candidate will be required to work alongside other Investment Analysts, Managers and Directors across the full range of the ISIF’s investment activities. The principal responsibilities will include: * Due diligence and the preparation of investment committee materials for new investments * Industry and company research and analysis * Financial analysis, including assisting with financial modelling and valuations as required, to support the evaluation of investment opportunities * Engaging with third\-party advisors (including on their appointment and scope) * Project management of deal execution * Working collaboratively with clients, co\-investors, advisers and internal stakeholders to create, execute and/or manage investments **Experience** The role is open to all talented and motivated individuals interested in transitioning into an investment role or further developing their skills in that area. The ideal candidate will likely have 2 to 4 years of professional experience. Working in corporate finance, investment appraisal or experience of commercial or financial due diligence will be a distinct advantage. **Knowledge** The ideal candidate will: * Have a third level qualification in Finance, Economics, Accounting, Scientific, Engineering or a related discipline * Demonstrate a keen and well\-informed interest in investment and/or in developing knowledge and expertise in investment **Skills** * Excellent overall academic profile with a desire to pursue professional qualifications * Diligent, self\-motivated and proactive * Displays a high level of accuracy, efficiency and attention to detail in all aspects of work * Excellent communication skills, with the ability to convey complex information clearly and concisely, both verbally and in writing * Strong IT proficiency, including in Microsoft Office (Excel, Word, PowerPoint) * Strong interpersonal skills and the ability to work within a small team * Ability to manage a range of tasks across several stakeholders in a professional manner **Pension Abatement** If an appointee has previously been employed in the Civil or Public Service and that appointee is entitled to or in receipt of a pension from the Civil or Public Service or where a Civil/Public Service pension comes into payment during the appointee’s re\-employment that pension will be subject to abatement in accordance with Section 52 of the Public Service Pensions (Single Scheme and other Provisions) Act 2012\. Please note: In applying for this position, you are acknowledging that you understand that the abatement provisions, where relevant, will apply. It is not envisaged that the employing Department/Office/Body will support an application for an abatement waiver in respect of appointments to this position. Applicants will be required to complete a pre\-employment declaration to confirm whether they have previously availed of a Public sector pension scheme. The NTMA is proud to be an equal opportunities employer. We recognise that a diverse and inclusive workplace informs better decision making, creative thinking, innovation and drives business performance. We are strongly committed to ensuring that our workforce is representative of our society. Necessary arrangements can be made at interview stage to accommodate the needs of candidates with disabilities. If you are having difficulty uploading your CV online or in fully accessing any information on this site please email recruitment@ntma.ie **The NTMA is proud to be an equal opportunities employer. We recognise that a diverse and inclusive workplace informs better decision making, creative thinking, innovation and drives business performance. We are strongly committed to ensuring that our workforce is representative of our society.**",https://www.linkedin.com/jobs/view/4400472211
Investment Corporate Actions Representative III/Associate Analyst,Fidelity Investments,"Dublin, County Dublin, Ireland",linkedin,"**Job Description** **Corporate Actions Analyst – Income \& Class Actions.** **Location: Dublin** Perform daily tasks associated with the processing and reconciliation of voluntary and mandatory corporate actions, as well as research Class Action cases. Process corporate actions promptly and correctly with policies, procedures, and regulations. Interact with various groups across the organization as well as external vendors and business partners. The **Expertise** We’re Looking For * 1\-2 years of relevant Financial Services experience. * Mandatory and Voluntary Corporate Actions processing experience preferable. * Bachelor’s Degree or equivalent work experience. The **Purpose** of Your Role * Conduct and keep track of corporate action activities. * Conduct processing of all types of corporate action events, both voluntary and mandatory. * Facilitate the confirmation and settlement of security and currency transactions and provide daily cash estimates. * Coordinate corporate action executions, ensure the collection of income to the funds, resolve position differences, and facilitate securities lending activities. * Assist the team with corporate action research and process tasks related to assets under management. * Collaborate with stakeholders on issues and continuously follow up to resolve them. * Escalate high\-risk items or seek assistance to mitigate loss. * Develop the knowledge required to grasp product and processing rules while working under the direction of more experienced colleagues. * Display a strong sense of teamwork. * Explore and communicate new ways of improving existing processes. The **Skills** You Bring * Your knowledge of the key elements of Corporate Actions processing * Your knowledge of the Custody industry, Fund Accounting and Mutual Fund Operations * Your ability to manage multiple tasks effectively * Your ability to identify and escalate high risk items * Your strong written and verbal communications skills * Your time management skills * Your analytical and problem\-solving skills * Your Innovative mindset – you look for new ways to improve current processes and develop creative solutions. The **Value** You Deliver * Responsibility for high quality processing of Mandatory and Voluntary corporate actions * Managing the communication of complex corporate actions to internal stakeholders * Interacting with many groups within the Fidelity organization and effectively representing the business to customers and business partners * Escalating issues appropriately * Demonstrating a strong team\-work ethic How Your Work **Impacts** the Organization The Global Middle Office acts as a servicing centre for FMR Co.'s trading desks globally, facilitating the confirmation and settlement of security and currency transactions with brokers and custodian banks, and providing daily cash estimates to Trading. It is also responsible for coordinating corporate action executions, ensuring the collection of income to the Funds, resolving position differences and facilitating securities lending activities. **Company Overview** At Fidelity, we are focused on making our financial expertise broadly accessible and effective in helping people live the lives they want. We are a privately held company that places a high degree of value in creating and nurturing a work environment that attracts the best talent and reflects our commitment to our associates. Fidelity established an Ireland presence in 1996 and we currently employ 1000 staff across IT and shared services, with offices in Dublin (City West) and Galway (Parkmore East). For information about working at Fidelity, visit www.fidelityinvestments.ie. Fidelity Investments is an equal opportunity employer. **Category** Investment Operations",https://www.linkedin.com/jobs/view/4390010730
