title,company,location,site,description,job_url
SaaS Operations Engineer,Stripe,"Dublin, County Dublin, Ireland",linkedin,"Who we are **About Stripe** Stripe is a financial infrastructure platform for businesses. Millions of companies—from the world’s largest enterprises to the most ambitious startups—use Stripe to accept payments, grow their revenue, and accelerate new business opportunities. Our mission is to increase the GDP of the internet, and we have a staggering amount of work ahead. That means you have an unprecedented opportunity to put the global economy within everyone’s reach while doing the most important work of your career. **About The Team** The Core Applications team at Stripe owns, integrates, administers and maintains the systems that keep Stripe running smoothly (Google Workspace, Slack, Jira, Confluence and Dropbox, etc). Your work will connect Stripes from around the world and contribute directly to the company’s mission of increasing the GDP of the internet. As a SaaS Operations Engineer on the Core Applications team, you will play a critical role across our entire portfolio of third party applications, running both in the cloud and on premise. You'll enable all Stripes to work better together: more efficiently, productively, and collaboratively, while maintaining Stripe's high security bar. What you'll do You will act as the service owner for multiple company\-wide SaaS applications. You will act as a solutions architect and strategist for the SaaS applications and services that Stripe relies upon. You will take action on escalations from our partner teams. You will participate in an on\-call rotation. You will work in two week Sprints. **Responsibilities** * Act as a final escalation point from Helpdesk agents for issues with CoreApps owned systems * Integrate (and support efforts to integrate) SaaS applications with other parts of Stripe’s corporate technology stack * Partner with teams across Stripe to transition ownership of SaaS applications into the Corporate Technology organization * Lead projects to audit and optimize our SaaS portfolio, focusing on improvements to security, permissions, automation, scalability, end\-user experience, and license usage * Participate in renewal conversations with our vendor partners * Develop programs or processes to communicate and drive adoption of new product features company\-wide * Participate in regular interviews with our user population to understand pain points, and use their feedback as an input into our strategic roadmap * Design creative solutions, advocate for best practices, and lead by example as a service owner as Stripe evolves and scales in complexity * Help grow and mentor others in the corporate technology organization * Participate in an on\-call rotation **Minimum Requirements** * 5\+ years of relevant technical experience in system administration or engineering * Expertise managing Google Workspace and other enterprise productivity applications (e.g., Slack / Zoom / Jira / Confluence) * Strong organizational and task management skills * Excellent communication and collaboration skills, both written and verbal * An empathetic, humble, and user\-focused demeanor **Preferred Qualifications** * Experience working with REST API endpoints using various authentication methods (OAuth, JWT, API keys/secrets, Basic auth, etc.) * Expertise with Workplace Management applications (e.g., Envoy, Robin, Zoom, etc.) * Google or Slack Admin and / or Developer Certification * Experience with GCP and / or Azure ^ * Ability to plan, manage, code, and support multiple, concurrent projects and initiatives * Comfort working in a fast paced and rapidly changing environment * Proficient in either Python, Javascript or Go Hybrid work at Stripe This role is available either in an office or a remote location (35\+ miles or 56\+ km from a Stripe office). In\-office expectations Office\-assigned Stripes spend at least 50% of the time in a given month in their local office or with users. This hits a balance between bringing people together for in\-person collaboration and learning from each other, while supporting flexibility about how to do this in a way that makes sense for individuals and their teams. Working remotely at Stripe A remote location is defined as being 35 miles (56 kilometers) or more from one of our offices. While you would be welcome to come into the office for team/business meetings, on\-sites, meet\-ups, and events, our expectation is you would regularly work from home rather than a Stripe office. Stripe does not cover the cost of relocating to a remote location. We encourage you to apply for roles that match the location where you currently live or plan to live. Pay and benefits The annual salary range for this role in the primary location is €92,000 \- €138,000\. This range may change if you are hired in another location. For sales roles, the range provided is the role’s On Target Earnings (“OTE”) range, meaning that the range includes both the sales commissions/sales bonuses target and annual base salary for the role. This salary range may be inclusive of several career levels at Stripe and will be narrowed during the interview process based on a number of factors, including the candidate’s experience, qualifications, and specific location. Applicants interested in this role and who are not located in the primary location may request the annual salary range for their location during the interview process. Specific benefits and details about what compensation is included in the salary range listed above will vary depending on the applicant’s location and can be discussed in more detail during the interview process. Benefits/additional compensation for this role may include: equity, company bonus or sales commissions/bonuses; retirement plans; health benefits; and wellness stipends. Hybrid work at Stripe This role is available either in an office or a remote location (35\+ miles or 56\+ km from a Stripe office). In\-office expectations Office\-assigned Stripes spend at least 50% of the time in a given month in their local office or with users. This hits a balance between bringing people together for in\-person collaboration and learning from each other, while supporting flexibility about how to do this in a way that makes sense for individuals and their teams. Working remotely at Stripe A remote location is defined as being 35 miles (56 kilometers) or more from one of our offices. While you would be welcome to come into the office for team/business meetings, on\-sites, meet\-ups, and events, our expectation is you would regularly work from home rather than a Stripe office. Stripe does not cover the cost of relocating to a remote location. We encourage you to apply for roles that match the location where you currently live or plan to live.",https://www.linkedin.com/jobs/view/4403148906
Sales Associate,Ralph Lauren,"Kildare, KE, IE",indeed,"**Ref\#:** W176440 **Department:** Retail **City:** Kildare **State/Province:** Kildare **Location:** Ireland **Company Description**Ralph Lauren Corporation (NYSE:RL) is a global leader in the design, marketing and distribution of premium lifestyle products in five categories: apparel, accessories, home, fragrances, and hospitality. For more than 50 years, Ralph Lauren's reputation and distinctive image have been consistently developed across an expanding number of products, brands and international markets. The Company's brand names, which include Ralph Lauren, Ralph Lauren Collection, Ralph Lauren Purple Label, Polo Ralph Lauren, Double RL, Lauren Ralph Lauren, Polo Ralph Lauren Children, Chaps, among others, constitute one of the world's most widely recognized families of consumer brands. At Ralph Lauren, we unite and inspire the communities within our company as well as those in which we serve by amplifying voices and perspectives to create a culture of belonging, ensuring inclusion, and fairness for all. We foster a culture of inclusion through: Talent, Education \& Communication, Employee Groups and Celebration. **Position Overview** **WHAT WE OFFER** * The opportunity to work for an iconic and unique lifestyle brand * Exciting career opportunities * Competitive benefits package and discounts * An environment where you can bring your whole self to work **Essential Duties \& Responsibilities** **WHAT YOU'LL DO** **One team focused on the consumer** * Deliver an extraordinary customer experience to drive sales * Communicate consistently with the team to ensure an excellent customer service * Provide product and customer feedback to managers **Ralph Lauren Brand Ambassador** * Provide a welcoming and elevated experience * Embody the Ralph Lauren values and spirit * Demonstrate a customer\-first culture **Operations** * Use the Ralph Lauren store systems and procedures to enhance selling efficiencies and to build the customer data\-base * Maintain established operational and merchandising store standards * Store maintenance **Experience, Skills, and Knowledge** **WHAT YOU ARE** * Energetic, passionate, and results\-driven team player * Experience in a fast\-paced environment * Excellent communication skills",https://ie.indeed.com/viewjob?jk=369845453709db4e
Sales Consultant - Full Training Provided,Archer Recruitment,"Dublin, County Dublin, Ireland",linkedin,"**Junior Sales Consultant – Full Training \& Fast\-Track Career Growth** **Ambitious? Driven? Ready to break into recruitment and build a career with real impact?** This is your opportunity to join a high\-performing business development team within one of Dublin’s specialist IT recruitment consultancies. We’re looking for someone hungry to learn, motivated to succeed, and eager to grow into a key player in our expanding business. From day one, you’ll be immersed in a dynamic environment working alongside experienced consultants, learning proven strategies, and making a tangible impact. With full training, ongoing mentorship, and clear progression, this role is the perfect launchpad for a successful sales career. **What You’ll Do** * Drive new business development and expand existing client relationships * Build strong partnerships with clients across Ireland and international markets * Identify opportunities, prospect potential clients, and generate new leads * Book and lead client meetings with decision\-makers * Negotiate terms and close high\-value deals * Consistently hit (and exceed) sales targets and performance KPIs * Play a key role in the growth of a thriving, ambitious consultancy **What We’re Looking For** * 9–12 months of sales experience (B2B preferred) * Proactive, goal\-oriented, and eager to take initiative * Strong communication skills with confidence engaging clients at all levels * A resilient, results\-driven mindset with the ambition to succeed in a fast\-paced industry **What You’ll Get** * **Full training \& mentorship** – structured development from industry experts * **Onsite collaboration** – learn and grow daily with a supportive, energetic team * **Clear progression path** – opportunities to advance quickly into senior and leadership roles * **Vibrant culture** – work hard, celebrate success, and be part of a close\-knit team driving growth For more information, Contact **Saoirse Lawton** at \+353 (0\)1 649 8517 or email **saoirse.lawton@archer.ie**",https://www.linkedin.com/jobs/view/4402994269
Security Assurance Analyst,Primark,"Dublin, County Dublin, Ireland",linkedin,"Because we strive to put people first. Culture, our way. Technology at Primark What’s a career at Primark all about? The positive impact you’re making, the experiences you’re having and the people you’re with. You’re our inspiration. Embrace what sets you apart, own your career and develop in ways you never expected. Leave your mark. And do it your way. Our technology team is actively shaping the next wave of advancements. Engaged with innovative initiatives, your expertise will propel our business into the future. Collaborating with a creative team of tech enthusiasts, you’ll contribute your unique skills to fuel our technological advancements. What You’ll Do as a Security Assurance Analyst In your role, you’ll collaborate with different people across a range of skillsets. Here’s a flavour of your day\-to\-day: * Support assurance activities by conducting project and third‑party reviews, helping identify risks in project delivery and in the security posture of new and existing vendors. * Maintain key repositories and tools, ensuring items like the Supplier Register, Project Assurance lists, and the Third‑Party Risk Management tool are complete, accurate, and up to date. * Coordinate penetration testing logistics, ensuring tests are scheduled, arranged, and supported, with all required inputs and communications in place. * Ensure project compliance, supporting project managers in completing required documentation on time and confirming all security controls are implemented before go‑live. * Manage third‑party documentation, including collecting and reviewing SOC, PCI, and ISO 27000 certifications, and flagging outdated or missing information to vendors. * Support risk tracking, collaborating with the Risk Management team to ensure all third‑party risks are accurately captured, monitored, and kept current in the GRC tool. People are at the heart of what we do here, so it’s essential we provide you with the right environment to perform at your very best. Let’s talk lifestyle: Healthcare, pension, and potential bonus. 27 days of leave, plus bank holidays and if you want, you can buy 5 more. Because Primark is all about tailoring to you, we offer Tax Saver Tickets, fitness centre, and a subsidised cafeteria. **What You’ll Bring** Here at Primark, we want everyone to feel valued – so please bring your authentic self to work, of course with some other key experience and abilities for this role in particular: * Strong security and risk management expertise, including hands‑on experience with GRC tools (e.g., OneTrust), TPRM modules, and the ability to analyse third‑party risks based on service offering, security posture, supporting evidence, and relevant security certifications (ISO27K, Cyber Essentials). * Solid understanding of security frameworks and regulations, including ISO, NIST, GDPR, and PCI, with the ability to interpret their impact on project requirements and third‑party assurance activities. * Knowledge of project delivery methodologies, such as Waterfall and Agile, combined with a clear understanding of security‑by‑design principles and how to embed them into project lifecycles. * Penetration testing awareness, including knowledge of testing approaches and experience advising projects on remediation measures following test results. * Strong analytical, organisational, and data skills, demonstrated through attention to detail, ability to present data effectively, and experience using data analytics tools like Power BI. * Relevant professional background and qualifications, including a minimum of 3 years in an Information Security role with a focus on security assurance, an appropriate degree or equivalent qualification, and desirable experience working on accreditation projects (ISO27K, PCI, Cyber Essentials). Does this sound like you? Great, because we can’t wait to see what you’ll bring. You’ll be supported within a team of equally capable people, celebrating who you are and aiding you reach your potential. At Primark, we’re excited about our future \- and we’re excited to develop yours. **About Primark** At Primark, people matter. They’re the beating heart of our business and the reason we’ve grown from our first store in Dublin in 1969 to a £9bn\+ turnover business and over 80,000 colleagues and over 440 stores in 17 countries today. Our values run through everything we do. In essence, we're Caring and always strive to put people first. We're also Dynamic, bravely pushing the boundaries to stay ahead. And finally, we succeed Together. If you need any reasonable adjustments or have an accessibility request, during your recruitment journey, such as extended time or breaks between online assessments, a sign language interpreter, mobility access, or assistive technology please contact your talent acquisition specialist. All offers of employment are subject to background checks, including right to work, reference education and for some roles criminal, and financial checks. If you have any concerns, please reach out to our talent acquisition team to discuss. Our fashion isn’t one\-size\-fits\-all and neither is our culture. Primark promotes equal employment opportunity, we strive to create an inclusive workplace where people can be themselves, access opportunities and thrive together. **REQ ID:** JR\-6759",https://www.linkedin.com/jobs/view/4390398814
Site Foreman,Elite Groundworks,"Ashbourne, MH, IE",indeed,"**Elite Ground Works** is a well established Company, delivering work of high quality across a range of residential and commercial projects. We pride ourselves on professionalism, reliability and maintaining a thriving working culture. As our business expands across multiple areas within the **Dublin \- this role is in relation to a DATA Centre project in Ashbourne, Meath Region**, we are looking for skilled and dependable Working Foreman / Site Supervisors to join \& lead our crew. This is a great opportunity to be part of a company that values hard work, safety and getting the job done to the highest standard. Requirements: * Valid Safe pass, Manual Handling Certificates (CIF Supervisor Safety an advantage) * All relevant PPE ( safety boots, hardhat, hi\-vis etc) * Proven Experience as a working foreman or similar supervisory role in construction. * Strong Leadership and Communication Skills. * Knowledge of Health \& Safety practice's and construction regulations. * Ability to manage teams and coordinate multiple tasks effectively. * Ability to read and interpret technical drawings and specifications * Strong attention to detail and a proactive hands \- on approach * Relevant qualifications in Construction, Trades, or proof of skill are all an advantage. What we Offer : * Competitive Salary * Stable, long term opportunity with a reputable contractor * Opportunities to work on significant projects * Supportive team environment with career development prospects * Engagement with reputable construction companies and opportunities to build connections. If you are ready to take the next step in your construction career and have the skillset we are looking for apply now for Elite Ground Works Job Type: Full\-time Pay: €30\.00\-€35\.00 per hour Expected hours: 50 per week Additional pay: * Overtime pay * Performance bonus * Yearly bonus Schedule: * 10 hour shift * Day shift * Monday to Friday * Overtime * Weekend availability Pay: €32\.00\-€35\.00 per hour Benefits: * Bike to work scheme * Company events * On\-site parking Ability to commute/relocate: * Ashbourne, County Meath: reliably commute or plan to relocate before starting work (required) Language: * Fluent English (preferred) Licence/Certification: * Safepass Card / Manual Handling (preferred) Work Location: In person",https://ie.indeed.com/viewjob?jk=47222460494d1995
Site Reliability Engineer,Prism Digital,,linkedin,"**Site Reliability Engineer \| SRE, Cloud \& Incident Management \| Mission\-Critical Platforms \| Global HealthTech** * Hybrid \- 4 days onsite, 1 day from home * €90,000 – €100,000 base \+ bonus **The Role:** You will lead the response to high\-severity, customer\-impacting incidents across a global managed services platform. This is a hands\-on incident leadership role, acting as the central point of coordination during major outages to ensure fast resolution, clear communication and minimal impact. You will operate in an SRE\-led environment, combining real\-time incident management with ongoing reliability improvements. You will work across engineering, cloud and support teams to manage incidents end\-to\-end and drive post\-incident improvements to prevent recurrence. The role includes a paid on\-call rotation (1/9 weeks), with incidents relatively infrequent, the focus is on being ready when it matters. **What They're Looking For:** * Major incident management experience (P1/P2 incidents) * SRE, production operations or service reliability background * Experience in 24/7, mission\-critical environments * Strong understanding of incident, problem and change management (ITIL) * Experience with cloud platforms (AWS, Azure or GCP) * Experience with incident tooling (ServiceNow, Jira, PagerDuty) * Strong stakeholder communication (including senior leadership) * Ability to lead under pressure and make clear, structured decisions **What You’ll Work With:** * AWS / Azure / GCP * Kubernetes environments * ServiceNow / Jira / PagerDuty * Observability tooling (Grafana, Prometheus, Datadog, Splunk) * Cloud monitoring tools (CloudWatch) * SRE practices (SLIs, SLOs, error budgets) * Runbooks and incident playbooks * High\-availability, distributed systems **Core Responsibilities:** * Lead end\-to\-end management of major incidents (P1/P2\) * Act as Incident Commander during live incidents * Coordinate across engineering, SRE, cloud and support teams * Deliver clear, timely updates to stakeholders and customers * Manage executive\-level communication during critical events * Drive post\-incident reviews and root cause analysis (RCA) * Ensure corrective and preventative actions are defined and tracked * Identify patterns, trends and repeat issues for improvement * Improve incident processes, tooling and runbooks * Ensure incidents meet SLA and regulatory requirements * Maintain audit\-ready documentation and reporting * Participate in on\-call rotation and incident simulations **Examples of the work:** * Leading response to critical outages across cloud platforms * Coordinating multi\-team incident resolution under time pressure * Communicating with senior stakeholders during live incidents * Running post\-mortems to prevent repeat failures * Improving incident response processes and automation * Identifying reliability gaps across a 24/7 platform **Why Join?** You will join a team responsible for mission\-critical platforms where reliability is non\-negotiable. This role sits at the centre of operations, giving you visibility across engineering, cloud and customer environments. You will have real ownership over how incidents are handled and how the platform improves over time. The business is also investing heavily in its cloud and managed services capability, making this a strong opportunity to step into a role with long\-term growth and impact. **Employee Benefits:** * 12\.5% annual bonus * Paid on\-call allowance and call\-out compensation * Clear progression as the Ireland function scales * High\-impact role with exposure to global teams and leadership **Site Reliability Engineer \| SRE, Cloud \& Incident Management \| Mission\-Critical Platforms \| Global HealthTech**",https://www.linkedin.com/jobs/view/4400418768
