title,company,location,site,description,job_url
Project Client Representative,Blackrock Health,"Dublin, County Dublin, Ireland",linkedin,"**Job Title: Project Client Representative** **Reports to: CEO with dotted line to Group Head of Facilities** **Location: Blackrock Clinic, Rock Road, Co: Dublin, A94 E4X7** **Job Type: Permanent** **Hours: 39 hours per week** **Role Purpose:** Blackrock Health, Blackrock Clinic are commencing an internal refurbishment project on the lower ground floor of the hospital building to include Theatre stores, mortuary, clinical changing, DOSA, Recovery, theatre changing, local switch room , Theatre 5 and the addition of a new operating theatre in the existing Eye centre location, together with its associated ventilation plant room located on the roof of the existing Curium/ Nuclear medicine plant room. In addition, Blackrock Clinic will commence construction of a two\-storey extension located on the roof of the Central Decontamination unit which will include an expanded Cardiology department, refurbishment of existing Cardiology department locations on the ground floor and the addition of patient bedrooms on the East elevation of level 1 together with associated plant room to provide mechanical and electrical services to the extension. Blackrock Clinic will also commence the relocation of the hospitals main entrance from Rock Road to a new location to include a 3\-lane entrance from Rock Road and associated modifications to car parking and car parking equipment. Blackrock Clinic plan to demolish the Seafort and Glenalla buildings and install a modular building on that site to accommodate the decanting of departments currently located in St Catherine’s building to allow a major expansion of the hospital onto the St Catherine’s site. We are currently looking for a Project Manager, acting on behalf of Blackrock Health to manage the projects, including the Design Team and other external parties associated with the project. **Qualifications/Experience:** * Engineering qualification * At least eight years’ satisfactory \& relevant experience in project management or project controls management within large infrastructure projects / programmes, as relevant to this role. * A significant track record and direct experience of successfully delivering construction programmes/projects (healthcare is desirable). * Significant experience in change management and process implementation as they are adapted throughout the project lifecycle to suit the programme needs. * Extensive and relative experience managing and working collaboratively with multiple internal and external stakeholders, as relevant to this role. **Key Responsibilities:** * Co\-ordinate response / communication between Hospital stakeholders and the Project Manager. * Investigate potential risks to the Hospital normal operation associated with the construction project, some common examples: * Infection Control / Aspergillus risks associated with internal / external works and possible requirement for alternative HEPA filtered air in high\-risk operational areas. * Noise / vibration control requirements associate with normal occupancy and sensitivity of medical equipment to vibration. * Risk to Utility disruption, including Electricity, Gas, Water and Communications. * Break\-in to existing services that may require a shutdown of those services and contingency requirements. * Monitor the environmental / utility requirements associated with specialist medical / other equipment included within the project scope to ensure the Design Team is fully briefed for compatibility within the existing infrastructure \+ design. Advise if detailed investigation is required. * Assist the Mechanical and Electrical consultant to advise on the overall effect that the intended project will have on the existing utilities infrastructure, and if any of the existing utilities will be stretched beyond acceptable limits to keep the utilities service within safe parameters. * Ensure that the Design Team aware of existing utility infrastructure to assist in informing Design Team constraints. * It is expected that all new / refurbishment design will conform with Hospital HBN’s \+ HTM's. If compliance is not achievable, then the Design Team will submit a derogation proposal. The Client Representative will assist the Hospital in understanding the risks, if any, associated with the proposal and co\-ordinate the response to the Design Team and PM. * Co\-ordinate between the Design Team and Hospital in the selection of finishes, room data sheets, including the Hospital Infection Control Manager \+ Hospital H\+S Manager \+ relevant Dept Heads * Work closely with the Hospital to adjust the Blackrock Healthcare ""Site Limitations Document"" to reflect the unique attributes associated with this project. * Work closely with the Hospital PSDP to develop the preliminary H\+S plan and importantly incorporate the site limitation document agreed with the Hospital as mentioned above. The overall Preliminary H\+S plan (incorporating the site limitations document) must be formally communicated and agreed with the Hospital Team and PM. * Co\-ordinate the input from the Fire Safety Consultant and Hospital H\+S / Facility Managers around the construction fire safety risk assessment with the Hospital fire safety policy and any modifications required to the existing Hospital structural and operational fire safety requirements. * Co\-ordinate communication of the project program requirements, design and construction with the Hospital so the Hospital understands and agrees the effects on the operation of the Hospital, this is particularly important around agreement with infection control. * Co\-ordinate communication of the project phasing with the design team / Builder and Hospital Team, particularly the Facility and infection control Managers. The internal phasing will need to be carefully developed and programmed by the lead architect and Project Manager and co\-ordinated to avoid disruption to Hospital operations. * Ensures all Hospital team members / stakeholders are kept fully informed throughout the project. * Co\-ordinate with Group Facilities, the ongoing development with the Architect of the Blackrock Health ""Standard Finishes Detail"" manual for application to all Hospital. * Co\-ordinate with Group Facilities and PSDP, the specification for the format and program associated with the OM documents. * Provide input into the budget formation and tender documents for the project including making sure the Design Team include the following factors in the budget preparation (this is an indicative list, not a definitive one): * Fire precautions, both for Fire Alarm protocols and Fire Structural separation requirements. * Site Limitations requirements, including noise \& dust precautions. * Constraints regarding working hours. * Competency training to meet specific hospital requirements – particularly re fire / hot work issues. * Special safety precautions to meet hospital requirements, e.g. fitting Manual Call Points at external locations for roof works etc. * On\-going Fire Consultancy costs, both for Fire Auditing during the construction process, as well as Fire Engineering Consultancy, for inspecting fire sealing / fire dampers etc * Provide a rough guide, where appropriate, to compare the cost benefit of certain plant proposals which takes into account factors such as the expected life cycle / maintenance requirements / environmental impact. * In addition to the hospitals Design Team consultants monitor/witness the commissioning of Mechanical and Electrical systems in their entirety to ensure handover of these systems meets the hospitals requirements. **Why work at the Blackrock Clinic:** At the Blackrock Clinic, we are passionate about our people and believe in their development and growth. As a member of the team you can benefit from: • Competitive salary • Pension • Discounted café • Sports and Social club • Employee Assistance Programme • Discounted onsite pharmacy **Please Note:** ***Job descriptions are a reflection of the present service requirements and may be subject to review and amendments to meet the changing needs of the service. Please note that we reserve the right to close this vacancy early if sufficient applications are received.*** ***Blackrock Clinic is an Equal Opportunities employer, and we are committed to creating an environment that promotes equality and dignity at work.*** ***Blackrock Clinic is committed to providing reasonable accommodation when needed. Please advise if you have particular requirements, so that we can look into arranging reasonable adjustments to the recruitment process. You can contact us at HR@blackrockhealth.com*** ***It is essential that you have valid work permission for the Republic of Ireland to take up employment for this position, or in the case of critical skills, you must be eligible for a work permit.***",https://www.linkedin.com/jobs/view/4395808967
Project Client Representative,Blackrock Health,"Dublin, D, IE",indeed,"**Job Title: Project Client Representative** **Reports to: CEO with dotted line to Group Head of Facilities** **Job Type: Permanent** **Hours: 39 hours per week** **Role Purpose:** Blackrock Health, Blackrock Clinic are commencing an internal refurbishment project on the lower ground floor of the hospital building to include Theatre stores, mortuary, clinical changing, DOSA, Recovery, theatre changing, local switch room , Theatre 5 and the addition of a new operating theatre in the existing Eye centre location, together with its associated ventilation plant room located on the roof of the existing Curium/ Nuclear medicine plant room. In addition, Blackrock Clinic will commence construction of a two\-storey extension located on the roof of the Central Decontamination unit which will include an expanded Cardiology department, refurbishment of existing Cardiology department locations on the ground floor and the addition of patient bedrooms on the East elevation of level 1 together with associated plant room to provide mechanical and electrical services to the extension. Blackrock Clinic will also commence the relocation of the hospitals main entrance from Rock Road to a new location to include a 3\-lane entrance from Rock Road and associated modifications to car parking and car parking equipment. Blackrock Clinic plan to demolish the Seafort and Glenalla buildings and install a modular building on that site to accommodate the decanting of departments currently located in St Catherine's building to allow a major expansion of the hospital onto the St Catherine's site. We are currently looking for a Project Manager, acting on behalf of Blackrock Health to manage the projects, including the Design Team and other external parties associated with the project. **Qualifications/Experience:** * Engineering qualification * At least eight years' satisfactory \& relevant experience in project management or project controls management within large infrastructure projects / programmes, as relevant to this role. * A significant track record and direct experience of successfully delivering construction programmes/projects (healthcare is desirable). * Significant experience in change management and process implementation as they are adapted throughout the project lifecycle to suit the programme needs. * Extensive and relative experience managing and working collaboratively with multiple internal and external stakeholders, as relevant to this role. **Key Responsibilities:** * Co\-ordinate response / communication between Hospital stakeholders and the Project Manager. * Investigate potential risks to the Hospital normal operation associated with the construction project, some common examples: * Infection Control / Aspergillus risks associated with internal / external works and possible requirement for alternative HEPA filtered air in high\-risk operational areas. * Noise / vibration control requirements associate with normal occupancy and sensitivity of medical equipment to vibration. * Risk to Utility disruption, including Electricity, Gas, Water and Communications. * Break\-in to existing services that may require a shutdown of those services and contingency requirements. * Monitor the environmental / utility requirements associated with specialist medical / other equipment included within the project scope to ensure the Design Team is fully briefed for compatibility within the existing infrastructure \+ design. Advise if detailed investigation is required. * Assist the Mechanical and Electrical consultant to advise on the overall effect that the intended project will have on the existing utilities infrastructure, and if any of the existing utilities will be stretched beyond acceptable limits to keep the utilities service within safe parameters. * Ensure that the Design Team aware of existing utility infrastructure to assist in informing Design Team constraints. * It is expected that all new / refurbishment design will conform with Hospital HBN's \+ HTM's. If compliance is not achievable, then the Design Team will submit a derogation proposal. The Client Representative will assist the Hospital in understanding the risks, if any, associated with the proposal and co\-ordinate the response to the Design Team and PM. * Co\-ordinate between the Design Team and Hospital in the selection of finishes, room data sheets, including the Hospital Infection Control Manager \+ Hospital H\+S Manager \+ relevant Dept Heads * Work closely with the Hospital to adjust the Blackrock Healthcare ""Site Limitations Document"" to reflect the unique attributes associated with this project. * Work closely with the Hospital PSDP to develop the preliminary H\+S plan and importantly incorporate the site limitation document agreed with the Hospital as mentioned above. The overall Preliminary H\+S plan (incorporating the site limitations document) must be formally communicated and agreed with the Hospital Team and PM. * Co\-ordinate the input from the Fire Safety Consultant and Hospital H\+S / Facility Managers around the construction fire safety risk assessment with the Hospital fire safety policy and any modifications required to the existing Hospital structural and operational fire safety requirements. * Co\-ordinate communication of the project program requirements, design and construction with the Hospital so the Hospital understands and agrees the effects on the operation of the Hospital, this is particularly important around agreement with infection control. * Co\-ordinate communication of the project phasing with the design team / Builder and Hospital Team, particularly the Facility and infection control Managers. The internal phasing will need to be carefully developed and programmed by the lead architect and Project Manager and co\-ordinated to avoid disruption to Hospital operations. * Ensures all Hospital team members / stakeholders are kept fully informed throughout the project. * Co\-ordinate with Group Facilities, the ongoing development with the Architect of the Blackrock Health ""Standard Finishes Detail"" manual for application to all Hospital. * Co\-ordinate with Group Facilities and PSDP, the specification for the format and program associated with the OM documents. * Provide input into the budget formation and tender documents for the project including making sure the Design Team include the following factors in the budget preparation (this is an indicative list, not a definitive one): * Fire precautions, both for Fire Alarm protocols and Fire Structural separation requirements. * Site Limitations requirements, including noise \& dust precautions. * Constraints regarding working hours. * Competency training to meet specific hospital requirements \- particularly re fire / hot work issues. * Special safety precautions to meet hospital requirements, e.g. fitting Manual Call Points at external locations for roof works etc. * On\-going Fire Consultancy costs, both for Fire Auditing during the construction process, as well as Fire Engineering Consultancy, for inspecting fire sealing / fire dampers etc * Provide a rough guide, where appropriate, to compare the cost benefit of certain plant proposals which takes into account factors such as the expected life cycle / maintenance requirements / environmental impact. * In addition to the hospitals Design Team consultants monitor/witness the commissioning of Mechanical and Electrical systems in their entirety to ensure handover of these systems meets the hospitals requirements. **Why work at the Blackrock Clinic:** At the Blackrock Clinic, we are passionate about our people and believe in their development and growth. As a member of the team you can benefit from: Competitive salary Pension Discounted cafe Sports and Social club Employee Assistance Programme Discounted onsite pharmacy **Please Note:** ***Job descriptions are a reflection of the present service requirements and may be subject to review and amendments to meet the changing needs of the service. Please note that we reserve the right to close this vacancy early if sufficient applications are received.*** ***Blackrock Clinic is an Equal Opportunities employer, and we are committed to creating an environment that promotes equality and dignity at work.*** ***Blackrock Clinic is committed to providing reasonable accommodation when needed. Please advise if you have particular requirements, so that we can look into arranging reasonable adjustments to the recruitment process. You can contact us at HR@blackrockhealth.com*** ***It is essential that you have valid work permission for the Republic of Ireland to take up employment for this position, or in the case of critical skills, you must be eligible for a work permit.***",https://ie.indeed.com/viewjob?jk=2daff9961e897368
QC Micro Analyst,PE Global,"Dublin, County Dublin, Ireland",linkedin,"**PE Global are currently recruiting for a QC Micro \- Days role to be based in our Bio client site in South Dublin on a 12 month initial contract:** **Job Description:** Under minimal supervision, successful candidate would be responsible for one or more of the following activities in QC including microbiological testing, method transfers, sample and data management and equipment maintenance. This role is for an experienced and technically strong associate who will spend 90% of their work day performing testing. The successful candidate would contribute to team by ensuring the quality of the tasks/services provided by self and contribute to the completion of milestones associated with specific projects or activities within team. This role will support manufacturing operations, as such some extended hours, shift and weekend work may be necessary as required. **Job duties are as follows but not limited to:** * Endotoxin testing of water, in\-process and drug product release samples * Bioburden testing of water \& in\-process drug product samples * Sterility testing * Water sampling * Lab Support duties such as Biological Indicator testing, Growth Promotion, Media Preparation, Identifications and Autoclave. * Writing technical reports * Media fill reconciliation and inspection * Weekend bioburden cover * Perform analytical testing as a main priority with efficiency and accuracy * With a high degree of technical flexibility, work across diverse areas within the lab * Plan and perform multiple routine/ non\-routine methods and procedures with a large variety of assays. * Report, evaluate, archive, trend and approve analytical data. * Troubleshoot, solve problems and communicate with stakeholders. * Initiate and/or implement changes in controlled documents. * Participate in audits, initiatives, and projects that may be departmental or organizational in scope. * Write protocols and perform assay validation. * Introduce new techniques to the lab, including method transfers, reports, validations and protocols. * Evaluate lab practices for compliance and operational excellence improvement on a continuous basis. * Review and Approve lab results * May participate in lab investigations. * May provide technical guidance. * May train others. * May contribute to regulatory filings. * May represent the department/organization on various teams * May interact with outside resources **Basic Qualifications:** * Bachelors degree in a science discipline * Biopharmaceutical QC experience in a microbiology lab * Experience with regulatory compliance in cGMP manufacturing and testing of pharmaceutical products **To apply, please call Audrey on 0214297900 or alternatively send an up\-to\-date CV to** audrey.mccarthy@peglobal.net **\*\*\*Please note our client cannot assist with any visa sponsorship and candidates must have the correct visa to live and work in Ireland\*\*\***",https://www.linkedin.com/jobs/view/4393555998
