title,company,location,site,description,job_url
Quantity Surveyor (All Levels),Rascor Waterproofing UK & Ireland,"Gorey, County Wexford, Ireland",linkedin,"**Company Description** Rascor Ireland Ltd is part of the RASCOR Group, an international corporate group specialising in the development, manufacture and installation of structural waterproofing systems. With our International head office and engineering department based in Zurich, we operate the UK and Ireland business from our offices in Gorey Co. Wexford and Slough, London. Operating in the construction industry we are a trusted specialist subcontractor to most of the largest building contractors in the UK \& Ireland. We are currently working on a number of high\-profile commercial developments across both locations. **The Role** RASCOR is expanding and we’re looking for **Quantity Surveyors at all levels** , from recent graduates to experienced professionals. This is a great opportunity to join a dynamic and collaborative team, contribute to exciting construction projects, and develop your commercial expertise. You’ll be involved in the **full commercial lifecycle** \- from tendering and procurement to cost control, valuations, and final accounts \- helping to ensure projects are delivered safely, profitably, and to the highest standards. **Key Responsibilities** * Assist or lead on pre\- and post\-contract commercial management across projects. * Prepare, submit, and agree interim applications and final accounts. * Manage our payments, and variations. * Maintain cost reports, cashflow forecasts, and risk/opportunity registers. * Support tenders, take\-offs, and pricing. * Liaise closely with project managers, site teams, clients, and suppliers. * Ensure compliance with contracts, specifications, and health \& safety requirements. **What You’ll Bring** We’re open to **candidates at different stages** of their QS career. The scope of responsibility will align with your experience. **For all candidates:** * Degree in Quantity Surveying, Commercial Management, or equivalent experience. * Working knowledge of standard forms of contract * Strong analytical, numerical, and communication skills. * Proficient in Microsoft Excel and measurement software. **Early\-career (0–2 years):** * Internship or placement experience beneficial but not essential. * Eager to learn and develop core QS skills under guidance. **Mid\-level (2–5 years):** * Capable of independently running work packages. * Confident in monthly reporting. **Senior (5\+ years):** * Proven track record on complex or large\-scale projects. * Strong contractual awareness and leadership ability. * Able to mentor junior staff and manage client relationships. **What We offer** · Competitive salary DOE · Laptop, Mobile, etc. · Company Pension \& Service Benefits. · Full support of a focused technical and commercial team. · Excellent opportunity to progress to a more senior role in the future. · Annual salary review Job Type: Full\-time Pay: From €45,000\.00 per year * Work Location: In person",https://www.linkedin.com/jobs/view/4406075557
Quantity Surveyor - 2026 Work Placement,Arup,"Dublin, County Dublin, Ireland",linkedin,"**Shape a future with purpose at Arup in Dublin or Cork.** Arup’s purpose, shared values and collaborative approach has set us apart for over 75 years, guiding how we shape a better world. **The Opportunity** Arup Ireland are seeking talented students to join our Procurement \& Cost Management team. We look for students who are ready to jump into the professional world; diverse individuals with inquisitive minds and a desire to challenge. You will work alongside skilled professionals and contribute to the success of real projects. You will also enjoy learning sessions with technical experts within your team, working on local projects and all kinds of social events. A role in the Procurement and Cost management team will include liaising with other multi\-disciplinary contributors within Arup for the successful outcome of real\-world projects. You will be required to deliver projects to the required technical standards in a timely manner, reporting to the team leader or project manager as appropriate. **As a Quantity Surveyor work placement student at Arup, you will:** * Assist senior team members in delivering construction projects dealing with payment certificates and claims. * Assist senior team members in the preparation of bills of quantities, ensuring compliance with required method of measurement. * Be proactive in communicating and working with the direct team as well as Arup colleagues from various disciplines for the successful delivery of tasks. * Follow instructions and/or use own initiative to achieve designated tasks in a timely manner. * Understand the required outputs/deliverables of a project or assignment and work efficiently to deliver them. * Develop relationships with colleagues, always being professional, presentable and articulate. * Adopt a flexible approach to working, supporting multiple teams across the buildings and infrastructure sectors **Does this role inspire you?** We're looking for students who are currently working towards RICS accredited, surveying\-based degree. We also value students who are: * Proactive, motivated and enthusiastic. Able to apply their own initiative to undertake tasks independently. * A team player, who can adopt flexible working practices to support the needs of the business. * Articulate, with both excellent written and verbal communication skills. * Logical in their approach to tasks, with the ability to interpret, understand and analyse data. * Output focused, always working with the objective in mind. * Commercially astute with strong numerical skills, demonstrating an attention to detail. * Proficient with Microsoft Office products and ideally Cost X (Although not necessary). **Why Arup?** At Arup, we believe in investing in our people and supporting their growth from day one. As a trust\-owned company, we're driven by our purpose and values, creating a collaborative and rewarding environment for our employees. **Benefits That Work For You** * Professional Growth \& Development: Kickstart your career with our structured program, benefit from continuous learning opportunities, and receive guidance from experienced mentors. * Wellbeing and Culture: At Arup we are committed to fostering a healthy working culture by offering a range of health and wellbeing benefits, including health insurance, flexible working schemes, wellness programmes and an Employee Assistance Programme. * Equality, Diversity and Inclusion: We strive to embed inclusion in our way of working, our interactions with one another and the projects we deliver. We are committed to creating an inclusive working environment for talented people of any background, based on merit, fairness and respect. At Arup, you belong to an extraordinary collective where individuality is encouraged. Our strength comes from how we respect, share, and connect our diverse experiences, perspectives, and ideas. You'll have the opportunity to do socially useful work that has meaning – to Arup, to your career, and to the clients and communities we serve. We welcome applications from talented individuals of all backgrounds, regardless of age (within legal limits), gender identity or expression, disability, ethnicity, religion, sexual orientation, or any other protected characteristic. We are committed to making our recruitment process and workplaces accessible. If you need any assistance or adjustments, please visit our Candidate Support page for contact information and assistance. We're happy to help. **Please note this role is only suitable for those who are in full time education and are looking for a placement for the summer months or for those who are required to complete a placement as part of their course requirements.** **If you have recently graduated, please apply to one of our '2026 Graduate Programme' roles.** \#IREIntern **Do you want to join us in shaping a better world?**",https://www.linkedin.com/jobs/view/4408766669
Quantity Surveyor Graduate - 2026,Winthrop Technologies,"Dublin, County Dublin, Ireland",linkedin,"**About Us** Winthrop is a dedicated Data Centre Construction company providing turnkey solutions to our clients, headquartered in Dublin and delivering throughout Europe. Winthrop specialises in providing Turnkey Data Centre Solutions, providing services from design, through to construction across the full range of civil, structural, architectural, mechanical and electrical services as well as commissioning. **Winthrop Graduate Programme:** Building on the success of our comprehensive Graduate Programme introduced in 2022, we offer an opportunity to work on cutting\-edge projects across Ireland and Europe. This enables graduates to gain valuable technical experience during a crucial stage in their careers. Our programme is uniquely designed to develop skilled professionals with a deep understanding of all phases of large\-scale construction projects, providing graduates with exposure to the complete construction process. **About the Role** The **QS Graduate** , based in **Europe** , will play a key role in supporting the cost management team by preparing estimates, managing budgets, and overseeing the financial aspects of construction projects across the region. This position offers an excellent opportunity to develop professional skills, gain exposure to large‑scale international projects, and work alongside experienced industry professionals. **Responsibilities** * Assist in preparing cost estimates, budgets, and tender documents * Support in the measurement and valuation of works (both on\-site and from drawings) * Participate in cost control and financial reporting throughout project lifecycle * Assist with procurement processes, including preparing bills of quantities and tender evaluations * Monitor and report on project progress, identifying risks and opportunities * Liaise with contractors, suppliers, and clients to ensure smooth project execution * Maintain accurate records and documentation for all project\-related activities * Ensure compliance with company policies, health \& safety regulations, and industry standards **Requirements** * **Education:** Bachelor's degree in Quantity Surveying or related discipline * Graduation between 2025\-2026 * Strong numerical and analytical skills with attention to detail * Excellent communication and interpersonal skills * Proficient in MS Office; knowledge of QS software is an advantage * Ability to work collaboratively in a team environment * Eagerness to learn and develop professionally within the construction sector **Benefits** * **Mentorship from experienced professionals** , supporting you throughout your graduate programme and beyond * **Exposure to large‑scale data centre projects** , gaining hands‑on international experience from the outset * **A competitive salary, with an additional package to support working and living abroad** * **A collaborative and supportive work culture** , where graduates are invested in as long‑term team members * **A clear pathway from the graduate programme into a permanent role** , offering long‑term career stability and ongoing progression with the business ***Winthrop Technologies Ltd. is an equal opportunities employer***",https://www.linkedin.com/jobs/view/4407026348
Reinsurance Analyst – Permanent,Oliver James,"Dublin, County Dublin, Ireland",linkedin,"**Key Responsibilities** **Insights \& Data Analytics** * Prepare and update reinsurance reports, improving and automating existing processes, and supporting monthly and quarterly close cycles. * Maintain and manage reinsurance databases covering premiums, claims, and participation. * Enhance data quality to support performance monitoring and continuous improvement initiatives. * Review both internal and external reinsurance reports and accounts. * Support renewal processes through data packs, programme reviews, and scenario analysis, working closely with key stakeholders. * Present findings and insights to internal and external senior stakeholders when required. * Provide support to other departments as needed. **Operational** * Assist in reviewing and accurately recording reinsurance programmes and associated terms. * Produce and manage claims notifications for excess of loss programmes, including related cash flows. * Process premiums, claims recoveries, cash allocations, and settlements in accordance with established procedures and reporting standards. * Liaise with reinsurers and brokers on claims notifications, settlements, and ad hoc queries. * Review, validate, and reconcile bordereaux as well as reinsurer and broker reports. * Ensure all activities comply with regulatory requirements, audit standards, and internal policies. * Maintain process and procedure documentation in line with internal control frameworks. **Requirements** * Third\-level qualification in science, mathematics, or an insurance\-related discipline is advantageous * 2\-3 years’ experience in a reinsurance environment is advantageous, other background will be considered * Knowledge of coverage, accounting, and claims processes. * Strong SQL skills, including the ability to write queries, with a willingness to further develop technical expertise. * Excellent analytical, problem\-solving, and decision\-making capabilities. * Experience handling large data sets, including data manipulation and cleansing. * Proficiency in Microsoft Office applications (Excel, Word, PowerPoint, etc.). * Familiarity with data visualisation tools such as Tableau. * Strong communication, presentation, and interpersonal skills. * Self\-driven with the ability to work independently and a proactive approach to learning and development. * Ambitious and self\-aware, with a willingness to grow and take on increasing responsibility over time. * Team\-oriented, supporting a collaborative environment within a small team. * Strong attention to detail with a focus on quality, accuracy, and continuous improvement. * Effective organisational, planning, and problem\-solving skills. * Clear and concise written and verbal communication, with the ability to explain complex findings. * Strong relationship\-building skills and the ability to work proactively with internal and external stakeholders. Apply Now",https://www.linkedin.com/jobs/view/4408784392
Retail Associate (8 hours) - Kildare Village,New Balance,"Kildare, KE, IE",indeed,"New Balance is more than just a sportswear brand – we are a family. We want people to join our team who can develop with us as we continue our journey as a growing brand. Our retail stores are looking for associates who can engage, excite, educate and entertain our consumers from the moment they walk through the door. We need your passion and the desire to be a true brand ambassador as well as your genuine love for working with customers. Apply now for the chance to join an incredible team!**MAJOR ACCOUNTABILITIES:** * To achieve personal KPIs and contribute to overall store performance * Deliver total customer satisfaction to every customer, following the end\-to\-end customer journey – from entering the store to leaving the store * Help to ensure the store remains as commercial as possible following company guidelines * Adhere to company’s policies and procedures * Responsible for maintaining health, safety, and environmental standards in store * Perform other duties are required from the management team **REQUIREMENTS FOR SUCCESS:** * Team Player * Demonstrate customer service skills * A passion for retail and sales * Desire to learn * Ability to perform basic maths and general retail operational processes * Effective communication skills * Flexible work schedule including weekends and holidays **ADDITIONAL BENEFITS:** * Competitive compensation * Potential to earn more through our Retail Bonus Scheme * Great development opportunities * Inclusive working environments across all our European locations * Generous staff discount * Project involvement across our European region * Flexible uniform package",https://ie.indeed.com/viewjob?jk=dedbf6e911711cce
Revenue Analyst,eTeam,"Dublin, County Dublin, Ireland",linkedin,"**Job Title: Revenue Operations Analyst** **Location: Dublin (Hybrid – 3 days per week onsite)** **Duration: 11 months contract initially** **Max. Budget: €45\.7k per annum \+ paid holidays** **The Opportunity:** * In Revenue Operations, our vision is to simplify and innovate to make it easy for our customers to do business with client. * As stewards of client’s global quote\-to\-cash business processes, we strive to delight customers and stakeholders through standardized processes and automated solutions that are supported by smart people who are flexible to evolving business needs. * We move quickly, so the business can move quickly and capitalize on opportunities to support the creativity of our customers. * We are a value\-driven organization and foster a culture of diversity, inclusion, and continual growth and learning. **What you’ll do:** * Support all activities related to, but not limited to, customer account management, business consultation, contract validation and execution, order processing, invoice creation, usage metering, and provisioning products. * Performs complex validations of revenue transactions sourced through multiple selling channels (Channel, Enterprise, eCommerce). Ensures that deals presented align with product rules, revenue standards, and compliance policies. * Executes work in compliance with SOX controls, including drafting controls, narratives, memos, and process documents. Partners with internal and external auditors on audits of control design and execution. * Stewards and knowledge experts over customer information related to contracting, order management, and provisioning. Leverages this knowledge to provide business recommendations to ensure optimal customer experience outcomes. * Monitors a subset of automated transactions through various tools and technology solutions. Review logs and system reporting to intervene, troubleshoot, and manage errors. * Provide escalation support for external customers, sales, customer service, product management, product marketing, finance, and legal. Serve as a subject matter expert who initiates investigation, coordinates cross\-functional teams, and drives issues to resolution. * Be a champion of scaling the business through automation by identifying ideas, building proposals, securing support for prioritization, documenting requirements, partnering with technical teams for development, testing solutions, and leading enablement and change management. * Operationalize strategic plans for new product offerings and routes to market by testing, adopting, documenting, and communicating required changes. Executes against defined integration strategies for acquired companies, including onboarding to new systems and processes, maintaining business continuity, and performing customer, financial, product, and user data migrations. * Designs and executes reports to support accuracy reconciliation, capacity planning, work completion, key results performance, and other ad hoc requests. * Creates and maintains documentation essential to performing the role. Includes: job procedures, corporate policies, process flows, stakeholder FAQs, and new hire onboarding documentation. **What's needed to succeed:** * Strong written and verbal communication and presentation skills * Relentless attention to detail with a central focus on customer experience * Critical thinking skills to solve unique challenges * Ability to prioritize, multitask, and meet crucial deadlines * Solid documentation and organizational skills * Self\-starter that can execute work independently * Capable interpretation of legal contracts, terms, and conditions * Knowledge of accounts receivable, revenue recognition, and finance operations * Demonstrated proficiency with standard tools (Office 365, ERP, CRM) * 2\-5 years of experience in a similarly related role.",https://www.linkedin.com/jobs/view/4408771215
Revenue Operations Analyst  (Tech),Principle,"Dublin, County Dublin, Ireland",linkedin,"**Revenue Operations Analyst \- 11 Month Contract** * Dublin (Hybrid \- 3 days onsite / 2 remote) * €45,000 per year salary We're partnering with a leading global technology company to hire a Revenue Operations Analyst to support their fast\-paced, high\-growth business. This is a strong opportunity for someone who enjoys working at the intersection of finance, operations, and commercial teams, with exposure to end\-to\-end quote\-to\-cash processes in a complex, multinational environment. **What you'll be doing:** * Manage and validate revenue transactions across multiple sales channels (enterprise, channel, eCommerce) * Support the full quote\-to\-cash lifecycle including order processing, invoicing, and contract validation * Ensure compliance with revenue recognition standards and internal controls (SOX) * Investigate and resolve transaction issues, working cross\-functionally with sales, finance, legal, and product teams * Monitor automated workflows, troubleshoot errors, and improve operational efficiency * Contribute to process improvements and automation initiatives * Produce reports and documentation to support performance tracking and operational accuracy **What we're looking for:** * **2\-5 years' experience** in Revenue Operations, Finance Operations, Order Management, or similar * Strong understanding of quote\-to\-cash, revenue recognition, or accounts receivable * Experience working with ERP/CRM systems and Excel (Office 365\) * High attention to detail with strong analytical and problem\-solving skills * Comfortable interpreting contracts, terms, and compliance requirements * Ability to manage multiple priorities in a deadline\-driven environment * Strong communication skills and ability to work cross\-functionally This role suits someone who is process\-driven, detail\-oriented, and comfortable operating in a structured but evolving environment.",https://www.linkedin.com/jobs/view/4408528875
