title,company,location,site,description,job_url
Cloud Security Architect,BOYLE Sports,"Dundalk, County Louth, Ireland",linkedin,"**Cloud Security Architect –Platform Design Team** **Location: Hybrid / Remote** **The Role** The **Cloud Security Architect** plays a critical role within the **Platform Design squad** , ensuring that all cloud and infrastructure solutions are designed, built, and operated with security at their core. Working closely with the **design squad of Architects** , the **Director of Cloud** , and the **Platform Engineering and Operations leads** , you will define and embed **security\-by\-design** principles, ensuring the organisation’s cloud platforms are resilient, compliant, and trusted by design. This is a hands\-on, delivery\-focused architecture role — combining strategic oversight with practical engineering knowledge. You will translate security and compliance requirements into automated, reusable patterns that enable secure cloud adoption across engineering and delivery teams. The Security Architect is an integral part of the organisation’s cloud transformation journey, balancing innovation and agility with risk management and regulatory compliance. **Key Responsibilities** **Security Architecture \& Design** * Define and own the security architecture strategy for cloud and infrastructure platforms. * Develop security reference architectures, design patterns, and reusable controls that can be implemented through Infrastructure as Code (IaC). * Collaborate with your fellow design squad members to ensure all platform solutions adhere to cloud security standards and risk frameworks. * Translate business and regulatory requirements into practical, automated security solutions across cloud environments (AWS/Azure). * Design and guide the implementation of identity and access management (IAM), network security, encryption, and key management controls. * Ensure security\-by\-design principles are embedded throughout CI/CD pipelines and platform engineering practices. **Governance, Risk \& Compliance** * Partner with the Cloud Management Office and Heads of information and Cyber Security to align security controls with policy, audit, and compliance requirements (e.g. ISO 27001, CIS, NIST, SOC 2\). * Conduct architecture risk assessments, threat modelling, and design reviews for platform and application solutions. * Support continuous improvement of security guardrails, policy\-as\-code, and automated compliance frameworks. * Maintain visibility of security posture and platform metrics, supporting governance dashboards and risk reporting. **Collaboration \& Delivery** * Work together with Platform Engineering, Platform Operations, and (as part of) the Platform Design squads to ensure secure delivery of cloud infrastructure. * Provide architectural security input into the development of IaC modules, CI/CD pipelines, and platform services. * Participate in agile ceremonies, contributing to sprint planning, backlog refinement, and platform roadmap activities. * Act as a subject matter expert and design authority for engineers, architects, and delivery teams on all matters of cloud security. * Lead security\-related proof\-of\-concepts (POCs) and pilots to evaluate and validate new technologies and approaches. **Continuous Improvement \& Enablement** * Promote a DevSecOps culture by integrating security practices early in the design and development lifecycle. * Identify opportunities for automation, simplification, and improved resilience across the platform. * Contribute to knowledge sharing through documentation, training, and internal workshops. * Mentor and guide engineers and aspiring architects on security best practices and modern cloud defence strategies. **Experience / Skills Required** * 5\+ years’ experience in security architecture or cloud security engineering roles. * Proven expertise in securing AWS and/or Azure cloud environments (certified to Professional or Security Specialist level preferred). * Strong background in Infrastructure as Code (IaC) security and DevSecOps practices. * Demonstrated experience designing and implementing automated security controls and policy\-as\-code frameworks. * Solid understanding of network security, IAM, encryption, logging, and incident response in cloud environments. * Experience working within agile delivery frameworks (Scrum/Kanban) and collaborating with DevOps or platform teams. * Familiarity with compliance standards (CIS Benchmarks, NIST, ISO 27001, SOC 2, GDPR). **Skills \& Attributes** * Strategic mindset with strong analytical and problem\-solving skills. * Excellent communicator — able to explain complex security concepts to technical and non\-technical stakeholders. * Pragmatic and collaborative — balances security, agility, and business outcomes effectively. * Hands\-on technical competence — capable of reviewing IaC and cloud configurations for security posture. * Passionate about automation, secure design, and continuous improvement. * Self\-motivated, delivery\-focused, and comfortable operating in a fast\-paced, cloud\-first environment.",https://www.linkedin.com/jobs/view/4407544046
Cloud Software Engineer,Fruition Group Ireland,"Dublin, County Dublin, Ireland",linkedin,"Our Dublin based client are looking for a **Senior Cloud Software Engineer** to join the team on a permanent basis. Excellent career opportunity with an established company that operate on a global scale Hybrid working model with 2 days per week on site **Job Responsibilities** * The implementation of microservices and serverless solutions. * Lead the backend development across various services, ensuring systems are high\-performing, and scalable. * Implement security best practices, including encryption and secure API development. * Work closely with frontend developers, engineers, and business stakeholders * Ensure the backend solutions align with user needs and business goals * Define and uphold coding standards by introducing best practices, building a unified codebase, and implementing comprehensive testing. * Monitor and optimize all aspects of product performance. * Troubleshoot issues across a wide array of services and functional areas. * Contribute to the DevOps culture and practices. * Provide technical leadership and mentorship to junior team members and engineers. **Experience Required** * 5\+ years of experience in backend development and 2 years in a cloud environment. * Highly capable in cloud platforms like AWS, Azure, or GCP * Experience with microservices architecture, RESTful APIs, and containerization technologies. * Track\-record for building robust and scalable applications. * Ability to collaborate effectively, give and receive feedback. Ability to articulate complex technical ideas in an understandable manner **Essential and Desirable Skills** * Bachelor’s or Master’s degree in Computer Science, Software Engineering, or a related field. * Experience with architecture, design, and development – experience on the whole life cycle of the product. * Extensive experience with cloud platforms (AWS, Azure, Google Cloud). * Proficiency in at least one backend programming language. * Strong understanding of cloud infrastructure, containerization (Docker), and orchestration (Kubernetes). * Strong fundamentals in database systems, SQL DB or No SQL DB – experience dealing with large volumes of data. * Knowledge of high\-scale stream/batch processing systems * Experience managing and maintaining production systems * Expertise in RESTful and GraphQL APIs. **HOW TO APPLY:** To apply for this role, please submit your updated CV. If your skills and experience match job requirements, you will be contacted to discuss your application in detail. **SIMILAR ROLES OPEN:** As a specialized recruitment agency, we also have several other permanent and contract IT roles available. Visit our website for more information or explore additional opportunities.",https://www.linkedin.com/jobs/view/4406210203
Cloud Solutions Architect (Daily Rate),Fruition Group Ireland,"Dublin, County Dublin, Ireland",linkedin,"**Cloud Solutions Architect** **Daily Rate Contract (1 day onsite, Dublin City Centre) Ireland or UK** My Dublin based client is seeking an experienced Cloud Solutions Architect for a daily rate contract. The Cloud Architect will support a large\-scale digital and cloud transformation programme. This is a daily rate contract role focused on designing, delivering, and optimising secure, scalable cloud infrastructure solutions across AWS and/or Azure environments. You will operate within a Cloud Centre of Excellence style function, contributing hands\-on architecture expertise, establishing best practice patterns, and accelerating cloud adoption across enterprise platforms. **Key Responsibilities** * Design and deliver secure, scalable, and cost\-efficient cloud architecture solutions aligned to enterprise and regulatory requirements * Refine and translate business requirements into robust technical designs * Provide strategic guidance on cloud adoption, platform optimisation, and architectural best practice * Drive innovation and cost optimisation across public cloud environments * Present architectural solutions to both technical and non\-technical stakeholders * Ensure security\-by\-design principles are embedded across all solutions * Develop reusable, repeatable cloud patterns to accelerate delivery and reduce platform overhead * Collaborate with engineering teams to implement, deploy, and enhance cloud capabilities * Ensure solutions meet performance, reliability, and governance standards **Required Experience** * 5\+ years’ experience designing and implementing scalable cloud solutions * Strong background in modern cloud\-native architecture (microservices, serverless, containerisation) * Hands\-on Infrastructure as Code expertise (Terraform, CloudFormation) * Deep experience with at least one major cloud platform (AWS or Azure) * Experience designing or implementing Kubernetes solutions (preferably EKS or equivalent) * Proven ability to manage and optimise public cloud infrastructure environments * Strong stakeholder engagement and communication skills * Experience producing clear, structured architecture and design documentation **Desirable Experience** * Exposure to regulated or complex enterprise environments * Experience across both AWS and Azure * CI/CD and DevOps implementation using IaC tooling * Experience supporting cloud migration or transformation programmes **Certifications (Advantageous)** * AWS Certified Solutions Architect (or equivalent cloud certification)",https://www.linkedin.com/jobs/view/4404679372
Cloud Support Consultant,Codec,"Dublin, County Dublin, Ireland",linkedin,"We are seeking a highly skilled and solutions\-oriented Cloud Support Consultant with a strong focus on Microsoft Azure and Microsoft Cloud Infrastructure to join our growing technical support team. This role is a remote escalation position, responsible for resolving complex cloud related incidents, infrastructure issues, and technical challenges escalated from the Level 1 and Level 2 Team. The Cloud Support Consultant will be instrumental in ensuring the stability, security, and performance of customer environments hosted in Azure, while also assisting in the design and improvement of cloud systems and automation processes. **Key Responsibilites:** • Act as the primary escalation point for complex incidents that cannot be resolved by the Service Desk team. • Troubleshoot and resolve issues across Azure infrastructure, including Virtual Machines, Networking, Entra ID, and related PaaS/IaaS services. • Manage and maintain Azure subscriptions, resource groups, and policies across customer tenants. • Monitor system health and proactively identify areas for performance tuning or cost optimization. • Implement and support Conditional Access, Entra ID configurations, and Intune management for secure endpoint and identity control. • Deploy and maintain core Azure services such as: o Azure Virtual Networks, VPN Gateways, and NSGs o Azure Storage and Backup solutions • Provide advanced support for Microsoft 365, Exchange, Intune and Defender for Cloud, including integration and security posture recommendations. • Create and maintain PowerShell automation scripts for routine administrative and remediation tasks. • Configure and maintain monitoring policies for Windows, iOS and Android devices using third\-party tools (DattoRMM, NinjaRMM, etc.) or native Microsoft tools such as Intune • Collaborate with project engineers on new cloud implementations or migrations. • Document troubleshooting steps and solutions to enhance the Service Desk knowledge base. • Support continuous improvement by identifying recurring problems and proposing permanent technical fixes. **Skills, Knowledge \& Expertise:** Essential: • 5\+ years’ experience in a technical support or cloud engineering role, preferably within a managed services or enterprise environment. • Strong hands\-on experience with Microsoft Azure (IaaS, PaaS, and security components). • Solid understanding of Entra ID, Conditional Access, Identity Protection, and Security/Defender solutions. • Proven troubleshooting skills across Azure Networking, VM connectivity, and security baselines. • Strong understanding of Azure Virtual Desktop technologies. • Strong PowerShell scripting ability for automation and configuration. • Working knowledge of Intune, Exchange, Defender for Endpoint/Identity, and Microsoft 365 administration. • Understanding of patching and monitoring policies in live customer environments • Familiarity with ARM templates, Azure Policy, and Resource Locks. • Excellent communication skills, both written and verbal, with an emphasis on customer experience and clarity. • Ability to work independently, manage priorities, and maintain accurate case documentation. Desirable: • Microsoft Certified: Azure Administrator Associate (AZ\-104\) or higher (Solutions Architect, etc.). • Certifications in Microsoft Security such as SC\-200, SC\-300, SC\-400, SC900, SC\-100, AZ\-500 • Experience integrating Azure with on\-premises environments (Entra ID Connect, hybrid networking, etc.). • Exposure to Terraform, Bicep, or Azure DevOps pipelines. • Understanding of ITIL processes and service delivery frameworks. • Familiarity with ISO Standards or other compliance frameworks. Skills/Behavioural Competencies: • Analytical thinker with strong problem\-solving abilities. • Calm and methodical under pressure, capable of managing critical incidents effectively. • Self\-driven and proactive in identifying and resolving systemic issues. • Strong collaborator who communicates well with both technical and nontechnical stakeholders. • Passionate about continuous learning and staying up\-to\-date with the evolving Microsoft cloud ecosystem.",https://www.linkedin.com/jobs/view/4407190638
Cloud Support Consultant,Codec,"Dublin, D, IE",indeed,"### **Description** We are seeking a highly skilled and solutions\-oriented Cloud Support Consultant with a strong focus on Microsoft Azure and Microsoft Cloud Infrastructure to join our growing technical support team. This role is a remote escalation position, responsible for resolving complex cloud related incidents, infrastructure issues, and technical challenges escalated from the Level 1 and Level 2 Team. The Cloud Support Consultant will be instrumental in ensuring the stability, security, and performance of customer environments hosted in Azure, while also assisting in the design and improvement of cloud systems and automation processes. ### **Key Responsibilities** * Act as the primary escalation point for complex incidents that cannot be resolved by the Service Desk team. * Troubleshoot and resolve issues across Azure infrastructure, including Virtual Machines, Networking, Entra ID, and related PaaS/IaaS services. * Manage and maintain Azure subscriptions, resource groups, and policies across customer tenants. * Monitor system health and proactively identify areas for performance tuning or cost optimization. * Implement and support Conditional Access, Entra ID configurations, and Intune management for secure endpoint and identity control. * Deploy and maintain core Azure services such as: o Azure Virtual Networks, VPN Gateways, and NSGs o Azure Storage and Backup solutions * Provide advanced support for Microsoft 365, Exchange, Intune and Defender for Cloud, including integration and security posture recommendations. * Create and maintain PowerShell automation scripts for routine administrative and remediation tasks. * Configure and maintain monitoring policies for Windows, iOS and Android devices using third\-party tools (DattoRMM, NinjaRMM, etc.) or native Microsoft tools such as Intune * Collaborate with project engineers on new cloud implementations or migrations. * Document troubleshooting steps and solutions to enhance the Service Desk knowledge base. * Support continuous improvement by identifying recurring problems and proposing permanent technical fixes. ### **Skills, Knowledge and Expertise** Essential: * 5\+ years’ experience in a technical support or cloud engineering role, preferably within a managed services or enterprise environment. * Strong hands\-on experience with Microsoft Azure (IaaS, PaaS, and security components). * Solid understanding of Entra ID, Conditional Access, Identity Protection, and Security/Defender solutions. * Proven troubleshooting skills across Azure Networking, VM connectivity, and security baselines. * Strong understanding of Azure Virtual Desktop technologies. * Strong PowerShell scripting ability for automation and configuration. * Working knowledge of Intune, Exchange, Defender for Endpoint/Identity, and Microsoft 365 administration. * Understanding of patching and monitoring policies in live customer environments * Familiarity with ARM templates, Azure Policy, and Resource Locks. * Excellent communication skills, both written and verbal, with an emphasis on customer experience and clarity. * Ability to work independently, manage priorities, and maintain accurate case documentation. Desirable: * Microsoft Certified: Azure Administrator Associate (AZ\-104\) or higher (Solutions Architect, etc.). * Certifications in Microsoft Security such as SC\-200, SC\-300, SC\-400, SC900, SC\-100, AZ\-500 * Experience integrating Azure with on\-premises environments (Entra ID Connect, hybrid networking, etc.). * Exposure to Terraform, Bicep, or Azure DevOps pipelines. * Understanding of ITIL processes and service delivery frameworks. * Familiarity with ISO Standards or other compliance frameworks. Skills/Behavioural Competencies: * Analytical thinker with strong problem\-solving abilities. * Calm and methodical under pressure, capable of managing critical incidents effectively. * Self\-driven and proactive in identifying and resolving systemic issues. * Strong collaborator who communicates well with both technical and nontechnical stakeholders. * Passionate about continuous learning and staying up\-to\-date with the evolving Microsoft cloud ecosystem. ### **About Codec** Established over 40 years ago, Codec is a multi\-award\-winning Microsoft Solutions Partner, trusted by public and private sector organisations to deliver impactful digital transformation. With offices in **Dublin**, **Belfast**, **Cologne**, and across **Germany**, our team of over **300 experts** specialises in harnessing the full potential of Microsoft technologies—including **Dynamics 365**, **Power Platform**, **Azure**, and **Copilot**—to drive innovation, automation, and operational excellence. Codec combines deep industry expertise with a proven track record to help organisations unlock the power of AI and modern cloud solutions Though originally best known as a hardware reseller, since 2010 Codec has focused on building an outstanding software consulting business with a team of experts implementing enterprise solutions using products from Microsoft and Oracle. Our customer base, revenues and average contract values have grown steadily year on year and we continue to invest in the provision of new product and service offerings. Our team is a careful mix of recent graduates and experienced professionals from a variety of diverse cultural backgrounds. We are a melting pot of seasoned consultants supported by the best talent from the local universities. We have a thriving placement student academy and graduate recruitment programme which grows year on year. This company is an equal opportunities employer",https://ie.indeed.com/viewjob?jk=3e4a7d62c77f93ae
Cloud Support Engineer,Fruition Group Ireland,"Dublin, County Dublin, Ireland",linkedin,"**Job Description:** Our client, a leading financial services technology organisation, is seeking a Senior Cloud Support Engineer to join their service delivery function, supporting and maintaining a global cloud\-based platform. **Job Responsibilities** * Provide high\-quality technical support to end users, ensuring service levels and customer satisfaction targets are consistently achieved * Deploy, manage and optimise cloud\-based infrastructure to ensure performance, scalability and security across production environments * Build and maintain CI/CD pipelines using modern tooling to support efficient software delivery * Monitor system performance, availability and capacity, proactively addressing issues and improving resilience * Manage system upgrades, patching activities and configuration changes across environments * Act as an escalation point for complex technical issues and drive timely resolution * Collaborate with cross\-functional teams to deliver reliable and scalable technical solutions * Develop and maintain infrastructure as code using tools such as Terraform * Implement monitoring, logging and observability practices across platforms * Support incident, problem and change management processes aligned to ITIL frameworks * Drive continuous improvement through automation, optimisation and operational best practices **Experience Required** * Minimum 5 years’ experience in cloud infrastructure, technical operations or a similar role * Proven experience supporting highly available, 24/7 cloud\-based environments * Strong hands\-on experience with cloud platforms, particularly Microsoft Azure, alongside exposure to AWS * Experience with cloud\-native architectures and distributed systems * Demonstrated experience in customer\-facing support roles within technical environments * Strong troubleshooting and problem\-solving skills across infrastructure and application layers * Experience with monitoring and alerting tools within cloud environments * Familiarity with CI/CD pipelines and deployment tooling such as Azure DevOps * Experience with identity and access management principles, including role\-based access controls * Proven ability to manage incidents effectively and maintain composure in high\-pressure situations **Desirable Skills** * Experience with platform security best practices and secure\-by\-design principles * Knowledge of vulnerability management and remediation approaches * Exposure to infrastructure automation and configuration management tools * Experience implementing observability frameworks including logging and metrics collection * Understanding of modern DevOps practices and continuous delivery models * Strong communication skills with the ability to work across global teams **Educational Requirements** * Bachelor’s degree or equivalent in Computer Science, Information Technology, or a related discipline **Working Hours \& Benefits** * Competitive salary and benefits package * Opportunity to work within a global, technology\-driven environment * Exposure to modern cloud\-native technologies and large\-scale platforms * Collaborative and supportive team culture with opportunities for professional growth **How to Apply** To apply for this role, please submit your updated CV. If your skills and experience match job requirements, you will be contacted to discuss your application in detail. **Similar Roles Open** As a specialised recruitment agency, we also have several other permanent and contract IT roles available. Visit our website for more information or explore additional opportunities.",https://www.linkedin.com/jobs/view/4406201489
