title,company,location,site,description,job_url
Administrative Assistant,AWN Consulting Ltd.,"Dublin, County Dublin, Ireland",linkedin,"Are you a motivated Administrative Assistant seeking a more flexible and supportive work environment? Look no further than AWN Consulting! Our company values work\-life balance and offers a hybrid work policy that allows for remote work and collaborative office settings. Training and development are at the forefront of our priorities, as we invest in your growth through chartership opportunities, training programs, and mentorship. At AWN, we celebrate diversity and prioritise inclusivity, respect, and well\-being for all our employees. Our partnership with Health Assured provides a range of services aimed at improving mental and physical health, and our employee resource groups promote a supportive environment where you can thrive and reach your full potential. Join our team and embark on a fulfilling career in the environmental sector where you can truly make a difference. In addition to our supportive work environment, we offer a comprehensive employee benefits package designed to enhance every aspect of your life. From income protection to paid maternity and paternity leave, service awards, and performance\-related bonuses, we also provide access to a bike\-to\-work scheme and organise various social events throughout the year for all staff members. As a subsidiary of Trinity Consultants, AWN stands out as a premier environmental consultancy offering expert services to a wide range of clients throughout Ireland and Europe. Our team of highly experienced environmental experts deliver top\-quality services in areas including Environmental Impact Assessments, acoustic assessments, air quality assessments, and process safety management. As Ireland’s premier specialist environmental consultancy our team work on a range of large, complex and interesting projects. Examples of our recent projects include – MetroLink, BusConnects, DART\+, Semi\-conductor manufacturing facilities, biologics manufacturing facilities and many more. **Position Overview** AWN is expanding its Administration Team and is currently seeking a Junior Administrative Assistant. The successful candidate will join our dynamic admin and finance team, providing support across project administration, HR and Operations. **Main Duties and Responsibilities** * Acting as point of contact for project set up on our accounts software * Assisting with the upkeep of employee documentation, training, recruitment paperwork and induction packs * Assisting with the upkeep of our Internal Management System in line with our audit requirements * Updating spreadsheets and client records * Providing administrative support to the admin team and across the organisation * Answering and directing phone calls * Writing and distributing emails, correspondence memos and letters * Working within a busy company, multi\-tasking and contributing to all aspects of office administration **Essential Requirements:** * 1\-2 years’ experience working in a similar role * Excellent organisational and interpersonal skills, self\-motivation, and the ability to work independently and as part of a team. * High attention to detail, excellent report writing, and communication skills. * Excellent proficiency in Microsoft Office. **Benefits** * Competitive salary. * Contributory pension. * Discretionary company bonus. * Up to 25 days holiday. * Hybrid working/ flexible working arrangements available. * Paid Maternity/Paternity leave. * Career development and support, including training and assistance towards professional chartership or membership.",https://www.linkedin.com/jobs/view/4395345653
"Analyst I, CDD",GoFundMe,"Dublin, County Dublin, Ireland",linkedin,"**Want to help us help others? We’re hiring!** GoFundMe is the world’s most powerful community for good, dedicated to helping people help each other. By uniting individuals and nonprofits in one place, GoFundMe makes it easy and safe for people to ask for help and support causes—for themselves and each other. Together, our community has raised more than $40 billion since 2010\. Join us! The GoFundMe team is searching for a skilled and passionate Analyst I to join our global Trust \& Safety team. In this dynamic role, you will be required to operate at an impeccable level of consistency while mastering new techniques and technologies to ensure GoFundMe remains a safe place to give and receive donations online. Trust \& Safety is an integral part of GoFundMe's business. It drives growth, builds and nurtures our brand, and ensures that we always do the right thing by our customers. We are at the front line of GoFundMe’s efforts to protect donors, fundraiser organizers, beneficiaries, and our company from financial crimes and abuse. As a member of the Customer Due Diligence (CDD) team, you will be responsible for providing high\-quality email support to ensure the authenticity of fundraisers, campaign organizers, and beneficiaries, as well as analyzing fundraisers for fraud and money laundering schemes, verifying identities and Know Your Customer/Business (KYC/B) information, and enforcing compliance with relevant laws and regulations. **The Job** * Provide high\-quality email and occasional phone support to customers and other stakeholders to ensure fundraiser authenticity and safe delivery of funds for beneficiaries. * Evaluate fundraiser and account attributes for unusual activity and escalate identified risks for final determination and/or next steps. * Conduct KYC and CDD reviews on individuals to support escalation pathways to the EDD team for enhanced due diligence; focusing on identity verification, sanctions and watchlist screening, Politically Exposed Person(s), Counter\-Terrorism Financing, and financial crimes. * Conduct onboarding due diligence and KYB reviews on organizations, including but not limited to, identity verification and watchlist management, to ensure entities comply with our Terms of Service and applicable laws and regulations. * Collect and analyze information on an organization’s governance, operations, and financial performance. * Work cross\-functionally with Payments Risk, Content Risk, Legal, Customer Care, the Compliance program, Product, and others to ensure fundraisers on GoFundMe are legitimate and donations are delivered to the correct parties. * Field questions connected to customer due diligence from internal partners. * Develop a deep understanding of risk\-related issues experienced on the platform. **You** * Bachelor’s degree or equivalent experience preferred. * 1\-3 years experience working in the payments or compliance industry, with knowledge of merchant processing behaviors. * In\-depth knowledge of global customer due diligence, AML, CTF, sanctions, beneficial ownership requirements, Know Your Customer standards, and how these apply for a merchant and the wider financial ecosystem. * Passionate about staying current on regulatory changes, industry guidance, and card scheme compliance. * Excel in individual performance metrics to adhere to Service Level Agreements and maintain strong quality standards, while contributing to improving the team’s operational performance. * Ability to work with ambiguity, thrive in a dynamic environment with shifting priorities and quickly adapt to process and policy changes. * Empathetic with a strong customer\-centric mindset. * Work well with a distributed global workforce and confidently maintain communication while working autonomously in a remote or hybrid environment. * Ambitious self\-starter with excellent attention to detail. * Fast learner, with initiative and follow through without sacrificing quality. * Strong performer, able to meet deadlines while balancing different priorities. * Communicate clearly and concisely both orally and in writing, with C1 English proficiency. * Inquisitive with a solution\-oriented mindset. * Exemplify company core values and embody team culture. * Adaptable to structured schedules and resilience in covering holiday shifts as part of regular operations. **Why you’ll love it here** * Make an Impact: Be part of a mission\-driven organization making a positive difference in millions of lives every year. * Innovative Environment: Work with a diverse, passionate, and talented team in a fast\-paced, forward\-thinking atmosphere. * Collaborative Team: Join a fun and collaborative team that works hard and celebrates success together. * Competitive Benefits: Enjoy competitive pay and comprehensive healthcare benefits. * Holistic Support: Enjoy financial assistance for things like hybrid work, family planning, along with generous parental leave, flexible time\-off policies, and mental health and wellness resources to support your overall well\-being. * Growth Opportunities: Participate in learning, development, and recognition programs to help you thrive and grow. * Commitment to DEI: Contribute to diversity, equity, and inclusion through ongoing initiatives and employee resource groups. * Community Engagement: Make a difference through our volunteering program. **We live by our core values:** *impatient to be great* , *find a way* , *earn trust every day* , *fueled by purpose* . Be a part of something bigger with us! GoFundMe is proud to be an equal opportunity employer that actively pursues candidates of diverse backgrounds and experiences. We do not discriminate on the basis of race, color, religion, ethnicity, nationality or national origin, sex, sexual orientation, gender, gender identity or expression, pregnancy status, marital status, age, medical condition, mental or physical disability, or military or veteran status. If you require a reasonable accommodation to complete a job application or a job interview or to otherwise participate in the hiring process, please contact us at accommodationrequests@gofundme.com. **Global Data Privacy Notice For Job Candidates And Applicants** Depending on your location, the General Data Protection Regulation (GDPR) or certain US privacy laws may regulate the way we manage the data of job applicants. Our full notice outlining how data will be processed as part of the application procedure for applicable locations is available here. By submitting your application, you are agreeing to our use and processing of your data as required. **Learn More About GoFundMe** We’re proud to partner with GoFundMe.org, an independent public charity, to extend the reach and impact of our generous community, while helping drive critical social change. You can learn more about GoFundMe.org’s activities and impact in their FY ‘24 annual report. Our annual “Year in Help” report reflects our community’s impact in advancing our mission of helping people help each other. For recent company news and announcements, visit our Newsroom.",https://www.linkedin.com/jobs/view/4395345704
Apprentice Cabinet Maker,NFT Logistics,"Rathnew, WW, IE",indeed,"We are currently recruiting a qualified or Apprentice Cabinet Maker to join our team in Wicklow. **Role Overview:** * Manufacture and assemble custom joinery items * Use a variety of woodworking machinery safely and efficiently * Carry out detailed bench joinery to final finish * Collaborate with a team to meet production deadlines **Candidate Requirements:** * Qualified or 3rd/4th\-year apprentice * Experience in a joinery workshop environment * Strong knowledge of woodworking tools and machinery * Understanding of traditional joinery techniques * Good communication skills and fluent English Job Types: Full\-time, Permanent Pay: €28,876\.80\-€50,035\.11 per year Work Location: In person",https://ie.indeed.com/viewjob?jk=8ed3f71da9fa71dc
Assistant Designer - Menswear,Primark,"Dublin 1, County Dublin, Ireland",linkedin,"**Assistant Designer** Because your ideas are our style. Design, our way. As Assistant Designer, you will work closely alongside Primark’s Buying and Merchandising teams to translate trend into product. Working alongside a Designer, you will collaborate with fellow product designers across the business you will create strong, fashion forward, commercial and global ranges that identify with the Primark brand. As Assistant Designer, you will demonstrate passion, curiosity and interest in fashion. You will predict key trends using the knowledge of top sellers, extensive research and the knowledge of forecasting tools. You will actively participate in key range building meetings and support product development through the completion of focused technical tasks. You will work within the development process, applying good knowledge of design tools, product qualities and specifications. You will be responsible for staying ahead of trends, continually research new ideas. **What You’ll Do As An Assistant Designer** We want you to feel challenged and inspired. Here, you’ll develop your skills across a range of responsibilities: * Research \& Spot Trends: Identify emerging fashion trends through research and translate them into commercially viable concepts for Primark’s ranges. * Support Range Development: Assist the Designer in building impactful, trend\-led product ranges that balance creativity and commerciality. * Collaborate Across Teams: Work closely with Designers, Buyers, and Merchandisers to ensure creative vision is executed and aligned with brand strategy. * Manage Design Process: Track design updates, maintain critical path timelines, and prepare trend and design files for presentations and supplier meetings. * Analyse Performance: Review past range performance with Buying and Merchandising teams to inform future design decisions. * Ensure Commercial Awareness: Understand cost implications, competitor activity, and how trends influence sales to support profitable product development. **Key Interactions and Engagements as part of this role:** As Assistant Designer you will report directly to a Designer. You will work closely with Primark’s Buying and Merchandising teams, as well as collaborating with Design teams across all product categories to ensure alignment and a unified Design vision across our brand. You will also be expected to represent your product categories on working groups and forums across departmentally **What You’ll Get** People are at the heart of what we do here, so it’s essential we provide you with the right environment to perform at your very best. Let’s talk lifestyle. Let’s talk lifestyle: 27 days of leave, plus bank holidays and if you want, you can buy 5 more. Because Primark is all about tailoring to you, we offer Tax Saver Tickets, fitness centre, and a subsidised cafeteria. **What You’ll Bring** We want every person in our organisation to feel like they’re making a key contribution. Here are some of the experiences and skills you’ll need for the role: * Design Expertise: At least 2 years’ experience in a Trainee or Assistant Designer role, with a solid understanding of fashion design principles. * Relevant Qualification: Degree in fashion design or equivalent practical experience. * Technical Proficiency: Strong skills in Adobe Illustrator and Photoshop to create high\-quality design assets. * Commercial Mindset: Good business acumen and genuine interest in retail, with the ability to balance creativity and commerciality. * Attention to Detail \& Organization: Accuracy, proactive approach, and excellent planning skills to manage deadlines effectively. * Collaborative \& Creative Attitude: Strong communication skills, positive energy, and an innovative mindset to thrive in a fast\-paced environment. Excited? Good. Because it’s energising to put your skills to work, in a growing global business committed to encouraging people to express themselves – and feel a sense of belonging. Apply to be part of Primark’s future, today… and enjoy career growth, our way. **About Primark** Primark is an international clothing retailer employing more than 70,000 colleagues across 16 countries in Europe and the US. Founded in Ireland in 1969 under the Penneys brand, Primark aims to create maximum joy at minimum cost – less money and less impact on the planet. Primark continues to expand across new and existing markets with the aim of reaching 530 stores by the end of 2026\. Every person impacts the culture at Primark. Our values: Caring (we always strive to put people first), Dynamic (we bravely push the boundaries to stay ahead) and Together (we learn more, laugh more and achieve more as a team) outline the behaviours we expect of our people as we work with each other, our customers, our suppliers and our partners. Let’s see what impact you can make! Our fashion isn’t one\-size\-fits\-all and neither is our culture. Primark promotes equal employment opportunity, we strive to create an inclusive workplace where people can be themselves, access opportunities and thrive together. **REQ ID:** JR\-3870",https://www.linkedin.com/jobs/view/4373994430
Associate Data Engineer - People Analytics,Central Bank,"Dublin, D, IE",indeed,"**The Central Bank of Ireland serves the public interest by safeguarding monetary and financial stability and by working to ensure that the financial system operates in the best interests of consumers and the wider economy.** We currently have a vacancy for an **Associate Data Analyst, People Analytics** on a **specified purpose contract of 12 months** in the **HR Division**. This role is aligned with the **Bank Executive grade** and the BEX salary scale of *€**39,090* applies. Please click here for further information on our salary scales. The purpose of the role is to assist the People Analytics team with specialist data analytics expertise to support the delivery of effective outcomes, including the production of relevant periodic management information. The role requires a comprehensive understanding of statistical analysis, business analytics, and practical experience in leveraging diverse data analytics tool to drive informed decision\-making within People Analytics. **Responsibilities*** Assist in delivering comprehensive data analysis findings, supporting divisional actions via descriptive, diagnostic, predictive, and decision analytics. * Prepare and analyse information ensuring timely, accurate delivery to stakeholders, effectively communicating completed work outcomes. * Continuously design, implement, and enhance reporting capabilities and tools to produce valuable management insights for informed business decisions. * Ensure stringent data integrity controls and compliance with relevant procedures, policies, and legislative requirements. * Collaborate with colleagues to facilitate effective project and work program delivery within the People Analytics domain. **Requirements*** Hold a third level honours degree or professional qualification in statistics, business analytics, computer science, mathematics, finance, economics, risk, or related fields. * 3\-5 years of relevant experience in data analytics within industry, academia, or financial services, spanning data science, statistical consulting, business intelligence, or data\-focused risk analysis. * Possess understanding/experience in applying data science/analytics in a business context along with practical knowledge of analytics software/tools and infrastructure. * Exhibit proficiency in database management (SQL, SQL Server/Services), statistical analysis tools (R, SAS, Matlab), programming languages (Python, Java, Julia), and business intelligence reporting/visualisation tools. Ability to acquire proficiency in new tools/languages as required. * Willingness to understand the broader regulatory environment, coupled with strong communication, organisational, workload management, judgment, and professional conduct skills. We know it's our people who make the Central Bank special and we are focused on creating a diverse, inclusive, fulfilling and progressive work environment. We encourage applications from candidates with different backgrounds, experiences and perspectives as it strengthens us, as individuals and as an organisation. We are committed to positively supporting candidates with disabilities. If we can make any reasonable accommodations for you in the recruitment process in order to give you the opportunity to perform to your best, please email our Disability Inclusion Partner, Aobh Kavanagh at aobh.kavanagh@centralbank.ie. Any information that you provide will be used only for the purposes of providing relevant support and will have no bearing on how your application will be viewed. *We have recently implemented a hybrid working model to balance the flexibility working from home provides with the value our office environments bring to support collaboration and connection with colleagues.* **Our approach to hybrid working enables colleagues to work from home up to 50% of working days, building on an existing broad range of flexible working policies and practices already in place to support our people achieve the right balance.** Our policies also provide insight into our organisational culture, work environment and working arrangements. Here are some of the key policies (subject to ongoing review and amendment) which may be of interest as you consider a career with us. The Central Bank pension scheme mirrors the rules of the civil service pension scheme. Therefore if you are in receipt of civil/public service pension, abatement may apply to your current pension. Details of the appropriate pension scheme will be provided upon determination of the appointee’s status. Application Details: Closing Date: **09/04/2026** To apply, please complete the application form attached (via the “apply” link). Before starting your application you will be asked to create a profile with us, this will allow you to track and review your application throughout the process. Click ""register"" to create a profile and complete the application process. Once your application has been successfully submitted you will receive an automatic email from us acknowledging receipt. If you do not receive this auto\-acknowledgement, please contact recruitment@centralbank.ie Our policies also provide insight into our organisational culture, work environment and working arrangements. Here are some of the key policies (subject to ongoing review and amendment) which may be of interest as you consider a career with us. **The Central Bank pension scheme mirrors the rules of the civil service pension scheme. Therefore if you are in receipt of civil/public service pension, abatement may apply to your current pension. Details of the appropriate pension scheme will be provided upon determination of the appointee’s status.** *Cuirfear fáilte roimh iarratais i nGaeilge* *The Central Bank of Ireland is an equal opportunities employer.*",https://ie.indeed.com/viewjob?jk=14934216d7464995
