title,company,location,site,description,job_url
Graduate Engineer - Wastewater,Nicholas O'Dwyer Ltd,"Dublin, County Dublin, Ireland",linkedin,"**The Vacancy** **About The Role** We are seeking a motivated and enthusiastic **Graduate Engineer** to join our Wastewater Engineering Team. This is an exciting opportunity for a recent graduate to kick\-start their career in civil or environmental engineering, working on a diverse range of wastewater infrastructure projects. As part of the team, you will gain invaluable hands\-on experience, develop your technical and project management skills, and work on projects that positively impact communities and the environment. You will have the opportunity to contribute to all phases of wastewater engineering projects, from feasibility studies to detailed design and construction, while learning from experienced engineers in a collaborative and supportive environment. You will also participate in our Graduate Programme, which provides structured training and mentoring throughout your first year. In addition to office\-based learning and development, the programme includes practical exposure through site visits and involvement in site\-based activities. **Key Duties And Responsibilities** * Preparation of Feasibility, Route, and Site Selection Reports. * Contributing to the preparation of Concept and Detailed Design Reports, including drawings, calculations, and specifications. * Developing Technical Specifications and Contract Documents for works and investigations. * Assisting in the preparation of documentation for statutory approvals, such as planning permissions and wayleaves. * Collaborate with senior engineers and project managers during construction stage contract administration. * Gaining exposure to developing detailed project plans, including budgets, schedules, and resource allocation. * Assisting in ensuring projects are delivered within budget, on time, and in compliance with regulations and standards. * Learning to identify and mitigate project risks under guidance from senior team members. * Performing site visits and inspections to monitor progress and quality. * Preparing and reviewing technical reports, drawings, and specifications with supervision. * Fostering effective communication and collaboration within the team, clients, and stakeholders. * Building your knowledge of wastewater engineering principles, regulations, and best practices. * Undertake additional responsibilities as required, in line with the evolving needs of the role and the business. **Key Requirements** * Bachelor’s degree in Civil or Environmental Engineering or a related discipline (or currently completing). * Interest in and basic understanding of wastewater engineering principles and practices. * Strong communication skills, both verbal and written, with the ability to work effectively as part of a collaborative team and build positive working relationships. * Methodical, detail\-oriented approach to problem\-solving, with curiosity, a willingness to ask questions, and an eagerness to learn through mentorship. * Self\-motivated and dependable, able to take initiative on assigned tasks while contributing positively within a supportive team environment. * Familiarity with design software such as AutoCAD, Civil 3D, or similar tools is advantageous but not essential. **About Us** Our mission is to deliver sustainable solutions that transform communities and bring about lasting positive change. Through a blend of expertise, innovation and global dedication, we envision a world where sustainable engineering protects growing communities. Nicholas O’Dwyer provides professional services in engineering design, project management, environment and planning, construction supervision and technical and contract advisory. We are one of the most respected Irish consultancies operating in local and international markets, providing professional services to public\- and private\-sector clients. Whether in Ireland, the UK or internationally, we understand and solve major challenges associated with delivering and adapting infrastructure for an increasing global population while maintaining a sustainable environment for future generations. Nicholas O’Dwyer is part of the RSK Group, a leading integrated environmental, engineering, and technical services business providing dynamic, multidisciplinary services to a wide range of sectors. RSK was founded in 1989 and has grown considerably since then. At RSK, we operate as a group of businesses that work together seamlessly, aiming for growth through diversification. Our strategy helps us build a strong and resilient business, capable of weathering external challenges, while also providing greater value to our clients and more opportunities for our employees. Since the beginning, our philosophy has remained the same: employ, develop and reward talented individuals. People are crucial to our company, and we recognise that our success hinges on our colleagues' growth. We're committed to preserving RSK's people\-first culture, promoting innovation, and fostering a supportive and caring environment for collaboration. At RSK, we want you to be part of our successes and help you reach your career aspirations. We take pride in offering employees fulfilling and challenging careers by promoting ongoing growth and empowering individuals to excel. We are committed to fostering an inclusive workplace that welcomes individuals from all backgrounds, experiences, and perspectives. We firmly believe that embracing and celebrating the diversity in our workforce makes us a stronger and more innovative company. If you're passionate about making a difference, join us as we work together to build a brighter, more equitable, and sustainable future for all. Do you have what it takes?",https://www.linkedin.com/jobs/view/4401488040
Graduate Health and Safety Consultant - 2026 Graduate Programme (5558),Arup,"Dublin, County Dublin, Ireland",linkedin,"The Opportunity A career at Arup offers you the chance to make a positive difference in the world. Independently owned and independently minded, Arup is the creative force at the heart of many of the world's most prominent projects in the built environment. When you join Arup, you immediately become part of our global community working on some of the world's most recognised projects. Dedicated to sustainable development, Arup is a collective of advisors and experts working across 140 countries. Founded to be both humane and excellent, we collaborate with our clients and partners using imagination, technology and rigour to shape a better world. As a Graduate Health and Safety Consultant at Arup, you will: * Carrying out the duties of Project Supervisor Design Process (PSDP) co\-ordinator on projects of varying sizes and complexities * Carrying out design health and safety reviews with our design teams on projects * Provision of advice to clients and designers in relation to construction, operational and occupational health and safety * Providing assistance to the Company Safety Officers in the implementation of our occupational safety management systems (which is OHSAS 18001 accredited) * Carrying out design and construction safety reviews/inspections on construction sites and operational facilities Does this role inspire you? We're looking for graduates who are currently pursuing a third level qualification in Health and Safety. **We Also Value** * Third level qualification in another technical area within the construction industry, e.g. Engineering, Architecture, Construction Management or similar * Some knowledge of design and construction\-related health and safety legislation * Some understanding of the PSDP role * Some knowledge of Safety Management Systems * Excellent communications, inter\-personal and writing skills * Pro\-active approach to gathering and processing information with good follow\-through to completion * Some construction site experience will also be an advantage Please submit a a copy of your CV, Cover letter and most recent transcripts when applying.",https://www.linkedin.com/jobs/view/4379187727
Graduate International Business Development Representative,Intuition,"Dublin, County Dublin, Ireland",linkedin,"We are looking for talented graduates wishing to pursue a career in business development and management. This is an exciting opportunity for those who have a keen interest in international experiences with opportunities across our London and Dublin offices. For those based in the London office, there will be a one\-week training period at our Dublin headquarters. The ideal candidates for these positions will be innovative, driven and highly motivated to succeed. They will be client\-focused with excellent communication skills. The ability to multitask and work independently are key requirements, while ambition and diligence are expected as standard. The successful candidates will be at the forefront of our business development efforts and will be involved in a wide array of activities to gain exposure to and build familiarity with our products, services, and markets. Initially, this will involve working with other members of the team in a support capacity to manage and grow overall client relationships, before taking on more client\-facing, revenue\-driven roles. **These Roles Involve:** •Collaborating with management to identify and target opportunities. •Developing a lead database of potential prospects using tools such as LinkedIn, showcasing your digital acumen. •Utilising our software and your research skills to collect essential information (prospect name, position, contact details, etc.). •Qualifying prospects via email and over the phone against key criteria. •Arranging meetings with prospects, demonstrating your organisational skills. •Attending client meetings alongside internal resources, gaining exposure to real\-world interactions. •Managing the design and development of proposals in conjunction with internal resources. •Taking an active role in closing sales, showcasing your ability to bring deals to fruition. •Leading the onboarding process for new clients, gaining hands\-on experience in client initiation. •Creating client development plans, exploring opportunities for upselling and cross\-selling within the account. •Creating account reviews to ensure client satisfaction throughout the client lifecycle. **Abilities \& Skills:** •'Can\-do’ attitude and self\-starter mentality. •Excellent organisational skills with the ability to multitask. •Strong interpersonal and collaborative skills as well as highly effective communication skills. •Enthusiastic, confident and professional manner. •Ability to listen to clients and understand their needs. •Ability to handle pressure and to meet and exceed targets. •Strong negotiation skills. •Basic understanding of digital marketing. **Minimum Requirements:** •Bachelor’s or master’s degree in Business, Business Management, or related fields. •Passion for technology and interest in understanding how people learn. •Excellent communication skills. •Strong analytical and numerical ability. •Willingness to travel. **Intuition is an Equal Opportunities Employer**",https://www.linkedin.com/jobs/view/4402945082
Graduate Manufacturing Engineer,Jones Engineering,"Carlow, County Carlow, Ireland",linkedin,"**Position** : Graduate Manufacturing Engineer **Location** : Carlow **Company Description** We are a leading engineering services company with a proven track record of high quality, customer focused project delivery for over 130 years. Our core divisions include Mechanical Engineering, Electrical Engineering, Instrumentation, Sprinkler and Fire Protection. Some of the other services we provide include Waste to Energy (BioEnergy), Specialist Lift, Off Site Fabrication, Technical Support Services, Maintenance, Asset Management, BIM (Building Information Modelling) and Geo\-Surveying. We offer competitive salaries, financial support for further training, Continuous Professional Development (CPD) leading to chartered status, performance incentives and the ability to progress your career with a world class engineering contractor. **Duties** * Collaborating with multi discipline team to ensure all project quality/documentation requirements are met * Supporting the project team providing analysis through the inspection process * Carry out Root cause analysis and issue Non conformance reports to non compliant subcontractors/vendors * Liaise with the client quality/manufacturing team to ensure project deliverables are met * Aid with co\-ordination of project logistics * Carry out manufacturing inspections * Develop tolerance stack analysis * Liaise with vendors for supporting documentation * Compiling documentation with the aid of the project team including: * Technical Reports * User and O\+M manuals * PFMEA * Process flow maps * Work instructions * Manufacturing checklists * Handover documents **Basic Requirements** * Must have a third level qualification in Manufacturing Engineering * Experience in a manufacturing/assembly background * Experience with Project methodology * Ability to work both individually and as part of a multi\-functional team essential; * Excellent IT Skills essential; * Excellent communication and organisation skills essential; * Keen awareness of safety * Safe pass or to be completed before start **Benefits** We offer a competitive salary package commensurate with experience and qualifications. In addition, you will have the opportunity to work in a dynamic and supportive environment, collaborating with industry leaders and contributing to a sustainable future. Our company values work\-life balance and encourages professional growth through training and development programs. If you are ready to make a difference and be part of a growing industry, please submit your CV, along with a cover letter highlighting your relevant experience and why you are interested in this role. Recognising the contributions and respecting our people is core to our culture and values. We are an equal opportunities employer, and we encourage candidates from all backgrounds to apply for roles. Please note, we are currently not accepting applications from agencies, for this role at this time",https://www.linkedin.com/jobs/view/4402930853
Graduate Sales Executive (Czech/Slovak Market),Revolut,,linkedin,"**About Revolut** People deserve more from their money. More visibility, more control, and more freedom. Since 2015, Revolut has been on a mission to deliver just that. Our powerhouse of products — including spending, saving, investing, exchanging, travelling, and more — help our 70\+ million customers get more from their money every day. As we continue our lightning\-fast growth,‌ 2 things are essential to our success: our people and our culture. In recognition of our outstanding employee experience, we've been certified as a Great Place to Work™. So far, we have 13,000\+ people working around the world, from our offices and remotely, to help us achieve our mission. And we're looking for more brilliant people. People who love building great products, redefining success, and turning the complexity of a chaotic world into the simplicity of a beautiful solution. **About The Role** Our Sales team powers customer growth around the world. From prospecting to acquisition and activation, they own their market segments, solve complex problems, and help more customers discover the value of Revolut with a sharp, solution\-oriented approach. We're looking for a Sales Executive to join our Graduate Sales Programme, which offers an unparalleled opportunity for ambitious graduates, regardless of prior experience, to join a high\-performing, international team. You'll be at the forefront of delivering cutting\-edge financial solutions to customers while building key relationships. You’ll kick things off with a focused bootcamp, complete with workshops, lectures, and hands\-on training to sharpen your commercial and communication skills. Once you're up to speed, you'll dive straight into the on\-the\-job experience by working with real clients. Watch this video from our team members about what goes into being an Account Executive at Revolut. Up to shape what's next in finance? Let's get in touch. **What You'll Be Doing** * Outreaching prospects across multiple touch points and channels, with an emphasis on cold\-calling * Developing and executing a robust lead\-sourcing strategy by identifying key verticals, diversifying your prospects base, and maintaining consistent activity levels * Building and managing your own pipeline, from prospecting to closing and account management, maximising adoption and upsell/cross\-sell opportunities * Liaising customer relationships with internal stakeholders to ensure a smooth experience, from getting started to daily usage * Being autonomous to effectively balance your time (prospect vs. close vs. upsell), activate internal resources, and engage your team * Using solution\-based selling to understand customer needs and communicate the value proposition * Becoming a product expert on Revolut Business, its market positioning, and the solutions it offers, backed by relevant, compelling case studies **What You'll Need** * Fluency in English and Czech/Slovak * To have graduated from university in 2024 or 2025 * Excellent communication skills and articulation over the phone * Impeccable literacy skills (email, LinkedIn outreach) * A drive to launch a career in a high\-performing sales culture * An interest in the financial industry **Nice to have** * Previous internship or experience in a high\-performance, fast\-paced environment, with exposure to strategic thinking, analytical tasks, or client\-facing work Building a global financial super app isn’t enough. Our Revoluters are a priority, and that’s why in 2021 we launched our inaugural D\&I Framework, designed to help us thrive and grow everyday. We're not just doing this because it's the right thing to do. We’re doing it because we know that seeking out diverse talent and creating an inclusive workplace is the way to create exceptional, innovative products and services for our customers. That’s why we encourage applications from people with diverse backgrounds and experiences to join this multicultural, hard\-working team. **Important notice for candidates:** Job scams are on the rise. Please keep these guidelines in mind when applying for any open roles. * Only apply through official Revolut channels. We don’t use any third\-party services or platforms for our recruitment. * Always double\-check the emails you receive. Make sure all communications are being done through official Revolut emails, with an @revolut.com domain. **We won't ask for payment or personal financial information during the hiring process.** If anyone does ask you for this, it’s a scam. Report it immediately. By submitting this application, I confirm that all the information given by me in this application for employment and any additional documents attached hereto are true to the best of my knowledge and that I have not wilfully suppressed any material fact. I confirm I have disclosed if applicable any previous employment with Revolut. I accept that if any of the information given by me in this application is in any way false or incorrect, my application may be rejected, any offer of employment may be withdrawn or my employment with Revolut may be terminated summarily or I may be dismissed. By submitting this application, I agree that my personal data will be processed in accordance with Revolut's Candidate Privacy Notice",https://www.linkedin.com/jobs/view/4401480467
Graduate Sales Executive (Danish Market),Revolut,,linkedin,"**About Revolut** People deserve more from their money. More visibility, more control, and more freedom. Since 2015, Revolut has been on a mission to deliver just that. Our powerhouse of products — including spending, saving, investing, exchanging, travelling, and more — help our 70\+ million customers get more from their money every day. As we continue our lightning\-fast growth,‌ 2 things are essential to our success: our people and our culture. In recognition of our outstanding employee experience, we've been certified as a Great Place to Work™. So far, we have 13,000\+ people working around the world, from our offices and remotely, to help us achieve our mission. And we're looking for more brilliant people. People who love building great products, redefining success, and turning the complexity of a chaotic world into the simplicity of a beautiful solution. **About The Role** Our Sales team powers customer growth around the world. From prospecting to acquisition and activation, they own their market segments, solve complex problems, and help more customers discover the value of Revolut with a sharp, solution\-oriented approach. We're looking for a Sales Executive to join our Graduate Sales Programme, which offers an unparalleled opportunity for ambitious graduates, regardless of prior experience, to join a high\-performing, international team. You'll be at the forefront of delivering cutting\-edge financial solutions to customers while building key relationships. You’ll kick things off with a focused bootcamp, complete with workshops, lectures, and hands\-on training to sharpen your commercial and communication skills. Once you're up to speed, you'll dive straight into the on\-the\-job experience by working with real clients. Watch this video from our team members about what goes into being an Account Executive at Revolut. Up to shape what's next in finance? Let's get in touch. **What You'll Be Doing** * Outreaching prospects across multiple touch points and channels, with an emphasis on cold\-calling * Developing and executing a robust lead\-sourcing strategy by identifying key verticals, diversifying your prospects base, and maintaining consistent activity levels * Building and managing your own pipeline, from prospecting to closing and account management, maximising adoption and upsell/cross\-sell opportunities * Liaising customer relationships with internal stakeholders to ensure a smooth experience, from getting started to daily usage * Being autonomous to effectively balance your time (prospect vs. close vs. upsell), activate internal resources, and engage your team * Using solution\-based selling to understand customer needs and communicate the value proposition * Becoming a product expert on Revolut Business, its market positioning, and the solutions it offers, backed by relevant, compelling case studies **What You'll Need** * Fluency in English * Fluency in Danish * To have graduated from university in 2024 or 2025 * Excellent communication skills and articulation over the phone * Impeccable literacy skills (email, LinkedIn outreach) * A drive to launch a career in a high\-performing sales culture * An interest in the financial industry **Nice to have** * Previous internship or experience in a high\-performance, fast\-paced environment, with exposure to strategic thinking, analytical tasks, or client\-facing work Building a global financial super app isn’t enough. Our Revoluters are a priority, and that’s why in 2021 we launched our inaugural D\&I Framework, designed to help us thrive and grow everyday. We're not just doing this because it's the right thing to do. We’re doing it because we know that seeking out diverse talent and creating an inclusive workplace is the way to create exceptional, innovative products and services for our customers. That’s why we encourage applications from people with diverse backgrounds and experiences to join this multicultural, hard\-working team. **Important notice for candidates:** Job scams are on the rise. Please keep these guidelines in mind when applying for any open roles. * Only apply through official Revolut channels. We don’t use any third\-party services or platforms for our recruitment. * Always double\-check the emails you receive. Make sure all communications are being done through official Revolut emails, with an @revolut.com domain. **We won't ask for payment or personal financial information during the hiring process.** If anyone does ask you for this, it’s a scam. Report it immediately. By submitting this application, I confirm that all the information given by me in this application for employment and any additional documents attached hereto are true to the best of my knowledge and that I have not wilfully suppressed any material fact. I confirm I have disclosed if applicable any previous employment with Revolut. I accept that if any of the information given by me in this application is in any way false or incorrect, my application may be rejected, any offer of employment may be withdrawn or my employment with Revolut may be terminated summarily or I may be dismissed. By submitting this application, I agree that my personal data will be processed in accordance with Revolut's Candidate Privacy Notice",https://www.linkedin.com/jobs/view/4401479460
