title,company,location,site,description,job_url
Language Specialist,Adaptive HVM,"Dublin, County Dublin, Ireland",linkedin,"Job Title : Language Specialist (Data Associate) Languages : French, Dutch, Germany One of our clients is Amazon and they have a new project underway that requires Data Associate with strong language skills in French, German or Dutch, who can work with a range of different types of data. This role is for a 6 months contract with the possibility of extension or become permanent. There is a good opportunity for career development. So if you are a recent graduate who has good data proficiency and interested in starting in a new large scale program with Amazon we would love to hear from you. The role is base in Dublin, there is also opportunities across Europe and in the UK. **Responsibilities** * Maintain and follow strict confidentiality as customer privacy. * Work with a range of different types of data. * Demonstrate proficiency in generating high quality human insight data across a range of modalities, inclusive of text, image video and audio. * Demonstrate support on daily operational deliverables for multiple task types assigned to you and the team * Analyze root causes, identify error patterns, and propose solutions to enhance the quality of labeling tasks and their outputs. * Responsible for identifying day\-to\-day process and operational issues in Standard Operating Procedure, tools and suggest changes to unblock operations * Demonstrate ownership in floor support to clarify internal queries during execution on need basis **Basic Qualifications** * Language speaker in one of the following languages: **French, Dutch or German.** * Excellent English skills. Must be bilingual. * An Associate’s Degree or related work experience * Strong business writing skills with ability to create reports, proposals, and professional correspondence * Advanced reading comprehension with ability to analyze complex business documents * Developed analytical thinking and structured problem\-solving capabilities * Strong ability to interpret and implement detailed instructions across various projects * Proficient research skills with experience gathering and synthesizing information from multiple sources * Proven attention to detail in managing complex tasks and documents **Preferred qualifications** * Bachelor’s degree in a relevant field * 2\+ years of professional work experience with demonstrated task execution ability * Proven capacity to leverage open\-source resources effectively for comprehensive research purposes * Ability to adapt well to fast\-paced environments with changing circumstances, direction, and strategy * 2\-3 years project coordination or management experience (for support functions teams) * Experience managing stakeholder relationships across departments * Advanced proficiency in Microsoft Office Suite and common business applications. The candidate need to be eligible to work in the country full time without sponsorship.",https://www.linkedin.com/jobs/view/4406858156
Legal Counsel – Multinational Tech Company,Methodius IT Recruitment,"Dublin, County Dublin, Ireland",linkedin,"My client is looking for an experienced Legal Counsel to join their team in Dublin. They are a major Multinational company growing their team in Ireland at scale. You’ll provide legal advice to management on strategic initiatives, business operations, regulatory matters, and compliance in Ireland. Lead corporate legal activities and ensure timely, effective legal support across the business, including drafting, reviewing, and negotiating contracts. **Key Responsibilities** * Draft, review, and negotiate a wide range of commercial contracts and legal documents. * Advise on contractual, statutory, and regulatory obligations, ensuring ongoing compliance in customer engagements. * Conduct legal due diligence and research to support business decisions. * Provide legal counsel across corporate, commercial, and risk management matters. * Identify and mitigate legal and operational risks. * Interpret statutes, regulations, and contracts, and advise on resolving legal and business issues. * Partner with internal stakeholders to deliver clear, practical legal guidance. * Manage and support legal projects and, where required, supervise junior legal staff. * Report regularly to the Head of Legal on key matters and developments. **Skills \& Experience** * Qualified lawyer (LLB/LLM/JD or equivalent) with a current practising certificate. * 5–10 years’ experience, including at least 5 years in outsourcing, IT contracts, or licensing. * Strong drafting, negotiation, and analytical skills, with solid knowledge of relevant laws. * Effective communicator with the ability to work across all levels and cultures. * Strong organisational, project management, and prioritisation skills. * Collaborative, proactive, and able to operate independently with minimal support. * Experience managing or mentoring team members is an advantage. * Willingness to travel domestically and internationally as required. Salary dependent on candidate experience. Benefits: Annual Bonus Scheme. Contributory Pension. Private Medical Insurance. Life Assurance \& Long\-Term Disability. Employee Assistance Programme. 22 days annual leave \+ 10 public holidays. Continuous Learning \& Development. Access to extensive training \& certification resources. Lunch \& Learn sessions. Additional perks including company discounts, on\-site parking, and bike\-to\-work scheme **Based in Dublin, Ireland. Hybrid.** Candidates must be eligible to work in Ireland/EU. For more information, please contact **David Coyle** at **01 635 1748** or email **david@methodius.com**",https://www.linkedin.com/jobs/view/4403548400
Logistics and Hardware Operations Analyst - Manufacturing and Distribution -9 months contract,Oracle,"Dublin, County Dublin, Ireland",linkedin,"**What you will do:** * The Operations Analyst will be responsible for monitoring and processing of daily hardware requests with accuracy in a timely manner. * Perform hardware receiving, inspection, put away and cycle counting to maintain inventory accuracy. * Organize inventory and handle variety of daily operations inquiries and issues. Assist team with hardware devices configurations for laptops, network equipment, tokens, etc. * Perform hardware setup and installation, deliver hardware to internal network sites, and participate in projects as dictated by the business need. * Review and update procedures to ensure accuracy to meet business requirements. Keep lab \& associated work areas clean, safe and follow all safety guidelines, and consistently demonstrates and incorporates principals of safety for self and others into daily activities. * Identify areas for process improvement, cost savings, and collaborate with associates to improve efficiency, productivity, and processes. * Communicate to management team regularly operational status and provide insights on performance trends as well as recommendations on how to exceed plan and accelerate productivity and growth. * Perform transactions, maintain accurate system data, analysing and creating operational reports, and data entry and system transactions using Oracle applications and provide daily status and reports to management. * Troubleshoot basic issues independently and report issues to management. May travel to assist network hardware installation or removals. * Work involves some problem solving with assistance and guidance in understanding and applying company policies and procedures. * Ship hardware to end user or destination, in compliance with Oracle Policies and Procedures. Familiarly with Parcel Carrier Procedures, Systems and Transportation Networks essential. * Responsible for shipping, receiving, storing, and distributing Computer Hardware, Peripherals and related equipment. Includes material planning and scheduling. * Meets with suppliers to ensure highest quality Hardware deliveries within established lead times. * The Operations Analyst is an essential role and will report to our Oracle M\&D office daily. This position does not offer teleworker or remote/working from home options. **Desired Experience:** * BA/BS degree, typically graduate or equivalent with 2 years’ experience. * Knowledge of desktop support / PC repair and hardware configuration a plus. * Knowledge of Logistics and Hardware Distribution methodologies. * Knowledge of Microsoft Office. * Good computer and technical skills; quick to learn new tools applicable to the role. * Excellent communication and interpersonal skills. * Willingness to work in a dynamic, fast\-paced environment. * Strong customer services skills with the ability to maintain professionalism under pressure. * Exhibits strong organizational skills, attention to detail and follow\-through. Ability to multitask in a dynamic environment. * Analytical skills and ability to meet deadlines. * Ability to lift, carry, push, or pull up to 50 lbs and drive company vehicles. **What We Will Offer You** * A competitive salary with exciting benefits * Learning and development opportunities to advance your career * An Employee Assistance Program to support your mental health * An inclusive culture that celebrates what makes you unique *At Oracle, we don’t just respect differences—we celebrate them. We believe that innovation starts with inclusion and to create the future we need people with diverse backgrounds, perspectives, and abilities. That’s why we’re committed to creating a workplace where all kinds of people can do their best work. It’s when everyone’s voice is heard and valued that we’re inspired to go beyond what’s been done before.* *https://www.oracle.com/corporate/careers/diversity\-inclusion/*",https://www.linkedin.com/jobs/view/4397570639
Material Handler,Avantor,"Dublin, D, IE",indeed,"**The Opportunity:** -------------------- **Material Handler** ==================== **Location:** Blanchardstown We are currently seeking a **Material Handler** to join a business‑leading company operating in a **GMP‑regulated environment** , including the handling of chemicals and lab related products. This role is ideally suited to individuals who have experience working in **structured, safety‑critical, or regulated environments** and who are comfortable following procedures, quality standards, and compliance requirements. We are open to applicants from a wide range of industries, and **full training will be provided** . **The Team** You will be part of a **small, dedicated team,** working closely together in a highly supportive environment with a positive and collaborative group atmosphere. **What We’re Looking For** **Education** * High school completion or equivalent required * Bachelor’s degree preferred but not essential **Experience** * A consistent and reliable work history is highly desirable * Experience may come from **manufacturing, logistics, laboratory support, healthcare support, facilities, production, or other regulated and process‑driven environments** * Previous GMP, pharmaceutical, laboratory, or chemical handling experience is an advantage * **Candidates with experience working in structured, safety‑critical, or regulated environments will be highly regarded** **Additional Skills \& Attributes** * Friendly, reliable, and hard‑working with a positive attitude * Strong attention to detail and ability to follow written procedures * Familiarity with general warehousing or inventory practices is beneficial * Good IT skills preferred (Microsoft Word, Excel, Outlook) **Who You Are** * You enjoy hands‑on work and thrive in a structured, regulated setting * You are comfortable working to **procedures, safety standards, and quality requirements** * You take ownership of your work and contribute positively to a team environment * You hold a **full driving licence and your own vehicle** and can commute easily to **Meath / Blanchardstown** **How You Will Thrive and Create an Impact** * Place stock orders as required, including **ad‑hoc and urgent requests** * Carry out cleaning and regular **decontamination of specialist laboratory equipment** * Handle chemicals in accordance with **safety, GMP, and site regulatory requirements** * Operate equipment in line with procedural documentation and compliance standards * Maintain and update records for equipment servicing, routine activities, and other associated administrative tasks **Why Join Us** * Entry‑level friendly role with **comprehensive training provided** * Exposure to **GMP‑regulated environments and chemical handling** * Supportive team culture with close day‑to‑day collaboration * Strong opportunity for **career development and progression** within a leading organisation **What we offer** * 37,5 hours per week, only one shift, no weekend work * Private health care * Bonus system * 25 days holidays * Pension scheme * Employee Assistance Program Interested? Let\`s apply! **\#LI\-Onsite** **Disclaimer:** The above statements are intended to describe the general nature and level of work being performed by employees assigned to this classification. They are not intended to be construed as an exhaustive list of all responsibilities, duties and skills required of employees assigned to this position. Avantor is proud to be an equal opportunity employer. **Why Avantor?** **Dare to go further in your career.** Join our global team of 14,000\+ associates whose passion for discovery and determination to overcome challenges relentlessly advances life\-changing science. **The work we do changes people's lives for the better.** It brings new patient treatments and therapies to market, giving a cancer survivor the chance to walk his daughter down the aisle. It enables medical devices that help a little boy hear his mom's voice for the first time. Outcomes such as these create unlimited opportunities for you to contribute your talents, learn new skills and grow your career at Avantor. We are committed to helping you on this journey through our diverse, equitable and inclusive culture which includes learning experiences to support your career growth and success. At Avantor, dare to go further and see how the impact of your contributions set science in motion to create a better world. **Apply today!** **EEO Statement:** We are an Equal Employment/Affirmative Action employer and VEVRAA Federal Contractor. We do not discriminate in hiring on the basis of sex, gender identity, sexual orientation, race, color, religious creed, national origin, physical or mental disability, protected Veteran status, or any other characteristic protected by federal, state/province, or local law. If you need a reasonable accommodation for any part of the employment process, please contact us by email at recruiting@avantorsciences.com and let us know the nature of your request and your contact information. Requests for accommodation will be considered on a case\-by\-case basis. Please note that only inquiries concerning a request for reasonable accommodation will be responded to from this email address. **Privacy Policy:** We will use the personal information that you have submitted to us in order to consider your application for the relevant role. Your privacy is important to us. Please click here for our Privacy Policy which explains the purposes for which we will use your personal information and the ways in which we will handle and retain your information. It also explains the rights you have in relation to your information, and how to contact us with any queries or requests. **3rd Party Non\-Solicitation Policy:** By submitting candidates without having been formally assigned on and contracted for a specific job requisition by Avantor, or by failing to comply with the Avantor recruitment process, you forfeit any fee on the submitted candidates, regardless of your usual terms and conditions. Avantor works with a preferred supplier list and will take the initiative to engage with recruitment agencies based on its needs and will not be accepting any form of solicitation.",https://ie.indeed.com/viewjob?jk=8ca91235578c8f1a
Mechanical Engineer - Ireland,Jacobs,"Dublin, County Dublin, Ireland",linkedin,"At Jacobs, we're challenging today to reinvent tomorrow by solving the world's most critical problems for thriving cities, resilient environments, mission\-critical outcomes, operational advancement, scientific discovery and cutting\-edge manufacturing, turning abstract ideas into realities that transform the world for good. Your impact Ireland’s water sector is undergoing a major transformation. Unprecedented investment and technological innovation are creating a once\-in\-a\-generation opportunity to redefine water and wastewater infrastructure. At Jacobs, we’re proud to be at the forefront of this transformation—partnering with Uisce Éireann (Irish Water), Northern Ireland Water, and the Department for Infrastructure (DfI) to deliver critical water and wastewater services, flood management solutions, and environmental protection projects. These initiatives make a real difference to communities across Ireland. We’ve secured multiple long\-term frameworks and programmes, giving our teams the chance to work on projects that span the entire lifecycle—from strategic planning and feasibility studies to detailed design, construction, and commissioning. We’re looking for Mechanical Engineers at all levels—from ambitious early\-career professionals to experienced leaders—to join our teams across Ireland. Whether you’re starting out or ready to take on a senior role, you’ll work on detailed design and Design \& Build projects for water, wastewater, and bioresources infrastructure. You’ll design and deliver mechanical systems for pumping stations, treatment plants, and associated assets, ensuring compliance with regulatory and safety standards. Depending on your experience, you’ll contribute to or lead engineering activities throughout the project lifecycle—collaborating with multidisciplinary teams and clients to achieve outstanding results. Key responsibilities * Deliver Mechanical Design Excellence Design water and wastewater systems, including pumping stations, treatment plants, and associated infrastructure, from concept through completion. * Innovate \& Add Value Participate in value engineering and buildability workshops, delivering sustainable and innovative design solutions. * Project Lifecycle Involvement Develop feasibility studies, outline and detailed designs, and provide construction and commissioning support. * Technical Documentation Produce design layouts, technical specifications, datasheets, and P\&IDs for mechanical systems. * Equipment Selection Specify mechanical equipment such as pumps, blowers, screens, valves, chemical dosing plant, and odour control systems. * Site Engagement Conduct site surveys and investigations, liaising with clients, contractors, and suppliers. * Compliance \& Standards Ensure designs meet Irish and UK water industry standards, health \& safety, and environmental regulations. * Team Development Mentor junior engineers and contribute to building a strong, collaborative team culture. * Collaborative Delivery Work closely with civil, electrical, and process engineers to deliver integrated solutions. * Project Management Support or lead design management, scheduling, risk management, and financial forecasting. Here's what you'll need * Working toward or holding chartered status (e.g., IMechE or Engineers Ireland). * Experience ranging from developing core mechanical engineering skills to 12\+ years in detailed design and Design \& Build execution for water, wastewater, and bioresources projects. * Strong understanding of mechanical engineering principles, project lifecycle management, and mechanical equipment used in water/wastewater treatment. * Familiarity with Irish water sector regulations, health \& safety, and environmental standards. * Excellent communication, collaboration, and organisational skills; leadership experience for senior roles. * Robust understanding of health, safety, and welfare legislation. * Experience with design tools (e.g., AutoCAD, Revit, BIM) is advantageous. Why Join Jacobs? * Grow Your Career – From early talent to seasoned professionals, we offer clear paths for progression and development. * Shape the Future of Water – Work on innovative, high\-impact projects that protect resources and drive sustainability. * Collaborate with the Best – Partner with industry\-leading clients and experts in a thriving, future\-focused sector. **Ready to make a difference?** Join Jacobs and help deliver smarter, sustainable water solutions for generations to come. Apply today and be part of the change! Joining Jacobs not only connects you locally but globally. Our values stand on a foundation of safety, integrity, inclusion and belonging. We put people at the heart of our business, and we truly believe that by supporting one another through our culture of caring, we all succeed. We value positive mental health and a sense of belonging for all employees. With safety and flexibility always top of mind, we’ve gone beyond traditional ways of working so you have the support, means and space to maximize your potential. You’ll uncover flexible working arrangements, benefits, and opportunities, from well\-being benefits to our global giving and volunteering program, to exploring new and inventive ways to help our clients make the world a better place. No matter what drives you, you’ll discover how you can cultivate, nurture, and achieve your goals – all at a single global company. Find out more about life at Jacobs. We aim to embed inclusion and belonging in everything we do. We know that if we are inclusive, we’re more connected and creative. We accept people for who they are, and we champion the richness of different perspectives, lived experiences and backgrounds in the workplace, as a source of learning and innovation. We are committed to building vibrant communities within Jacobs, including through our Jacobs Employee Networks, Communities of Practice and our Find Your Community initiatives, allowing every employee to find connection, purpose, and belonging. Find out more about our Jacobs Employee Networks here. Jacobs partners with VERCIDA to help us attract and retain talent from a wide range of backgrounds. For greater online accessibility please visit https//www.vercida.com/uk/employers/jacobs to view and access our roles. As a disability confident employer, we will interview disabled candidates who best meet the criteria. We welcome applications from candidates who are seeking flexible working and from those who may not meet all the listed requirements for a role. We value collaboration and believe that in\-person interactions are crucial for both our culture and client delivery. We empower employees with our hybrid working policy, allowing them to split their work week between Jacobs offices/projects and remote locations enabling them to deliver their best work. Your application experience is important to us, and we’re keen to adapt to make every interaction even better. If you require further support or reasonable adjustments with regards to the recruitment process (for example, you require the application form in a different format), please contact the team via Careers Support.",https://www.linkedin.com/jobs/view/4358985433
