title,company,location,site,description,job_url
REVENUE DATA ANALYST- FMCG,Amicus Search & Recruitment,"Dublin, County Dublin, Ireland",linkedin,"Amicus Recruitment has an excellent opportunity for a **Business Analyst** / **Revenue Data Analyst** with a leading Global FMCG Multinational .So why is this an excellent opportunity ? It is their brands ; calibre of people in place\- and the learnings you will obtain With offices worldwide and with an iconic brand portfolio; you cannot get any bigger or better! Importantly however, there is a genuine and collaborative culture with some of the best people within the FMCG sector in situ and if successful, there is room for career progression. I had a really good meerting with Karen \- the Head of Commercial/ Business Operations\- ( Karen is a Diamond of a person\- experienced; sharp yet very personable ) and she said "" *we can be a complex business in that there can be red\- tape and processes to follow; but on the plus side, a number of our brands are number 1\- our customers need our brands to succeed and we have the best in class activations and as you know Denis people consistently move in to different areas and business units and you / the incoming Analyst will obtain fantastic learnings. I have been here close to 6 years and I love working here""* **\*\* To be considered for this role, you must have at least 3 years FMCG experience in a buyer / commercial or analytical role \- and reside in Ireland \*\*** **Key Duties** * Own Customer \& Channel input to the S\&OP process driving forecast accuracy. * Design for channel, retail and pricing \& promo mix optimisation, sku simplification, and Trade Terms optimisation for Fuel for Growth. * Partner with Supply Chain team in the Demand Review Meeting gathering key demand driving inputs from customer and brand teams to ensure the Unit has the appropriate demand forecast to support in\-market activity. * Track and drive total category/channel business performance. * Monitor category/brand/channel market share, financial and execution performance to address issues and opportunities. Lead gap closing initiatives \& interventions. * Responsible for SKU reduction process and Business waste (Residuals). * Own resolutions on trading issues that affect more than one customer (eg promo strategy / volume allocations / 1st to market NPD launches) * Work closely with Customer \& Finance teams on optimising promotional sell\-out (trade investment, volume delivery \& profitability) **KEY SKILLS \& KNOWLEDGE** * Results driven/achievement focused, strong focus on business outcomes, gap closure etc. Makes decisions in ambiguous circumstances * Entrepreneurship and Experimentation: Leads/takes action as if it was own business. Leverages digital technologies to simplify work and improve communication. * Organizational agility: Develops and leverages strong internal and external networks effective at stakeholder management \& strategic influencing. * Strong understanding of the Ireland retailer landscape and how it’s evolving * Digital connected world – understands the path to purchase and embeds connected world framework into strategies and priorities. For more information, please contact Denis Mac Sweeney on 087 977 2742 for a confidential call or email Denis at denis@amicus.ie if you wish to apply for the role.",https://www.linkedin.com/jobs/view/4409888123
Real Estate Agent (Relocation to Dubai),betterhomes,"Dublin, County Dublin, Ireland",linkedin,"**Join the Betterhomes Family: Where Innovation Meets Heart!** **Real Estate Agent** **Location \- Dubai☀️** At Betterhomes, we don't just help people find homes—we've been making dreams come true for over 38 years. From humble beginnings to becoming the Dubai’s leading real estate powerhouse, we've been shaking up the industry with a blend of innovation, passion, and a touch of cheeky charm. As pioneers in the property game, we're always looking for forward\-thinkers, go\-getters, and those who believe in the power of a home to change lives. Ready to roll up your sleeves and be part of something extraordinary? We promise it’ll be more than just a job—it’ll be a chance to make a real impact, all while having a little fun along the way. We are currently looking for Sales and Leasing Real Estate Agents to join our team. You will be part of an experienced, high performing team and will work closely with some of the best in the business. **What you’ll need to succeed:** To be successful you will: * Have a minimum 1 year sales experience in a high performing sales environment – Real Estate, Car sales, Recruitment etc OR have worked in a high\-end service industry such as Cabin Crew or Luxury Retail * Be fluent in English * Have a valid driving license * Have a proactive can\-do attitude * Have the ability to thrive in a fast\-paced, competitive yet supportive environment. * Strong communication and negotiation skills * You will be resilient and have a passion for delivering results while also building lasting relationships with clients. **What’s in it for you?** * Work for a well\-known, award winning, respected brand – be proud of where you work! * You will receive all encompassing industry leading training * Uncapped earning potential \- up to 65% commission paid monthly * Access to the highest amount of leads generated at any Real Estate Brokerage. More Leads \= More $$ for you * Dedicated Client Partnership team generating HOT live listings for our Agents * Access to Exclusive Projects that only Betterhomes Agent’s have access to * Full Marketing and Admin support, so you can focus on getting deals done * Employment Visa * Medical and Life insurance * Career progression opportunities * We recognize our top performers and reward them with– Monthly and Quarterly team incentives including Dinners, Rooftop Bars, Top Golf, Yacht trips just to name a few, Overseas all expenses paid trips twice a year and monthly company wide breakfasts to name a few If you are ready to come to Betterhomes and unlock your full potential, reach out to me today! Betterhomes is an equal opportunity employer committed to diversity and inclusion",https://www.linkedin.com/jobs/view/4407764435
Reliability Engineer,PCI Pharma Services,"Dundalk, County Louth, Ireland",linkedin,"Life changing therapies. Global impact. Bridge to thousands of biopharma companies and their patients. **We are PCI.** Our investment is in People who make an impact, drive progress and create a better tomorrow. Our strategy includes building teams across our global network to pioneer and shape the future of PCI. **Summary Of Role** Working within the Engineering function for PCI Pharma Services (Ireland Sites) the Reliability Engineer will act as the Subject Matter Expert (SME) for assigned packaging equipment within the technical function of Engineering. The Reliability Engineer will display strong technical ability and have interpersonal and communication skills that build the strongest of relationships at department and site level. The Reliability Engineer will have a proven track record in troubleshooting equipment issues and be capable of understanding and optimising machine performance, be strong in a team environment and possess excellent coordination skills. **Primary Responsibilities** * Analyse current processes to assess performance, identify improvement opportunities for equipment reliability, preventive and predictive maintenance, and condition monitoring. * Lead technical root cause analysis, incident investigations and troubleshooting issues related to manufacturing equipment / systems. * Using SMED principles identify opportunities to improve the consistency and RFT of our batch change\-over / machine setting activities. * Assist the Project Engineering function with the transfer of new equipment from the validation to commercial phase of our NPI projects. * Implement a critical spares program based on OEM specifications, ongoing maintenance programs and the predictive maintenance program. * Ensure the calibration of all relevant engineering equipment is maintained appropriately. * Lead and support system improvements, development of detailed specifications, engineering documents and standard operating procedures. * Solving complex problems, project management, equipment lifecycle management and operational excellence. * Support a safe working environment by complying with all pertinent environmental health/safety practice, rules and regulations. * Work with the Continuous Improvement team and Department Managers to deliver operational excellence within PCI Ireland focusing on the warehouse functions. * Design, implement, review and action critical KPIs for processing equipment. **Requirements** * Minimum of 5 years’ experience in a pharmaceutical, medical device or similar environment. * Experience in change control, management of change, non\-conformance, corrective and preventative actions and validation practices. * Excellent communication skills, both verbal and written. * Knowledge of pharmaceutical packaging equipment, packaging materials, technologies and challenges with each. * Experience in a GMP or Regulated Environment. * Proficient utilisation of software packages such as Excel, Word, PowerPoint, Project and Visio and a high level of computer literacy. * Ability to manage multiple tasks and set priorities. * Problem Solving and Troubleshooting skills. The successful candidate should display a dynamic and proactive approach to manage problems. * Self\-motivated with a results driven approach. * Adaptable and ability to work collaboratively. * Effective communication – internal and external. * Team working – display obvious signs of ability to work in high performing complex teams. * Committed to the highest levels of integrity, ethics and professionalism. * Excellent analytical and critical thinking skills with a record of successfully change management. Join us and be part of building the bridge between life changing therapies and patients. Let’s talk future **Equal Employment Opportunity (EEO) Statement** *PCI Pharma Services is an Equal Opportunity/Affirmative Action Employer. We do not unlawfully discriminate on the basis of race, color, religion, age, sex, creed, national origin, ancestry, citizenship status, marital or domestic or civil union status, familial status, affectional or sexual orientation, gender identity or expression, genetics, disability, military eligibility or veteran status, or any other protected status.* *At PCI, Equity and Inclusion are at the core of our company’s purpose: Together, delivering life\-changing therapies. We are committed to cultivating an inclusive workplace by holding ourselves accountable to the highest standards of understanding, fairness, respect, and equal opportunity – at every level. We envision a PCI community where everyone can belong and grow, and we strive to bring this vision to reality by continuously and intentionally assessing our people practices, policies and programs, marketing approach, and workplace culture.*",https://www.linkedin.com/jobs/view/4369102153
SAP Security Consultant - SuccessFactors,Methodius IT Recruitment,"Dublin, County Dublin, Ireland",linkedin,"Our client is seeking an experienced SAP SuccessFactors and S/4 Security Consultant to join a dynamic IT Service Delivery team. This role is responsible for securing SAP systems that support critical business functions, working closely with IT and business stakeholders across operations and projects. **Key Responsibilities** * Design, implement, and manage SAP security procedures and access controls across SuccessFactors and S/4\. * Configure and maintain Role\-Based Permissions (RBP), including roles, groups, and target populations. * Ensure compliance with least privilege and segregation of duties principles. * Conduct security risk assessments and implement appropriate controls. * Perform regular access reviews, audits, and security validations. * Troubleshoot and resolve security and authorization issues. * Support system releases, upgrades, and change requests from a security perspective. * Identify and drive continuous improvement across SAP security processes. * Collaborate with technical and functional teams to manage risks and deliver solutions. * Provide knowledge transfer and documentation to support team capability. **SuccessFactors Security (Module Coverage)** * **Recruiting \& Onboarding:** Secure access to candidate, onboarding, and employee data; ensure data privacy compliance and smooth access transitions. * **Performance \& Goals:** Manage permissions for performance cycles, goal plans, and calibration while protecting confidentiality. * **Learning (LMS):** Control access to learning content, roles, and reporting. * **Career Development \& Succession:** Secure sensitive talent data, ensuring appropriate visibility for employees, managers, and HR. **Essential Experience** * Proven experience in SAP SuccessFactors Security configuration and administration. * Strong understanding of access control, RBP, and security best practices. **Desirable Experience** * Experience with SAP S/4 Security. * Familiarity with HP Quality Centre (test scripting and defect management). * Exposure to Concur. * Demonstrated leadership or mentoring capability. Salary dependent on candidate experience. Benefits: Annual Bonus Scheme. Contributory Pension. Private Medical Insurance. Life Assurance \& Long\-Term Disability. Employee Assistance Programme. 22 days annual leave \+ 10 public holidays. Continuous Learning \& Development. Access to extensive training \& certification resources. Lunch \& Learn sessions. Additional perks including company discounts, on\-site parking, and bike\-to\-work scheme **Based in Dublin, Ireland. Hybrid (1 day a week on site)** . Candidates must be eligible to work in Ireland/EU. For more information, please contact **David Coyle** at **01 635 1748** or email **david@methodius.com**",https://www.linkedin.com/jobs/view/4407831088
Scrum Master,Glanbia,"Dublin, County Dublin, Ireland",linkedin,"**SCRUM Master** **Glanbia Enterprise Solutions** **Role Overview** The **Scrum Master** is responsible for orchestrating multiple Product teams through the delivery lifecycle to realise valuable technology solutions for the Business. They are a facilitator, coach, and problem solver to their Product teams, ensuring they adhere to agreed delivery practices, foster self\-organisation, and overcome delivery obstacles. They foster a culture of continuous improvement within their Product teams, whilst advocating for the broader adoption of Agile methodologies and practices across the organisation. This opportunity reports to the **Head of Technology Value Stream** **Key Responsibilities** * Creates and Runs key Product team ceremonies, including Sprint Planning, Daily Stand\-ups, Sprint Reviews, and Sprint Retrospectives. * Coaches the Product team to ensure ceremonies are effective, time\-boxed, and all team members are actively participating. * Guides the Product team through the application of Agile principles and best practices. * Promotes a safe and collaborative environment for the Product team to thrive in. * Supports the product team to maintain, track, and report on the Product team progress, challenges, and changes; working with the Product Manager to resolve or improve Product team performance. This includes the maintenance of Product team artefacts (e.g., Burndown charts, Sprint backlog, time tracking). * Supports the Product Owners in refining and maintaining the Product backlog (e.g., ensuring upcoming user stories are groomed). * Acts as an SME on Agile methodologies and practices, liaising with Business and IS communities on the adoption of Agile best practices. * Supports the product manager with Budget tracking and management of resource allocation. * Responsible for providing regular updates on the Backlog and sprint planning for roadmap updates * Supports the coordinatinon of monthly timesheet planning across the team validating resource recharges to sprints and work delivered **The Skills You Will Bring To The Team** * Bachelor's or Master's degree in a relevant field (e.g., Project Management, Computer Science, Information Technology), or equivalent experience. * Industry certifications highly desirable (e.g. Agile Methodologies, Scrum Master) * Proven experience as a Scrum Master, preferably in an environment that is new to Agile ways of working. * Track record of coaching Product teams throughout the delivery lifecycle, with an ability to evidence delivery successes and overcoming obstacles . * Significant understanding and hands\-on experience of Agile methodologies. Certified Scrum Master (CSM) or other relevant Agile certifications (e.g., SAFe, Certified Product Owner) are preferred. * Servant leadership and facilitation skills to develop Product teams. * Strong ability to arbitrate and resolve conflicts, promoting a collaborative team environment. * Able to inspire and motivate teams to achieve their goals and deliver high\-quality increments. * Understanding of financial and resource constraints. * Effective communicator that is able to influence key Business and IS stakeholders on the value of Agile practices. * Strong understanding of Agile tools and software (e.g., Jira, Confluence) **Where And How You Will Work** The opportunity will be based in Citywest, Dublin 24 with hybrid working arrangements available which offer you a greater choice in how you work and live, giving you a better work\-life balance. **What we would like to offer you!** The opportunity to develop your career on a global stage, continuous learning through an on\-demand learning platform, and a competitive compensation package including staff discounts, generous family leave policy, health \& dental plan, competitive salary. **About Glanbia** Glanbia is a better nutrition company with three divisions: Performance Nutrition, Health \& Nutrition and Dairy Nutrition. Collectively and with our partners we offer an incredible breadth of expertise in nutrition. We employ a team of 5800 people, work with global food and beverage companies, and sell our award\-winning and market\-leading brands and ingredients in more than 100 countries worldwide At Glanbia, we celebrate diversity, because we know that our individual strengths make us stronger together. We welcome and encourage interest from a variety of candidates, we will give your application consideration, without regard to race, color, religion, sex, sexual orientation, gender perception or identity, national origin, age, marital status, protected veteran status, or disability status. At Glanbia, our culture celebrates individuality, knowing that together we are more.",https://www.linkedin.com/jobs/view/4408619011
Service Technician,Crewit Resourcing Group,"County Carlow, Ireland",linkedin,"**Service Technician** **Location:** On\-site / Field\-based (UK or Ireland – depending on assignment) **Company:** Crewit Resourcing Crewit Resourcing is currently recruiting an experienced Service Technician to join a well\-established agricultural engineering operation. This is an excellent opportunity for a hands\-on technician who enjoys diagnostic work, repairs, and continuous technical development. **Key Responsibilities** * Carry out diagnostics, servicing, and repairs on agricultural machinery and equipment * Perform pre\-delivery inspections and machine setup * Complete all job\-related documentation and service reports accurately and on time * Support and mentor junior technicians where required * Maintain a clean, organised, and safe working environment * Work effectively as part of a busy workshop and mobile service team **Requirements** * 3–5 years’ experience working in a busy workshop or service technician role * Strong mechanical and diagnostic skills (agricultural machinery experience preferred) * Comfortable using IT systems for reporting and diagnostics * Good communication skills and a team\-player attitude * Ability to work independently and manage service tasks efficiently * Ideally experience in Claas , Horsch, or JCB **Training \& Development** * Full manufacturer and product training will be provided * Ongoing opportunities to develop technical and professional skills **What’s on Offer** * Competitive salary package (based on experience) * Long\-term, stable role with strong career progression * Supportive working environment with continuous training",https://www.linkedin.com/jobs/view/4410044087
Software Architect,Air Apps,"Dublin, County Dublin, Ireland",linkedin,"**About Air Apps** At Air Apps, we believe in thinking bigger—and moving faster. We’re a family\-founded company on a mission to create the world’s first AI\-powered Personal \& Entrepreneurial Resource Planner (PRP), and we need your passion and ambition to help us change how people plan, work, and live. Born in Lisbon, Portugal, in 2018—and now with offices in both Lisbon and San Francisco—we’ve remained self\-funded while reaching over 100 million downloads worldwide. Our long\-term focus drives us to challenge the status quo every day, pushing the boundaries of AI\-driven solutions that truly make a difference. Here, you’ll be a creative force, shaping products that empower people across the globe. Join us on this journey to redefine resource management—and change lives along the way. **The Role** As a **Software Architect / Solutions Architect** at Air Apps, you will be responsible for **defining and overseeing the overall system architecture** for our AI\-powered platform. You will collaborate with engineering teams, product managers, and stakeholders to design **scalable, secure, and high\-performing solutions** that align with business objectives. You will play a key role in shaping our **technology strategy, evaluating new tools and frameworks, and ensuring best practices** in software design, cloud infrastructure, and system integration. * This is a fully onsite position, based at our office in Lisbon, where you will collaborate closely with cross\-functional teams in person and contribute to a dynamic and fast\-paced environment. We are open to support with relocation efforts. **Responsibilities** * Define and maintain the overall architecture and system design for scalable and efficient software solutions. * Provide technical leadership to engineering teams, guiding them in best practices for architecture, coding, and system scalability. * Design and document high\-level system diagrams, data flows, and API structures. * Evaluate and recommend technologies, frameworks, and cloud services to optimize performance, security, and cost\-efficiency. * Ensure high availability, fault tolerance, and security in all architectural decisions. * Oversee system integrations, including microservices, APIs, and third\-party services. * Work closely with DevOps and SRE teams to ensure smooth deployment and operational reliability. * Establish coding and architecture standards, ensuring maintainability and scalability of codebases. * Identify and mitigate technical risks, ensuring system resilience and future scalability. * Conduct architecture reviews and performance audits to continuously improve system efficiency. **Requirements** * Around 6\+ years of experience in software development and architecture. * Strong expertise in system design, cloud computing, and microservices architecture. * Experience with cloud platforms (AWS, Azure, or Google Cloud Platform) and cloud\-native architectures. * Proficiency in backend technologies (e.g., Node.js, Python, Java, .NET) and experience with modern frontend frameworks (e.g., React, Angular, Vue). * Knowledge of databases (SQL and NoSQL), caching strategies, and data pipelines. * Experience with event\-driven architectures, API design, and containerization (Docker, Kubernetes). * Strong understanding of security best practices, identity management, and encryption techniques. * Ability to evaluate trade\-offs in architectural decisions, balancing scalability, cost, and complexity. * Familiarity with DevOps, CI/CD pipelines, and Infrastructure as Code (Terraform, CloudFormation). * Strong communication skills, with the ability to explain complex architectural concepts to technical and non\-technical stakeholders. **What benefits are we offering?** * Apple hardware ecosystem for work. * Annual Bonus * Top\-tier Health and Life Insurance for peace of mind. * Transportation Budget to support your commute needs. * Coverflex benefits package for meal allowances, well\-being, and more. * Childcare support. * Air Conference \- an opportunity to meet the team, collaborate, and grow together. * Pension Fund to support your long\-term financial planning. * Urban Sports Club membership to keep you active. * Meals 100% free at the hub. **Diversity \& Inclusion** At Air Apps, we are committed to fostering a diverse, inclusive, and equitable workplace. We enthusiastically welcome applicants from all backgrounds, experiences, and perspectives. We celebrate diversity in all its forms and believe that varied voices and experiences make us stronger. **Application Disclaimer** At Air Apps, we value transparency and integrity in our hiring process. Applicants must submit their own work without any AI\-generated assistance. Any use of AI in application materials, assessments, or interviews will result in disqualification.",https://www.linkedin.com/jobs/view/4407755679
