title,company,location,site,description,job_url
Customer Finance Specialist (Accounts Receivable),Mondelēz International,"Coolock, D, IE",indeed,"Job Description **Are You Ready to Make It Happen at Mondelēz International?** **Join our Mission to Lead the Future of Snacking. Make It Possible.** You will handle the daily management of accounts receivables activity against collections strategies, worklists and priorities. You will work to minimize overdue invoice balances, cash application to customer accounts and processing claims/deductions. **How you will contribute** You will: * Proactively execute cash collection in line with payment terms and process flows your respective accounts and prompt retrospective chasing of overdue invoices in line with targets. * Monitor Account Dashboard daily reacting to anomalies and escalating where required if risk to cash deliverables. * Ensure processes are followed to facilitate effective processing of deductions. * Communicate in a timely manner and work with appropriate functions to ensure deductions are cleared or recovered. * Ensure prompt reconciliation of credits with deductions * Partner with commercial teams to manage their accounts ledger and debt – ensuring all claims are processed in a timely manner. * Work Cross Functionally \& with Customers \& 3 PLs to resolve Pricing and Delivery Queries. * Lead Monthly Ledger Reviews with Commercial Teams to review o/s debt and escalate issues ensuring on target Overdue %. * Utilise HR (DMS dispute management ) to ensure date up to date cases. * Support Audit deliverables, and develop system knowledge to implement new systems and developments relevant to your area. * Work with UK BTC teams for knowledge sharing and support. **What you will bring** A desire to drive your future and accelerate your career and the following experience and knowledge: * Experience in accounts receivable or with a background in finance * Excellent knowledge of SAP and a very good knowledge of MS Office (Excel) * Good communication and teamwork skills * Good analytical mindset with attention to detail * Able to understand the wider business context **More about this role** **What you need to know about this position:** **What extra ingredients you will bring:** **Education / Certifications:** **Job specific requirements:** **Travel requirements:** **Work schedule:** Relocation Support Available? No Relocation support available Business Unit Summary We value our talented employees, and whenever possible strive to help one of our associates grow professionally before recruiting new talent to our open positions. If you think the open position you see is right for you, we encourage you to apply!*Our people make all the difference in our succes* Mondelēz International is an equal opportunity employer and all qualified applicants will receive consideration for employment without regard to race, color, religion, gender, sexual orientation or preference, gender identity, national origin, disability status, protected veteran status, or any other characteristic protected by law. Excited to grow your career? We value our talented employees, and whenever possible strive to help one of our associates grow professionally before recruiting new talent to our open positions. If you think the open position you see is right for you, we encourage you to apply! IF YOU REQUIRE SUPPORT TO COMPLETE YOUR APPLICATION OR DURING THE INTERVIEW PROCESS, PLEASE CONTACT THE RECRUITER Job Type Regular Credit \& Collections Management (BTC) Customer Service \& Logistics",https://ie.indeed.com/viewjob?jk=85b3d2ab594b3f18
"Customer Growth Associate, SBS Scaled, Google Customer Solutions",Google,"Dublin, County Dublin, Ireland",linkedin,"**Minimum qualifications:** * Bachelor's degree or equivalent practical experience. * Experience in digital sales, client management, customer service, business development, customer outreach, marketing, consulting, digital advertising, or related fields. * Ability to communicate in English and French fluently to engage with clients in the region. **Preferred qualifications:** * Familiarity with Google Ads and online advertising, with Google Digital Workshop certification or equivalent experience. * Ability to own an advertising or media sales portfolio in France, and consistently overachieve quotas to drive growth. * Ability to build compelling narratives and utilize storytelling as a client engagement strategy. * Ability to influence stakeholders internally and externally to deliver impact. **About The Job** Businesses of all shapes and sizes rely on Google’s unparalleled advertising solutions to help them grow in today's dynamic marketing environment. You bring a passion for sales, knowledge of online media, and commitment to maximize customer success. You act like an owner, move with velocity through change, finding innovative and strategic ways to consistently deliver extraordinary and incremental outcomes for both Google and your customers. You build trusted relationships with customers, uncovering their business needs and translating them into powerful solutions to achieve their most ambitious goals. You achieve as a team with sellers, shape the future of advertising in the AI\-era, and make a real impact on the millions of companies and billions of users that trust Google with their most important goals. In this role, you will specialize in delivering effective solutions to high potential small businesses from all verticals and business models in the most efficient way for the business. As a Customer Growth Associate, you will be the front\-line promoter, the majority of your time will be spent establishing relationships by conducting regular phone consultations and sales pitches with a large portfolio of clients. Using your influencing and relationship\-building skills, you will provide Google\-caliber solution promoting, partnership management and analysis to deliver successful business outcomes. Google Customer Solutions (GCS) sales teams are trusted advisors and competitive sellers who maintain a relentless focus on customer success by bringing the best Google has to offer to small\- and medium\-sized businesses (SMBs), which are the backbone of our communities. As a member of our team, you’ll have the opportunity to work with company owners and make a real difference in their businesses by helping them grow. Together, we help shape the future of innovation for customers, partners, and sellers...and we have fun doing it. **Responsibilities** * Deliver against ambitious quarterly business growth and product growth goals. * Establish relationships via phone calls or email marketing and conduct regular phone consultations with clients to advise them on how to get the best return on their Google Ads investment. * Own a portfolio of small businesses by thoroughly understanding growth drivers identifying opportunities for growth, managing risks and building quarterly plans for achievement. * Drive customer growth by delivering outstanding customer sales experience and achieving customer business and marketing objectives. * Participate in continuous training throughout the program to develop professional and business skills. Google is proud to be an equal opportunity workplace and is an affirmative action employer. We are committed to equal employment opportunity regardless of race, color, ancestry, religion, sex, national origin, sexual orientation, age, citizenship, marital status, disability, gender identity or Veteran status. We also consider qualified applicants regardless of criminal histories, consistent with legal requirements. See also Google's EEO Policy and EEO is the Law. If you have a disability or special need that requires accommodation, please let us know by completing our Accommodations for Applicants form .",https://www.linkedin.com/jobs/view/4401499801
"Customer Growth Associate, SBS Scaled, Google Customer Solutions",Google,"Dublin, D, IE",indeed,"### **Minimum qualifications:** * Bachelor's degree or equivalent practical experience. * Experience in digital sales, client management, customer service, business development, customer outreach, marketing, consulting, digital advertising, or related fields. * Ability to communicate in English and French fluently to engage with clients in the region. ### **Preferred qualifications:** * Familiarity with Google Ads and online advertising, with Google Digital Workshop certification or equivalent experience. * Ability to own an advertising or media sales portfolio in France, and consistently overachieve quotas to drive growth. * Ability to build compelling narratives and utilize storytelling as a client engagement strategy. * Ability to influence stakeholders internally and externally to deliver impact. **About the job** ----------------- Businesses of all shapes and sizes rely on Google’s unparalleled advertising solutions to help them grow in today's dynamic marketing environment. You bring a passion for sales, knowledge of online media, and commitment to maximize customer success. You act like an owner, move with velocity through change, finding innovative and strategic ways to consistently deliver extraordinary and incremental outcomes for both Google and your customers. You build trusted relationships with customers, uncovering their business needs and translating them into powerful solutions to achieve their most ambitious goals. You achieve as a team with sellers, shape the future of advertising in the AI\-era, and make a real impact on the millions of companies and billions of users that trust Google with their most important goals. In this role, you will specialize in delivering effective solutions to high potential small businesses from all verticals and business models in the most efficient way for the business. As a Customer Growth Associate, you will be the front\-line promoter, the majority of your time will be spent establishing relationships by conducting regular phone consultations and sales pitches with a large portfolio of clients. Using your influencing and relationship\-building skills, you will provide Google\-caliber solution promoting, partnership management and analysis to deliver successful business outcomes. Google Customer Solutions (GCS) sales teams are trusted advisors and competitive sellers who maintain a relentless focus on customer success by bringing the best Google has to offer to small\- and medium\-sized businesses (SMBs), which are the backbone of our communities. As a member of our team, you’ll have the opportunity to work with company owners and make a real difference in their businesses by helping them grow. Together, we help shape the future of innovation for customers, partners, and sellers...and we have fun doing it. **Responsibilities** -------------------- * Deliver against ambitious quarterly business growth and product growth goals. * Establish relationships via phone calls or email marketing and conduct regular phone consultations with clients to advise them on how to get the best return on their Google Ads investment. * Own a portfolio of small businesses by thoroughly understanding growth drivers identifying opportunities for growth, managing risks and building quarterly plans for achievement. * Drive customer growth by delivering outstanding customer sales experience and achieving customer business and marketing objectives. * Participate in continuous training throughout the program to develop professional and business skills. Google is proud to be an equal opportunity workplace and is an affirmative action employer. We are committed to equal employment opportunity regardless of race, color, ancestry, religion, sex, national origin, sexual orientation, age, citizenship, marital status, disability, gender identity or Veteran status. We also consider qualified applicants regardless of criminal histories, consistent with legal requirements. See also Google's EEO Policy and EEO is the Law. If you have a disability or special need that requires accommodation, please let us know by completing our Accommodations for Applicants form.",https://ie.indeed.com/viewjob?jk=cbf7dfb7fe29d637
Customer Success Intern (Summer 2026),Okta,"Dublin, County Dublin, Ireland",linkedin,"**Secure Every Identity, from AI to Human** Identity is the key to unlocking the potential of AI. Okta secures AI by building the trusted, neutral infrastructure that enables organizations to safely embrace this new era. This work requires a relentless drive to solve complex challenges with real\-world stakes. We are looking for builders and owners who operate with speed and urgency and execute with excellence. This is an opportunity to do career\-defining work. We're all in on this mission. If you are too, let's talk. **Location:** We’re seeking dynamic and motivated individuals to join our team in one of our EMEA HQ, Dublin, Ireland. Our interns will be in\-person. You will work in\-person in the office Monday through Thursdays and can work remotely on Fridays. **About the internship:** The Customer Success Team at Okta ensures our customers achieve their business goals using our technology. We bridge the gap between Okta’s innovations and our customers’ priorities, driving long\-term value and strategic alignment. The Okta Customer Success Intern will be involved in all stages of the customer journey: onboarding, deployment, product adoption, and renewal. You will gain hands\-on experience in how a Customer Success professional strategically partners with global brands to maximise their outcomes with Okta. **You will gain experience in:** **Business:** Mapping the customer journey from initial setup to full adoption; learning Customer Success concepts like recurring revenue (ARR), ROI, and success planning. **Technical:** Building knowledge in Identity Access Management (IAM) and Zero Trust; the opportunity to earn your Okta Professional Certification; and applying AI to CS best practices. **Functional:** Developing presentation skills for executives; communicating technical concepts clearly; and collaborating with cross\-functional teams. **What You’ll Get Do:** * Learn to communicate the business value of Okta’s products and solutions through presentations and storytelling. * Observe Customer Success Managers to understand onboarding plans, competitive landscapes, and IAM best practices. * Learn the Scale Customer Success motion and playbook. * Collaborate with teams like Sales, Engineering, Renewals, Marketing and Customer Advocacy to drive measurable business outcomes. **Who we are Looking For** : * **Academic Journey:** Currently pursuing a Bachelor’s or Master’s degree with a graduation date between December 2026 and Summer 2027\. * **Problem Solvers:** A proactive learner with a sharp eye for detail and the ability to solve complex problems through data and analysis. * **Communication:** A strong communicator and storyteller, comfortable presenting ideas and research to diverse audiences. * **Project Management:** Ability to manage multiple projects simultaneously, from performing market research to generating actionable reports. * **Tech Passion:** A genuine interest in building a career within the SaaS/Cloud space, with a specific curiosity for how Identity secures the world’s leading brands. **Availability:** Able to commit to a full\-time 12\-week internship (Summer 2026\). **Okta’s Intern Program** As an intern at Okta, you’ll do **real work that matters** . From day one, you’ll own meaningful projects that directly contribute to our mission and get a front\-row seat to how the world’s leading Identity company operates. You won’t do it alone, you’ll have the dedicated support of a mentor and manager to help you navigate your project and master new skills. Beyond the work, you’ll join a vibrant community of fellow interns and Okta employees. You’ll have the chance to grow professionally through exclusive events like our Executive Speaker Series, technical ""Brown Bag"" sessions, and, of course, plenty of social events to ensure you’re having fun along the way. **The Okta Experience** * Supporting Your Well\-Being * Driving Social Impact * Developing Talent and Fostering Connection \+ Community We are intentional about connection. Our global community, spanning over 20 offices worldwide, is united by a drive to innovate. Your journey begins with an immersive, in\-person onboarding experience designed to accelerate your impact and connect you to our mission and team from day one. Okta is an Equal Opportunity Employer. All qualified applicants will receive consideration for employment without regard to race, color, religion, sex, sexual orientation, gender identity, national origin, ancestry, marital status, age, physical or mental disability, or status as a protected veteran. We also consider for employment qualified applicants with arrest and convictions records, consistent with applicable laws. If reasonable accommodation is needed to complete any part of the job application, interview process, or onboarding please use this Form to request an accommodation. Notice for New York City Applicants \& Employees: Okta may use Automated Employment Decision Tools (AEDT), as defined by New York City Local Law 144, that use artificial intelligence, machine learning, or other automated processes to assist in our recruitment and hiring process. In accordance with NYC Local Law 144, if you are an applicant or employee residing in New York City, please click here to view our full NYC AEDT Notice. Okta is committed to complying with applicable data privacy and security laws and regulations. For more information, please see our Personnel and Job Candidate Privacy Notice at https://www.okta.com/legal/personnel\-policy/.",https://www.linkedin.com/jobs/view/4399997763
Cyber Security Analyst,Dunnes Stores,"Dublin, County Dublin, Ireland",linkedin,"**Senior Cyber Defence Analyst** **SOC Escalations \| Threat Hunting \| Detection Engineering \| Dublin City Centre** **About Dunnes Stores** Dunnes Stores is Ireland’s leading retailer across food, fashion and home. With over 130 stores and continued investment in digital and operational transformation, technology plays a central role in how we serve customers. From Scan \& Go and intelligent digital displays to modern cloud infrastructure, we are building a retail environment powered by secure, resilient systems. Our Cyber Defence function is central to that mission. **The Opportunity** We are hiring a **Senior Cyber Defence Analyst** to act as a key escalation point within our SOC and to strengthen detection, vulnerability management and cyber engineering capability across the organisation. This is not a monitoring\-only role. You will: * Lead complex incident investigations * Design and validate detection use cases * Drive vulnerability and attack surface management * Mentor junior analysts * Contribute to wider cybersecurity initiatives across IT The role is based at our Head Office in Dublin city centre and reports to the Senior Manager Cyber Defence. **What You’ll Be Responsible For** * Acting as escalation point for SIEM investigations and root cause analysis * Planning and executing threat hunts using retail\-focused intelligence * Owning and improving enterprise vulnerability management coverage * Overseeing external attack surface management and remediation * Designing and validating new detection use cases * Conducting cloud security posture reviews * Supporting purple team and controls testing initiatives * Providing leadership cover when required **What We’re Looking For** * 5\+ years’ experience in cybersecurity, ideally in SOC or incident response * Strong experience across SIEM, EDR, vulnerability management and cloud security * Deep understanding of Windows, Linux, AD, networking and cloud environments * Hands\-on experience in incident response and forensic investigation * Familiarity with MITRE ATT\&CK, NIST and PCI DSS * Certifications such as CISSP, GIAC, CEH, OSCP or similar * Ability to translate technical risk into business impact **Why Join Dunnes Stores** * Competitive salary * Comprehensive benefits including employee discount * Clear opportunity to influence and shape a growing Cyber Defence function * A collaborative environment focused on continuous improvement Full details are available via the Apply button.",https://www.linkedin.com/jobs/view/4374773515
Data Analyst,Peroptyx,"Maynooth, County Kildare, Ireland",linkedin,"For thousands of years, maps have provided humans with the knowledge they need to make decisions. As a **Maps Evaluator** , you will have the opportunity to provide ground truth for your town, city or country. At Peroptyx, **we are looking for Data Analysts** who will review mapping data for digital mapping applications. Your research capabilities will validate and ensure that the navigation of certain routes are accurate and safe. As part of this role, you will verify that business names and opening hours are correct. You will check that the distance from a starting point to an end destination is listed accurately, resulting in better user experiences. With this job you can plan your days around this **highly flexible working schedule** , work weekends or late evenings, all from the **comfort of your own office** . The flexibility of our roles minimizes the impact on your daily routine. So, whether you are a student looking to earn as you learn, a retiree looking for a new challenge, a part\-time/full time professional or a work from home parent, Peroptyx has the right role for you! **Benefits** * Work up to 20 hours per week. * Earn a competitive rate of pay. * Develop your research skills. * Avoid the long commute. * Work from the comfort of your home office. * Enjoy the flexibility of setting your own working hours! **Apply Online Today!** This is a freelance, independent contractor position. **Minimum Qualifications** **The Ideal Candidate** * Fluent in English * Excellent research skills. * Excellent local knowledge of your home country. * Good understanding and general knowledge of the geography and culture of the Philippines. * Analytical mindset. **Job Requirements** * Must be living in the Philippines for a minimum of 5 consecutive years. * Must pass an online open\-book exam that can verify your full understanding of the material and concepts. * Must be willing to work a minimum of 10 hours and up to 20 hours per week depending on task availability. * Good working knowledge of search engines, map applications and familiarity with social media platforms. * Strong ability to learn, understand and apply multiple sets of different instructions. * All work must be of an independent nature. **Technical Requirements To Perform The Work** Access to a laptop or computer which uses: * A logon account unique to you * Anti\-virus solution that is kept up to date, with regular scans performed * Only one member per household may apply NB. All products should be provided at your own expense.",https://www.linkedin.com/jobs/view/4401491650
