title,company,location,site,description,job_url
Sales Associate,Slalom,"Dublin, County Dublin, Ireland",linkedin,"**About The Role** You will own the full sales cycle — from first conversation to signed contract. That means you prospect, qualify, pitch, negotiate, and close. You'll build and manage your own pipeline across new and existing accounts, partnering closely with our account, delivery, and practice teams to bring the right solution to every client conversation. This role involves a high level of internal partnership amongst many different teams you'll be the key link between marketing, sales, consulting, and product teams. **Day To Day, You'll** * Hunt for new business. Identify, target, and open net\-new accounts across enterprise and mid\-market — you don't wait for inbound * Run deals end to end. From discovery through to MSA and SOW, you own the commercial process and know how to move a deal forward at every stage * Build and leverage partner relationships. You'll work shoulder to shoulder with AWS, Salesforce, and Microsoft to generate joint pipeline and bring co\-sell opportunities to life * Win on value, not price. You'll define win themes, understand the competitive landscape, and contribute to compelling proposals that land * Hold yourself accountable to a number. You'll manage a well\-structured, growing book of business and have the forecasting discipline to back it up **What You'll Bring** * A proven track record in solution sales — you've hit your number, you know what it takes, and you're hungry to do it again * Hunter mentality. You open doors others don't and you follow through until they close * An AI\-first mindset, both for the sales life cycle and in how we will deliver our solutions * The ability to build real relationships — with clients, with partners, and with the internal team you'll rally around a deal. * Sharp commercial instincts — you understand how to structure a deal, handle an objection, and negotiate to a win * A collaborative edge. You know that in a team\-selling culture, the best closers bring people with them * A passion for sales and technology * Excellent collaboration and team\-building skills * Organized and methodical; strong prioritization skills * Excellent written and verbal communication skills with attention to detail * Proactive self\-starter attitude and a willingness to learn. * Strong relationship building skills; internally and with clients. * Proficient with and excited to use next\-generation AI tooling across all domains of the go\-to\-market workflow * Proficiency with Microsoft Office Suite (Excel, Word, PowerPoint Copilot) **Nice to have** * Sales industry experience in Financial Services, Healthcare/Life Sciences, Manufacturing, Technology * Partner relationship manage﻿ment within the tech eco system (AWS/MSFT/Salesforce) We have a question for you \- and it’s something we’re really passionate about. Can you imagine a world in which you can truly love your life and your work? Well, we have some good news – creating that world and making this vision a reality is what we get out of bed for; it’s our north star. But what do we really mean when we talk about loving your life and your work? Let’s take a look at the ways in which we help our team members to achieve this – and the ‘how’. **Deep connections, better outcome** We have deep relationships with over 400 leading technology partners and they love us for our innovative and outcome based approach. Our people are passionate about solving our clients’ problems using the tech that’s the best solution for them. What’s more, we’re there to work side\-by\-side with our client teams to enable them for success long after we’ve gone. We’re all about momentum that outlasts us. **Flexibility** Life is busy and we appreciate that. We’re often juggling work, family, and personal commitments. We do everything we can to support our people in prioritising what matters to them while also working on high\-impact projects that they’ll love. **People\-first** Great solutions start with great people. And those great people are at their best when they’re empowered to be their true authentic selves. Through leading with kindness and empathy, and striving for equity, we’re able to create better experiences for our people and our clients. Our culture is central to everything we do \- encouraging passion and adventure, adaptiveness, and diversity of thought. Inclusion, diversity and equity is at the top of our agenda, we have created a community where we empower our team to be the best version of themselves. **Rewards** There’s no shying away from it \- the compensation and benefits on offer have to be competitive too, right? We know that. That’s why we have a dedicated team working with our leaders to ensure our packages are fair, competitive, and rewarding! Take a look at the role below and if something sparks your interest, apply! Want to learn more? Get in touch! If you require any assistance with regards to reasonable adjustments during the recruitment process, please do not hesitate to contact us – we will always be happy to help.",https://www.linkedin.com/jobs/view/4394201915
School Meals Worker - SCOIL NAIS AITINN BHUI 17741N,The Lunch Bag,"Meath Hill, County Meath, Ireland",linkedin,"**A Little Bit About Us** Looking for a job that actually makes a difference \- and fits into your day\-to\-day routine? At The Lunch Bag, we deliver healthy, hot school meals to children across Ireland. We're the country’s leading school meal provider, and we’re on a mission to help kids build healthy habits for life. We’re changing children’s lives, one lunch at a time. Are you flexible, bubbly, and keen to bring a little extra joy to the school day? We’re looking for people who want to help us keep driving forward and doing something great. Bonus? You’re off when the schools are! **So, what’s the job?** We’re on the hunt for **School Meals Workers** – reliable, cheerful folks who take pride in doing things right and bring a bit of warmth to every school day. Think of yourself as the final link in the lunch chain – the friendly face everyone sees, and the front\-line hero representing us in the school. All meals are prepared in our headquarters in Nenagh, Tipperary, and then delivered to the schools. It’s from there that you’ll take over. Your duties will consist of heating the meals in the oven and then distributing them to classrooms. If you’re a detail addict and thought this was a little vague, here’s a list for you: * Load pre\-packaged school meals into ovens. * Turn on oven and heat meals to specific temperature according to HACCP guidelines. * Unload ovens and distribute lunches to classrooms. * Ensure adequate stock levels. * Follow and maintain work and cleaning schedule. * Maintain temperature and cleaning records. * Restock the fruit bowls in each classroom. * Distribute snacks to classrooms. * HACCP and Manual Handling Training will be provided. **What we’re looking for** Since you’ll be representing The Lunch Bag in schools, we’re looking for doers \- people who are sound, good\-natured, and genuinely care about doing a good job. Our values matter to us, and to keep improving the lives of children across the country, we need people who share that same goal. We’re not asking for bodybuilders, but you do need to be able to lift 14kg boxes as part of the job. You may also need to climb some stairs – not every school in Ireland has a lift (just yet)! Working with children is really rewarding – their cute little faces can brighten your day... just don’t let them get hungry or they’ll turn into tiny monsters! So we’re looking for someone who can work quickly, stay calm under pressure, and still do things properly. If you’ve worked with kids or food before, great. If not, don’t let it put you off \- we value people from all backgrounds and we’ll show you the ropes. All you need is the ability to read English, follow instructions, and heat each lunch with care. **I still have questions actually…** No problem! We’re here to answer them. * When will I work? This job is offered on a part\-time basis, **5\.5 hours a day, Monday through Friday** ! * Will I have to work all year long? No! As schools close for the summer, we follow the academic calendar. As a result, you will work with us approx 183 days of the year and will have the rest off to enjoy some well\-deserved rest! * What benefits do I get by joining The Lunch Bag? Well, for starters \- a decent rate of pay and a genuinely supportive team who’ve got your back. The role’s flexible, ideal if you’re looking to ease back into work or just want something steady during school terms. And best of all? You get to be part of a lovely school environment, surrounded by friendly faces (and the occasional tiny comedian in a uniform). * How much is it paid? It’s THE question everybody is asking! The same way we take care of the children in the schools, we take care of our people. You will earn **€14\.65 per hour** .",https://www.linkedin.com/jobs/view/4405716445
Software Developer,Clio,"Dublin, County Dublin, Ireland",linkedin,"Clio is the global leader in legal AI technology, empowering legal professionals and law firms of every size to work smarter, faster, and more securely. We are transforming the legal experience for all by bettering the lives of legal professionals while increasing access to justice. **Summary:** We are currently seeking a **Software Developer** to join our Engineering team in Dublin, Ireland. It's expected to be in office minimum twice per week on one of our Anchor Days. **What your team does:** We at Clio have an amazing team that is on a mission to transform the legal experience for all, and our engineering team’s goal is to deliver an incredible experience to our customers. To enable our engineers to build the best product they can, our development team has to build the best possible product that is performant, reliable, scalable, and beautiful. **A day in the life might look like:** * Work with a team of developers to solve complex problems and provide elegant solutions to Clio customers; * Work in an agile environment with our team of full stack developers across a variety of projects. * Using a wide variety of technologies, learning new things, and challenging yourself; * Participating in diverse projects and collaborating with multiple engineering teams across three countries; * Review and provide feedback on a peer's code, both from within your own team or across all of Clio. Thrive as \#TeamClio. **What you may have:** * Experience in software development, specifically with building web applications at scale and Ruby on Rails; * Front\-end experience with Javascript, Typescript, Angular \& React * The ability to master new technologies quickly and work effectively in a dynamic and ever\-evolving environment that includes distributed teams and customers; * Demonstrated success in mentorship in software development, particularly using an Agile process and with large scale SaaS products; * Database optimization experience; * Experience working with large\-scale systems; * A diverse base of knowledge that allows you to help your team solve complex technical problems; * A portfolio of successful projects (as well as a collection of lessons learned from failed projects); and * Excellent communication skills and the ability to build trusted relationships with fellow Clions and customers. * Demonstrate a keen interest in improving your craft by using AI **Don’t have all of those?** The most important part of this job is that you approach new challenges with curiosity and a drive to apply what you learn to fixing root causes, not just symptoms. Deep curiosity and a desire to learn will help you succeed in this job, combined with a drive to help others by shipping code. We have cross\-trained developers coming from Java, Python, C\+\+, and JavaScript backgrounds, and are happy to help you learn Ruby when you get here. **What you will find here:** Compensation is one of the main components of Clio’s Total Rewards Program. We have developed a series of programs and processes to ensure we are creating fair and competitive pay practices that form the foundation of our human and high\-performing culture. **Some highlights of our Total Rewards program include:** * Competitive, equitable salary with top\-tier health benefits and dental coverage * Hybrid work environment, with expectation for local Clions (Vancouver, Calgary, Toronto, Dublin and Sydney) to be in office minimum twice per week. * Flexible time off policy * Pension contribution * Clioversary recognition program with special acknowledgement at 3, 5, 7, and 10 years The expected salary range\* for this role is €72,300 to €85,000 to €97,700 EUR. There are a separate set of salary bands for other regions based on local currency. * Our salary bands are designed to reflect the range of skills and experience needed for the position and to allow room for growth at Clio. For experienced individuals, we typically hire at or around the midpoint of the band. The top portion of the salary band is reserved for employees who demonstrate sustained high performance and impact at Clio. Those who are new to the role may join below the midpoint and develop their skills over time. The final offer amount for this role will be dependent on geographical region, applicable experience, and skillset of the candidate. **Diversity, Inclusion, Belonging and Equity (DIBE) \& Accessibility** Our team shows up as their authentic selves, and are united by our mission. We are dedicated to diversity, equity and inclusion. We pride ourselves in building and fostering an environment where our teams feel included, valued, and enabled to do the best work of their careers, wherever they choose to log in from. We believe that different perspectives, skills, backgrounds, and experiences result in higher\-performing teams and better innovation. We are committed to equal employment and we encourage candidates from all backgrounds to apply. Clio provides accessibility accommodations during the recruitment process. Should you require any accommodation, please let us know and we will work with you to meet your needs. Learn more about our culture at clio.com/careers We're a Human and High Performing AI company, meaning we use artificial intelligence to improve all of our operations. In recruitment, AI helps us streamline the process for greater efficiency. However, we've built our systems to ensure that a human always reviews AI\-generated output, and we never make automated hiring decisions. ***Disclaimer:** We only communicate with candidates through official @clio.com email addresses.*",https://www.linkedin.com/jobs/view/4324592834
Software Engineer II,Zendesk,"Dublin, County Dublin, Ireland",linkedin,"**Job Description** We are looking for a Software Engineer II to join our teams that will contribute to innovative solutions in the Messaging Experience group. You’ll be involved in building integrations and connectors to the ES platform that is currently used by thousands of users around the world. Sunshine Conversations powers conversational experiences between people and organizations through an omnichannel experience from a wide range of channels such as Slack, WhatsApp, Instagram, Messenger, Telegram and more. In Zendesk, we value the people that create our great products, and encourage each other to grow and innovate. We offer our employees a competitive benefits package \& ensure relevant opportunities for professional growth and performance in a diverse and inclusive environment. What you’ll be doing * Own features from design, implementation, review, testing, rollout, monitoring. * Produce a short design doc for medium\+ changes (problem, constraints, chosen approach, rollback plan) and present it to the team before implementation. * Contribute to platform, architecture, and data model decisions working closely with Engineering, Product and Design. * Work on reliability and scalability improvements. * Write/maintain concise README(s), design docs, API docs, and runbooks for the services you own. * Present technical proposals and demo important features to cross\-functional stakeholders (Product, Design, Support). * Improve engineering culture and processes by leading occasional tech talks and help the team adopt best practices (testing, observability, code reviews). * Advocate for and help implement improvements to CI/CD, monitoring dashboards, or deployment practices. What you bring to the role **Basic Qualifications** * 2\+ years building backend services with Node.js, Express and TypeScript. * Autonomy and leadership to carry a project through its execution, while also knowing when to ask for help. * A collaborative attitude, contributing to an enjoyable work environment that promotes teamwork throughout the organization. * Comfortable working in agile teams and contributing to product/technical planning. **Preferred Qualifications** * Experience designing and developing distributed systems (secure, scalable, reliable) * Hands\-on experience with message systems (RabbitMQ, Kafka, SQS) and data stores (MongoDB, Redis, MySQL). * Familiarity with Kubernetes, AWS, and production observability (metrics/tracing/logging). * Experience in SaaS product development and working with globally distributed teams. * Experience with event driven architectures. Tech Stack * Our application code is mostly written in TypeScript and JavaScript. * Our main backend runs on Node.js and Express. Most of our frontend runs on React. * Our data is stored on MongoDB, Redis, MySQL, S3 and queued or streamed through RabbitMQ, Kafka and SQS. * Our workloads run on Kubernetes clusters running on AWS. Hybrid: In this role, our hybrid experience is designed at the team level to give you a rich onsite experience packed with connection, collaboration, learning, and celebration \- while also giving you flexibility to work remotely for part of the week. This role must attend our local office for part of the week. The specific in\-office schedule is to be determined by the hiring manager. **The Intelligent Heart Of Customer Experience** Zendesk software was built to bring a sense of calm to the chaotic world of customer service. Today we power billions of conversations with brands you know and love. Zendesk believes in offering our people a fulfilling and inclusive experience. Our hybrid way of working, enables us to purposefully come together in person, at one of our many Zendesk offices around the world, to connect, collaborate and learn whilst also giving our people the flexibility to work remotely for part of the week. As part of our commitment to fairness and transparency, we inform all applicants that artificial intelligence (AI) or automated decision systems may be used to screen or evaluate applications for this position, in accordance with Company guidelines and applicable law. Zendesk is an equal opportunity employer, and we’re proud of our ongoing efforts to foster global diversity, equity, \& inclusion in the workplace. Individuals seeking employment and employees at Zendesk are considered without regard to race, color, religion, national origin, age, sex, gender, gender identity, gender expression, sexual orientation, marital status, medical condition, ancestry, disability, military or veteran status, or any other characteristic protected by applicable law. We are an AA/EEO/Veterans/Disabled employer. If you are based in the United States and would like more information about your EEO rights under the law, please click here. Zendesk endeavors to make reasonable accommodations for applicants with disabilities and disabled veterans pursuant to applicable federal and state law. If you are an individual with a disability and require a reasonable accommodation to submit this application, complete any pre\-employment testing, or otherwise participate in the employee selection process, please send an e\-mail to peopleandplaces@zendesk.com with your specific accommodation request.",https://www.linkedin.com/jobs/view/4373478215
